,Date,Content,Section
1706,2016-04-30,The experiments providing homes around the world,cities
1707,2016-04-30,Housing in crisis: council homes were the answer in 1950. They still are,cities
1708,2016-04-30,UK housing crisis: four in 10 renters fear they will never own a home,cities
1709,2016-04-30,Generation rent: can your landlord be your friend?,cities
1710,2016-04-30,UK housing crisis: poll reveals city v country split on who to blame,cities
1711,2016-04-29,Los Angeles to get on-demand 'driverless buses',cities
1712,2016-04-29,Always practise safe text: the German traffic light for smartphone zombies,cities
1713,2016-04-29,Story of cities #33: how Santiago tackled its housing crisis with 'Operation Chalk',cities
1714,2016-04-28,'Teach young people we are not going to move over': stories of ageing in cities,cities
1715,2016-04-28,Utrecht's cycling lessons for migrants: 'Riding a bike makes me feel more Dutch',cities
1716,2016-04-28,"Story of cities #32: Jane Jacobs v Robert Moses, battle of New York's urban titans",cities
1717,2016-04-27,Greenhouse in the sky: inside Europe's biggest urban farm,cities
1718,2016-04-27,Which cities have the oldest residents?,cities
1719,2016-04-27,Story of cities #31: Skopje plans for the future by fixating on its ancient past,cities
1720,2016-04-26,Athens under pressure: city races to clear port's refugee camp before tourists arrive,cities
1721,2016-04-26,"London without old people is just a factory floor, with no past and no future",cities
1722,2016-04-26,Story of cities #30: how this Amsterdam inventor gave bike-sharing to the world,cities
1723,2016-04-25,Insider's guide to Bari: raw fish and reggae on the Adriatic,cities
1724,2016-04-25,Improving with age? How city design is adapting to older populations,cities
1725,2016-04-25,Story of cities #29: Los Angeles and the 'great American streetcar scandal',cities
1726,2016-04-22,The beavers are back: animals return to Stockholm after almost a century,cities
1727,2016-04-22,HullCoins well spent? City's 'Bitcoin for volunteers' offers a new way to pay,cities
1728,2016-04-22,Story of cities #28: how postwar Warsaw was rebuilt using 18th century paintings,cities
1729,2016-04-21,Oakland's housing crisis: 'I’m the last one here. I don’t know if I can stay or go',cities
1730,2016-04-21,Soviet squares: how public space is disappearing in post-communist cities,cities
1731,2016-04-21,Story of cities #27: Singapore – the most meticulously planned city in the world,cities
1732,2016-04-20,Poles apart: Gdansk divided as city grapples with immigration and identity,cities
1733,2016-04-20,London had a sub-prime housing problem. Now it has a super-prime crisis,cities
1734,2016-04-20,Story of cities #26: Delhi's modernist dream proves a far-fetched fantasy,cities
1735,2016-04-19,Right to the city: can this growing social movement win over city officials?,cities
1736,2016-04-19,Story of cities #25: Shannon – a tiny Irish town inspires China’s economic boom,cities
1737,2016-04-18,"'We have lost the science of building cities' – meet Joan Clos, the unofficial world leader for cities",cities
1738,2016-04-18,An insider's guide to Gothenburg: unspoiled green spaces and steel guitars,cities
1739,2016-04-18,Story of cities #24: how Hiroshima rose from the ashes of nuclear destruction,cities
1740,2016-04-15,'Paris has changed permanently': a day on duty with mayor Anne Hidalgo,cities
1741,2016-04-14,Story of cities #23: how disaster sparked Napier's art deco renaissance,cities
1742,2016-04-14,Our parks must get statutory protection | Letters,cities
1743,2016-04-14,How the slum women of Ahmedabad led a housing revolution,cities
1744,2016-04-14,Story of cities #22: how Hitler's plans for Germania would have torn Berlin apart,cities
1745,2016-04-13,Something in the water: is fluoride actually good for cities?,cities
1746,2016-04-13,Story of cities #21: Olivetti tries to build the ideal 'human city' for its workers,cities
1747,2016-04-12,Mind the merde: why can't French cities clean up after their dogs?,cities
1748,2016-04-12,Constructive conflict: can design competitions make cities stronger?,cities
1749,2016-04-12,"Story of cities #20: the secret history of Magnitogorsk, Russia's steel city",cities
1750,2016-04-11,An insider's guide to Hamilton: the fall and rise of an industrial powerhouse,cities
1751,2016-04-11,Story of cities #19: Johannesburg's apartheid purge of vibrant Sophiatown,cities
1752,2016-04-11,Sanctuary or ghetto? How Mannheim created a 'city within a city' for refugees,cities
1753,2016-04-08,The caffeine curse: why coffee shops have always signalled urban change,cities
1754,2016-04-08,Story of cities #18: Vienna's 'wild settlers' kickstart a social housing revolution,cities
1755,2016-04-07,Gothenburg's refugee youths: 'Come and meet us – nobody is here to be violent',cities
1756,2016-04-07,What's the world's loneliest city?,cities
1757,2016-04-06,Story of cities #17: Canberra's vision of the ideal city gets mired in 'mediocrity',cities
1758,2016-04-06,Lost heritage: which city structures should have been saved from demolition?,cities
1759,2016-04-06,Sold for scrap: great city buildings that were stupidly demolished,cities
1760,2016-04-06,Milton Keynes has a writer in residence? Imagine the possibilities,cities
1761,2016-04-06,Story of cities #16: how the US-run Canal Zone divided Panama for a century,cities
1762,2016-04-05,The story of cities #15: the rise and ruin of Rio de Janeiro's first favela,cities
1763,2016-04-04,An insider's guide to Sarajevo: 'our Olympic past seems almost like a myth',cities
1764,2016-04-04,Cities need more power to deal with refugee crisis: report,cities
1765,2016-04-04,Have you recently migrated to a new city? Share your story,cities
1766,2016-04-04,Story of cities #14: London's Great Stink heralds a wonder of the industrial world,cities
1767,2016-04-04,After the flood: Vienna's struggle to make its refugee residents feel at home,cities
1768,2016-04-01,Hip-hop and rabbits: the youth group transforming Brussels' vacant buildings,cities
1769,2016-04-01,Story of cities #13: Barcelona's unloved planner invents science of 'urbanisation',cities
1770,2016-03-31,"Come for the pizza, stay for the power: why Boston let teenagers set its budget",cities
1771,2016-03-31,Story of cities #12: Haussmann rips up Paris – and divides France to this day,cities
1772,2016-03-30,Clean streets: the mobile laundry service helping Australia's homeless,cities
1773,2016-03-30,"Story of cities #11: the reclamation of Mumbai – from the sea, and its people?",cities
1774,2016-03-29,En-suite education: the unstoppable rise of luxury student housing,cities
1775,2016-03-29,The ultimate urbanist pub quiz,cities
1776,2016-03-29,Story of cities #10: how the dirty Old Town became enlightened Edinburgh,cities
1777,2016-03-28,An insider's guide to Šibenik: where the streets have secret names,cities
1778,2016-03-25,A city framed: the doors and windows of Transylvania's Cluj-Napoca – in pictures,cities
1779,2016-03-24,Which UK city suffers the most panic attacks?,cities
1780,2016-03-24,How is public space changing in European cities?,cities
1781,2016-03-24,‘My neighbour avoids me ... I was very unhappy’: your tales of urban loneliness,cities
1782,2016-03-24,"Story of cities #9: Kingston, Jamaica – a city born of 'wickedness' and disaster",cities
1783,2016-03-23,'Erase and I will draw again': the struggle behind Cairo's revolutionary graffiti wall,cities
1784,2016-03-23,Can you guess how these sports teams got their names? An urban quiz,cities
1785,2016-03-23,Story of cities #8: St Petersburg – is the 'city built on bones' starting to crumble?,cities
1786,2016-03-22,Story of cities #7: Philadelphia grid marks birth of America's urban dream,cities
1787,2016-03-22,Poetry or property punts: what's driving China's love affair with Cambridge?,cities
1788,2016-03-21,"Seattle's 'aggressive plan' to cut pollution with 15,000 electric vehicles",cities
1789,2016-03-21,"An insider's guide to Halifax: 'The perks of a city, as relaxed as a small town'",cities
1790,2016-03-21,Story of cities #6: how silver turned Potosí into 'the first city of capitalism',cities
1791,2016-03-21,The stuff of night mayors: Amsterdam pioneers new way to run cities after dark,cities
1792,2016-03-18,"Story of cities #5: Benin City, the mighty medieval capital now lost without trace",cities
1793,2016-03-17,Hyde and seek: can you identify the city park from the satellite image?,cities
1794,2016-03-17,Story of cities #4: Beijing and the earliest planning document in history,cities
1795,2016-03-16,Dubai wants to be 'world's happiest city'. Report says it has a long way to go,cities
1796,2016-03-16,Story of cities #3: the birth of Baghdad was a landmark for world civilisation,cities
1797,2016-03-15,Return of the Bicycle Kingdom? How pavement cycling is transforming Taipei,cities
1798,2016-03-15,Story of cities #2: Rome wasn't planned in a day … in fact it wasn't planned at all,cities
1799,2016-03-14,An insider's guide to Manila: where brutalism meets bamboo,cities
1800,2016-03-14,"The story of cities, part 1: how Alexandria laid foundations for the modern world",cities
1801,2016-03-11,Cheaper cities? Economist index shows cost of urban life is going down,cities
1802,2016-03-11,Streetfighting woman: inside the story of how cycling changed New York,cities
1803,2016-03-11,River of garbage: parody drone video mocks Beirut's rubbish crisis,cities
1804,2016-03-10,"Occupy Buenos Aires: the workers' movement that transformed a city, and inspired the world",cities
1805,2016-03-09,Can Bogotá's state-sanctioned street art survive a crackdown by the new mayor?,cities
1806,2016-03-09,London's changing skyline: planned tall buildings 'almost double in two years',cities
1807,2016-03-09,The miracle of Kolkata's wetlands – and one man's struggle to save them,cities
1808,2016-03-08,"Mayor Morrissey? Don't laugh, stranger celebrity mayors have won before",cities
1809,2016-03-08,The world's best cities for millennials,cities
1810,2016-03-08,Seashells or spider silk: how nature could transform the structure of cities,cities
1811,2016-03-07,An insider's guide to Turin: church bells and post-industrial electronic rock,cities
1812,2016-03-07,Chernobyl 30 years on: former residents remember life in the ghost city of Pripyat,cities
1813,2016-03-04,A tale of twin cities: how Coventry and Stalingrad invented the concept,cities
1814,2016-03-03,Revealed: how facial recognition has invaded shops – and your privacy,cities
1815,2016-03-03,What a difference 400 years makes: the London skyline 1616 v 2016 – interactive,cities
1816,2016-03-02,Occupy Turin: refugees find a home in Italy's abandoned Olympic Village,cities
1817,2016-03-02,Manatees to the rescue? Cities offer ideas to solve Chennai's flooding problem,cities
1818,2016-03-01,Paris's river revolution: the supermarket that delivers groceries via the Seine,cities
1819,2016-02-29,‘We used to ring and ask for the Milky Bar Kid’: your memories of phone boxes,cities
1820,2016-02-29,"An insider's guide to Blantyre: 'Cheaper than New York, cleaner than London'",cities
1821,2016-02-29,Does city life make us more or less lonely? Share your stories,cities
1822,2016-02-29,Cash for cycling: polluted Milan might pay commuters to bike to work,cities
1823,2016-02-26,"'Beyond the chaos, there's a real human bond': Lagos residents share their stories",cities
1824,2016-02-26,Lagos on Instagram: from selling bubblegum to cycling in the sun,cities
1825,2016-02-26,"'Lagos shows how a city can recover from a deep, deep pit': Rem Koolhaas",cities
1826,2016-02-25,Lagos's blackout nightmare: the suburb that's been in darkness for five years,cities
1827,2016-02-25,Beatings and bribes: the corruption behind Lagos's traffic jams,cities
1828,2016-02-25,Uncool to use English: the rise of 'dialectical' rap,cities
1829,2016-02-24,'Bullying can break you down': young Lagos women fight the generation gap,cities
1830,2016-02-23,What can an abstract idea like 'playability' do for a city like Lagos?,cities
1831,2016-02-23,Inside Makoko: danger and ingenuity in the world's biggest floating slum,cities
1832,2016-02-22,Welcome to Guardian Lagos Week – live,cities
1833,2016-02-22,Lagos is expected to double in size in 15 years. How can it possibly cope?,cities
1834,2016-02-20,Will privatisation of UK cities rip out their hearts?,cities
1835,2016-02-19,"Transport maps in big cities baffle human brain, says study",cities
1836,2016-02-19,How can cities prevent the creation of 'tech ghettos'?,cities
1837,2016-02-19,The City by the Bay: readers share their photographs of San Francisco,cities
1838,2016-02-19,How can cities be improved for older people? Share your experiences,cities
1839,2016-02-19,Art underground: share your photos of metro station art around the world,cities
1840,2016-02-19,Ad-free art on the underground: Düsseldorf's 'pure' new metro line,cities
1841,2016-02-18,The city where war is the best employer: life in liberated Aden,cities
1842,2016-02-18,Reimagining park life: how Britain’s green spaces are scrambling for cash,cities
1843,2016-02-17,The payphone that became a disco: how street furniture is being transformed,cities
1844,2016-02-16,Stereographic New York: animated 3D images from the 1850s to the 1930s,cities
1845,2016-02-16,Are you the ultimate trainspotter: can you ID the cities from their stations?,cities
1846,2016-02-15,An insider's guide to Bucharest: manele music and pastry-scented metro stops,cities
1847,2016-02-15,Can Liverpool's new hospital make the whole city healthier – and wealthier?,cities
1848,2016-02-14,Sarajevo love story: how a chance photo revealed the joy and pain of Bosnia's war,cities
1849,2016-02-12,Will Paris' €23bn metro expansion help unify the city?,cities
1850,2016-02-12,Rootless and ruled by the landlord class – the future for young adults,cities
1851,2016-02-12,Ice cycles: the northerly world cities leading the winter bicycle revolution,cities
1852,2016-02-11,"Houston's health crisis: by 2040, one in five residents will be diabetic",cities
1853,2016-02-10,How is Lagos changing? Share your stories,cities
1854,2016-02-10,Subway in the sky: has La Paz's cable car made a real difference to the city?,cities
1855,2016-02-10,What the battle for Freeman's Wood says about the future of our common land,cities
1856,2016-02-09,The destruction of Sur: is this historic district a target for gentrification?,cities
1857,2016-02-08,The next Tokyo? Plan for 'flood-defence city' boasts first mile-high skyscraper,cities
1858,2016-02-08,"An insider's guide to Salzburg: power plants, synth-pop and Cara Delevingne",cities
1859,2016-02-08,Where are the world's highest cities?,cities
1860,2016-02-04,Corporate America's Detroit love affair,cities
1861,2016-02-04,To Beirut with hope: how the city shaped by refugees makes room for new arrivals,cities
1862,2016-02-03,From Berlin's warehouses to London's estates: how cities shape music scenes,cities
1863,2016-02-02,Synthetic or human? The changing voices behind transport announcements,cities
1864,2016-02-01,An insider's guide to Dundee: scooby snacks and Grand Theft Auto,cities
1865,2016-02-01,Cuba for sale: ‘Havana is now the big cake – and everyone is trying to get a slice’,cities
1866,2016-01-29,High streets: Stockholm plans walkways connecting high-rise rooftops,cities
1867,2016-01-29,"Drowning in rubbish, Lima sends out the vultures with GoPros",cities
1868,2016-01-29,Life before mobiles: share your memories of red phone boxes,cities
1869,2016-01-28,"'Hackney, I lost you': the London creatives priced out of their studios",cities
1870,2016-01-28,Where are the world's newest cities … and why do they all look the same?,cities
1871,2016-01-27,Stride on: capturing Chicago's crosswalks – in pictures,cities
1872,2016-01-27,Tel Aviv's journey to becoming the hippest cycling city,cities
1873,2016-01-27,Be a part of Guardian Cities: share your ideas for what we should cover next,cities
1874,2016-01-26,The disappearing roadside hamburger stands of downtown Los Angeles,cities
1875,2016-01-26,From Singapore to Amaravati: the battle to build India's new state capital,cities
1876,2016-01-25,An insider's cultural guide to Ankara: unique Anatolian modernity,cities
1877,2016-01-25,How London might have looked: five masterplans after the great fire,cities
1878,2016-01-22,Copenhagen's public spaces that turn into picturesque ponds when it rains,cities
1879,2016-01-22,'We don't need IT here': the inside story of India’s smart city gold rush,cities
1880,2016-01-21,Europe's most liveable city? The secret of Odense's post-industrial revolution,cities
1881,2016-01-21,Inside Hanoi's gated communities: rich enclaves where even the air is cleaner,cities
1882,2016-01-20,When the Big One comes: the woman preparing LA for life after a major quake,cities
1883,2016-01-20,Punta del Este: is Uruguay's uber-rich 'gated city' a glimpse of our urban future?,cities
1884,2016-01-19,Memories of goldfish-flushing toilets in 60s Holborn | Letters,cities
1885,2016-01-19,Britain’s first garden town: housing crisis solution or 'dog's breakfast'?,cities
1886,2016-01-19,Log fires or traffic fumes: what's the real cause of Bergen's air pollution?,cities
1887,2016-01-18,An insider’s cultural guide to Blackpool: bovver boots and ballroom dancing,cities
1888,2016-01-16,Is gentrification inevitable – and inevitably bad?,cities
1889,2016-01-15,"If Sesame Street can gentrify, are any TV streets safe?",cities
1890,2016-01-15,Amsterdam's sex workers: the unlikely victims of gentrification,cities
1891,2016-01-14,The anti-eviction blues: audio reports from San Francisco's gentrifying streets,cities
1892,2016-01-14,How has Brixton really changed? The data behind the story,cities
1893,2016-01-13,'You are left with no choice but to leave' – your stories of long-term gentrification,cities
1894,2016-01-13,The 'gaytrification' effect: why gay neighbourhoods are being priced out,cities
1895,2016-01-12,Gentrification X: how an academic argument became the people's protest,cities
1896,2016-01-11,An insider's cultural guide to Muscat: steeped in heritage and tradition,cities
1897,2016-01-08,How much it costs to rent in Berlin – mapped by its metro stations,cities
1898,2016-01-08,"If roads are gridlocked in rush hour, what happens when disaster strikes?",cities
1899,2016-01-07,"Crossrail 1, St Giles 0: farewell to one of London's last wild corners",cities
1900,2016-01-07,From 'puddle cam' to Desperate Dan: what are the best city webcams?,cities
1901,2016-01-06,Pixação: the story behind São Paulo's 'angry' alternative to graffiti,cities
1902,2018-01-05,Unbuilt cities: the outrageous highway schemes left as roads to nowhere,cities
1903,2018-01-04,Accidentally Wes Anderson: Instagram finds stylised symmetry in real cities,cities
1904,2018-01-03,‘Does Hull have a future?’ City built on a flood plain faces sea rise reckoning,cities
1905,2018-01-02,'A rolling walking stick': why do so many disabled people cycle in Cambridge?,cities
1906,2018-01-01,Bratislava in the spotlight: Slovakian city celebrates 25 years as capital,cities
1907,2017-12-29,From parasite architects to pseudo-public space: 2017's best Cities stories,cities
1908,2017-12-28,Which were the most Instagrammed cities in the world in 2017?,cities
1909,2017-12-27,Six objects to define the London of 2017,cities
1910,2017-12-22,The carriage belted out Christmas songs: readers' positive public transport tales,cities
1911,2017-12-22,North Pole in the spotlight: Alaskan wonderland meets Twin Peaks,cities
1912,2017-12-21,'I met my wife on a train platform': Twitter responds to Elon Musk with positive public transport stories,cities
1913,2017-12-21,Breaking down the new Berlin wall: refugee guides show their side of city,cities
1914,2017-12-20,‘The bayou's alive’: ignoring it could kill Houston,cities
1915,2017-12-19,Quiz: can you identify these cities from their historic maps?,cities
1916,2017-12-19,Southampton in the spotlight: boom times ahead for Titanic's home town?,cities
1917,2017-12-18,'They stole the soul of the city': how Warsaw's reprivatisation is causing chaos,cities
1918,2017-12-15,From Edinburgh's tram to Boston's Big Dig: readers' urban white elephants,cities
1919,2017-12-14,'Dark forces will be unleashed': the fire temple v the Mumbai metro,cities
1920,2017-12-13,Abu Dhabi: the city where citizenship is not an option,cities
1921,2017-12-12,Nelson in the spotlight: is a storm brewing in New Zealand's boho bay?,cities
1922,2017-12-11,What would an earthquake-proof city look like?,cities
1923,2017-12-08,A crime against fashion? Why Montreal police donned colourful cargo pants,cities
1924,2017-12-08,Laiza in the spotlight: Myanmar's rebel capital digs in – and switches on,cities
1925,2017-12-07,"Véliberté, egalité, fraternité: is Paris's seminal bike share scheme out of date?",cities
1926,2017-12-05,'They're just not very British': will cities finally splash out on water fountains?,cities
1927,2017-12-04,'Addis has run out of space': Ethiopia's radical redesign,cities
1928,2017-12-04,Sadiq Khan plans network of London water fountains to reduce plastic waste,cities
1929,2017-12-02,'It's not just extra-rich and extra-poor': Paulistanos respond to São Paulo Live,cities
1930,2017-12-01,Deslocamento diário de quatro horas: tarefa difícil da vida na periferia de São Paulo,cities
1931,2017-12-01,Taming 'the worm': how the Minhocão is São Paulo's soul,cities
1932,2017-12-01,"São Paulo 'exclusively for business, by business' at expense of urban poor",cities
1933,2017-11-30,'This exhibition contains nudity': the front line of Brazil's culture wars,cities
1934,2017-11-30,Protegidos pela noite: conheça o gigante mercado informal da Feirinha da Madrugada,cities
1935,2017-11-30,"Conheça o prefeito João Doria: a versão paulistana, esperta e polêmica de Trump",cities
1936,2017-11-30,Copan strategy: the wild plan to revamp the ‘coolest building in Latin America’,cities
1937,2017-11-30,São Paulo's recycling army: will a police shooting spell change for the catadores?,cities
1938,2017-11-30,O exército da reciclagem de São Paulo: uma morte provocada pela polícia poderia ser o começo da mudança para os catadores?,cities
1939,2017-11-30,Retratos da periferia: 'o coração de São Paulo bate na periferia',cities
1940,2017-11-30,Portraits of the 'periferia': 'The pulse of São Paulo comes from its periphery',cities
1941,2017-11-29,"Flea markets, favelas and football fever: Sāo Paulo storms Instagram – in pictures",cities
1942,2017-11-29,São Paulo: imagem de injustiça,cities
1943,2017-11-29,Inequality ... in a photograph,cities
1944,2017-11-29,Teatro Oficina: the tycoon v the theatre,cities
1945,2017-11-29,"Meet mayor João Doria – São Paulo's slick, polarising answer to Trump",cities
1946,2017-11-29,The four hour commute: the punishing grind of life on São Paulo’s periphery,cities
1947,2017-11-28,O efeito Amazônia: como o desmatamento está deixando São Paulo sem água,cities
1948,2017-11-28,"Por dentro da Cracolândia, a feira aberta de crack que São Paulo não consegue destruir",cities
1949,2017-11-28,The Amazon effect: how deforestation is starving São Paulo of water,cities
1950,2017-11-28,Under cover of darkness: inside São Paulo's vast illegal Feirinha night market,cities
1951,2017-11-28,The revolution will not be televised: how a Guaraní tribe got São Paulo's attention,cities
1952,2017-11-27,Guardian Cities: Live from São Paulo's occupations,cities
1953,2017-11-27,Resistance! São Paulo's homeless seize the city,cities
1954,2017-11-27,O futuro de São Paulo dorme sob um barraco de plástico preto,cities
1955,2017-11-27,Revealed: fires in São Paulo favelas more likely on higher-value land,cities
1956,2017-11-27,Inside Crackland: the open-air drug market that São Paulo just can’t kick,cities
1957,2017-11-27,Living on the edge: São Paulo’s inequality mapped,cities
1958,2017-11-27,The future of São Paulo sleeps in an improvised shack,cities
1959,2017-11-26,What is Guardian São Paulo live – and how can you get involved?,cities
1960,2017-11-26,O que é o Guardian São Paulo ao vivo e como você pode participar?,cities
1961,2017-11-25,Gaza City in the spotlight: hesitant hope in a city where everyone still wants out,cities
1962,2017-11-24,The $3.35bn subway station – and other urban white elephants,cities
1963,2017-11-23,Bilbao on the prairie: why does tiny Saskatoon need an $85m art gallery?,cities
1964,2017-11-23,London mayor to draw up charter regulating pseudo-public space,cities
1965,2017-11-21,The haves and have-nots: four cities in crisis,cities
1966,2017-11-20,Behind the 'Medellín miracle': why the smart kids are going to hip-hop school,cities
1967,2017-11-17,Cycling downhill: has Copenhagen hit peak bike?,cities
1968,2017-11-16,"Raze, rebuild, repeat: why Japan knocks down its houses after 30 years",cities
1969,2017-11-15,Britain's cash-strapped councils and the great Civic Centre sell-off,cities
1970,2017-11-14,Silver screen: the film festival putting older people at the heart of the plot,cities
1971,2017-11-13,Punta Arenas in the spotlight: Chile's oil-rich gateway city to the Antarctic,cities
1972,2017-11-13,"Sí, seniors: the Chilean city with grand plans to be the best place to grow old",cities
1973,2017-11-09,"'If I'm stratum 3, that's who I am': inside Bogotá's social stratification system",cities
1974,2017-11-08,Bids are in for Amazon's HQ2. Now the contest begins – but will it be worth it?,cities
1975,2017-11-07,'Bike theft is not inevitable': Vancouver rolls out a cycle crime revolution,cities
