,Date,Content,Section
901,2015-08-28,Paris prepares to rid its streets of cars for one day,cities
902,2015-08-28,A manifesto for conscious cities: should streets be sensitive to our mental needs?,cities
903,2015-08-27,Why plans for a new golf course have caused uproar in New Orleans,cities
904,2015-08-27,"Welcome to the naked city: sun, swingers and very little shoplifting",cities
905,2015-08-26,New Orleans launches resilience roadmap to tackle climate and social challenges,cities
906,2015-08-26,What's the world's most expensive city?,cities
907,2015-08-25,Our strategy to rebuild New Orleans for the threats it will face in 50 years' time,cities
908,2015-08-25,The spirit of New Orleans: street life in the Big Easy – in pictures,cities
909,2015-08-24,Australia's biggest bike-lane sceptic 'wants to destroy cycling in Sydney',cities
910,2015-08-24,Is New Orleans in danger of turning into a modern-day Atlantis?,cities
911,2015-08-24,An insider's guide to Mogadishu: 'There's no life without peace',cities
912,2015-08-21,Why Indianapolis is a test case for a fairer form of gentrification,cities
913,2015-08-21,The popsicle test: what makes a city good for children?,cities
914,2015-08-20,"As cities fall out of love with cars, Toyota redefines its role as 'mobility provider'",cities
915,2015-08-19,Where is the world’s most remote city?,cities
916,2015-08-19,Young Londoners talk inequality,cities
917,2015-08-18,Isolated suburbs: share your photos and stories,cities
918,2015-08-18,End of the Red Road: residents mourn Glasgow's high-rise dream gone wrong,cities
919,2015-08-18,An insider's cultural guide to Minsk: rocking in the 'world's cleanest city',cities
920,2015-08-18,The war on Görli: could cleaning up Berlin destroy the reason people love it?,cities
921,2015-08-17,'Electric motorways' could power the cars of the future,cities
922,2015-08-17,"No cafe, no pub, no doctor in London's most isolated suburb",cities
923,2015-08-15,Introducing 'treeconomics': how street trees can save our cities,cities
924,2015-08-14,Green city: share your photos and stories of urban trees,cities
925,2015-08-14,The concrete beauty of brutalist architecture – in pictures,cities
926,2015-08-14,Sheffield's Park Hill: the tangled reality of an extraordinary brutalist dream,cities
927,2015-08-13,Can the Safecity app make Delhi safer for women?,cities
928,2015-08-13,After Katrina: New Orleans then and now – interactive photographs,cities
929,2015-08-12,'Covent Garden? I find it flavourless': a video epitaph for Food for Thought,cities
930,2015-08-12,Can cities kick ads? Inside the global movement to ban urban billboards,cities
931,2015-08-11,"An insider's cultural guide to Kaunas: no more 'fashion police', promise",cities
932,2015-08-11,Why it's time for summer capitals to make a comeback,cities
933,2015-08-11,Commuting from Barcelona: a London worker who makes it pay,cities
934,2015-08-10,Superdensity: the facades of Hong Kong – in pictures,cities
935,2015-08-10,Fighting the fatbergs: how cities are waging war on clogged sewers,cities
936,2015-08-07,Munich plans an 'autobahn for bikes',cities
937,2015-08-07,Londoners speak: what's fair and unfair about the city,cities
938,2015-08-07,Land-starved Singapore exhumes its cemeteries to build roads and malls,cities
939,2015-08-06,The Guardian Cities: Skylines challenge – can I build a truly anti-capitalist city?,cities
940,2015-08-06,The Guardian Cities: Skylines challenge – can I build the world's greenest city?,cities
941,2015-08-05,Habitat III is all about cities. The UN should give them a seat at the table,cities
942,2015-08-05,Brighton's Marlborough House: an architectural gem ignored by its city,cities
943,2015-08-04,An insider's cultural guide to Minneapolis: 'A smart place to start a band',cities
944,2015-08-04,Forgotten architectural gems in your city: share photos and stories,cities
945,2015-08-04,How the Jack the Ripper industry distorts London's East End,cities
946,2015-08-04,London's public and private spaces – can you spot the difference? Quiz,cities
947,2015-08-04,The privatisation of cities' public spaces is escalating. It is time to take a stand,cities
948,2015-08-03,"Davis, California – the American city which fell in love with the bicycle",cities
949,2015-08-03,How the New Routemaster came full circle: back to a regular old London bus,cities
950,2015-07-31,How to tell if you're a gentrifier,cities
951,2015-07-31,The night-time hunt for the secretive urban slender loris of Bangalore,cities
952,2015-07-30,What's the hottest subway station in New York City?,cities
953,2015-07-30,Kiruna: the arctic city being knocked down and relocated two miles away,cities
954,2015-07-29,How Groningen invented a cycling template for cities all over the world,cities
955,2015-07-28,"Welcome to Astana, Kazakhstan: one of the strangest capital cities on Earth",cities
956,2015-07-27,The insider's cultural guide to Hargeisa: 'the mother of Somali arts',cities
957,2015-07-27,Californian city to get 'marijuana innovation zone',cities
958,2015-07-27,10 years after the storm: has New Orleans learned the lessons of Hurricane Katrina?,cities
959,2015-07-26,How megacities compare: China plans a city 25 times the size of London,cities
960,2015-07-24,How an abandoned barracks in Ljubljana became Europe’s most successful urban squat,cities
961,2015-07-23,London's Olympic legacy three years on: is the city really getting what it needed?,cities
962,2015-07-22,Where is the world's hottest city?,cities
963,2015-07-22,Young people are driving the 'urban renaissance' of city centres – report,cities
964,2015-07-21,Santa Monica: the city that wants to design itself happier,cities
965,2015-07-21,Why historic Norton Folgate is a crucial battleground for the future of London,cities
966,2015-07-20,The rise of urban playgrounds for the elderly,cities
967,2015-07-20,Cult of the temporary: is the pop-up phenomenon good for cities?,cities
968,2015-07-20,"An insider's guide to Fez: Ceramics, courtyards and Macbook decals",cities
969,2015-07-17,Inside Phnom Penh's empty new skyscraper: 'This is only for excellencies',cities
970,2015-07-16,Walk on the wild side: saving California's mountain lions,cities
971,2015-07-15,Could a new pavement design give walking culture a foothold in Bangalore?,cities
972,2015-07-14,Could the gangs of Port-au-Prince form a pact to revitalise Haiti's capital?,cities
973,2015-07-14,How are protected views shaping cities?,cities
974,2015-07-14,Which urban views would you protect?,cities
975,2015-07-13,"An insider's guide to Asunción: Super-relaxed, upbeat and carefree",cities
976,2015-07-13,What would make London a fairer city?,cities
977,2015-07-13,What do we mean by fairness in cities?,cities
978,2015-07-10,The giving city: Utrecht plans 'basic income' experiment,cities
979,2015-07-09,Urban farmers: community food growing around the world – in pictures,cities
980,2015-07-09,'If there aren’t as many women cycling as men … you need better infrastructure',cities
981,2015-07-08,How community-led renovation is helping a rundown Pittsburgh neighbourhood fight crime,cities
982,2015-07-07,The art of the urban nap: let's lose the stigma of public snoozing,cities
983,2015-07-07,Tokyo readies for the rise of the 'guerrilla rainstorm',cities
984,2015-07-06,"New Orleans, 10 years after Katrina: do residents feel more prepared?",cities
985,2015-07-06,"An insider’s guide to Zagreb: Greenery,  Germanisms and suburban punk",cities
986,2015-07-06,Radioactive city: how Johannesburg’s townships are paying for its mining past,cities
987,2015-07-03,"Bright lights, big trees: Dutch designer imagines an 'urban forest'",cities
988,2015-07-03,"The human cost of the Tbilisi floods: 'The truth is, I'd really lost all hope'",cities
989,2015-07-02,Making sense of Miami: what America's refuge city says about the US's future,cities
990,2015-07-02,Calcutta's architecture is unique. Its destruction is a disaster for the city,cities
991,2015-07-01,From Waze for crowds to Uber for street food – MIT innovations at Kumbh Mela,cities
992,2015-07-01,"Bodies, beer cans and prime property: Manchester learns to love its canals",cities
993,2015-06-30,Rainbow city: the colourful houses of San Francisco – in pictures,cities
994,2015-06-30,How to build a city from scratch: the handy step-by-step DIY guide,cities
995,2015-06-29,New Yorkers to get free Wi-Fi via old phone booths in Google-funded project,cities
996,2015-06-29,"An insider's guide to Addis Ababa: Car crashes, coffee and contemporary art",cities
997,2015-06-29,Mumbai's endangered Parsis fight to preserve the city's greenest space,cities
998,2015-06-29,A ghost city revived: the remarkable transformation of Hebron,cities
999,2015-06-26,Urban life in a wheelchair: which city is the most accessible?,cities
1000,2015-06-26,Dirty boulevard: why Paris's ring road is a major block on the city's grand plans,cities
1001,2015-06-25,The best urban buildings in the movies – readers' photos,cities
1002,2015-06-25,Revealed: how developers exploit flawed planning system to minimise affordable housing,cities
1003,2015-06-25,"'My children are suffering but what can I do?' Delhi's polluted air, by the people who live there",cities
1004,2015-06-24,Which London neighbourhoods will disappear next?,cities
1005,2015-06-24,From Cripplegate to Agar Town: inside London's vanished neighbourhoods,cities
1006,2015-06-23,Chennai unchained: can India's first cycle cafe make bikes cool again?,cities
1007,2015-06-23,"Cape Town's death industry: 'If you’re buried here, it’s ​​as if they threw you away'",cities
1008,2015-06-22,America wakes up to walking: 'Think of it as a patriotic duty',cities
1009,2015-06-22,"An insider's cultural guide to Sofia: Tsars, trams and plays about Tupac",cities
1010,2015-06-22,Dundee: from black sheep of Scottish cities to 'living cultural experiment',cities
1011,2015-06-19,Dublin becomes the latest city to propose partial ban on private cars,cities
1012,2015-06-19,Will Google's $5m plan make cycling in the rest of Silicon Valley easier?,cities
1013,2015-06-18,Charles Correa wanted to design a better Mumbai – but the city let him down,cities
1014,2015-06-18,Epicentre of the Great Recession: what happened to Cleveland's Slavic Village?,cities
1015,2015-06-17,People power: the secret to Montreal's success as a bike-friendly city,cities
1016,2015-06-17,Havana: one of the world's great cities on the brink of a fraught transition,cities
1017,2015-06-16,Meet the 'digital nomads' who travel the world in search of fast Wi-Fi,cities
1018,2015-06-16,Inside Venice's bid to hold back the tide,cities
1019,2015-06-15,Community gardens and beyond: share your examples of 'urban commoning',cities
1020,2015-06-15,Urban commons have radical potential – it's not just about community gardens,cities
1021,2015-06-15,"An insider's cultural guide to Nottingham: Cinematic, collaborative and creative",cities
1022,2015-06-15,Which is the cleanest city in the world?,cities
1023,2015-06-13,Our future is urban. Why don’t we talk more about our cities?,cities
1024,2015-06-13,'Things have started to improve': Moscow residents share thoughts on the city's changes,cities
1025,2015-06-13,Gay in Putin's Moscow: why the city is pinker than you think,cities
1026,2015-06-12,Нарушить табу: москвички против домашнего насилия,cities
1027,2015-06-12,Moscow on Instagram: from hidden gardens to unusual architecture,cities
1028,2015-06-12,"Inside Skolkovo, Moscow's self-styled Silicon Valley",cities
1029,2015-06-12,"Moscow's suburbs may look monolithic, but the stories they tell are not",cities
1030,2015-06-11,Why a giant statue of Vladimir is causing a public outcry in Moscow,cities
1031,2015-06-11,"Amid the Fifa scandal, Moscow's 2018 World Cup venue is ahead of schedule",cities
1032,2015-06-11,"Станет ли Москва, стоящая в пробках, городом для велосипедистов?",cities
1033,2015-06-11,Can traffic-choked Moscow become a more cycle-friendly city?,cities
1034,2015-06-10,Прическа для космонавта: как воспринимают московских женщин,cities
1035,2015-06-10,"Aren't you interested in the hairstyles of male cosmonauts, too? What it is to be a woman in Moscow",cities
1036,2015-06-10,Breaking the taboo: the Moscow women taking a stand against domestic violence,cities
1037,2015-06-09,"Moscow's food revolution: craft beer, McDonald's and a big dash of nostalgia",cities
1038,2015-06-09,Moscow then and now – interactive with photographs from the Guardian archive,cities
1039,2015-06-09,Moscow 25 years on: do I still recognise the city?,cities
1040,2015-06-09,"Патриотизм и пармезан: москвичи о том, как изменилась их жизнь",cities
1041,2015-06-09,"Patriotism, propaganda and parmesan: what do Muscovites really think?",cities
1042,2015-06-09,TV Rain: inside Russia's only independent television channel,cities
1043,2015-06-09,"В гостях у “Дождя”, единственного в России независимого телеканала",cities
1044,2015-06-08,Cities with physically active residents more productive as well as healthier,cities
1045,2015-06-08,"Lavender, petrol or vomit: what does your city smell like?",cities
1046,2015-06-08,Guardian Moscow Week – what we've learned so far,cities
1047,2015-06-08,Why are migrants fleeing Moscow?,cities
1048,2015-06-08,Провалился ли “московский эксперимент”?,cities
1049,2015-06-08,"The insider's cultural guide to Moscow: Concrete, coding and Soviet ghosts",cities
1050,2015-06-08,Is the 'Moscow experiment' over?,cities
1051,2015-06-08,What is Guardian Moscow Week? Что будет на этой неделе с редакцией Guardian в Москве?,cities
1052,2015-06-05,Can the internet of things make cycling in cities safer?,cities
1053,2015-06-05,"Salman Khan has been convicted, but are India's roads any safer?",cities
1054,2015-06-05,Numaish Karachi: can art installations change this violent megacity's image?,cities
1055,2015-06-05,A history of cities in 50 buildings – interactive,cities
1056,2015-06-05,A history of cities in 50 buildings: readers tell us what we missed,cities
1057,2015-06-04,"Jeddah's Kingdom Tower: how much higher can skyscrapers go? A history of cities in 50 buildings, day 50",cities
1058,2015-06-03,"Barcelona's Sagrada Família: Gaudí's 'cathedral for the poor' – a history of cities in 50 buildings, day 49",cities
1059,2015-06-02,"Makoko Floating School, beacon of hope for the Lagos 'waterworld' – a history of cities in 50 buildings, day 48",cities
1060,2015-06-02,"Mapping, Beirut-style: how to navigate a city without using any street names",cities
1061,2015-06-01,"Honest Ed’s, Toronto's doomed compendium of kitsch – a history of cities in 50 buildings, day 47",cities
1062,2015-06-01,"An insider's cultural guide to Miami: Flashy, classy and hot!",cities
1063,2015-06-01,The most cycle-friendly cities in the world – your pictures and stories,cities
1064,2015-05-29,Travel back in time to New York City,cities
1065,2015-05-29,"Palestine's abandoned parliament – a history of cities in 50 buildings, day 46",cities
1066,2015-05-29,Do 20mph speed limits actually work?,cities
1067,2015-05-28,Istanbul shows ferries have a future,cities
1068,2015-05-28,"Norman Foster's Hong Kong HSBC headquarters tore up the rule book – a history of cities in 50 buildings, day 45",cities
1069,2015-05-27,"Learning from Seoul's Sampoong Department Store disaster – a history of cities in 50 buildings, day 44",cities
1070,2015-05-27,Real street food: Spiced fish and rice from Dakar,cities
1071,2015-05-27,The magic of Croydon: is London's punchline having the last laugh?,cities
1072,2015-05-26,"How Curitiba's BRT stations sparked a transport revolution – a history of cities in 50 buildings, day 43",cities
1073,2015-05-26,Which is the safest city in the world?,cities
1074,2015-05-25,"The insider's cultural guide to São Paulo: City of contrast, contradiction and chaos",cities
1075,2015-05-25,The best places to skateboard in cities – readers' pictures,cities
1076,2015-05-22,Which is the healthiest city in the US?,cities
1077,2015-05-22,"The Renaissance Center: Henry Ford II's grand design to revive Detroit – a history of cities in 50 buildings, day 42",cities
1078,2015-05-22,"Welcome to Baoding, China's most polluted city",cities
1079,2015-05-21,"Thames Baths is a great idea, but should city projects be crowdfunded at all?",cities
1080,2015-05-21,What are cities doing so right – and so wrong? Edward Glaeser talks to Simon Jenkins,cities
1081,2015-05-21,"Byker Wall: Newcastle's noble failure of an estate – a history of cities in 50 buildings, day 41",cities
1082,2015-05-20,"New York's twin towers – the 'filing cabinets' that became icons of America: a history of cities in 50 buildings, day 40",cities
1083,2015-05-20,From floating messageboards to musical benches: ideas for a more playable city,cities
1084,2015-05-20,Why gonzo journalism is crucial to our understanding of cities and their tribes,cities
1085,2015-05-19,Toxteth then and now: photographs of a bygone Liverpool,cities
1086,2015-05-19,London's local markets under threat from gentrification – readers' stories,cities
1087,2015-05-19,Why does Barclays want to build a city in the New Mexico desert?,cities
1088,2015-05-18,"Canberra's Parliament House: a 'symbol of national identity' – a history of cities in 50 buildings, day 39",cities
1089,2015-05-18,An insider's cultural guide to Detroit: The Motor City moves on,cities
1090,2015-05-18,"'Welcome to Fear City' – the inside story of New York's civil war, 40 years on",cities
1091,2015-05-18,"Roppongi Hills: controversial blueprint for Tokyo's new breed of high-rise – a history of cities in 50 buildings, day 38",cities
1092,2015-05-15,Seoul's Skygarden: the High Line of South Korea?,cities
1093,2015-05-15,Is Moscow changing for better or worse?,cities
1094,2015-05-15,"Yamoussoukro's Notre-Dame de la Paix, the world's largest basilica - a history of cities in 50 buildings, day 37",cities
1095,2015-05-15,What's the most radioactive city?,cities
1096,2015-05-14,"From The Godfather to Jason Bourne, why Hollywood loves urban transport",cities
1097,2015-05-14,"The first Starbucks coffee shop, Seattle - a history of cities in 50 buildings, day 36",cities
1098,2015-05-13,"Habitat 67, Montreal's 'failed dream' – a history of cities in 50 buildings, day 35",cities
1099,2015-05-13,How Berlin's urban goshawks helped me learn to love the city,cities
1100,2015-05-12,Confessions of a location scout: why the New York beloved of the movies doesn't exist any more,cities
1101,2015-05-12,Expo 2015: what does Milan gain by hosting this bloated global extravaganza?,cities
1102,2015-05-12,"Havana's Habana Libre, pawn in Castro's battle against the US - a history of cities in 50 buildings, day 34",cities
1103,2015-05-11,The insider's cultural guide to Banja Luka: Where life is lived in cafes,cities
1104,2015-05-11,The best urban buildings in film: share your pictures,cities
1105,2015-05-11,"Step into my evil modernist lair, Mr Bond: the best urban buildings in film",cities
1106,2015-05-11,"Johannesburg's Ponte City: 'the tallest and grandest urban slum in the world' – a history of cities in 50 buildings, day 33",cities
1107,2015-05-08,'The cycling revolution could not happen sooner': readers discuss the future of cars in cities,cities
1108,2015-05-08,How to revolutionise San Francisco: make its streets look more European,cities
1109,2015-05-08,The LA street artist who sees beauty in the cracks of our cities,cities
1110,2015-05-08,"Warsaw's Palace of Culture, Stalin's 'gift': a history of cities in 50 buildings, day 32",cities
1111,2015-05-07,"The tragedies of Mexico City’s Tlatelolco housing complex – a history of cities in 50 buildings, day 31",cities
1112,2015-05-07,Is India's 100 smart cities project a recipe for social apartheid?,cities
1113,2015-05-06,Five ways to survive your daily commute,cities
1114,2015-05-06,Why do Africa's mayors get so little respect?,cities
1115,2015-05-06,"Southdale Center: America's first shopping mall – a history of cities in 50 buildings, day 30",cities
1116,2015-05-06,The dangers of eco-gentrification: what's the best way to make a city greener?,cities
1117,2015-05-05,What are the world's most cycle-friendly cities?,cities
1118,2015-05-05,"Moscow's Narkomfin building: Soviet blueprint for collective living – a history of cities in 50 buildings, day 29",cities
1119,2015-05-05,How Amsterdam became the bicycle capital of the world,cities
1120,2015-05-04,'Chaos? This is open-heart surgery': Medellín bets it all on burying a highway,cities
1121,2015-05-04,"The insider's cultural guide to Thimphu: Chilli, cheese, alcohol, music, archery",cities
1122,2015-05-01,Meet the artist who believes digging holes and climbing in cures urban stress,cities
1123,2015-05-01,Public art in cities: share your photos and stories,cities
1124,2015-05-01,What the Brandenburg Gate's pop-up horses say about the state of Berlin's public art,cities
1125,2015-05-01,"Beirut's bullet-riddled Holiday Inn - a history of cities in 50 buildings, day 28",cities
1126,2015-04-30,Scared to speak up and with nowhere to go: is this the price of gentrification?,cities
1127,2015-04-30,"Nepal earthquake: a disaster that shows quakes don't kill people, buildings do",cities
1128,2015-04-30,Have we really reached 'peak car'?,cities
1129,2015-04-30,"The Bilbao Effect: is 'starchitecture' all it’s cracked up to be? A history of cities in 50 buildings, day 27",cities
1130,2015-04-29,"From New York to Beijing, where in the world can you still smoke in a bar?",cities
1131,2015-04-29,"Manchester's Trafford Park, the world's first industrial estate – a history of cities in 50 buildings, day 26",cities
1132,2015-04-28,'These could have been homes for people who need them': readers' thoughts on Glasgow's regeneration,cities
1133,2015-04-28,"Levittown, the prototypical American suburb – a history of cities in 50 buildings, day 25",cities
1134,2015-04-28,"Brixton's anti-gentrification protest: identifying the problems is one thing, fixing them is another",cities
1135,2015-04-28,End of the car age: how cities are outgrowing the automobile,cities
1136,2015-04-27,"The insider's guide to Johannesburg: 'Gold, blood, work, dance, faster'",cities
1137,2015-04-27,"Vienna's Karl Marx Hof: architecture as politics and ideology - a history of cities in 50 buildings, day 24",cities
1138,2015-04-27,'It doesn't even smell': a ride on the Bristol bus powered by human poo,cities
1139,2015-04-24,Can this rotating building really help solve housing inequality?,cities
1140,2015-04-24,The gentrification of Brixton unites an eclectic group of protesters,cities
1141,2015-04-24,"A former Shanghai 'comfort house' – a history of cities in 50 buildings, day 23",cities
1142,2015-04-23,What's the perfect size for a city?,cities
1143,2015-04-23,"Reliving the Rana Plaza factory collapse: a history of cities in 50 buildings, day 22",cities
1144,2015-04-22,Motorcycling near misses: share your experiences,cities
1145,2015-04-22,"Pruitt-Igoe: the troubled high-rise that came to define urban America – a history of cities in 50 buildings, day 21",cities
1146,2015-04-22,Disappearing Glasgow: documenting the demolition of a city's troubled past,cities
1147,2015-04-21,Privatised cities – your pictures and stories,cities
1148,2015-04-21,Glyphosate is a 'probably carcinogenic' herbicide. Why do cities still use it?,cities
1149,2015-04-21,"Chhatrapati Shivaji Terminus, Mumbai's iconic railway station – a history of cities in 50 buildings, day 20",cities
1150,2015-04-20,The insider's cultural guide to Ramallah: 'A misunderstood cosmopolitan bubble',cities
1151,2015-04-20,Cycling 'near misses' – your stories,cities
1152,2015-04-20,Where are the best places to skateboard in cities?,cities
1153,2015-04-20,The new skate city: how skateboarders are joining the urban mainstream,cities
1154,2015-04-20,"Kharkiv's Derzhprom: Europe’s first skyscraper complex  – a history of cities in 50 buildings, day 19",cities
1155,2015-04-17,Rotterdam plans a wind turbine you can live in,cities
1156,2015-04-17,Is your local market under threat? Share your stories and photos,cities
1157,2015-04-17,End of the road for London's traditional street markets? Meet the last stallholder in Hackney's 'Waste',cities
1158,2015-04-17,"Asmara's Fiat Tagliero service station: a history of cities in 50 buildings, day 18",cities
1159,2015-04-16,Real street food: Tuy palov from Tashkent,cities
1160,2015-04-16,"Beijing's old stock exchange – a history of cities in 50 buildings, day 17",cities
1161,2015-04-16,How cities vote: could Britain's left-leaning cities decide the election?,cities
1162,2015-04-15,"São Paulo's water crisis: in the Favela do Moinho, 2,500 residents rely on one impossibly thin blue pipe",cities
1163,2015-04-15,"Berlin's flat-roofed Hufeisensiedlung – a history of cities in 50 buildings, day 16",cities
1164,2015-04-14,"Manaus's opulent Amazon Theatre – a history of cities in 50 buildings, day 15",cities
1165,2015-04-14,King's Cross airport? The outlandish plans for London that almost got built,cities
1166,2015-04-13,"Los Angeles's Four Level interchange: a history of cities in 50 buildings, day 14",cities
1167,2015-04-13,How Warsaw's district heating system keeps the capital cleaner than Kraków,cities
