,Date,Content,Section
2244,2017-03-08,Rebels with a cause: the female biker clubs reclaiming Delhi's public space,cities
2245,2017-03-07,Would Jesus be a gentrifier? How Christianity is embracing urban renewal,cities
2246,2017-03-06,Accra in the spotlight: colonial questions as Ghana's capital celebrates its 60th,cities
2247,2017-03-06,Brick Lane in the 80s: before it became Banglatown,cities
2248,2017-03-03,Toronto's buried history: the dark story of how mining built a city,cities
2249,2017-03-02,Stuttgart residents sue mayor for 'bodily harm' caused by air pollution,cities
2250,2017-03-01,The architecture of fear: how Caracas has adapted to constant threat of violence,cities
2251,2017-03-01,City of burning lakes: experts fear Bangalore will be uninhabitable by 2025,cities
2252,2017-02-28,He who controls the sand: the mining 'mafias' killing each other to build cities,cities
2253,2017-02-27,Sand mining: the global environmental crisis you’ve never heard of,cities
2254,2017-02-26,The lure of tall buildings: A guide to the risky but lucrative world of ‘rooftoppers’,cities
2255,2017-02-24,'A city's art biennial can be like watching an army of curatorial truffle pigs',cities
2256,2017-02-24,'It's like being on an island in the sky': your stories of high-rise living,cities
2257,2017-02-23,One day in the life of San Francisco Bay – mapped,cities
2258,2017-02-23,Paint it grey: the controversial plan to 'beautify' São Paulo,cities
2259,2017-02-22,'I can’t believe how I used to live': from gang war to peace treaties in Monterrey,cities
2260,2017-02-22,A tale of four skulls: what human bones reveal about cities,cities
2261,2017-02-21,Cologne library opens its doors to refugees: 'You fill this room with life',cities
2262,2017-02-21,Cardiff v Cambridge: can the Welsh capital steal the crown of Britain's top cycling city?,cities
2263,2017-02-20,Plant power: why greenery is more than just a fig leaf for urban development,cities
2264,2017-02-20,Malta's secret tunnels: inside the newly discovered underworld of Valletta,cities
2265,2017-02-18,Hope for Hanoi? New bus system could cut pollution … if enough people use it,cities
2266,2017-02-17,'Forest cities': the radical plan to save China from air pollution,cities
2267,2017-02-16,'You can taste it in the air': your stories of life in polluted cities,cities
2268,2017-02-16,Where the wind blows: how China's dirty air becomes Hong Kong's problem,cities
2269,2017-02-16,"Millions of premature births could be linked to air pollution, study finds",cities
2270,2017-02-15,10 ways to beat air pollution: how effective are they?,cities
2271,2017-02-15,'Filthy glamour': could polluted Marylebone Road help fix London's air?,cities
2272,2017-02-15,Delhi's deadly dust: how construction sites are choking the city,cities
2273,2017-02-14,Breathless in Bakersfield: is the worst air pollution in the US about to get worse?,cities
2274,2017-02-14,"Zenica, Bosnia: the steel town where even taking a breath can be a struggle",cities
2275,2017-02-14,Air pollution masks – fashion's next statement?,cities
2276,2017-02-14,"65% of British public support new Clean Air Act, says survey",cities
2277,2017-02-14,Are you at risk? How pollution increases your chance of death – interactive,cities
2278,2017-02-13,One day in the life of a suffocating planet – as it happened,cities
2279,2017-02-13,'We had to sue': the five lawyers taking on China's authorities over smog,cities
2280,2017-02-13,Pant by numbers: the cities with the most dangerous air – listed,cities
2281,2017-02-13,Smog tips: what to do when there's a pollution warning,cities
2282,2017-02-13,Welcome to Onitsha: the city with the world’s worst air,cities
2283,2017-02-13,Tipping point: revealing the cities where exercise does more harm than good,cities
2284,2017-02-13,The war against air pollution has begun – and it will be fought in cities,cities
2285,2017-02-11,"UK's cash-starved parks at tipping point of decline, MPs warn",cities
2286,2017-02-11,Mies’s Mansion House Square: the best building London never had?,cities
2287,2017-02-10,Urban public art: can it be more than a developer’s decoy strategy?,cities
2288,2017-02-08,The populist bishop and the Apprentice host: meet Brazil's new megacity mayors,cities
2289,2017-02-08,Deja vu but different: how the fall of one New Zealand city helped save another,cities
2290,2017-02-07,'A brave new world': what happened to Newcastle's dream for a vertical city?,cities
2291,2017-02-06,Made in London no more: will property speculation kill industry in the capital?,cities
2292,2017-02-06,New life in the kingdom of death: the plan to redevelop subterranean Paris,cities
2293,2017-02-04,Head in the clouds: share your stories about life in tall buildings,cities
2294,2017-02-04,'The building creaks and sways': life in a skyscraper,cities
2295,2017-02-03,Vanity height: how much space in skyscrapers is unoccupiable?,cities
2296,2017-02-03,Quiz: guess the city from its skyline,cities
2297,2017-02-02,Forget-me-nots in Purley: how the town became 'dementia friendly',cities
2298,2017-02-02,Beirut's last public beach: residents fear privatisation of Ramlet al-Baida,cities
2299,2017-02-01,First class meal: could the US postal service deliver food to the needy?,cities
2300,2017-02-01,Sydney's last stand: the residents holding out against gentrification,cities
2301,2017-01-31,Britain has enough land to solve the housing crisis – it's just being hoarded,cities
2302,2017-01-31,Building Zion: the controversial plan for a Mormon-inspired city in Vermont,cities
2303,2017-01-30,"From book to boom: how the Mormons plan a city for 500,000 in Florida",cities
2304,2017-01-27,Devolve power to London as a blueprint for other major UK cities – report,cities
2305,2017-01-27,Frankfurt prepares for Brexit bankers: 'Maybe our city will change them',cities
2306,2017-01-26,Blackpool's beach pleasures: nostalgia and neglect at the seaside – in pictures,cities
2307,2017-01-26,Going Dutch: will Amsterdam grab a slice of the post-Brexit cake?,cities
2308,2017-01-25,The future of the US-Mexican border: inside the 'split city' of El Paso-Juárez,cities
2309,2017-01-25,Passport to Paris? City rolls out red carpets to arrivals from Brexit London,cities
2310,2017-01-24,Will New York get a Brexit boost to cancel out feared 'Trump slump'?,cities
2311,2017-01-24,​Tinder for cities: how tech is making urban planning more inclusive,cities
2312,2017-01-23,Can post-Brexit London survive as Europe's cultural and financial capital?,cities
2313,2017-01-20,"50 reasons to love Milton Keynes (what, only 50?)",cities
2314,2017-01-19,'I want to kill these dogs': question of whether to cull strays divides Yangon,cities
2315,2017-01-19,The female street photographers of Instagram – in pictures,cities
2316,2017-01-18,How a design competition changed the US approach to disaster response,cities
2317,2017-01-18,People power in Puerto Rico: how a canal community escaped gentrification,cities
2318,2017-01-17,Face-off over the Congo: the long rivalry between Kinshasa and Brazzaville,cities
2319,2017-01-16,The radical model fighting the housing crisis: property prices based on income,cities
2320,2017-01-13,Homeless in Britain: ‘I graduated with honours – and ended up on the streets’,cities
2321,2017-01-12,Fear and loathing in Nicosia: will peace talks unify Europe's last divided capital?,cities
2322,2017-01-11,The Forbidden City: inside the abandoned Soviet camp of Wünsdorf,cities
2323,2017-01-11,Bournville again: can a new Birmingham hospital recreate the Cadbury effect?,cities
2324,2017-01-10,US housing crisis: what can Ben Carson learn from radical 1960s 'new town' plan?,cities
2325,2017-01-10,Guns for hire in Hereford: inside England's unlikely global security hub,cities
2326,2017-01-09,A divided empire: what the urban-rural split means for the future of America,cities
2327,2017-01-09,The rise of the cashless city: 'There is this real danger of exclusion',cities
2328,2017-01-06,'Spat on and ignored': what I've learned from a month sleeping rough in London,cities
2329,2019-01-07,Baghdad at 10 million: fragile dreams of normality as megacity status beckons,cities
2330,2019-01-04,'Sometimes the city lands right on top of you': Glasgow by Mitch Miller – an urban cartoon,cities
2331,2019-01-03,"Too little, too late? The battle to save Tripoli's futuristic fairground",cities
2332,2019-01-02,Turkey's gift of a mosque sparks fears of ‘neo-Ottomanism’ in Kosovo,cities
2333,2018-12-31,City life in miniature: the tiny cement sculptures hidden across Europe,cities
2334,2018-12-30,Newcastle's 'digital twin' to help city plan for disasters,cities
2335,2018-12-28,Spite buildings and 50C cities: the most-read urban stories of 2018,cities
2336,2018-12-27,Green-feathered immigrant surge prompts Greek parakeet count,cities
2337,2018-12-27,'The location is a character': where cinema meets the city,cities
2338,2018-12-25,'London can feel impersonal': why two men are replicating it in gingerbread,cities
2339,2018-12-21,'There's no major city like it': Toronto's unique ravine system under threat,cities
2340,2018-12-20,From autobahn anomaly to motorway marvel: Berlin's roadside grandstands,cities
2341,2018-12-19,The dark history of Santa's city: how Rovaniemi rose from the ashes,cities
2342,2018-12-18,Row over Belgrade's Christmas decorations leaves city more furious than festive,cities
2343,2018-12-18,"The fallen metropolis: the collapse of Caracas, the jewel of Latin America",cities
2344,2018-12-17,Baghdad's Green Zone reopens: 'The politicians inside are sleeping on money',cities
2345,2018-12-14,Minnette de Silva: the brilliant female architect forgotten by history,cities
2346,2018-12-13,What would a city that is safe for women look like?,cities
2347,2018-12-13,'City living no be easy': Accra by Richard Opoku Agyeman – an urban comic,cities
2348,2018-12-12,Shenzhen's silent revolution: world's first fully electric bus fleet quietens Chinese megacity,cities
2349,2018-12-12,'A different type of housing spreads': Manchester by Ben Tallon – an urban comic,cities
2350,2018-12-11,Cycles for cigarettes: city gives bikes to children if a relative quits,cities
2351,2018-12-11,"In the postwar 'death zone', new life: Berlin by Ali Fitzgerald – an urban comic",cities
2352,2018-12-10,Grinding and dehumanising: New York by Liana Finck – an urban comic,cities
2353,2018-12-10,The anxious art of Liana Finck: 'People who don't live in cities think I'm being so mean',cities
2354,2018-12-07,"'I'm just trying to survive, like you': the people living on London's streets",cities
2355,2018-12-06,Boston’s miracle: how America stopped young men killing each other,cities
2356,2018-12-06,Down with 'studentification': how cities fought for their right not to party,cities
2357,2018-12-05,"Nepal: first came the earthquake, then came the debt",cities
2358,2018-12-04,Axolotls in crisis: the fight to save the 'water monster' of Mexico City,cities
2359,2018-12-04,'Busking might die out': musicians fear for future as councils crack down,cities
2360,2018-12-03,'Their ideas had no place here': how Crete kicked out Golden Dawn,cities
2361,2018-12-02,'Will I have existed?' The unprecedented plan to move an Arctic city,cities
2362,2018-11-30,'It’s the only way forward': Madrid bans polluting vehicles from city centre,cities
2363,2018-11-29,"30,000 empty homes and nowhere to live: inside Dublin’s housing crisis",cities
2364,2018-11-28,Manchester tackles homelessness crisis – by embracing the arts,cities
2365,2018-11-28,The rise of the 'meanwhile space': how empty properties are finding second lives,cities
2366,2018-11-27,Why are Ghana's roads so deadly? Latest fatality sparks fury in Accra,cities
2367,2018-11-27,Magnetic levitation: the return of transport's great 'what if?',cities
2368,2018-11-26,'A playground for grown up kids': inside the student housing built by its residents,cities
2369,2018-11-26,How London became the tuberculosis capital of Europe,cities
2370,2018-11-24,Fake Adidas and Hello Kitty: a taste of consumerism for North Korea’s elite,cities
2371,2018-11-22,We have a problem: can a city spaceport keep Houston in the space race?,cities
2372,2018-11-21,Is India’s biggest ever urban redevelopment too good to be true?,cities
2373,2018-11-20,Viking city: excavation reveals urban pioneers not violent raiders,cities
2374,2018-11-19,Has the ‘New Zealand dream’ turned sour for Auckland's Pacific Islanders?,cities
2375,2018-11-16,'I felt like I had seen the future': capturing east Asian megacities,cities
2376,2018-11-15,Vanity projects and kamikaze loggias: Tbilisi’s architectural disaster,cities
2377,2018-11-14,Can local walking groups help solve urban issues?,cities
2378,2018-11-13,What would a smog-free city look like?,cities
2379,2018-11-10,Student loans company: Milan's age-defying solution to high rents,cities
2380,2018-11-10,"Exploding buses, collapsing escalators – what's the matter with Rome's transit?",cities
2381,2018-11-09,Trafalgar pyramid? A look at an alternative London,cities
2382,2018-11-08,"Quakes, mudslides, an active volcano: inside the world's riskiest city",cities
2383,2018-11-08,"Caught, gutted, sold: the final days of Dakar's traditional fish market",cities
2384,2018-11-06,Ramallah construction boom threatens city's architectural heritage,cities
2385,2018-11-05,'The wrong type of development': the battle for Edinburgh's Leith Walk,cities
2386,2018-11-05,Minnesota Experimental City: the 1960s town based on a comic strip,cities
2387,2018-11-02,'It became a form of therapy': the Londoner who writes #NotestoStrangers,cities
2388,2018-11-01,Stockholm says no to Apple 'town square' in its oldest park,cities
2389,2018-10-31,Last chapter for Hong Kong bookshop selling titles banned in China,cities
2390,2018-10-30,Mexico City's vertical gardens: seeds of change or cynical greenwashing?,cities
2391,2018-10-30,Inside Santos Lima: the block at the heart of Lisbon's 'real-estate bullying',cities
2392,2018-10-29,Happy Kataloween: the spooky celebration in the Paris catacombs,cities
2393,2018-10-29,'Build it and they will come': Tirana's plan for a 'kaleidoscope metropolis',cities
2394,2018-10-27,A hip-hop Halloween: inside the haunted house that 2 Chainz built,cities
2395,2018-10-26,'The world's only just begun to have a taste of Atlanta's sauce': ATL responds,cities
2396,2018-10-26,Hollywood of the south: Atlanta's film industry got so big it built its own neighborhood,cities
2397,2018-10-26,"City in a city: the 63,000 people who run the world's busiest airport",cities
2398,2018-10-25,'This is Wakanda': the black tech entrepreneurs taking on Silicon Valley,cities
2399,2018-10-25,Goatlanta: why exactly are there so many goats here anyway?,cities
2400,2018-10-25,A city cursed by sprawl: can the BeltLine save Atlanta?,cities
2401,2018-10-24,#weloveatl: how Instagram fell in love with Atlanta – in pictures,cities
2402,2018-10-24,‘It's OK to be ourselves’: Atlanta’s black LGBT community in their own words,cities
2403,2018-10-24,'It's 100% segregated': does Georgia's LGBT haven have a race problem?,cities
2404,2018-10-24,Real Housewives of Anywhere: what does the series say about the cities?,cities
2405,2018-10-24,Stone Mountain: is it time to remove America's biggest Confederate memorial?,cities
2406,2018-10-23,The roots of the US black art renaissance: 'It wouldn't have been OK in any other city',cities
2407,2018-10-23,The lost city of Atlanta,cities
2408,2018-10-23,'A-T-L!': the soccer team outselling the NFL,cities
2409,2018-10-23,Nowhere for people to go: who will survive the gentrification of Atlanta?,cities
2410,2018-10-22,Atlanta liveblog: the Guardian visits the unofficial capital of the 'new south' – as it happened,cities
2411,2018-10-22,"Barcelona Airbnb host 'manages rentals worth £33,000 a day'",cities
2412,2018-10-22,The Sound of Atlanta – music interactive,cities
2413,2018-10-22,Black 'reverse migration' driving metro Atlanta towards Democrats,cities
2414,2018-10-22,'Disneyland for adults': John Portman's dizzying interior legacy,cities
2415,2018-10-22,Black mecca or most unequal US city: will the real Atlanta please stand up?,cities
2416,2018-10-22,What is Guardian Atlanta week – and how can you get involved?,cities
2417,2018-10-18,Politicians may finally be catching on: towns now hold the key to Britain's future,cities
2418,2018-10-17,Chinese city 'plans to launch artificial moon to replace streetlights',cities
2419,2018-10-16,The Mexican town that refused to become a smart city,cities
2420,2018-10-15,'I leave the car at home': how free buses are revolutionising one French city,cities
2421,2018-10-11,Tourism pushed women out of Zanzibar's public spaces – but now they're taking them back,cities
2422,2018-10-10,What would an age-friendly city look like?,cities
2423,2018-10-09,"Asian Town, Qatar's mall for migrants: 'You can't ignore the racial undertones'",cities
2424,2018-10-08,'Repulsive to children and adults': how explicit should public art get?,cities
2425,2018-10-05,Raccoons v Toronto: how 'trash pandas' conquered the city,cities
2426,2018-10-05,Desire paths: the illicit trails that defy the urban planners,cities
2427,2018-10-04,'This is part of the plan': new train blurs line between China and Hong Kong,cities
2428,2018-10-03,"As Bangkok sinks, could this anti-flood park be the answer?",cities
2429,2018-10-03,'Don't touch my Vespa!' Why Genoa is threatening to ban its icon of cool,cities
2430,2018-10-02,'There’s no other option’: the radical plan to move Mexico's government,cities
2431,2018-10-02,Walkways in the sky: the return of London's forgotten 'pedways',cities
2432,2018-10-01,Multibillion-dollar Macau: a city of glitz and grit – photo essay,cities
2433,2018-09-28,Life is sweet: on the hunt with Slovenia's 'rapid response' beekeeper unit,cities
2434,2018-09-27,'There was a lot of fear': how Heidelberg changed when the US army left town,cities
2435,2018-09-27,Meet the Midnight Runners: 'It bonds us with the city',cities
2436,2018-09-26,Statue wars: what should we do with troublesome monuments?,cities
2437,2018-09-26,'These cities value freedom and democracy’: the Syrian families searching Europe for justice,cities
2438,2018-09-25,Sleepless in ... Seattle? Which city gets the least shuteye?,cities
2439,2018-09-21,'Unbelievable': campaigners dispute police verdict 'M25 cat killer' is foxes,cities
2440,2018-09-21,'Let's bring back the dignity of walking': being on foot in your city,cities
2441,2018-09-21,'I follow a different person every day': using strangers to explore the city,cities
2442,2018-09-20,Don't walk this way: why Hong Kong reopened a pedestrian street to cars,cities
2443,2018-09-20,New data reveals most dangerous London borough for pedestrians,cities
2444,2018-09-19,Everyday memories of Addis Ababa – a photo essay,cities
2445,2018-09-19,Walk the Lijnbaan: decline and rebirth on Europe’s first pedestrianised street,cities
2446,2018-09-19,What would a truly walkable city look like?,cities
2447,2018-09-18,"'For me, this is paradise': life in the Spanish city that banned cars",cities
2448,2018-09-18,‘Would that all journeys were on foot’: writers on the joy of walking,cities
2449,2018-09-17,Vision Zero: has the drive to eliminate road deaths lost its way?,cities
2450,2018-09-17,"It's fascinating, the things you see when you’re out on foot | David Sedaris",cities
2451,2018-09-16,What is Walking the City week – and how can you get involved?,cities
2452,2018-09-14,Was that the Whittington estate in Bodyguard? A spotter’s guide to brutalism,cities
2453,2018-09-14,City with a past: why classical and modern Athens are at war | Michael Scott,cities
2454,2018-09-13,Occupy Venice: 'We are the alternative to the death of the city',cities
2455,2018-09-13,Could a grid of giant filters help clean up Delhi's polluted air?,cities
2456,2018-09-12,US activists launch climate change initiatives in absence of federal leadership,cities
2457,2018-09-12,'Hiding in plain sight': How London street signs reveal more than just names,cities
2458,2018-09-12,Revealed: London council took on financial risk of estate development,cities
2459,2018-09-11,The São Paulo taxi firm that dares to go where Uber doesn't,cities
2460,2018-09-10,Working the line: street vendors at the US-Mexico border – photo essay,cities
2461,2018-09-10,Derry has a high suicide rate – but could redesigning the river help the city?,cities
2462,2018-09-07,'On the bike path I feel a connection to people': your shared spaces,cities
2463,2018-09-06,None of the fun of the fair: the London showpeople fighting for their homes,cities
2464,2018-09-05,Dublin's homelessness crisis jars with narrative of Irish economic boom,cities
2465,2018-09-05,Devastated and destroyed: Delhi slums struggle to recover from frequent fires,cities
2466,2018-09-04,'Everybody fits in': inside the Canadian cities where minorities are the majority,cities
2467,2018-09-04,Tell us about your 'third place' – where you connect with your community,cities
2468,2018-09-04,Inside Greece's first smart city: 'Now you don't need to know a politician to get something done',cities
2469,2018-09-03,Two hours with a stranger: can these questions open up a city?,cities
2470,2018-08-31,London's parks accused of 'creeping privatisation' of public spaces,cities
2471,2018-08-30,'Where it was – but not how it was': how the Sicilian earthquake divided a town,cities
2472,2018-08-29,Faces of Flint: the story of a modern American city,cities
2473,2018-08-29,How Spanish flu helped create Sweden's modern welfare state,cities
2474,2018-08-28,Get smart! How a 90s bus pass trial transformed London travel,cities
2475,2018-08-28,'Asmara is a jewel': but can Eritrea's modernising capital retain its charm?,cities
2476,2018-08-23,Hundreds of thousands displaced as Shenzhen ‘upgrades’ its urban villages,cities
2477,2018-08-23,How Turkey’s lira crisis was written in Istanbul's skyline,cities
2478,2018-08-22,"‘Addicts, crooks, thieves’: the campaign to kill Baltimore's light rail",cities
2479,2018-08-22,Ceci n’est pas une rue: Brussels to adopt whimsical new street names,cities
2480,2018-08-21,Turbo Island is a 'space left over after planning' – and Bristolians want it back,cities
2481,2018-08-20,'The rich man's road': Nairobi slum demolished for highway,cities
2482,2018-08-19,'So much cooler back then': exhibition recreates Berlin techno club culture,cities
2483,2018-08-17,'This summer doesn't belong in Scandinavia': your stories of heat around the world,cities
2484,2018-08-16,Green space in every schoolyard: the radical plan to cool Paris,cities
2485,2018-08-16,How Delhi's rising heat and a love of concrete caused a deadly water crisis,cities
2486,2018-08-15,Sydney's bushfire season starts in winter: 'We may have to rethink how we live',cities
2487,2018-08-15,"Plans for Australia's tallest building unveiled, but developer faces planning battle",cities
2488,2018-08-15,Planning regulations overlook heat – so developers build death traps,cities
2489,2018-08-15,What would a heat-proof city look like?,cities
2490,2018-08-14,'It can’t get much hotter ... can it?' How heat became a national US problem,cities
2491,2018-08-14,Which cities are liveable without air conditioning?,cities
2492,2018-08-14,An inversion of nature: how air conditioning created the modern city,cities
2493,2018-08-13,Heat: the next big inequality issue,cities
2494,2018-08-13,Halfway to boiling: the city at 50C,cities
2495,2018-08-10,Manhole covers: a window into a city’s soul – in pictures,cities
2496,2018-08-09,Straight Outta Compton is a classic album – but did it help or harm 'Hub City'?,cities
2497,2018-08-08,"Inside Ashgabat, the flashy but empty 'city of the dead'",cities
2498,2018-08-07,Hungry for change: urban foragers take the law into their own hands,cities
2499,2018-08-07,‘How can a proud country kill its heritage?’ Cairo calls time on oldest watch shop,cities
2500,2018-08-06,Socialist modernism: remembering the architecture of the eastern bloc,cities
2501,2018-08-06,"'Five years ago there was nothing': inside Duqm, the city rising from the sand",cities
2502,2018-08-04,Will skyscrapers sink to new depths in British cities?,cities
2503,2018-08-04,'It's a shocking idea': outcry over Bangkok street vendor ban,cities
2504,2018-08-03,'All-weather friendship': but is Pakistan relying too heavily on China?,cities
2505,2018-08-02,Sri Lanka's 'new Dubai': will Chinese-built city suck the life out of Colombo?,cities
2506,2018-08-01,São Paulo: taggers killed for their art show dangers of city's graffiti culture,cities
2507,2018-08-01,Germany's 'China City': how Duisburg became Xi Jinping's gateway to Europe,cities
2508,2018-07-31,"China in Africa: win-win development, or a new colonialism?",cities
2509,2018-07-31,'No Cambodia left': how Chinese money is changing Sihanoukville,cities
2510,2018-07-30,What is China's Belt and Road Initiative?,cities
2511,2018-07-30,Follow the New Silk Road,cities
2512,2018-07-28,'We have different ways of coping': the global heatwave from Beijing to Bukhara,cities
2513,2018-07-27,Can artists save St Petersburg's crumbling palaces?,cities
2514,2018-07-26,'No land for love or money': how gentrification hit the Mennonites,cities
2515,2018-07-26,Cover-up: Jakarta hides foul river with giant net before Asian Games,cities
2516,2018-07-25,Pride of Amsterdam: city's oldest gay bar celebrates survival,cities
2517,2018-07-24,'The US government has checked out on renewables': can cities fill the gap?,cities
