,Date,Content,Section
0,2013-12-05,Transport in Europe: how does it differ by city?,cities
1,2013-09-03,Boom and bus: how public transport can curb road deaths as our cities grow | Claudia Adriazola,cities
2,2013-08-13,Hyperloop train plans unveiled by PayPal founder Elon Musk - video,cities
3,2013-08-08,In search of Australia's best cycling city,cities
4,2013-07-31,Medellín: the fast track from the slums,cities
5,2013-07-19,Detroit: a city in decline - in pictures,cities
6,2015-01-03,Global campaign aims to inspire British cities to choose 100% clean energy,cities
7,2014-12-30,What I want from our cities in 2015: public spaces that are truly public,cities
8,2014-12-30,Bangs for their bucks: which city has the biggest New Year's Eve fireworks?,cities
9,2014-12-29,What I want from our cities in 2015: a severe tax on empty homes,cities
10,2014-12-22,The top city stories of 2014,cities
11,2014-12-22,"Songdo, South Korea: the world's first smart city - in pictures",cities
12,2014-12-22,The smartest cities rely on citizen cunning and unglamorous technology,cities
13,2014-12-19,Five cities where planning went right,cities
14,2014-12-18,Lego: can this most analogue of toys really be a modern urban planning tool?,cities
15,2014-12-17,The best neighbourhood murals around the world – readers' pictures,cities
16,2014-12-17,"The truth about smart cities: ‘In the end, they will destroy democracy'",cities
17,2014-12-17,'Nobody cycles across Mumbai.' But why?,cities
18,2014-12-16,Real street food: Mongolian Khuushuur,cities
19,2014-12-16,Inside Beijing's airpocalypse – a city made 'almost uninhabitable' by pollution,cities
20,2014-12-15,The 10 best city books of 2014,cities
21,2014-12-15,What an Ebola curfew looks like,cities
22,2014-12-12,"In Beijing, residents move underground to find affordable rents",cities
23,2014-12-12,'There’s land if you want it': how a hand-drawn map is transforming vacant lots in Brooklyn,cities
24,2014-12-12,Moscow embraces 'hipster Stalinism',cities
25,2014-12-11,London's post-war reconstruction plan promised 'new order and dignity',cities
26,2014-12-11,Bike share and the living wage: Your ingredients for a liveable city,cities
27,2014-12-11,Kabul – the fifth fastest growing city in the world – is bursting at the seams,cities
28,2014-12-10,"In Manila, malls aren't passe – they are the city itself",cities
29,2014-12-10,Pruitt Igoe: Blowing up this St Louis housing project was easier than demolishing the myth it created,cities
30,2014-12-10,An urbanist's guide to Mexico City: ‘Transport is an adventure and often a nightmare’,cities
31,2014-12-09,Bethlehem syndrome: understanding the little town of 'Brand Holy Land',cities
32,2014-12-09,The symbolic simplicity of Mexico City's metro signs,cities
33,2014-12-08,Melbourne floats a public surfing park,cities
34,2014-12-08,Neighbourhood murals: share your pictures and stories,cities
35,2014-12-08,Chicago's Wall of Respect: how a mural elicited a sense of collective ownership,cities
36,2014-12-08,What makes a liveable city?,cities
37,2014-12-08,Is Jan Gehl winning his battle to make our cities liveable?,cities
38,2014-12-05,Ebenezer Howard's three magnets,cities
39,2014-12-05,"If women built cities, what would our urban landscape look like?",cities
40,2014-12-04,This 'hero shot' of Shanghai’s future skyline projects China's success,cities
41,2014-12-04,"A new breed of resilience: 'In the 21st century, crisis may be the new normal'",cities
42,2014-12-03,Dubai's Palm Jumeirah islands only look like palm trees from space – but that doesn't matter,cities
43,2014-12-03,St Louis aims to ease social tensions as it joins 100 Resilient Cities programme,cities
44,2014-12-02,Bicester residents fear garden city plan will put strain on local services,cities
45,2014-12-02,The best urban parks in the US – your pictures and stories,cities
46,2014-12-02,100 Resilient Cities project ready to reveal 35 new urban strongholds,cities
47,2014-12-02,The architects of apartheid,cities
48,2014-12-01,The iconic origins of Brazil's capital city,cities
49,2014-12-01,How images shape our cities,cities
50,2014-11-28,Guardian Cities Mumbai: day five,cities
51,2014-11-28,The SlumGods of Mumbai: ‘hip-hop has brought us to the world’,cities
52,2014-11-28,'Slum' is a loaded term. They are homegrown neighbourhoods,cities
53,2014-11-28,Open Mumbai: how PK Das set out to map the city's slums,cities
54,2014-11-28,"Mumbai street vendors: 'Cops work in shifts, so I have to bribe each one'",cities
55,2014-11-28,"'God gave us so many fish, but he gave us so much ocean too'",cities
56,2014-11-28,"In Mumbai, the wealthy elite's willingness to show off has reached new extremes",cities
57,2014-11-28,D'kloset closes: how the only gay shop in Mumbai lost its fight for survival,cities
58,2014-11-28,The dockland redevelopment: Mumbai's last big chance?,cities
59,2014-11-27,Guardian Cities Mumbai: day four,cities
60,2014-11-27,Aditya Thackeray: 24-year-old scion of India’s controversial political dynasty,cities
61,2014-11-27,"'In India cricket is a religion, but football is a way of life'",cities
62,2014-11-27,Mumbai's dawn runners: the race for space on the city streets,cities
63,2014-11-27,Street kid kitchen: Mumbai black daal and chicken in coconut,cities
64,2014-11-27,Mumbai skywalks: are these elevated paths 'ugly caterpillars' or precious public space?,cities
65,2014-11-27,Cricket v football: Mumbai decides,cities
66,2014-11-27,Why Mumbai should get over its obsession with cars,cities
67,2014-11-27,‘Being a taxi driver in Mumbai is one of the lowest class of jobs’,cities
68,2014-11-27,"Hotter summers are coming to Mumbai, and it won't be pretty",cities
69,2014-11-27,Mumbai will likely flood again – and nobody's doing much about it,cities
70,2014-11-26,Guardian Cities Mumbai: day three,cities
71,2014-11-26,How Prerana’s Priti Patkar has changed the lives of sex workers' children,cities
72,2014-11-26,Mumbai in fiction: which six novels sum up Bombay best?,cities
73,2014-11-26,The leopards of Mumbai: life and death among the city's 'living ghosts',cities
74,2014-11-26,Mumbai after 26/11: policeman Brijesh Singh meets fellow author Hussain Zaidi,cities
75,2014-11-26,More than a taste test: just how hygienic is Mumbai's street food?,cities
76,2014-11-26,NDTV-Guardian Cities debates: from Bollywood to the safety of women,cities
77,2014-11-26,Terror threat to India rising again six years after Mumbai attacks,cities
78,2014-11-25,Guardian Cities Mumbai: day two,cities
79,2014-11-25,Painted men: the healers of Dharavi,cities
80,2014-11-25,"At the heart of Dharavi are 20,000 mini-factories",cities
81,2014-11-25,"From Bollywood to Hollywood, what are the top 10 films set in Mumbai?",cities
82,2014-11-25,On Juhu Beach: the YMCA shelter that Mumbai's poorest kids call home,cities
83,2014-11-25,Gangs targeting Bollywood stars again in search for ‘new business model’,cities
84,2014-11-24,Guardian Cities in Mumbai – day one,cities
85,2014-11-24,"‘If you want to clean Mumbai, give us women the responsibility’",cities
86,2014-11-24,Women in Mumbai: how is life changing?,cities
87,2014-11-24,Everyday Mumbai – in pictures,cities
88,2014-11-24,"Reclaiming the streets: a vision of a happier, healthier Mumbai",cities
89,2014-11-24,'Mumbai is on the verge of imploding',cities
90,2014-11-22,Guardian Cities in Mumbai: how to follow our events and join in the fun,cities
91,2014-11-22,Creating a buzz in the heart of Mumbai,cities
92,2014-11-21,Indian bureaucracy dashes Kim Kardashian’s hopes of joining Bigg Boss,cities
93,2014-11-21,How to create happy communities through co-housing,cities
94,2014-11-20,Downtown and out? The truth about Tony Hsieh’s $350m Las Vegas project,cities
95,2014-11-19,London v Pittsburgh – in pictures,cities
96,2014-11-19,Real street food - No 4: Ice-cream and peanut wrap from Taipei,cities
97,2014-11-18,Mumbai at night: share your pictures,cities
98,2014-11-18,Can Urban Vision turn Mumbai's unloved plots into precious spaces?,cities
99,2014-11-18,"Wherever American cities are going, the battle will be won or lost in Newark, not New York",cities
100,2014-11-18,District heating: a hot idea whose time has come,cities
101,2014-11-17,An urbanist's guide to Los Angeles: ‘The most misunderstood city on the planet’,cities
102,2014-11-14,How 'parasitic robots' on neon billboards could purify city air,cities
103,2014-11-14,Finding solutions for urban resilience on a farm in Vermont,cities
104,2014-11-13,The sci-fi future of lamp-posts,cities
105,2014-11-12,Hamburg at forefront of global drive to reverse privatisation of city services,cities
106,2014-11-11,Hypotopia: How a €19bn model city has changed Austria’s attitude to protest,cities
107,2014-11-11,Underground London: adventures in the secret city beneath our feet,cities
108,2014-11-10,How do you map a city?,cities
109,2014-11-10,"For the sake of our cities, it's time to make town planning cool again",cities
110,2014-11-10,Why is Brighton so obsessed with coffee?,cities
111,2014-11-09,Can Batman fix India’s pothole problem?,cities
112,2014-11-07,Are there really 'women-free' zones in the suburbs of Paris?,cities
113,2014-11-07,Indian police chief pushes yoga and meditation to strengthen arm of the law,cities
114,2014-11-06,Missing Maps: what is Baraka ... and how can you help map it?,cities
115,2014-11-06,'Re-education' campaigns teach China's new ghost city-dwellers how to behave,cities
116,2014-11-05,From Reagan to Hasselhoff: 5 people who didn’t bring down the Berlin Wall,cities
117,2014-11-05,Meet the ghost-sign hunters,cities
118,2014-11-04,End of the Boardwalk empire? The rise and demise of Atlantic City,cities
119,2014-11-03,Cairo's regeneration: share your stories,cities
120,2014-11-03,Why the battle for control of downtown Cairo is a fight for the future of Egypt,cities
121,2014-11-03,An urbanist's guide to Perth: ‘Perth has stripped me of my vagabondism’,cities
122,2014-10-31,The World Cities Day Challenge: meet our fire-breathing judges,cities
123,2014-10-31,The World Cities Day Challenge: so what is this thing anyway?,cities
124,2014-10-30,A guerrilla design project hopes to make cities better – for cars,cities
125,2014-10-30,The best parks and green spaces in US cities: share your favourites,cities
126,2014-10-30,Mitchell Silver: a man possessed by making New York’s parks havens of happiness for all,cities
127,2014-10-30,"Real street food – No 3: Com Tam, broken rice from Ho Chi Minh City",cities
128,2014-10-30,China's obsession with vertical cities,cities
129,2014-10-29,The best cycling infrastructure in cities around the world – your pictures,cities
130,2014-10-29,Disabled man takes on Tube challenge,cities
131,2014-10-28,Could new technology help older people in Barcelona create stronger networks?,cities
132,2014-10-28,Where on earth is the Berlin wall?,cities
133,2014-10-27,The 2014 World Cities Day Challenge: what's your favourite city idea?,cities
134,2014-10-27,Should we be concerned about Placemeter – an app which monitors street views from apartment windows?,cities
135,2014-10-27,An urbanist's guide to Cairo: ‘a city weighed down by stereotypes’,cities
136,2014-10-27,Old white guy for mayor: has Toronto's great multicultural project failed?,cities
137,2014-10-24,Could we plan our cities using Twitter?,cities
138,2014-10-24,Night lights: your pictures of cities around the world after dark,cities
139,2014-10-24,"Street lights, camera, action: how  LEDs are changing the look of films",cities
140,2014-10-23,Urban light pollution: why we're all living with permanent 'mini jetlag',cities
141,2014-10-23,Q&A: Are 24-hour cities good for you?,cities
142,2014-10-23,Stories from Mumbai: share yours,cities
143,2014-10-23,Real street food - No 2: Pesarattu from Chennai,cities
144,2014-10-23,The top 10 boring city objects – your pictures,cities
145,2014-10-22,New cold war: the Geneva fallout bunkers doubling as homeless shelters,cities
146,2014-10-22,How Barcelona's homeless are guiding tourists round the city's underbelly,cities
147,2014-10-21,The 'great indigenous divide': Winnipeg stares into an ethnic chasm,cities
148,2014-10-21,"Meet the Indian boss who gave cars, apartments and diamonds to employees",cities
149,2014-10-21,Athens v Munich: why homelessness hits rich cities as hard as poor ones,cities
150,2014-10-20,An urbanist's guide to Edmonton: 'a bright future for a city shaped by oil',cities
151,2014-10-20,Housing First: the 'counterintuitive' method for solving urban homelessness,cities
152,2014-10-19,Victoria Henshaw obituary,cities
153,2014-10-17,Bikes pretending to be cars? Riga's cyclists stage a clever protest over space,cities
154,2014-10-17,Now the UN is intervening in Detroit's water conflict. Could thirsty cities riot?,cities
155,2014-10-17,How the home of Bollywood united to rescue the Mumbai Film Festival,cities
156,2014-10-17,Surfboards and submarines: the secret escape of East Germans to Copenhagen,cities
157,2014-10-16,Q&A: Are UK cities prepared for another flooding disaster?,cities
158,2014-10-16,"Innovation in, lycra out: what Copenhagen can teach us about cycling",cities
159,2014-10-16,Jo Baka: the Gujarati internet meme that went viral,cities
160,2014-10-15,"Inside Gbadolite, President Mobutu’s personal city in the jungle",cities
161,2014-10-15,"Forty years on from the Rumble in the Jungle, Kinshasa is a city of chaos",cities
162,2014-10-15,Back to the future: the fake relics of the 'old' Chinese city of Datong,cities
163,2014-10-14,Real city street food – No 1: Pljeskavica from Belgrade,cities
164,2014-10-14,The Tour de Neglect: a cycle ride through Buffalo's deprived East Side,cities
165,2014-10-13,This renovated old Bogotá theatre shows just what culture can do for a city,cities
166,2014-10-13,An urbanist's guide to Tunis: ‘It feels like a different city now’,cities
167,2014-10-11,Secret Mumbai: show us your city,cities
168,2014-10-10,Can we climate-proof cities? Six of the best conclusions from SXSW Eco 2014,cities
169,2014-10-10,Reality check: will 'Crossrail for bikes' bring gridlock to central London?,cities
170,2014-10-10,We can't let lobbyists destroy London's segregated cycle lane plans | Chris Boardman,cities
171,2014-10-10,Researching cities: does Bogotá's transformation hold up to scrutiny?,cities
172,2014-10-10,"For too long, cities have paid little notice to global issues. Climate change must change their mindset",cities
173,2014-10-09,Why climate change should signal the end of the city-state,cities
174,2014-10-09,A local cinema for local people: the neighbourhood picturehouse returns,cities
175,2014-10-08,Parisians have their say on city’s first €20m ‘participatory budget’,cities
176,2014-10-08,LuminoCity: new interactive map tool sheds light on British cities,cities
177,2014-10-07,Can cities save our wild bees?,cities
178,2014-10-07,The last video shop in Bristol makes an indie stand  against the age of Netflix,cities
179,2014-10-06,Missing Maps: nothing less than a human genome project for cities,cities
180,2014-10-06,An urbanist's guide to Rome: ‘Patience and humour are essential; miracles are a useful optional’,cities
181,2014-10-06,Abandoned sports stadiums around the world – your pictures,cities
182,2014-10-03,Night lights: share your photos of illuminated cities at night,cities
183,2014-10-03,Is London ready for a 'Mini Holland'?,cities
184,2014-10-03,Wooden skyscrapers could be the future of flat-pack cities around the world,cities
185,2014-10-02,What are the best 'boring' city objects? Share your favourites,cities
186,2014-10-02,"Bollards, bricks and black cabs: why the best urban objects are mundane",cities
187,2014-10-01,In praise of boring cities,cities
188,2014-10-01,Sir Peter Hall: reflections on a lifetime of town planning,cities
189,2014-09-30,Riding the Shinkansen: share your bullet train photos and memories,cities
190,2014-09-30,How the Shinkansen bullet train made Tokyo into the monster it is today,cities
191,2014-09-30,"In India, is moving to a city good or bad for your health?",cities
192,2014-09-29,Can Amsterdam’s e-trikes revolutionise the city’s food system?,cities
193,2014-09-29,An urbanist's guide to Melbourne: ‘It’s as hard to find a laneway without street art as a barista without a beard’,cities
194,2014-09-29,Bring on Mr Pothole: the classic urban problem finally meets its match,cities
195,2014-09-26,Madrid plans city centre car ban,cities
196,2014-09-26,"Readers' short films: serenading Beirut, an ode to Toronto ... and a nightmare commute on the Circle Line",cities
197,2014-09-26,The Petite Ceinture: the battle over Paris's abandoned railway,cities
198,2014-09-26,The sound of silents: is it time to revive the 'city symphony' film genre?,cities
199,2014-09-25,The weird afterlife of the world's subterranean 'ghost stations',cities
200,2014-09-25,Could those utopian hoardings for new developments get any more nauseating?,cities
201,2014-09-25,"Readers' short films: 24-hour London, Kuala Lumpur and Chicago in motion",cities
202,2014-09-24,How to build a fairer city,cities
203,2014-09-24,"Readers' short films: invisible Venice, Brazil's toy city and a Doha lullaby",cities
204,2014-09-23,"Wim Wenders on his Berlin: 'Oh man, has it ever changed!'",cities
205,2014-09-23,Cities in cinema: from the Third Man to the home of Hollywood,cities
206,2014-09-22,Abandoned sports stadiums in cities: share your pictures and stories,cities
207,2014-09-22,How American sports franchises are selling their cities short,cities
208,2014-09-19,Will New York get its own cable car?,cities
209,2014-09-19,Chalk and chess: your playful street drawings from cities around the world,cities
210,2014-09-19,Khartoum: the most selfish city?,cities
211,2014-09-18,A global parliament of mayors? Just what cities need – more bureaucracy,cities
212,2014-09-17,How temporary 'cardboard cathedral' rose from the ruins to become most recognised building in Christchurch,cities
213,2014-09-17,We need to develop a new urban agenda – let's start on World Cities Day,cities
214,2014-09-17,The truth about property developers: how they are exploiting planning authorities and ruining our cities,cities
215,2014-09-16,'It is time we took back control': readers respond to Enfield's housing crisis,cities
216,2014-09-16,City lives: Timbuktu’s dustman is undaunted by racial divide,cities
217,2014-09-16,City lives: custodian of Timbuktu’s literary past looks to digital future,cities
218,2014-09-16,City lives: Timbuktu’s leader of the faith is also its chief builder,cities
219,2014-09-16,Life in Timbuktu: how the ancient city of gold is slowly turning to dust,cities
220,2014-09-15,Lost and Found in Detroit – in pictures,cities
221,2014-09-15,"An urbanist's guide to Manchester:  ‘To make the most of life here you need an open, creative mind’",cities
222,2014-09-15,Indian city of Surat anticipates worst effects of climate change,cities
223,2014-09-12,Brazilians are writing their own bus stop signs – and it's working,cities
224,2014-09-12,Richard Rogers' Florence masterplan – video,cities
225,2014-09-12,Why I love living in the Woolwich Central ‘carbuncle’,cities
226,2014-09-12,Map some noise: how your smartphone can help tackle city sound pollution,cities
227,2014-09-11,The playable city – live,cities
228,2014-09-11,To Hull and back: the rebirth of Britain’s poorest city,cities
229,2014-09-11,'Poor but sexy is not enough': the rise and fall of Berlin mayor Klaus Wowereit,cities
230,2014-09-10,Counter culture: shopkeepers from around the world – in pictures,cities
231,2014-09-10,Resilience in the playable city – live,cities
232,2014-09-10,A short history of world metro systems – in pictures,cities
233,2014-09-10,A claustrophobic 2 minutes on Beijing's metro – a timelapse video,cities
234,2014-09-09,100 Resilient Cities Challenge: how accurately do cities perceive risk?,cities
235,2014-09-09,From Hell to Electropolis: how comics depict cities – in pictures,cities
236,2014-09-09,Gotham state of mind: what do comics tell us about cities?,cities
237,2014-09-08,One World Trade Center: as seen from around New York City,cities
238,2014-09-08,One World Trade Center: how New York tried to rebuild its soul,cities
239,2014-09-05,Should we design cities for 'collisions'?,cities
240,2014-09-05,The death of America's suburban dream,cities
241,2014-09-05,The Soviet city is dead: long live Beijing,cities
242,2014-09-04,"Playable Cities: the city that plays together, stays together",cities
243,2014-09-04,'Chalkify' your city: share your pictures,cities
244,2014-09-04,Prize-winning designer says double size of 40 English towns,cities
245,2014-09-03,Life in Ulaanbaatar's tent city is hard – but Mongolians won't give up their gers,cities
246,2014-09-03,What is the ugliest building in Britain?,cities
247,2014-09-03,Welcome to Norwich – England’s first city of literature,cities
248,2014-09-02,An urbanist's guide to Anchorage: 'Moose often stroll the streets',cities
249,2014-09-02,The 2014 World Cities Day Challenge: champion your city's best idea,cities
250,2014-09-02,Will Self on Crossrail: ‘Projects don't get much grander - or more phallic’,cities
251,2014-09-01,Enfield tears up rules in radical attempt to ease housing problem,cities
252,2014-09-01,London's housing crisis: a week in an emergency housing office – video,cities
253,2014-09-01,Try this 3D rollercoaster for the Oculus Rift headset. Could it help plan cities?,cities
254,2014-09-01,What can ‘forensic architecture’ reveal about the conflict in Gaza?,cities
255,2014-08-30,Will the north follow Scotland and search for greater power?,cities
256,2014-08-29,No cash for the train fare? Beijing takes plastic ... bottles,cities
257,2014-08-29,"Talk to each other? Crazy, we know  ... share your stories of meeting strangers",cities
258,2014-08-29,The big problem with 'coolest city' lists,cities
259,2014-08-28,"War, earthquakes, tourism ... the city of Byblos, Lebanon fights for its future",cities
260,2014-08-28,Five reasons Belgium has the worst traffic in Europe,cities
261,2014-08-27,I visualise a rat: animated maps track rodents in US cities,cities
262,2014-08-27,"Buses are the future of urban transport. No, really",cities
263,2014-08-26,From Klaus Wowereit to Hurricane Hazel: meet the longest-serving mayors,cities
264,2014-08-26,One World Trade Center: share your photographs from your neighbourhood,cities
265,2014-08-26,Zebra-suited urbanists of Bolivia undeterred by hit-and-run death,cities
266,2014-08-26,The Yorkshire Dales family who are designing entire cities in Iraq,cities
267,2014-08-25,An urbanist's guide to Chicago: ‘the most American of American cities’,cities
268,2014-08-22,Is Unesco committing 'urbanicide' by encouraging city tourism?,cities
269,2014-08-22,My favourite city film is ... Chinatown,cities
270,2014-08-22,Inside Addis Ababa's Koshe rubbish tip: where hundreds literally scratch a living,cities
271,2014-08-21,My favourite city film is … The Third Man,cities
272,2014-08-21,Are better signs the secret to a successful city?,cities
273,2014-08-20,Scrapheap challenge: Durban’s shelter for hitchhikers is made out of used cars,cities
274,2014-08-20,My favourite city film is … Blade Runner,cities
275,2014-08-20,Why haven't China's cities learned from America's mistakes?,cities
276,2014-08-19,"Clean up your local park and get a council tax rebate, suggests thinktank",cities
277,2014-08-19,Tokyo’s disaster parks: hi-tech survival bunkers hidden under green spaces,cities
278,2014-08-19,"The urbanist's guide to Dhaka, Bangladesh: 'an unplanned sprawl'",cities
279,2014-08-19,My favourite city film is ... Wings of Desire,cities
280,2014-08-18,How Spain’s ‘guerrilla architect’ is building new hope out of financial crisis,cities
281,2014-08-18,My favourite city film is ... Roman Holiday,cities
282,2014-08-18,The top 10 … cities on film,cities
283,2014-08-16,Would you pay a new tax to live next to a park?,cities
284,2014-08-15,"LA was a cycling haven, until cars took over – could it be one again?",cities
285,2014-08-15,"'This is east London, not Park Lane': Stratford's regeneration, in your words",cities
286,2014-08-15,"Yubari, Japan: a city learns how to die",cities
287,2014-08-14,How making London greener could make Londoners happier – interactive map,cities
288,2014-08-13,How Rabat’s Mawazine music festival is signalling progress for the city,cities
289,2014-08-12,What are your favourite ever city films?,cities
290,2014-08-12,SketchFactor city app sparks accusations of racism,cities
291,2014-08-12,The gentrification of Woodstock: from rundown suburb to hipster heaven,cities
292,2014-08-11,Hanoi: is it possible to grow a city without slums?,cities
293,2014-08-11,An urbanist's guide to Copenhagen: ‘the perfect combination of cosy and sexy’,cities
294,2014-08-11,Stratford's Olympics legacy: boon or bust? Share your experiences,cities
295,2014-08-08,Olympic afterlife: the real legacy of the London Olympics  for Stratford,cities
296,2014-08-07,Pomona: the lost island of Manchester,cities
297,2014-08-06,Cycle couriers: my life as one of the dwindling band of urban cowboys,cities
298,2014-08-05,"One in every 35 Londoners is a dollar millionaire, new study shows",cities
299,2014-08-05,Can Dallas kick its addiction to cars?,cities
300,2014-08-04,"An urbanist guide to Glasgow: ‘Glasgow smokes, Glasgow chews gum, Glasgow eats takeaways’",cities
301,2014-08-04,Researching cities: do Melbourne teens drink more in the city or suburbs?,cities
