,Date,Content,Section
308,2010-08-25,Brent launches online homeless database,government-computing-network
309,2010-08-25,Home Office unveils new UK passport,government-computing-network
310,2010-08-24,CISx plans scrapped,government-computing-network
311,2010-08-24,Essex cancels £1m worth of IT tenders,government-computing-network
312,2010-08-24,Data.gov.uk releases open source code,government-computing-network
313,2010-08-23,Met Police awards printing deal to Canon,government-computing-network
314,2010-08-23,Green loans provide IT savings,government-computing-network
315,2010-08-23,Socitm reports website 'paradox',government-computing-network
316,2010-08-23,Sharing the networks,government-computing-network
317,2010-08-22,Lancashire councils share finance system,government-computing-network
318,2010-08-20,Southwark awards BSF deal to RM,government-computing-network
319,2010-08-20,Data.gov.uk gets a design update,government-computing-network
320,2010-08-20,Capital sets up swipe card contract,government-computing-network
321,2010-08-19,Coal Authority starts location pilot,government-computing-network
322,2010-08-19,Met to improve information handling,government-computing-network
323,2010-08-19,Scotland's auditor calls for better A&E data,government-computing-network
324,2010-08-19,Lane Fox launches review of Directgov,government-computing-network
325,2010-08-19,Edinburgh plans major staff cuts,government-computing-network
326,2010-08-18,Scottish council merger could save £1bn,government-computing-network
327,2010-08-18,Falkirk awards regional hardware deal,government-computing-network
328,2010-08-17,Council ICT spending predicted to rise,government-computing-network
329,2010-08-17,Directgov technology chief leaves post,government-computing-network
330,2010-08-17,Cumbria to take IT services in-house,government-computing-network
331,2010-08-16,Buying Solutions awards managed services deal,government-computing-network
332,2010-08-16,Government stalls on e-Borders plans,government-computing-network
333,2010-08-13,Birmingham steps up paperless storage,government-computing-network
334,2010-08-13,Council staff breach DWP database,government-computing-network
335,2010-08-12,BIS orchestrates savings on Elgar,government-computing-network
336,2010-08-12,TfL tenders for speed cameras,government-computing-network
337,2010-08-12,Airwave leads CLG spending list,government-computing-network
338,2010-08-12,ERG gets procurement chief,government-computing-network
339,2010-08-11,ICO warns coalition on benefit fraud plan,government-computing-network
340,2010-08-11,Northern Ireland to upgrade ANPR,government-computing-network
341,2010-08-11,MoD 'at risk of cyber attacks',government-computing-network
342,2010-08-10,Bristol launches audio library book downloads,government-computing-network
343,2010-08-10,'Climategate' university to open up data,government-computing-network
344,2010-08-10,Government drops Home Access scheme,government-computing-network
345,2010-08-10,TfL cancels traffic prediction tender,government-computing-network
346,2010-08-10,Janet sets up data transmission framework,government-computing-network
347,2010-08-10,Credit agencies may help detect benefit fraud,government-computing-network
348,2010-08-10,DWP improves e-security,government-computing-network
349,2010-08-09,"Wales awards phone, text and messaging deal",government-computing-network
350,2010-08-09,FoI may extend to Network Rail,government-computing-network
351,2010-08-08,Socitm warns 'Keep IT spending steady',government-computing-network
352,2010-08-06,South West education group signs support deal,government-computing-network
353,2010-08-06,DfE switches off ContactPoint database,government-computing-network
354,2010-08-06,ICO says students have exam rights under DPA,government-computing-network
355,2010-08-06,DNA database quango calls for greater transparency,government-computing-network
356,2010-08-05,Government points departments to PSN,government-computing-network
357,2010-08-05,Differentiating yourself,government-computing-network
358,2010-08-05,PS Online 2010: Supporters,government-computing-network
359,2010-08-05,DWP technology chief criticises data practices,government-computing-network
360,2010-08-04,Treasury considers Coins replacement,government-computing-network
361,2010-08-04,South Wales health board takes up xchangewales,government-computing-network
362,2010-08-04,Following the vandals,government-computing-network
363,2010-08-04,Leicester councillors trial iPads,government-computing-network
364,2010-08-04,Two boroughs join London mobile network,government-computing-network
365,2010-08-04,Scotland's police inspector slams data entry record,government-computing-network
366,2010-08-03,Defra publishes energy use online,government-computing-network
367,2010-08-02,South Derbyshire transfers risk in £22m deal,government-computing-network
368,2010-08-02,Presenting that winning bid,government-computing-network
369,2010-08-02,IPS ICT spend climbs to £21.7m,government-computing-network
370,2010-08-02,Buying Solutions launches aggregated spend web page,government-computing-network
371,2010-08-02,Government rules out scrapping IE6,government-computing-network
372,2010-08-01,Suffolk reveals terms to escape ICT contract freeze,government-computing-network
373,2010-07-30,Benefits shake-up to involve new DWP IT,government-computing-network
374,2010-07-30,Ofcom claims outsourcing will slash CO2,government-computing-network
375,2010-07-30,CRB predicts growth of e-checks,government-computing-network
376,2010-07-29,Data.gov.uk chief admits concerns,government-computing-network
377,2010-07-29,Government publishes all UK legislation online,government-computing-network
378,2010-07-29,ID card repeal bill completion planned for December,government-computing-network
379,2010-07-29,Government claims Directgov move will cut costs,government-computing-network
380,2010-07-29,Scotland may widen FoI to suppliers,government-computing-network
381,2010-07-28,FireControl IT contracts reach £202.3m,government-computing-network
382,2010-07-28,ICC reports rise in communications data probing,government-computing-network
383,2010-07-28,NAO slams Cafcass IT failures,government-computing-network
384,2010-07-27,MoD increased annual IT spending by £240m,government-computing-network
385,2010-07-27,Minister defends halving schools IT grant,government-computing-network
386,2010-07-26,Minister calls for more cyber security experts,government-computing-network
387,2010-07-26,Government to phase out NPIA and Soca,government-computing-network
388,2010-07-26,Parish councils switch to online maps,government-computing-network
389,2010-07-26,Seven police forces shun mobile devices,government-computing-network
390,2010-07-25,North Yorkshire seeks £8m back office deal,government-computing-network
391,2010-07-25,Total Place report calls for collaboration,government-computing-network
392,2010-07-23,Maude calls for open data suggestions,government-computing-network
393,2010-07-23,DfT's ANPR spending reaches £23.6m,government-computing-network
394,2010-07-23,Cambridgeshire and Northamptonshire merge services,government-computing-network
395,2010-07-23,Government to decommission ContactPoint database,government-computing-network
396,2010-07-23,Waveney told to improve website,government-computing-network
397,2010-07-22,"Thurrock needs to improve IT, says report",government-computing-network
398,2010-07-22,IT faults hit Pakistan visa service,government-computing-network
399,2010-07-22,Home Office axes e-Borders contract,government-computing-network
400,2010-07-22,ICO gets tougher on FoI rules,government-computing-network
401,2010-07-21,DCMS has spent £32.9m on ICT,government-computing-network
402,2010-07-21,Review reveals RPA's IT cost overruns,government-computing-network
403,2010-07-21,Environment Agency plans for emissions reporting,government-computing-network
404,2010-07-21,DfE cancels £15m funding for child care IT,government-computing-network
405,2010-07-21,Maude calls for 10% carbon cut pledge,government-computing-network
406,2010-07-20,LSC signs call centre deal,government-computing-network
407,2010-07-20,IT delays cost HMRC £33m,government-computing-network
408,2010-07-20,Yorkshire police plan mobile fingerprint scanners,government-computing-network
409,2010-07-20,Watchdogs call for better police procurement,government-computing-network
410,2010-07-19,Cyber attacks halt 'Spending Challenge' website,government-computing-network
411,2010-07-19,East Sussex launches online historic record,government-computing-network
412,2010-07-16,"CRB bars 130,000 unsuitable applicants",government-computing-network
413,2010-07-16,Broadband target put back to 2015,government-computing-network
414,2010-07-15,Remote control,government-computing-network
415,2010-07-15,DoH axes NHS-wide Microsoft contract,government-computing-network
416,2010-07-15,MoD may rethink DII spend,government-computing-network
417,2010-07-15,CLG reveals IT spending of £185m,government-computing-network
418,2010-07-15,"ICO has 'never been busier', says Graham",government-computing-network
419,2010-07-14,Home Office publishes draft reform plan,government-computing-network
420,2010-07-14,DfID cuts IT budget by 29%,government-computing-network
421,2010-07-14,Greater Manchester Police pilots text service,government-computing-network
422,2010-07-14,NAO calls for better performance data systems,government-computing-network
423,2010-07-13,MoD scraps £120m consultancy deal,government-computing-network
424,2010-07-13,Police share data quality suite procurement,government-computing-network
425,2010-07-13,Coalition spends £3m on ContactPoint,government-computing-network
426,2010-07-12,Government plans 'NHS information revolution',government-computing-network
427,2010-07-12,Kable Town Hall meeting,government-computing-network
428,2010-07-12,DoH will reveal NPfIT changes within weeks,government-computing-network
429,2010-07-12,National census could be scrapped,government-computing-network
430,2010-07-12,LGG 'to save £18m by outsourcing',government-computing-network
431,2010-07-09,Chancellor launches 'Spending Challenge' website,government-computing-network
432,2010-07-08,Council websites falter on business services,government-computing-network
433,2010-07-08,Maude talks cuts with ICT suppliers,government-computing-network
434,2010-07-08,Barnet and West Sussex breach DPA,government-computing-network
435,2010-07-08,Surrey launches online books service,government-computing-network
436,2010-07-08,Becta confirms continuation of ICT Mark,government-computing-network
437,2010-07-07,HMRC reviews use of 0845 numbers,government-computing-network
438,2010-07-07,ICO code highlights cloud security issues,government-computing-network
439,2010-07-07,IT issues hit UKBA complaints handling,government-computing-network
440,2010-07-06,"Put council job ads online, says minister",government-computing-network
441,2010-07-06,MoJ asks for data protection views,government-computing-network
442,2010-07-06,SCRs have cost NHS £96m,government-computing-network
443,2010-07-06,Gove axes £45bn BSF,government-computing-network
444,2010-07-05,NAO criticises MoJ finance IT,government-computing-network
445,2010-07-05,TfL suspends open data feed,government-computing-network
446,2010-07-05,May orders tougher ANPR regulations,government-computing-network
447,2010-07-05,Coming to terms with cuts,government-computing-network
448,2010-07-02,DWP puts application procurement on hold,government-computing-network
449,2010-07-02,IPS gets new chief,government-computing-network
450,2010-07-02,NPIA outlines £200m IT savings plan,government-computing-network
451,2010-07-01,Scotland hardens stance on DNA retention,government-computing-network
452,2010-07-01,"NHS spent £1.6bn on ICT, says minister",government-computing-network
453,2010-07-01,'Your Freedom' websites invites views on bills,government-computing-network
454,2010-06-30,Former CIO returns to Cabinet Office,government-computing-network
455,2010-06-30,"IT could replace day in court, says Clarke",government-computing-network
456,2010-06-30,TfL seeks managed ICT service,government-computing-network
457,2010-06-29,"Cash constraints hitting HMRC IT, says NAO",government-computing-network
458,2010-06-29,South Bucks seeks £20m back office deal,government-computing-network
459,2010-06-29,Coventry launches 'Jam' online dialogue,government-computing-network
460,2010-06-28,House of Commons plans for electronic PQs,government-computing-network
461,2010-06-28,Wales launches free online archive,government-computing-network
462,2010-06-28,College connects to local BSF ICT,government-computing-network
463,2010-06-27,Kent links skip licensing to public website,government-computing-network
464,2010-06-27,Maude calls for comments on open data,government-computing-network
465,2010-06-27,TNA upgrades archive searches,government-computing-network
466,2010-06-25,Nigel Smith to leave OGC,government-computing-network
467,2010-06-25,COI shows £128m Whitehall web costs,government-computing-network
468,2010-06-25,EU says 'More power to information commissioner',government-computing-network
469,2010-06-25,Government to axe more websites,government-computing-network
470,2010-06-24,Merseyside hospital accesses GP records,government-computing-network
471,2010-06-24,e-Channels could generate major NHS savings,government-computing-network
472,2010-06-24,NI Audit Office criticises local councils' IT,government-computing-network
473,2010-06-23,Scotland launches £1.5m superbug IT,government-computing-network
474,2010-06-23,"Budget ignores IT 'silver bullet', says Socitm",government-computing-network
475,2010-06-22,Minister shows ID card cost,government-computing-network
476,2010-06-22,Budget: Osborne freezes public pay for two years,government-computing-network
477,2010-06-22,Grampian FRS forced to use Firelink,government-computing-network
478,2010-06-21,TfL trials pedestrian digital countdown,government-computing-network
479,2010-06-21,Met Police take IT deal to 2015,government-computing-network
480,2010-06-20,Lambeth seeks £300m framework deal,government-computing-network
481,2010-06-18,Government delays ContactPoint abolition,government-computing-network
482,2010-06-18,Northern Ireland issues £350m schools ICT tender,government-computing-network
483,2010-06-18,Minister promises focus on open standards,government-computing-network
484,2010-06-18,IPCC compelled to process FoI requests,government-computing-network
485,2010-06-17,Cleveland Police take outsourcing step,government-computing-network
486,2010-06-17,Government CIO to get more power,government-computing-network
487,2010-06-17,SmartGov: Southwest One contemplates expansion,government-computing-network
488,2010-06-17,Birmingham suspends ANPR in Muslim areas,government-computing-network
489,2010-06-17,Government shakes up Whitehall teams,government-computing-network
490,2010-06-17,SmartGov: CIO outlines regional 'cloud' vision,government-computing-network
491,2010-06-17,SmartGov: Kent plans interconnection with Hampshire,government-computing-network
492,2010-06-16,SmartGov: OGC head predicts compulsory sharing,government-computing-network
493,2010-06-16,Maude plans £95m IT renegotiation savings,government-computing-network
494,2010-06-16,SmartGov: Scotland to launch new tenders database,government-computing-network
495,2010-06-16,SmartGov: Belfast CIO highlights third sector data need,government-computing-network
496,2010-06-15,SmartGov: Government has 'monolithic approach' towards ICT,government-computing-network
497,2010-06-15,SmartGov: September start planned for PSN services,government-computing-network
498,2010-06-15,Government suspends vetting and barring scheme,government-computing-network
499,2010-06-14,Capital creates councillors' website,government-computing-network
500,2010-06-14,Number 10 examines e-petitions,government-computing-network
501,2010-06-14,An easy pick?,government-computing-network
502,2010-06-14,Driving Efficiencies 2010: Programme,government-computing-network
503,2010-06-14,Northern Ireland launches fire service mobile system,government-computing-network
504,2010-06-14,Legal fight over ANPR in Muslim suburbs,government-computing-network
505,2010-06-13,TfL admits congestion charge autopayment problems,government-computing-network
506,2010-06-11,"SCRs under review, says minister",government-computing-network
507,2010-06-11,Liverpool launches bin text service,government-computing-network
508,2010-06-11,Two departments publish energy use online,government-computing-network
509,2010-06-10,Suffolk staff get social networking system,government-computing-network
510,2010-06-10,Government outlines new passport plans,government-computing-network
511,2010-06-10,Minister confirms IPS staff cuts,government-computing-network
512,2010-06-10,NAO seeks IT audit services,government-computing-network
513,2010-06-09,RCN seeks judicial review of vetting and barring,government-computing-network
514,2010-06-09,"Labour issued 13,200 ID cards",government-computing-network
515,2010-06-09,Scrapping Becta to save tens of millions,government-computing-network
516,2010-06-07,Birmingham ANPR cameras aimed at Muslims,government-computing-network
517,2010-06-04,Treasury puts Coins spending database online,government-computing-network
518,2010-05-26,CCTV regulation set to impact councils,government-computing-network
519,2010-05-19,Deputy Clegg outlines plans on liberty,government-computing-network
520,2010-05-14,New government shuns major Whitehall reorganisation,government-computing-network
521,2010-05-13,Con Lib IT cancellations could prove costly,government-computing-network
522,2010-05-13,The new government: pledges and problems,government-computing-network
523,2010-04-16,Home tutors reject 'intrusive' child safety database,government-computing-network
524,2010-04-13,"Red, blue and gold: how the parties compare",government-computing-network
525,2010-04-10,The rise of flexible and mobile working in the UK public sector: outlook to 2014-15,government-computing-network
526,2010-03-31,iPhone apps: a dangerous temptation?,government-computing-network
527,2010-03-17,Searching for insight,government-computing-network
528,2010-03-17,Government may shelve DNA storage reform,government-computing-network
529,2010-03-08,"Government IT under siege, says minister",government-computing-network
530,2010-03-04,Moving offshore,government-computing-network
531,2010-02-26,Cleveland police to outsource 999 control room,government-computing-network
532,2010-02-16,Customer journey mapping: a route to insights,government-computing-network
533,2010-02-11,Conservatives would publish contracts from 2011,government-computing-network
534,2010-02-08,"European database has 500,000 access points",government-computing-network
535,2010-02-03,"Police have more than 10,000 ANPR cameras",government-computing-network
536,2010-02-03,Policing: The ANPR secret,government-computing-network
537,2010-02-01,Conservatives unveil superfast broadband plan,government-computing-network
538,2010-02-01,A threefold challenge,government-computing-network
539,2010-01-29,Comment: A safe strategy,government-computing-network
540,2010-01-18,The information asset,government-computing-network
541,2010-01-15,ONS shows rise in public building,government-computing-network
542,2010-01-12,Brown pledges broadband for poor families,government-computing-network
543,2010-01-04,"New year, new broom",government-computing-network
544,2010-01-04,Police forces vary on DNA retention,government-computing-network
545,2010-01-04,Government to speed libraries' web archiving,government-computing-network
546,2011-12-30,Barking and Dagenham deals with housing queries by text message,government-computing-network
547,2011-12-29,Lambeth plans mobile telephone parking system,government-computing-network
548,2011-12-28,West Lothian council launches app,government-computing-network
549,2011-12-22,GPS extends telecom networks framework,government-computing-network
550,2011-12-22,East London councils to share data archiving,government-computing-network
551,2011-12-22,Lincolnshire police to outsource to G4S,government-computing-network
552,2011-12-22,Harnessing knowledge in the Department for Education,government-computing-network
553,2011-12-21,DWP pulls back identity services tender,government-computing-network
554,2011-12-21,No Minister: Any chance for the Communications Act?,government-computing-network
555,2011-12-21,Government ICT Strategy needs better measure of progress,government-computing-network
556,2011-12-20,Ministry of Justice plans for mega IT framework,government-computing-network
557,2011-12-20,UK fraud prevention service extends deal with Logica,government-computing-network
558,2011-12-20,Home Office: options open on police ICT company,government-computing-network
559,2011-12-19,Department for Education cuts spending with top supplier Capita by 19%,government-computing-network
560,2011-12-19,Hillingdon goes for Google Apps,government-computing-network
561,2011-12-19,"Public sector needs to improve quality of information, warns Eurim",government-computing-network
562,2011-12-19,Interview: Bill McCluggage and David Shields,government-computing-network
563,2011-12-16,Slough signs outsourcing deal with Arvato,government-computing-network
564,2011-12-16,Somerset county council introduces smartcard ticket reading machines,government-computing-network
565,2011-12-16,Libra blamed for financial data failure,government-computing-network
566,2011-12-16,Home Office reviews police IT centre,government-computing-network
567,2011-12-16,Northern police forces launch 101 service,government-computing-network
568,2011-12-16,Technology key to 'new model' of NI health and social care,government-computing-network
569,2011-12-16,The benefits of Tell Us Once,government-computing-network
570,2011-12-15,Whitehall looks for ICT scrutineers,government-computing-network
571,2011-12-15,Whitehall reveals uses of postcode information,government-computing-network
572,2011-12-15,ICO issues guidance about private emails,government-computing-network
573,2011-12-14,The implications of Real Time Information,government-computing-network
574,2011-12-14,DVLA could deliver more services online,government-computing-network
575,2011-12-14,Employers will have to update software for Real Time Information,government-computing-network
576,2011-12-14,Transport for London tests travel card market,government-computing-network
577,2011-12-14,Norfolk county council claims savings from e-auctions,government-computing-network
578,2011-12-14,Interview: Chris Chant,government-computing-network
579,2011-12-13,Hampshire and Oxfordshire county councils plan ICT partnership,government-computing-network
580,2011-12-13,HM Revenue and Customs spends £721m through Aspire,government-computing-network
581,2011-12-13,Logica wins central government back office deal,government-computing-network
582,2011-12-13,Logica wins central government back office deal,government-computing-network
583,2011-12-12,EU gets open data strategy,government-computing-network
584,2011-12-12,North Tyneside council publishes major ICT deal,government-computing-network
585,2011-12-12,DWP begins search for identity services,government-computing-network
586,2011-12-12,HMRC to work with employers on data quality,government-computing-network
587,2011-12-12,Whitehall waves flag for SFIA 5,government-computing-network
588,2011-12-09,Home Office increases spending with top supplier Fujitsu by 15%,government-computing-network
589,2011-12-08,Councils tender for cloud based CRM,government-computing-network
590,2011-12-08,How to get to 'digital by default',government-computing-network
591,2011-12-07,Criminal Records Bureau checks to go online,government-computing-network
592,2011-12-07,G Cloud framework deadline extended,government-computing-network
593,2011-12-07,Post Office wins biometric collection contract,government-computing-network
594,2011-12-07,"Powys council receives £130,000 fine for data breach",government-computing-network
595,2011-12-06,British Library plans website overhaul,government-computing-network
596,2011-12-06,Department for Work and Pensions plans open source tests,government-computing-network
597,2011-12-06,Government uses Experian data to detect fraud,government-computing-network
598,2011-12-05,HMRC leads e-learning in government,government-computing-network
599,2011-12-05,Police search for portable forensic technology,government-computing-network
600,2011-12-05,Cheshire councils tidy up the desktop loose ends,government-computing-network
601,2011-12-02,Government announces £158m for research IT,government-computing-network
602,2011-12-02,Emer Coleman named as digital engagement deputy,government-computing-network
603,2011-12-02,Defra increases spending with IBM by 21%,government-computing-network
604,2011-12-01,Cabinet Office considers creating 'agile' framework,government-computing-network
605,2011-12-01,Cloud security to focus on technologies,government-computing-network
606,2011-11-30,Government reveals cost of e-petitions website,government-computing-network
607,2011-11-30,Looking Local builds affordable housing website,government-computing-network
608,2011-11-30,DWP cuts spending with top IT supplier HP by 4%,government-computing-network
609,2011-11-30,Hertford college harnesses Iceland's geothermal energy,government-computing-network
610,2011-11-29,Live discussion: Should local government be worried about cyber security?,government-computing-network
