,Date,Content,Section
0,2010-12-31,Councils launch waste and recycling website,government-computing-network
1,2010-12-30,New website for NI geographic info strategy,government-computing-network
2,2010-12-29,Treasury spent £9.9m with Fujitsu,government-computing-network
3,2010-12-29,Manchester launches online deaf service,government-computing-network
4,2010-12-28,Government to move e-petitions,government-computing-network
5,2010-12-24,Scotland unveils privacy principles,government-computing-network
6,2010-12-23,NHS website invites patient comments on dentists,government-computing-network
7,2010-12-23,Calderdale loses patient data on stolen computer,government-computing-network
8,2010-12-23,Camden strikes deal for new schools' IT,government-computing-network
9,2010-12-22,TfL CIO backs teenage innovators,government-computing-network
10,2010-12-22,ICO waves stick over FoI compliance,government-computing-network
11,2010-12-22,Tell Us Once to go nationwide in 2011,government-computing-network
12,2010-12-22,"Virtual courts prove costly, concludes MoJ",government-computing-network
13,2010-12-22,Government seeks e-Borders compensation,government-computing-network
14,2010-12-21,Government gets MoU with Xerox,government-computing-network
15,2010-12-21,FiReControl to be axed,government-computing-network
16,2010-12-21,Queen set to outlaw ID cards today,government-computing-network
17,2010-12-21,Counties maintain ERP shared service,government-computing-network
18,2010-12-20,Cabinet Office signs MoU with Vertex,government-computing-network
19,2010-12-20,DoH extends BT N3 deal,government-computing-network
20,2010-12-20,MPs to examine government IT policy,government-computing-network
21,2010-12-17,Gray becomes new defence procurement chief,government-computing-network
22,2010-12-17,Plan to network coastguards,government-computing-network
23,2010-12-17,Cabinet Office claims major savings from ICT,government-computing-network
24,2010-12-17,EU outlines new e-government plans,government-computing-network
25,2010-12-17,IT helps cut M42 pollution,government-computing-network
26,2010-12-16,Buying Solutions plans £500m software contract,government-computing-network
27,2010-12-16,MoJ spent £121m with HP,government-computing-network
28,2010-12-16,Looking Local receives red button boost,government-computing-network
29,2010-12-16,Boeing wins MoD logistics deal,government-computing-network
30,2010-12-15,Council announces shared services programme,government-computing-network
31,2010-12-15,Manchester to lead 'smart city' project,government-computing-network
32,2010-12-15,"Government receives 240,000 malicious emails a year",government-computing-network
33,2010-12-14,TfL upgrades apps development site,government-computing-network
34,2010-12-14,Cornwall plans shared ERP,government-computing-network
35,2010-12-14,DfT spends £196m with IBM,government-computing-network
36,2010-12-13,Wirral announces major back office cuts,government-computing-network
37,2010-12-13,Localism Bill emphasises raw data role,government-computing-network
38,2010-12-13,Southwest One misses savings target,government-computing-network
39,2010-12-10,Birmingham plans for flexible printing,government-computing-network
40,2010-12-10,Home Office may re-use ID card equipment,government-computing-network
41,2010-12-09,A modern duty,government-computing-network
42,2010-12-09,Five authorities sign BSF deals,government-computing-network
43,2010-12-09,Designers to upgrade Scotland.gov.uk,government-computing-network
44,2010-12-09,Essex tenders for travel info system,government-computing-network
45,2010-12-09,Birmingham launches gunfire location IT,government-computing-network
46,2010-12-08,Scotland gets web services framework,government-computing-network
47,2010-12-08,NHS info is loaded onto London Datastore,government-computing-network
48,2010-12-07,Wales receives telemedicine funding,government-computing-network
49,2010-12-07,DfT launches e-tool for road safety advisers,government-computing-network
50,2010-12-07,Police cuts to focus on back office,government-computing-network
51,2010-12-06,Socitm: public agencies reluctant to share data,government-computing-network
52,2010-12-06,Nottinghamshire strikes £7.4m deal,government-computing-network
53,2010-12-06,HMRC wants to limit PAYE data channels,government-computing-network
54,2010-12-03,CLG plans national address gazetteer,government-computing-network
55,2010-12-03,GCSX N3 link goes live,government-computing-network
56,2010-12-03,Change of ownership for ICT Research Network,government-computing-network
57,2010-12-03,Atos Origin leads DCMS suppliers,government-computing-network
58,2010-12-02,GCHQ commercialisation 'a live issue' says minister,government-computing-network
59,2010-12-02,Red and blue boroughs share support deal,government-computing-network
60,2010-12-02,Web is snow alternative for Scottish schools,government-computing-network
61,2010-12-02,Maude calls on big players to embrace SMEs,government-computing-network
62,2010-12-02,Enfield to launch electronic 'token' for citizens,government-computing-network
63,2010-12-01,"A tale of two, or more, cities",government-computing-network
64,2010-12-01,Scottish legal reviewer signs deal with Atos Origin,government-computing-network
65,2010-12-01,Wokingham signs £8.5m ICT deal,government-computing-network
66,2010-12-01,Inspector criticises UKBA facial recognition gates,government-computing-network
67,2010-12-01,Questions on commissioning,government-computing-network
68,2010-12-01,MoD reveals £806m in payments to HP,government-computing-network
69,2010-12-01,Agency extends online flood warnings,government-computing-network
70,2010-11-30,Councils spent £314m on CCTV,government-computing-network
71,2010-11-30,Hampshire and Dorset announce joint IT strategy,government-computing-network
72,2010-11-30,Becta agrees £400m ICT framework,government-computing-network
73,2010-11-29,BIS spent £26.3m with Fujitsu last year,government-computing-network
74,2010-11-29,Service Birmingham extended to 2021,government-computing-network
75,2010-11-26,Hampshire Police spends £1.5m on mobile devices,government-computing-network
76,2010-11-26,FCO spends £39m with HP,government-computing-network
77,2010-11-25,Olympics team plans security system,government-computing-network
78,2010-11-25,Fibre optic deal increases PSN momentum,government-computing-network
79,2010-11-25,TfL to remove most western CC cameras,government-computing-network
80,2010-11-25,Hertfordshire signs £200m deal with Serco,government-computing-network
81,2010-11-25,Poor IT contributes to DWP errors,government-computing-network
82,2010-11-24,"ICO fines Hertfordshire £100,000",government-computing-network
83,2010-11-24,HMRC excise tracking to go online,government-computing-network
84,2010-11-23,Maude to give Directgov more weight,government-computing-network
85,2010-11-23,Tracker reveals status of coalition's pledges,government-computing-network
86,2010-11-23,NI courts get £37.4m ICT deal,government-computing-network
87,2010-11-23,Nickalls to leave Directgov,government-computing-network
88,2010-11-23,Cabinet Office signs MoU with IBM,government-computing-network
89,2010-11-23,DfE spent £113.8m with Capita last year,government-computing-network
90,2010-11-22,Councillors to vote on Service Birmingham,government-computing-network
91,2010-11-22,Government to make some services online-only,government-computing-network
92,2010-11-19,"Contracts 'made my eyes water', says Maude",government-computing-network
93,2010-11-19,Government reveals departments' recent IT spending,government-computing-network
94,2010-11-19,BT dominates recent NPfIT spending,government-computing-network
95,2010-11-19,DWP starts to diversify IT spending,government-computing-network
96,2010-11-18,Devon continues drive towards 'network of networks',government-computing-network
97,2010-11-17,'Government needs to expand cyber security capabilities',government-computing-network
98,2010-11-17,Kent and Norfolk paid IT bosses bonuses,government-computing-network
99,2010-11-17,Jisc praises social media in student recruitment,government-computing-network
100,2010-11-16,Government CIO to stand down,government-computing-network
101,2010-11-16,Serco signs MoU with Cabinet Office,government-computing-network
102,2010-11-16,London boroughs plan local cloud,government-computing-network
103,2010-11-16,DoH seeks NHS jobs portal,government-computing-network
104,2010-11-16,Elphicke takes top MP web prize,government-computing-network
105,2010-11-15,'PSN services will be live by Christmas',government-computing-network
106,2010-11-15,ICO censures New Forest over data breach,government-computing-network
107,2010-11-15,"Transparency saves money, says information commissioner",government-computing-network
108,2010-11-15,MoD selects Steria as preferred bidder,government-computing-network
109,2010-11-15,Scotland reveals high costs of FOI,government-computing-network
110,2010-11-12,Bournemouth signs £150m transformation deal,government-computing-network
111,2010-11-12,RM gets Stoke BSF education deal,government-computing-network
112,2010-11-12,Scotland to get new flood alert system,government-computing-network
113,2010-11-12,Public projects take IT prizes,government-computing-network
114,2010-11-12,"Surveillance still expanding, says parliamentary report",government-computing-network
115,2010-11-11,CLG datasets in open format by 2012,government-computing-network
116,2010-11-11,Transport Scotland seeks major IT deal,government-computing-network
117,2010-11-11,Agreement paves way for PSN services,government-computing-network
118,2010-11-10,"Patients will control records, says DoH",government-computing-network
119,2010-11-10,HMRC to launch real time system,government-computing-network
120,2010-11-10,Spring deadline for reporting on major projects,government-computing-network
121,2010-11-10,Cabinet Office signs MoU with Fujitsu,government-computing-network
122,2010-11-10,Criminal justice system fails to capture information,government-computing-network
123,2010-11-10,DWP drops lie detector software,government-computing-network
124,2010-11-10,DWP to centralise client contact,government-computing-network
125,2010-11-09,Home Office pledges data storage reforms,government-computing-network
126,2010-11-09,HMRC spent £765m through Aspire last year,government-computing-network
127,2010-11-09,Centro completes £14m bus smartcards project,government-computing-network
128,2010-11-09,Leicestershire and Nottingham to share services,government-computing-network
129,2010-11-08,Government launches 'transparency' website,government-computing-network
130,2010-11-08,London councils tender for web portal contract,government-computing-network
131,2010-11-08,Firelink goes live in Wales,government-computing-network
132,2010-11-08,"Public sector better than private, says ICO",government-computing-network
133,2010-11-08,Government will shred ID card data,government-computing-network
134,2010-11-05,Cabinet Office bans talks on IT,government-computing-network
135,2010-11-05,Staffordshire and Derbyshire councils unify IT services,government-computing-network
136,2010-11-05,Brussels blocks UK from Schengen biometric database,government-computing-network
137,2010-11-04,Norfolk and Suffolk police share IT services,government-computing-network
138,2010-11-04,"e-Borders discussions nearly complete, says Green",government-computing-network
139,2010-11-04,ICO picks up Portsmouth over privacy breach,government-computing-network
140,2010-11-04,New road cameras will watch for five offences,government-computing-network
141,2010-11-04,"Savings data 'unconvincing', says PAC",government-computing-network
142,2010-11-03,"First data fines imminent, says commissioner",government-computing-network
143,2010-11-03,DWP CTO predicts last Windows deployment,government-computing-network
144,2010-11-02,Air passengers face greater pre-flight checks,government-computing-network
145,2010-11-02,Wales creates digital advisory board,government-computing-network
146,2010-11-02,"Maude put squeeze on suppliers, says Watmore",government-computing-network
147,2010-11-01,"Legislation limited action against Google, says ICO",government-computing-network
148,2010-11-01,OU puts ebooks on iTunes,government-computing-network
149,2010-11-01,DWP publishes winter fuel helpline deal,government-computing-network
150,2010-10-29,Rattling cages,government-computing-network
151,2010-10-29,Auditor identifies IT problems for Scottish police,government-computing-network
152,2010-10-29,Bedfordshire and Hertfordshire police merge ICT,government-computing-network
153,2010-10-28,Bromley signs £42m deal,government-computing-network
154,2010-10-28,London PSN seeks network ID service,government-computing-network
155,2010-10-28,ICO to meet Home Office over IMP,government-computing-network
156,2010-10-28,Council watchdog calls for more data matching,government-computing-network
157,2010-10-27,IBM gets £15m stopgap borders deal,government-computing-network
158,2010-10-27,DfT to install new motorway technology,government-computing-network
159,2010-10-27,Scotland launches tenders app,government-computing-network
160,2010-10-26,North Lincs pilots victimisation index,government-computing-network
161,2010-10-25,Scotland sets out digital ambitions,government-computing-network
162,2010-10-25,ICO expresses interception modernisation programme concerns,government-computing-network
163,2010-10-25,Vetting and barring scheme under review,government-computing-network
164,2010-10-25,"Public intolerant of IT failures, warns Gershon",government-computing-network
165,2010-10-22,NYnet to participate in broadband project,government-computing-network
166,2010-10-22,Government revives £2bn interception modernisation programme,government-computing-network
167,2010-10-21,Chesterfield signs IT and infrastructure deal,government-computing-network
168,2010-10-21,Socitm: IT crucial in coping with cuts,government-computing-network
169,2010-10-21,Directgov 'needs to be simplified',government-computing-network
170,2010-10-21,Cabinet Office and Oracle reach agreement,government-computing-network
171,2010-10-20,Shadbolt says 'no going back' on open data trend,government-computing-network
172,2010-10-20,Cabinet Office signs MoU with Cable & Wireless,government-computing-network
173,2010-10-20,Suffolk emphasises 'demonstrable savings',government-computing-network
174,2010-10-20,Government focuses on back office for cuts,government-computing-network
175,2010-10-20,DWP to deliver administrative savings of 26%,government-computing-network
176,2010-10-20,HMRC to make efficiency savings of 25%,government-computing-network
177,2010-10-20,Chancellor announces £6bn in 'waste' savings,government-computing-network
178,2010-10-20,Treasury awards deal for Coins system,government-computing-network
179,2010-10-19,Cabinet Office signs MoU with Steria,government-computing-network
180,2010-10-19,Somerset schools to get broadband network,government-computing-network
181,2010-10-19,Birmingham school applications go on the box,government-computing-network
182,2010-10-19,DWP to step up data matching,government-computing-network
183,2010-10-19,Windsor and Maidenhead uses linked data,government-computing-network
184,2010-10-19,"300 IT projects under review,  says Maude",government-computing-network
185,2010-10-18,DoH pushes informatics to centre of NHS,government-computing-network
186,2010-10-18,Aberdeen awards data and desktop deal,government-computing-network
187,2010-10-18,"Scrap 'outdated' advertising laws, says LGA",government-computing-network
188,2010-10-15,Wirral to share data with HMRC,government-computing-network
189,2010-10-15,BT and HP sign MoUs with government,government-computing-network
190,2010-10-15,Councils could be overpaying suppliers £150m annually,government-computing-network
191,2010-10-15,Local government agency to launch Knowledge Hub,government-computing-network
192,2010-10-14,"Firebuy to be scrapped, National Archives retained",government-computing-network
193,2010-10-14,Schools favour laptops over desktops,government-computing-network
194,2010-10-14,GMP to tweet incidents for 24 hours,government-computing-network
195,2010-10-14,Scotland awards vote counting deal to Logica,government-computing-network
196,2010-10-13,Police establish ANPR alley on Staffordshire M6,government-computing-network
197,2010-10-13,Lane Fox talks up internet savings potential,government-computing-network
198,2010-10-13,Coalition promises to kill three-quarters of its websites,government-computing-network
199,2010-10-13,G Cloud will not eclipse other deals,government-computing-network
200,2010-10-13,BIS launches e-accessibility plan,government-computing-network
201,2010-10-12,"Most security is straightforward, says GCHQ boss",government-computing-network
202,2010-10-12,NAO: more online services for tax agents,government-computing-network
203,2010-10-12,Scottish councils consider merging services,government-computing-network
204,2010-10-12,Redbridge and Herts take Socitm awards,government-computing-network
205,2010-10-12,Council chief emphasises role of CIOs,government-computing-network
206,2010-10-12,Local IT leader highlights redaction problem,government-computing-network
207,2010-10-11,"Government is 'shockingly inefficient', concludes Green",government-computing-network
208,2010-10-11,HP received £657m from DWP in 09-10,government-computing-network
209,2010-10-11,Cameron: government made 'crazy decisions' on IT,government-computing-network
210,2010-10-11,Cabinet Office signs MoU with Siemens,government-computing-network
211,2010-10-11,Liam Byrne to shadow Cabinet Office,government-computing-network
212,2010-10-08,Government to retain key Becta services,government-computing-network
213,2010-10-08,ICO issues draft data sharing code,government-computing-network
214,2010-10-08,Southwark signs BSF deal,government-computing-network
215,2010-10-08,Hertfordshire selects Serco as preferred bidder,government-computing-network
216,2010-10-07,Gravesham launches reporting phone app,government-computing-network
217,2010-10-07,Patient Opinion gets digital treatment,government-computing-network
218,2010-10-07,West Sussex signs outsourcing deal with Capita,government-computing-network
219,2010-10-07,Cardiff launches smart cards,government-computing-network
220,2010-10-06,Departments reveal abandoned IT deals,government-computing-network
221,2010-10-06,ISF sounds IT infrastructure warning,government-computing-network
222,2010-10-06,Norfolk signs schools cloud contract,government-computing-network
223,2010-10-05,Official highlights government IT duplication,government-computing-network
224,2010-10-05,London council widens access to data,government-computing-network
225,2010-10-05,Somerset signs BSF deal,government-computing-network
226,2010-10-05,Tayside Police pilots social media tool,government-computing-network
227,2010-10-05,Online child protection chief quits,government-computing-network
228,2010-10-04,ICO monitors 33 FoI flouters,government-computing-network
229,2010-10-04,Maude to make FoI data machine readable,government-computing-network
230,2010-10-03,TfL to introduce new pay technology,government-computing-network
231,2010-10-01,Dangers in the cloud,government-computing-network
232,2010-10-01,CLG reveals new savings ideas,government-computing-network
233,2010-10-01,Europe takes UK to court over data protection,government-computing-network
234,2010-10-01,Hampshire plans web 'default' for service delivery,government-computing-network
235,2010-10-01,ANPR project established with 'no regard for law',government-computing-network
236,2010-10-01,Applications Store prototype for next year,government-computing-network
237,2010-09-30,Maude seeks  'single client' relationship with suppliers,government-computing-network
238,2010-09-30,TNA launches open data licence,government-computing-network
239,2010-09-30,Norfolk buys £11m schools system,government-computing-network
240,2010-09-29,North Somerset agrees £100m outsourcing deal,government-computing-network
241,2010-09-29,Wirral plans broadband boost,government-computing-network
242,2010-09-29,DoH ends NHS-wide Novell deal,government-computing-network
243,2010-09-28,Miliband retains Labour line on DNA and CCTV,government-computing-network
244,2010-09-28,Birmingham considers open source software,government-computing-network
245,2010-09-28,Cabinet Office and Logica sign MoU,government-computing-network
246,2010-09-28,Council claims savings with online job ads,government-computing-network
247,2010-09-28,ICO lets police maintain ANPR location secrecy,government-computing-network
248,2010-09-28,Merseytravel launches smart cards,government-computing-network
249,2010-09-27,Herefordshire buys shared business system,government-computing-network
250,2010-09-27,GLA awards deal for electronic vote counting,government-computing-network
251,2010-09-27,Transport Scotland plans roads IS,government-computing-network
252,2010-09-24,National Archives may be axed,government-computing-network
253,2010-09-24,LGG launches YouChoose web application,government-computing-network
254,2010-09-24,Cabinet Office confirms IT review,government-computing-network
255,2010-09-23,Council claims savings from online maps,government-computing-network
256,2010-09-23,DWP considers opening up Ideas Street,government-computing-network
257,2010-09-23,District council's CCTV costs outstrip London borough's,government-computing-network
258,2010-09-22,Andrew Stott announces retirement,government-computing-network
259,2010-09-22,DWP's Harley tops government CIO pay list,government-computing-network
260,2010-09-22,Learning grid claims broadband savings,government-computing-network
261,2010-09-22,College signs £4.3m outsourcing deal,government-computing-network
262,2010-09-21,"Schools to maintain ICT spending, says Besa",government-computing-network
263,2010-09-20,Surrey creates Blackberry waste app,government-computing-network
264,2010-09-20,Looking Local opens iPhone interface,government-computing-network
265,2010-09-20,Lancashire to share data with other organisations,government-computing-network
266,2010-09-20,British Library indicates shift to digital,government-computing-network
267,2010-09-20,Cabinet Office agrees GCSx local access terms,government-computing-network
268,2010-09-17,"DWP can handle welfare IT changes, says minister",government-computing-network
269,2010-09-17,Parliament rejects ID card passport discounts,government-computing-network
270,2010-09-16,Voters' data to be cross checked,government-computing-network
271,2010-09-15,DoH discloses spending with major suppliers,government-computing-network
272,2010-09-15,"Government prefers open source, says Maude",government-computing-network
273,2010-09-15,FCO agrees £82m telecoms deal,government-computing-network
274,2010-09-14,Capgemini signs MoU with Cabinet Office,government-computing-network
275,2010-09-13,Whitehall signs MoU with Atos,government-computing-network
276,2010-09-13,DfT plans national travel smartcard,government-computing-network
277,2010-09-13,"'Radically reconfigure' services, minister tells councils",government-computing-network
278,2010-09-13,Green reveals e-Borders consultancy levels,government-computing-network
279,2010-09-13,Councils must use CSV for publishing spending,government-computing-network
280,2010-09-10,MoD extends DFTS deal with BT,government-computing-network
281,2010-09-10,IBM gets £50m cut from fingerprinting deal,government-computing-network
282,2010-09-10,Government to use Spending Challenge website ideas,government-computing-network
283,2010-09-10,Government to localise NPfIT,government-computing-network
284,2010-09-08,London creates digital advisory board,government-computing-network
285,2010-09-08,GMP loses memory stick,government-computing-network
286,2010-09-08,BT takes 43% of CfH spending,government-computing-network
287,2010-09-07,Bristol awards real time system deal,government-computing-network
288,2010-09-07,DWP reveals web search spending,government-computing-network
289,2010-09-07,Choose and Book switches phone number,government-computing-network
290,2010-09-06,Think tank calls for commoditisation,government-computing-network
291,2010-09-06,LGA: geospatial technology saves councils millions,government-computing-network
292,2010-09-06,Germany downplays biometric ID card hack,government-computing-network
293,2010-09-03,Edinburgh to launch new website,government-computing-network
294,2010-09-03,NI website spend hits millions,government-computing-network
295,2010-09-02,HMRC issues CD-Rom alert to employers,government-computing-network
296,2010-09-01,Government fishes for ID ideas,government-computing-network
297,2010-09-01,Met Police extends payroll deal,government-computing-network
298,2010-09-01,Westminster seeks support services deal,government-computing-network
299,2010-08-31,DoH retains NHS Direct online,government-computing-network
300,2010-08-31,Cabinet Office renews Fast Stream deal,government-computing-network
301,2010-08-27,SQA seeks e-marking 'update',government-computing-network
302,2010-08-27,Government invites ideas on airport security,government-computing-network
303,2010-08-26,Survey shows support for road charging,government-computing-network
304,2010-08-26,Auditor calls on NHS to improve payments coding,government-computing-network
305,2010-08-25,Maudsley tags mentally ill offenders,government-computing-network
306,2010-08-25,Norfolk councils share IT services,government-computing-network
307,2010-08-25,Ofsted highlights child data sharing weakness,government-computing-network
