,Date,Content,Section
1188,2011-02-21,North-west claims savings from using IT,government-computing-network
1189,2011-02-18,NAO presents challenge for government ICT,government-computing-network
1190,2011-02-18,Sefton reviews major outsourcing contracts,government-computing-network
1191,2011-02-18,Marine body plans online licensing process,government-computing-network
1192,2011-02-18,Passport swap couple walk through airport scanners,government-computing-network
1193,2011-02-18,Gwent to expand use of police intelligence tool,government-computing-network
1194,2011-02-17,Surrey selects preferred bidder for Wi-Fi deal,government-computing-network
1195,2011-02-17,NAO: open data will underpin 'big society',government-computing-network
1196,2011-02-16,Beating the snags in open data,government-computing-network
1197,2011-02-16,DfE agrees £80m pensions contract with Capita,government-computing-network
1198,2011-02-16,OFT clears national address gazetteer plans,government-computing-network
1199,2011-02-15,London councils reveal joint IT jobs cut plan,government-computing-network
1200,2011-02-15,Socitm calls for better contact management,government-computing-network
1201,2011-02-15,Council quartet plans shared ERP,government-computing-network
1202,2011-02-15,DfT plans Blue Badge technology changes,government-computing-network
1203,2011-02-15,Tyne and Wear launches travel smart cards,government-computing-network
1204,2011-02-14,MPs test iPads,government-computing-network
1205,2011-02-14,Metropolitan Police Authority seeks £160m Airwave deal,government-computing-network
1206,2011-02-14,Minister says coastguard reforms will use existing ICT,government-computing-network
1207,2011-02-14,IPCC chief: ANPR is 'a victim of its own success',government-computing-network
1208,2011-02-11,Socitm calls for better ICT governance,government-computing-network
1209,2011-02-11,CCTV and ANPR to get commissioner and code,government-computing-network
1210,2011-02-11,Business Link plans small business boost,government-computing-network
1211,2011-02-10,Land Registry selects open source software,government-computing-network
1212,2011-02-10,Gallery: Minister helps destroys the national identity register,government-computing-network
1213,2011-02-10,Minister destroys national identity register,government-computing-network
1214,2011-02-10,Wales to receive £10m to extend broadband,government-computing-network
1215,2011-02-09,Councils miss e-petitions requirement,government-computing-network
1216,2011-02-09,Police framework pushes shared service,government-computing-network
1217,2011-02-08,ICO fines councils for data breaches,government-computing-network
1218,2011-02-07,Universities funding council pays £12.5m for cloud,government-computing-network
1219,2011-02-07,Chancellor launches budget portal,government-computing-network
1220,2011-02-04,Northern Ireland launches online TV service,government-computing-network
1221,2011-02-04,Buying Solutions chief Littley leaves,government-computing-network
1222,2011-02-04,European commission plans flight passenger database,government-computing-network
1223,2011-02-03,Home Office plans anti-knife crime website,government-computing-network
1224,2011-02-03,Government misses e-Borders passenger check target,government-computing-network
1225,2011-02-02,Guardian Government Computing Network: About us,government-computing-network
1226,2011-02-02,Guardian Government Computing Network: Contact us,government-computing-network
1227,2011-02-02,MoJ saves £9m with staff roster software,government-computing-network
1228,2011-02-02,Met Police signs mobile deal,government-computing-network
1229,2011-02-02,Edinburgh trials GPS teleguide device,government-computing-network
1230,2011-02-01,e-Petitions: the good and the bad,government-computing-network
1231,2011-02-01,IT problems hit tax processing,government-computing-network
1232,2011-02-01,Street crime search falters at launch,government-computing-network
1233,2011-02-01,Police force sets up business systems framework,government-computing-network
1234,2011-01-31,Harley becomes government CIO,government-computing-network
1235,2011-01-31,Nine in 10 councils publish spending online,government-computing-network
1236,2011-01-31,Hansard to pulp paper processes,government-computing-network
1237,2011-01-28,Agency warns of attacks on government websites,government-computing-network
1238,2011-01-28,Hertfordshire awards BSF deal to Balfour Beatty,government-computing-network
1239,2011-01-28,Staffordshire signs PSN deal,government-computing-network
1240,2011-01-27,DWP seeks data for identity verification service,government-computing-network
1241,2011-01-27,Scotland beefs up FoI,government-computing-network
1242,2011-01-26,Change to sustain public sector ICT spend,government-computing-network
1243,2011-01-26,LGfL agrees network framework,government-computing-network
1244,2011-01-25,London council awards £250m IT deal,government-computing-network
1245,2011-01-25,UK to get national public library e-catalogue,government-computing-network
1246,2011-01-25,Cornwall introduces online language learning system,government-computing-network
1247,2011-01-25,Buying Solutions publishes £3bn tender,government-computing-network
1248,2011-01-25,ICO warns councillors about DPA obligations,government-computing-network
1249,2011-01-24,A case for software rationalisation,government-computing-network
1250,2011-01-24,Telling it once,government-computing-network
1251,2011-01-24,Buying Solutions seeks £500m HR framework,government-computing-network
1252,2011-01-24,Government in court over BSF cancellation,government-computing-network
1253,2011-01-21,Socitm: groups of councils could run health IT,government-computing-network
1254,2011-01-21,Councils look for 'good enough' IT solutions,government-computing-network
1255,2011-01-21,"ID register costs £400,000 to destroy",government-computing-network
1256,2011-01-20,Border Agency plans £36.4m biometric collection contract,government-computing-network
1257,2011-01-20,"Hants to slash £900,000 from IT budget",government-computing-network
1258,2011-01-19,Herts college to offer Europe-wide framework,government-computing-network
1259,2011-01-19,DWP CTO Gardner leaves,government-computing-network
1260,2011-01-19,South Yorkshire police leads ANPR league,government-computing-network
1261,2011-01-18,Lane Fox launches recycled PCs pilot,government-computing-network
1262,2011-01-18,Government considers pared down children's database,government-computing-network
1263,2011-01-17,NPIA: no cuts to national database,government-computing-network
1264,2011-01-14,DWP to charge for use of child maintenance system,government-computing-network
1265,2011-01-14,CLG launches fire service control consultation,government-computing-network
1266,2011-01-14,Northants police signs comms deal with BT iNet,government-computing-network
1267,2011-01-13,Government outlines Data Corporation plans,government-computing-network
1268,2011-01-12,Government joins European fingerprint database,government-computing-network
1269,2011-01-12,BMA: cuts could hit patient record plans,government-computing-network
1270,2011-01-12,Yorkshire NHS and police admit data breaches,government-computing-network
1271,2011-01-12,Ombudsman slams departments' data bungle,government-computing-network
1272,2011-01-11,Soca strikes £157m outsourcing deal,government-computing-network
1273,2011-01-11,GLA publishes shared services target,government-computing-network
1274,2011-01-11,Fujitsu leads Home Office supplier spending,government-computing-network
1275,2011-01-10,NHS resumes SCR mailings to patients,government-computing-network
1276,2011-01-10,Looking Local launches iOS app,government-computing-network
1277,2011-01-10,Welsh Assembly donates PCs for recycling,government-computing-network
1278,2011-01-10,Staffordshire strikes £10m deal with Capita,government-computing-network
1279,2011-01-07,New features for Businesslink,government-computing-network
1280,2011-01-07,Chant takes interim CEO for digital role,government-computing-network
1281,2011-01-07,"Scrapping Becta a mistake, say committee witnesses",government-computing-network
1282,2011-01-07,MoJ extends reach of FoI,government-computing-network
1283,2011-01-07,The value in data,government-computing-network
1284,2011-01-07,Councillors expect more from technology,government-computing-network
1285,2011-01-06,British Transport Police awards £10m network deal,government-computing-network
1286,2011-01-06,National Archives launches continuity framework contract,government-computing-network
1287,2011-01-05,Police test IT to fight antisocial behaviour,government-computing-network
1288,2011-01-05,Pickles declares ultimatum on openness,government-computing-network
1289,2011-01-05,Public file 845 Christmas tax returns,government-computing-network
1290,2011-01-04,London to get one stop procurement shop,government-computing-network
1291,2011-01-04,Police store data on 999 callers,government-computing-network
1292,2011-01-04,DfT plans to make speed camera info public,government-computing-network
1293,2012-08-31,Government call for input in final push for EU procurement progress,government-computing-network
1294,2012-08-30,NHS Commissioning Board will continue to fund GP software,government-computing-network
1295,2012-08-30,End user device programme to adopt 'best-in-breed' approach,government-computing-network
1296,2012-08-30,The devil is in the data,government-computing-network
1297,2012-08-29,Council says Mouchel financial restructuring ends outsourcing uncertainty,government-computing-network
1298,2012-08-28,Police force trio set for G4S move,government-computing-network
1299,2012-08-24,Capita buys Reliance Secure Task Management,government-computing-network
1300,2012-08-24,G-Cloud accredits first suppliers,government-computing-network
1301,2012-08-24,NHS to get new Choose and Book deal,government-computing-network
1302,2012-08-23,NHS Commissioning Board seeks open data and intelligence leads,government-computing-network
1303,2012-08-23,Police to beef up iPad and mobile scrutiny,government-computing-network
1304,2012-08-23,Audit Commission: online information can cut councils' care review costs,government-computing-network
1305,2012-08-23,SCC to provide IL3-accredited cloud platform,government-computing-network
1306,2012-08-22,Logica name and brand to disappear from Stock Exchange this week,government-computing-network
1307,2012-08-22,Dorset completes initial PSN roll out,government-computing-network
1308,2012-08-21,MPs urge MoJ to put ICT at heart of business strategy,government-computing-network
1309,2012-08-21,ICO to investigate alleged Essex council data lapse,government-computing-network
1310,2012-08-20,Bristol council tells local SMEs to 'come and bid for our ICT business',government-computing-network
1311,2012-08-20,Denise McDonagh rebuts G-Cloud critics,government-computing-network
1312,2012-08-17,NHS Direct chosen for £40m NHS 111 contract,government-computing-network
1313,2012-08-17,North Tyneside says ICT outsourcing will secure jobs,government-computing-network
1314,2012-08-17,Crothers: more flexible pricing models are key,government-computing-network
1315,2012-08-16,CloudStore: 75% of suppliers are SMEs,government-computing-network
1316,2012-08-15,'Universal Jobmatch' to be launched in autumn,government-computing-network
1317,2012-08-15,£98k spent through CloudStore in July,government-computing-network
1318,2012-08-15,Forestry Commission signs PSN-compliant deal,government-computing-network
1319,2012-08-15,Bill Crothers calls on government IT suppliers to show more initiative on savings,government-computing-network
1320,2012-08-14,Councils seek £34m ICT services,government-computing-network
1321,2012-08-14,G-Cloud broadens accreditation scheme,government-computing-network
1322,2012-08-14,LGA: local shared services shave £30m off costs,government-computing-network
1323,2012-08-13,London borough's journey to new ways of delivering ICT,government-computing-network
1324,2012-08-13,Scotland plans to get more SMEs working for government,government-computing-network
1325,2012-08-13,Former government CIO joins exodus to private sector,government-computing-network
1326,2012-08-10,CSC sees $46m drop in income from NHS,government-computing-network
1327,2012-08-10,Highways Agency trials GPS data for road management,government-computing-network
1328,2012-08-09,London trusts name preferred providers for NHS 111,government-computing-network
1329,2012-08-09,Government clawbacks £249m in ICT savings,government-computing-network
1330,2012-08-08,SME complains about G-Cloud procurement,government-computing-network
1331,2012-08-08,London Fire Brigade signs call ID and data sharing deal,government-computing-network
1332,2012-08-08,HMRC urged to step up automated data collection,government-computing-network
1333,2012-08-07,Lincolnshire county council explores ICT procurement options,government-computing-network
1334,2012-08-07,ICT basis for London NHS trust merger,government-computing-network
1335,2012-08-06,"ICO fines Torbay Care Trust £175,000 for data gaffe",government-computing-network
1336,2012-08-06,NHS Direct among providers for London NHS 111 service,government-computing-network
1337,2012-08-03,Scientists and researchers to access NHS records 'on scale never seen before',government-computing-network
1338,2012-08-03,Atos and Capita named as preferred bidders for PIP disability assessments,government-computing-network
1339,2012-08-02,NHS trust saves £7m on national patient records costs,government-computing-network
1340,2012-08-01,"Government data lacks transparency, says committee",government-computing-network
1341,2012-07-31,London boroughs agree to implement single Oracle R12 release,government-computing-network
1342,2012-07-31,NAO identifies 'information assurance' gaps,government-computing-network
1343,2012-07-30,Reading council to develop app for young jobhunters,government-computing-network
1344,2012-07-30,OS to sell geographic data skills overseas,government-computing-network
1345,2012-07-30,xCouncils test Agile benefits,government-computing-network
1346,2012-07-27,NHS Commissioning Board appoints IT chief,government-computing-network
1347,2012-07-27,Newham council to install new centralised database,government-computing-network
1348,2012-07-27,NHS trusts form IT procurement groups,government-computing-network
1349,2012-07-26,CloudStore back to life after technical glitch,government-computing-network
1350,2012-07-26,Westminster city council launches free Wi-Fi network,government-computing-network
1351,2012-07-26,ICO power to stop FOI dodgers 'some way off',government-computing-network
1352,2012-07-26,DSA awards contract for hazard perception CGI technology,government-computing-network
1353,2012-07-26,NAO calls on ICT teams to 'collaborate' on agile,government-computing-network
1354,2012-07-26,"Outsourcing companies must comply with FOI, say MPs",government-computing-network
1355,2012-07-26,A Force for police ICT change,government-computing-network
1356,2012-07-25,Cabinet Office publishes government transactional services data,government-computing-network
1357,2012-07-25,Police force trio to take stock on G4S,government-computing-network
1358,2012-07-25,Department of Health awards £500m contact centre services deal,government-computing-network
1359,2012-07-24,Government's remote working lead not followed by private sector,government-computing-network
1360,2012-07-24,"Major ICT issues resolved, says animal health agency",government-computing-network
1361,2012-07-24,Met police goes live with NPIA online procurement hub,government-computing-network
1362,2012-07-23,UK Border Agency to launch 'allegations database',government-computing-network
1363,2012-07-23,NHS North Bristol sets up 'programme office' for IT,government-computing-network
1364,2012-07-23,Department for Transport awards £1.9m database deal to Capita,government-computing-network
1365,2012-07-20,DWP reveals local authority long-list for universal credit pilot,government-computing-network
1366,2012-07-20,Communities and Local Government opts for Desktop 21 route,government-computing-network
1367,2012-07-20,Police force trio to make decision on G4S outsourcing plan,government-computing-network
1368,2012-07-20,Croydon council to set up £180m ICT arrangement,government-computing-network
1369,2012-07-19,G-Cloud team to set up public sector matchmaking opportunities,government-computing-network
1370,2012-07-19,West Sussex council awards outsourcing deal to Capita,government-computing-network
1371,2012-07-18,MoD set to opt for GoCo model for Defence Equipment & Support,government-computing-network
1372,2012-07-18,NHS Wales launches iPhone health app,government-computing-network
1373,2012-07-18,Information commissioner welcomes 'step change' in transparency,government-computing-network
1374,2012-07-17,"Real time information and universal credit on track, say ministers",government-computing-network
1375,2012-07-17,West Midlands police says it remains committed to business partnering,government-computing-network
1376,2012-07-17,Immigration IT system runs £28m over budget,government-computing-network
1377,2012-07-17,Home Office launches police ICT company,government-computing-network
1378,2012-07-16,Wales announces GP IT framework contract,government-computing-network
1379,2012-07-16,RTI: right and wrong at the same time,government-computing-network
1380,2012-07-13,Leeds council to use Calderdale council's social care system,government-computing-network
1381,2012-07-13,MoJ plans to 'exploit IT investments' to join up service delivery,government-computing-network
1382,2012-07-13,London assembly urges mayor to adopt code of practice for statistics,government-computing-network
1383,2012-07-13,Fraud and error cost DWP £3.2bn last year,government-computing-network
1384,2012-07-12,Surrey police to pull out of West Midlands business partner programme,government-computing-network
1385,2012-07-12,"Trust receives £60,000 fine after patient's results sent to wrong address",government-computing-network
1386,2012-07-11,Lambeth council makes open data pledge,government-computing-network
1387,2012-07-11,Katie Davis to leave Connecting for Health,government-computing-network
1388,2012-07-10,Open data user group has first meeting,government-computing-network
1389,2012-07-10,Crothers appointed government chief procurement officer,government-computing-network
1390,2012-07-10,Surrey and East Sussex councils to join forces on procurement,government-computing-network
1391,2012-07-09,Thousands more employers to join HMRC's real time information pilot,government-computing-network
1392,2012-07-09,"Shared services go £500m over budget, MPs say",government-computing-network
1393,2012-07-06,Cerner questions Epic win for Cambridge patient records,government-computing-network
1394,2012-07-06,Government tenders for up to £1bn hosting framework agreement,government-computing-network
1395,2012-07-06,"ICO receives nearly 2,000 FOI complaints about councils",government-computing-network
1396,2012-07-06,BT extends MoD cyber security deal,government-computing-network
1397,2012-07-05,Managing the service towers,government-computing-network
1398,2012-07-04,West Sussex trust implements e-patient monitoring system,government-computing-network
1399,2012-07-04,Government chief procurement officer Collington heads for private sector,government-computing-network
1400,2012-07-02,NHS trust plans £67m IT strategy,government-computing-network
1401,2012-06-29,Departments to take on greater role in open data plans,government-computing-network
1402,2012-06-29,Government Procurement Service signs suppliers for PCs and tablets deal,government-computing-network
1403,2012-06-29,Sussex police to trial tablet devices for officers,government-computing-network
1404,2012-06-28,HMRC 'challenged' by real time information timetable,government-computing-network
1405,2012-06-28,Devon NHS 111 withdrawal raises commercial concerns,government-computing-network
1406,2012-06-28,Going beyond the headline savings,government-computing-network
1407,2012-06-28,Francis Maude: our controlled approach to ICT won't change,government-computing-network
1408,2012-06-26,David Pitchford promises better control of major projects,government-computing-network
1409,2012-06-25,Government strikes £70m software savings deals with Microsoft and SAP,government-computing-network
1410,2012-06-25,Government ICT strategy must better articulate business aims,government-computing-network
1411,2012-06-25,Cabinet Office pilots sales website for SMEs,government-computing-network
1412,2012-06-22,West Midlands police to cut call centre hubs,government-computing-network
1413,2012-06-22,Surrey council launches free app for libraries,government-computing-network
1414,2012-06-22,Government tenders for £1bn IT software and services framework,government-computing-network
1415,2012-06-21,Royal Berkshire trust awards Cerner £10m support deal,government-computing-network
1416,2012-06-21,No Minister: tiptoeing through the cybercrime minefield,government-computing-network
1417,2012-06-21,McDonagh talks up 'game changing' potential of G-Cloud,government-computing-network
1418,2012-06-20,Cornwall council pays bills late due to system glitch,government-computing-network
1419,2012-06-20,Andrew Lansley looks to telehealth and 111 to support NHS change,government-computing-network
1420,2012-06-19,Welsh councils starting to tweet,government-computing-network
1421,2012-06-19,Vertex acquisition raises IT services question for London tri-borough,government-computing-network
1422,2012-06-18,Yorkshire district councils to stop sharing services,government-computing-network
1423,2012-06-18,Cabinet Office joins the Open Identity Exchange,government-computing-network
1424,2012-06-15,Cabinet Office names 29 suppliers for new PSN framework,government-computing-network
1425,2012-06-15,SME wins NHS Wales online expenses deal,government-computing-network
1426,2012-06-15,HMRC seeks views on real time information compliance,government-computing-network
1427,2012-06-15,GLA to launch 'data dashboard',government-computing-network
1428,2012-06-14,Huddle grabs lion's share of CloudStore sales,government-computing-network
1429,2012-06-14,Home Office seeks £12.8m facial recognition system,government-computing-network
1430,2012-06-13,Denise McDonagh: buy camps and expos will 'propagate' G-Cloud,government-computing-network
1431,2012-06-13,Nelson hails cloud as government's biggest IT breakthrough,government-computing-network
1432,2012-06-12,How Greater London Authority's IT will face Olympic challenge,government-computing-network
1433,2012-06-11,"More honesty on procurement risks, says Foreign Office commercial chief",government-computing-network
1434,2012-06-11,Police trio say only outsourcing plan will tackle £73m funding gap,government-computing-network
1435,2012-06-08,Wokingham council gets private sector recognition for email contact,government-computing-network
1436,2012-06-08,Two years' 'hard work' spurs cross-border shared services deal,government-computing-network
1437,2012-06-07,Fife council goes live with handheld devices,government-computing-network
1438,2012-06-07,Six consortiums make West Midlands and Surrey police partner shortlist,government-computing-network
1439,2012-06-06,Norfolk county council receives full PSN certification,government-computing-network
1440,2012-06-06,Government plans 'dynamic' transfer of software licences,government-computing-network
1441,2012-06-01,Derbyshire council to install £2.8m social care database,government-computing-network
1442,2012-06-01,"ICO fines Sussex trust £325,000 for data breach",government-computing-network
1443,2012-06-01,Potential for government business may encourage new Logica bid,government-computing-network
1444,2012-06-01,Wi-Fi for Oxford Circus and Liverpool Street this summer,government-computing-network
1445,2012-06-01,Scotland to strengthen freedom of information legislation,government-computing-network
1446,2012-06-01,MPs call for tighter controls of Government Procurement Card,government-computing-network
1447,2012-05-31,Crime map gets new data,government-computing-network
1448,2012-05-30,"Open source still feared within Whitehall, says IT architect",government-computing-network
1449,2012-05-30,IT supplier negotiations deliver limited savings for Home Office,government-computing-network
1450,2012-05-30,The only way is IT for Essex's £300m savings programme,government-computing-network
1451,2012-05-29,MPs tell police to squeeze more out of their Blackberrys,government-computing-network
1452,2012-05-29,Northern Ireland rolls out £9m care record system,government-computing-network
1453,2012-05-29,Government launches new tax app,government-computing-network
1454,2012-05-29,Mike Bracken: we will make government work better,government-computing-network
1455,2012-05-28,Capita expresses concerns over NHS 111 tender process,government-computing-network
1456,2012-05-28,Government highlights CloudStore sale success story,government-computing-network
1457,2012-05-28,Universal credit to go live in north-west,government-computing-network
1458,2012-05-25,Potential identity assurance suppliers receive invitation to tender,government-computing-network
1459,2012-05-24,Government publishes end of first year ICT strategy report,government-computing-network
1460,2012-05-24,GPS launches next G-Cloud procurement,government-computing-network
1461,2012-05-24,Metropolitan police goes live with mobile fingerprint scanners,government-computing-network
