,Date,Content,Section
562,2020-07-05,Interview with First Dog on the Moon: ‘I ask myself:  what if a pineapple was doing this?’,membership
563,2020-06-29,Orwell prize nominee Aditya Chakrabortty: 'Don't do what everyone else is doing',membership
564,2020-06-21,Picture a pandemic: how Guardian photographers adapted to lockdown life,membership
565,2020-06-13,Youth justice: exposing a system that is failing our most vulnerable children,membership
566,2020-06-06,"George Floyd: reporting on a week of fury, pain and deep solidarity",membership
567,2020-05-30,Science Weekly in the pandemic: 'Every day you wake up to a discovery',membership
568,2020-05-23,Virtually anywhere but Westminster: 'We've found a new kind of sincerity',membership
569,2020-05-16,"Reviewing the arts in lockdown: 'Life is lonelier, but also more thoughtful'",membership
570,2020-05-09,Counting the human cost of Covid-19: 'Numbers tell a story words can't',membership
571,2020-05-02,Sport in lockdown: 'Someone pulled the rug out from under the summer',membership
572,2020-04-25,"Reporting in Wuhan: 'I thought Sars wouldn't be repeated, this was worse'",membership
573,2020-04-18,Covid-19 in New York: 'We knew the health system would be a frail match',membership
574,2020-04-11,Covid-19 from the West Wing: 'History's verdict will be unforgiving',membership
575,2020-04-04,'The moment everything changed': Covering Covid-19 from Westminster,membership
576,2020-03-28,Reporting  on Covid-19 in Italy: 'Life as we've known it has stopped',membership
577,2020-03-21,Writing a live blog: 'You're frantically keeping the plates spinning',membership
578,2020-03-14,Reporting on coronavirus: 'fear is almost as great a threat as the disease',membership
579,2020-03-06,Europeans: our new foreign language drama series from across the continent,membership
580,2020-03-03,Friend zone: where in Europe can you find Guardian readers?,membership
581,2020-02-29,"Books, bags and looks: how the Guardian Bookshop is branching out",membership
582,2020-02-19,The gene genie: our podcast exploring the tech reshaping human identity,membership
583,2020-02-15,Words with friends: how our Puzzles app can bring crossword fans together,membership
584,2020-02-08,Exposing Malta's dark side: ‘Daphne's story is far from over',membership
585,2020-02-01,In the ground and off the page: why we’re banning ads from fossil fuels extractors,membership
586,2020-01-25,Reporting on the Iran nuclear deal: 'nothing happens until everything happens',membership
587,2020-01-18,Reporting on the Australian fires: 'It has been heartbreaking',membership
588,2020-01-11,"Paul Johnson: 'At its core, the Guardian hasn't changed'",membership
589,2021-12-20,"Inside the Guardian: six years of candour, courage, and craft",membership
590,2021-12-06,Helping readers on the consumer desk: ‘We’re canaries in the coalmine’,membership
591,2021-11-22,Community reporting: ‘These stories are at the heart of modern Britain’,membership
592,2021-11-01,Optimism for Cop26: every bit of heating we prevent reduces suffering,membership
593,2021-11-01,Optimism for Cop26: we must win the climate battle – and we absolutely can,membership
594,2021-10-25,‘We’re all climate journalists now’: how the weather took over everything,membership
595,2021-10-14,"How to expose corruption, vice and incompetence – by those who have",membership
596,2021-09-27,‘Is that live?’ The pioneers who put the ‘new’ into news,membership
597,2021-09-20,‘We never went home before 10pm’: 50 years of reporting on politics and power,membership
598,2021-09-13,‘Numbers you can tell stories with’: a decade of Guardian data journalism,membership
599,2021-09-06,Life on the newsdesk: ‘Technology has changed. Expectations haven’t’,membership
600,2021-08-26,Reporting on the climate crisis: ‘For years it was seen as a far-off problem’,membership
601,2021-08-25,"We’ve reached our goal of 170,000 Guardian Australia supporters. Thank you",membership
602,2021-08-23,The Guardian’s first Tech editor: ‘They gave me a demo and showed me things I couldn’t believe’,membership
603,2021-08-14,Tokyo Olympics was a 16-day adrenaline rush but also a lesson in rights and wrongs | Sean Ingle,membership
604,2021-08-09,Jonathan Steele: ‘I came to Russia a political correspondent and left a crime reporter’,membership
605,2021-08-02,The changing art of the subeditor: ‘You had to read the type upside down’,membership
606,2021-07-15,Me and my Guardian: ‘Without the Guardian I would not be where I am today’,membership
607,2021-07-12,"Nazis, fear and violence: when reporting from Berlin was dangerous",membership
608,2021-06-27,Boozy lunches and sober sandwiches: how the Guardian film critic’s job has changed,membership
609,2021-06-21,"‘A woman, a refugee, and a Jew’: pioneering reporter Hella Pick on breaking down walls",membership
610,2021-06-14,More than just a game: the ageless art of the sports writer,membership
611,2021-06-03,‘Nose to the grindstone’: how Simon Winchester covered Watergate for the Guardian,membership
612,2021-05-23,The Guardian’s first fashion editor: ‘Highbrows no longer ignore high fashion’,membership
613,2021-05-17,"Long lunches, tea with the mafia … how reporting Italy has changed over the years",membership
614,2021-05-03,Covering India’s Covid crisis: ‘Hundreds of journalists have lost their lives’,membership
615,2021-04-26,How we made Colette: ‘We wanted to give witness to what she had held inside’,membership
616,2021-04-19,Life as readers’ editor: ‘Nothing escapes the readership’s attention’,membership
617,2021-04-13,Reporting on women’s safety: ‘We tell the stories that have been ignored’,membership
618,2021-04-05,Telling the story of the Freshwater Five: 'Millions are debating their innocence',membership
619,2021-03-29,"Made in Britain: 'Now more than ever, we must involve and empower people'",membership
620,2021-03-15,Reporting from Myanmar: 'The future has never been darker',membership
621,2021-03-08,On the ground in Yemen: ‘A place of wonder overshadowed by conflict’,membership
622,2021-03-01,"Guantánamo, torture and friendship: how we made My Brother's Keeper",membership
623,2021-02-22,Making Modern Masculinity: 'It felt like we needed to build bridges',membership
624,2021-02-15,Editing the Guardian experience column: 'It's about profound moments of discovery',membership
625,2021-02-08,Covering the Russia protest: 'Police usually let western reporters go',membership
626,2021-02-01,Reverberate: the Guardian's new podcast on the soundtrack of history,membership
627,2021-01-24,Permanent PJs and pivoting designers: how the pandemic hit the fashion world,membership
628,2021-01-18,'It can unite a nation': Guardian TV writers on why the small screen has prevailed,membership
629,2021-01-11,Anywhere but Washington: an eye-opening journey in a deeply divided nation,membership
