,Date,Content,Section
290,2017-08-12,The article that changed my view … of how we can fight racism towards indigenous groups,membership
291,2017-08-12,Weekend reading: Bellicose rhetoric and soothing songs,membership
292,2017-08-10,Membership one year on: together we are producing important Australian journalism,membership
293,2017-08-05,Felicity Lawrence: 'People want original investigative journalism more than ever',membership
294,2017-08-05,Weekend reading: Saying goodbye to Bolt and remembering partition,membership
295,2017-07-29,Weekend reading: Pink flamingos and a profane outburst,membership
296,2017-07-29,Almost a quarter of shops 'illegally sell knives to underage people',membership
297,2017-07-28,The article that changed my view … of how to tackle extremism,membership
298,2017-07-22,"Weekend reading: Wheels, wages and Wonderland",membership
299,2017-07-21,Game changers: how the increasing cultural significance of video games is reflected in our coverage,membership
300,2017-07-15,Weekend reading: Spotify's 'fake artists' and the UK's food snobbery,membership
301,2017-07-14,'Running is the rope that pulls us forward': the solidarity of the Running Blog regulars,membership
302,2017-07-14,The article that changed my view … of Corbyn's role as Labour leader,membership
303,2017-07-08,"Weekend reading: murder, asylum and sex robots",membership
304,2017-07-05,Our enduring commitment to reporting on knife deaths of young people,membership
305,2017-07-01,"Weekend reading: Banter, Balls and Brooklyn Beckham",membership
306,2017-06-30,Teenager faces life in prison after pupil's murder outside school,membership
307,2017-06-30,Data journalism: from information to insight in unpredictable times,membership
308,2017-06-30,The article that changed my view … of knife crime among young Britons,membership
309,2017-06-24,"Weekend reading: Brexit, art and royal reluctance",membership
310,2017-06-23,Brexit Shorts: Giving voice to a divided Britain through new dramas,membership
311,2017-06-23,The films that changed my view … of Britain's shifting political landscape,membership
312,2017-06-17,"Weekend reading: Power, wealth and tragedy",membership
313,2017-06-16,Guardian members: share your opinions and questions on Brexit,membership
314,2017-06-13,Guardian journalism goes from strength to strength. It's just our shape that's changing,membership
315,2017-06-13,Members' views on why media matters: 'good journalism is our modern cultural conscience',membership
316,2017-06-12,The article that change my view … of how to cope with anxiety,membership
317,2017-06-10,"Weekend reading: A political earthquake, plus life on a superyacht",membership
318,2017-06-03,"Weekend reading: Librarian chic, on-screen NHS and #feelthebern Corbyn",membership
319,2017-06-02,Owen Jones: varied views make the Election Daily podcast a success,membership
320,2017-06-02,General Election 2017: how the Guardian decides who to back,membership
321,2017-05-30,The article that changed my view … of how wars should be remembered,membership
322,2017-05-27,"Weekend reading: The best of croissants, the worst of the Croisette",membership
323,2017-05-26,How can we build confidence and trust? By scrutinising ourselves,membership
324,2017-05-21,"Police failed to engage with public, Met knife campaign chief admits",membership
325,2017-05-20,Voices and votes: Why the Guardian wants to find out what Britain is really thinking,membership
326,2017-05-20,"Weekend reading: Spin room spats, in-flight movies and a lonely snail",membership
327,2017-05-16,Can Met police's new 'murder suppression unit' make a difference?,membership
328,2017-05-15,Two sides to every story: giving readers a voice in the Guardian's history,membership
329,2017-05-13,"Weekend reading: Political slogans, Pink Floyd and pub theatre",membership
330,2017-05-08,Carbon footprints and practical action: readers have their say on environment reporting,membership
331,2017-05-06,Weekend reading: Electoral shocks and avant garde frocks,membership
332,2017-05-04,"'When knife victims arrive at hospital in school uniform, it brings it home to you'",membership
333,2017-04-29,Weekend reading: Books return – and the selfie evolves,membership
334,2017-04-28,Big stories are complex: here's how we're trying to explain them better,membership
335,2017-04-28,The article that changed my view … of dairy production,membership
336,2017-04-26,Has a Guardian article changed your view on a subject?,membership
337,2017-04-24,"Four stabbing deaths in a fortnight, as concerns raised over rise in knife crime",membership
338,2017-04-24,Weekend reading: Running the marathon to surviving the election,membership
339,2017-04-24,The article that changed my view … of how business should be done,membership
340,2017-04-24,The Guardian's contribution to MPs' inquiry into fake news,membership
341,2017-04-18,Climate change: surely the most important news story of our age?,membership
342,2017-04-15,"Weekend reading: Ayn Rand, pop plagiarism and the power of protest",membership
343,2017-04-10,Members' podcast: your opinions on the global rise of nationalism,membership
344,2017-04-10,Member's views: 'A rounded discussion with a fascinating woman',membership
345,2017-04-10,'I wanted to take you inside the paper' – a new history of the Guardian,membership
346,2017-04-08,"Weekend reading: Cocaine valley, Kendall Jenner and great Easter eggs",membership
347,2017-04-07,Beyond the blade: your responses to our project on knife crime,membership
348,2017-04-06,The article that changed my view … of how Isis gained power,membership
349,2017-04-01,"Weekend reading: Brexit, legs-it and a sea battle",membership
350,2017-03-29,A world without retirement,membership
351,2017-03-28,Irresponsible reporting of knife crime 'alienating young people',membership
352,2017-03-28,Share your experiences and views of knife crime in the UK,membership
353,2017-03-28,Beyond the blade: marking the death of every child and teen by a knife in 2017,membership
354,2017-03-27,"When terror strikes, our reporters need to be quick – but they must also be accurate",membership
355,2017-03-25,"Weekend reading: London pride, the Global Laundromat and a sushi bouquet",membership
356,2017-03-20,"Hella Pick: 'I'm not a war reporter, but I'd fight any political battles'",membership
357,2017-03-20,The article that changed my view … on capital punishment,membership
358,2017-03-18,"Weekend reading: A Royal plan, a Trump quiz and the best oven chips",membership
359,2017-03-13,"Thank you for your support, which is more important now than ever | Katharine Viner",membership
360,2017-03-11,"Weekend reading: Budget, Buffy and BBC4",membership
361,2017-03-06,What do you need for a good retirement?,membership
362,2017-03-06,The article that changed my view … of cycling,membership
363,2017-03-06,The New Arrivals project – why we are reporting on asylum seekers in the UK,membership
364,2017-03-06,How to retire successfully: 'You need to ask what you want out of life',membership
365,2017-03-04,"Weekend reading: Spy recruitment, superhero movies and budget hotels",membership
366,2017-02-27,The article that changed my view: 'This book review pushed my life down a whole different path',membership
367,2017-02-27,The New Retirement: we've relied on readers' feedback and have not been disappointed,membership
368,2017-02-27,What is retirement like for women?,membership
369,2017-02-27,What happens to women when they retire?,membership
370,2017-02-25,"Weekend reading: Oscar predictions, Putin myths and queuing science",membership
371,2017-02-20,Are your 60s and 70s the best decades of life?,membership
372,2017-02-20,Could your 60s and 70s be the best decades of life?,membership
373,2017-02-18,"Weekend reading: Satire for all, Netflix cheats and Love Back-tually",membership
374,2017-02-17,"Letter from Istanbul: By talking to people, you get through things together",membership
375,2017-02-17,Members' views: 'The printing process is old-school and rather beautiful',membership
376,2017-02-13,The new retirement: caring for others when you need care yourself,membership
377,2017-02-13,Hidden carers: the sixty-somethings looking after parents and grandchildren,membership
378,2017-02-11,"Weekend reading: Farewell TPT, Brexit heartache and pesto taste-tested",membership
379,2017-02-10,Sub standard procedures: a Guardian guide to subediting,membership
380,2017-02-10,Inside the Guardian: Fury as subeditors declare war on hyperbole,membership
381,2017-02-06,Members' podcast: Are we living in a new age of resistance?,membership
382,2017-02-06,The new retirement: what good ideas can we borrow from history?,membership
383,2017-02-06,Flexible retirement age: an idea whose time has come?,membership
384,2017-02-04,"Weekend reading: Celebs v Trump, the next Doctor, and pigs' ears cake",membership
385,2017-02-02,Reacting to Trump: Guardian Members on his first destabilising actions,membership
386,2017-01-30,The new retirement: will you keep working till you drop?,membership
387,2017-01-30,Work till you drop: when will you retire — and do you want to?,membership
388,2017-01-28,"Weekend reading: Dystopias, everyday nudity and one-pot recipes",membership
389,2017-01-27,Global warning: sounding the alarm on climate change with a 24 hour liveblog,membership
390,2017-01-27,The article that changed my view … of why the UK voted for Brexit,membership
391,2017-01-23,The new retirement: will your pension be enough?,membership
392,2017-01-23,'There's a danger of a generation who can't afford to retire',membership
393,2017-01-21,"Weekend reading: The Trumps, cancer diets and T2 Trainspotting",membership
394,2017-01-20,'A Calais refugee camp report moved me to take action',membership
395,2017-01-20,Readers' £1.8m donation is beacon for refugees in climate of hostility,membership
396,2017-01-16,The new retirement: how an ageing population is transforming Britain,membership
397,2017-01-16,Tell us what retirement means to you,membership
398,2017-01-14,"Weekend reading: Curry houses, avoiding divorce and Weetabix benedict",membership
399,2017-01-13,The article that changed my view …  of what journalism can achieve,membership
400,2017-01-13,"Diplomats, wage caps and dossiers: this week at Guardian conference",membership
401,2017-01-07,"Weekend reading: Willpower debunked,  Facebook's monster unleashed",membership
402,2017-01-06,Members' podcast: What do we need to talk about?,membership
403,2019-01-05,"Life in the lobby: 'Debate in parliament can be intense, emotional theatre'",membership
404,2018-12-31,What would you like us to cover in 2019? Share your thoughts,membership
405,2018-12-29,Reporting on poverty: 'Listening is the most important thing',membership
406,2018-12-22,'The story just keeps getting better': reporting on Scotland for the Guardian,membership
407,2018-12-15,Uncovering the implants scandal: 'the lack of transparency is shocking',membership
408,2018-12-08,Exposing rogue landlords: 'The deck feels stacked against tenants',membership
409,2018-12-01,Behind closed doors: why reporting on domestic abuse cases is so vital,membership
410,2018-11-24,Today in Focus: our new podcast bringing you the world in 20 minutes,membership
411,2018-11-22,Contribute to a podcast on the changing nature of our high streets,membership
412,2018-11-15,Why our readers' support is vital to the Guardian's future,membership
413,2018-11-14,'More than just a newspaper': Guardian writers thank readers for their support,membership
414,2018-11-13,From Iceland to India: the global community supporting the Guardian,membership
415,2018-11-12,Katharine Viner: 'The Guardian's reader funding model is working. It's inspiring',membership
416,2018-11-10,Uncovering Windrush: 'Only after months of reporting did the government apologise',membership
417,2018-11-09,Supporting the Guardian: how to make the most of our website and app,membership
418,2018-11-03,"Reporting from the West Country: floods, poison and scones in a region of contrasts",membership
419,2018-10-27,"Reporting on Trump, Kavanaugh and the women reshaping politics",membership
420,2018-10-20,Guardian Weekly: our bold new look for the international edition,membership
421,2018-10-13,Reporting on Trump and Putin amid the war on truth,membership
422,2018-10-06,Rape conviction crisis: the systemic failures that deny justice for victims,membership
423,2018-09-29,"Exposing Cambridge Analytica: 'It's been exhausting, exhilarating, and slightly terrifying'",membership
424,2018-09-22,"'Nasty, nasty man': Guardian reporter on being insulted by Trump and breaking the Snowden story",membership
425,2018-09-17,Contribute to a podcast on extinction,membership
426,2018-09-15,Beyond the Blade:  films and podcasts bring a vivid new angle to our series,membership
427,2018-09-15,Beyond the Blade Live: Join the debate,membership
428,2018-09-10,Beyond the Blade – The Mother,membership
429,2018-09-10,Beyond the Blade – The Boy,membership
430,2018-09-10,Beyond the blade – The Father,membership
431,2018-09-10,Beyond the Blade – The Doctor,membership
432,2018-09-10,Beyond the Blade multimedia series,membership
433,2018-09-08,Join the club: how Burning Man festival and co-ops are helping shape journalism,membership
434,2018-09-01,Meeting Jacinda Ardern: 'She makes the extraordinary seem ordinary',membership
435,2018-08-25,Best kept secrets: how the Guardian archive tells the story behind the stories,membership
436,2018-08-18,gal-dem Guardian takeover proves diversity breeds creativity,membership
437,2018-08-09,To the ends of the Earth: the activists risking their lives to defend the environment,membership
438,2018-08-03,Guardian film editor on meeting stars: 'It's rare someone is as you imagine',membership
439,2018-07-26,World Cup 2018: 'covering the action provided drama every day',membership
440,2018-07-19,Guardian documentaries: our short films captivating a global audience,membership
441,2018-07-05,Modern slavery: how we exposed deadly sex trafficking in US prisons,membership
442,2018-07-04,Beyond the Blade: thank you for reading and supporting our series on knife crime,membership
443,2018-06-27,Contribute to a podcast on the importance of positive news coverage,membership
444,2018-06-22,Matters of fact: separating brilliant breakthroughs from science fictions,membership
445,2018-06-21,The radical lessons of a year reporting on knife crime,membership
446,2018-06-14,Reporting from south-east Asia: 'I have witnessed hope triumph over fear',membership
447,2018-06-08,Covering Brexit from Brussels: 'It's like a high-stakes poker game',membership
448,2018-05-19,"Weekend reading: Harry and Meghan, fibroids … and farewell",membership
449,2018-05-12,"Weekend reading: Specs trade, This is America and the Met Gala",membership
450,2018-05-11,Contribute to a Guardian podcast that asks 'Should we all be vegan?',membership
451,2018-05-05,Alabama's lynch mob memorial: reporting on an American taboo,membership
452,2018-05-05,"Weekend reading: Puppet boy, palms and fake nature",membership
453,2018-04-30,The Windrush scandal shows why we must hold power to account | Katharine Viner,membership
454,2018-04-28,Weekend reading: trophy wives in Trumpland and MMMBop,membership
455,2018-04-27,The Daphne Project: a milestone in the fight to defend press freedom,membership
456,2018-04-21,"Weekend reading: Instascams, Kendrick’s Pulitzer and Ariana’s grand return",membership
457,2018-04-20,Amelia Gentleman on Windrush: 'I've felt like an immigration case worker',membership
458,2018-04-14,Alan Travis: 'The job hasn't changed – report the news and tell the story',membership
459,2018-04-14,Weekend reading: Splitting up Sydney and the truth about your favourite foods,membership
460,2018-04-07,How we make the Long Read: from the rise of the sandwich to the meaning of neoliberalism,membership
461,2018-04-07,"Weekend reading: 'Black ops', pay gaps and spyphones",membership
462,2018-03-31,How the Parkland students took over Guardian US,membership
463,2018-03-31,"Weekend reading: paying the wrong people for slavery, and a French escape",membership
464,2018-03-24,"Weekend reading: The second coming of Frida, and a legend at 70",membership
465,2018-03-17,Weekend reading: Stephen Hawking remembered and ex-rock groupies reflect,membership
466,2018-03-10,"Weekend reading: Goodbye NME, hello gritty chic",membership
467,2018-03-03,Weekend reading: The perils of bacon and where to warm up,membership
468,2018-02-24,Polly Toynbee: 'These are the darkest days I have known',membership
469,2018-02-24,The article that changed my view … of how we can counter racial prejudice,membership
470,2018-02-24,Weekend reading: Train abduction and dining crunch,membership
471,2018-02-17,The article that changed my view … of how bilingualism can improve society,membership
472,2018-02-17,"Weekend reading: Quorn, North Korea and carnality",membership
473,2018-02-10,'Grenfell has to change things': how we're covering Britain's housing crisis,membership
474,2018-02-10,"Weekend reading: Space, spice and snow",membership
475,2018-02-03,Supporters' views: 'Peter Carey seemed completely at ease discussing his work',membership
476,2018-02-03,"Weekend reading: Over the moon, and a web refresh",membership
477,2018-01-27,John Domokos: 'Video journalism forces you to go the extra mile',membership
478,2018-01-27,Weekend reading: A maverick signs off,membership
479,2018-01-24,Europe now – why the Guardian is launching a new series | Natalie Nougayrède,membership
480,2018-01-23,Contribute to a podcast on the future of journalism,membership
481,2018-01-20,Readers' hopes for 2018: what would you like us to cover this year?,membership
482,2018-01-20,"Weekend reading: Fear, strength and loneliness",membership
483,2018-01-13,New year's revolutions: the stories we're hoping to cover in 2018,membership
484,2018-01-13,"Weekend reading: Stoke, sloths and speeches",membership
485,2020-01-06,"With support from Guardian readers, we can make the 2020s the decade of hope",membership
486,2020-01-04,What does the Guardian's new B-corp status mean? 'It's about long-term impact',membership
487,2019-12-28,"The big stories of 2020, as predicted by Guardian readers",membership
488,2019-12-21,Britain's homelessness crisis: 'It didn't need to be this way',membership
489,2019-12-16,Climate crisis: what would Guardian readers like to see in our coverage?,membership
490,2019-12-14,"Editing the Weekend magazine: ‘It’s about warmth, fun, and surprise – as well as the serious stuff’",membership
491,2019-12-10,What would you like us to cover in 2020? Share your thoughts,membership
492,2019-12-07,The Guardian's all-new Daily app: 'It's a snapshot of how we see the world',membership
493,2019-11-23,Reporting on automated poverty: how tech is punishing the poor,membership
494,2019-11-16,Reporting on 'Cancer Town': 'We will hold politicians accountable for inaction',membership
495,2019-11-09,"Larry Elliott Q&A: 'History shows that, right now, we're playing with fire'",membership
496,2019-11-02,Tackling 'colourism': how our Shades of Black series exposed the race issue no one is discussing,membership
497,2019-10-26,Damian Carrington on 10 years as the Guardian's environment editor,membership
498,2019-10-12,Butterfly effect: How Guardian's brand campaign is inspiring readers,membership
499,2019-10-05,State of the arts: 'Theatre is usually in tune with our volatile times',membership
500,2019-09-28,The unforgettable summer: reporting on the 2019 cricket season,membership
501,2019-09-21,Breaking the menopause taboo: 'There are vital stories we should continue to pursue',membership
502,2019-09-14,Reporting on Hurricane Dorian: 'It was a scene of complete devastation',membership
503,2019-09-06,Guardian investigations: how tech helps tackle big data … and big lawyers,membership
504,2019-08-31,Reporting on Hong Kong: 'What will happen to this wonderful city?',membership
505,2019-08-27,The inside story of Guardian Cities: a new kind of journalism,membership
506,2019-08-16,'My ancestor founded the Guardian. Its work has never been so vital',membership
507,2019-08-10,Guardian technology podcast: 'World leaders should listen!',membership
508,2019-08-03,The Upside series: 'Our reporting generates change for the better',membership
509,2019-07-27,Guardian events commemorating Peterloo: 'the spirit of change is still palpable’,membership
510,2019-07-27,Reporting on the 2019 Women's World Cup: 'It was a turning point',membership
511,2019-07-13,Reporting on Glastonbury 2019: 'it's a cultural event unlike any other',membership
512,2019-07-06,"The art of the political sketch: 'These days,  it's a form of truth-telling'",membership
513,2019-06-29,Recipe for success: how we cook up Feast every week,membership
514,2019-06-22,Exploring the rise of populism: 'It pops up in unexpected places',membership
515,2019-06-15,Guardian Books desk: 'You can tell a lot about a country by how it treats its libraries',membership
516,2019-06-08,True north: in pursuit of balance and better buses in the Guardian's Manchester office,membership
517,2019-06-01,"The Guardian Opinion desk: ‘Disturbingly, Brexit is the gift that keeps on giving’",membership
518,2019-05-25,Covering the Sri Lanka attacks: 'It's about giving voices to victims',membership
519,2019-05-18,Jay Rayner: 'I have no time for exclusionist food fads',membership
520,2019-05-11,Reporting on Brexit from Europe: 'I'll be mighty glad when it's over',membership
521,2019-05-04,"Baptism of fire: my first, turbulent year as the Guardian's Latin America correspondent",membership
522,2019-04-27,Reporting from Jerusalem: 'the focus is always on how the story is told',membership
523,2019-04-20,Life as the Guardian's Ireland reporter: my return home to a nation in flux,membership
524,2019-04-13,Guardian culture critics: 'Art entangles itself with the raw reality of our world',membership
525,2019-04-06,'We would never put that image on page 1': how we covered Christchurch,membership
526,2019-03-30,"Picture of health: 'Our medical reporting is about suffering, money and power'",membership
527,2019-03-23,A decade of the Datablog: 'There's a human story behind every data point',membership
528,2019-03-16,Biscuit fund: the volunteers patching up Britain's welfare state,membership
529,2019-03-09,Gary Younge: ‘Our understanding of democracy is under threat',membership
530,2019-03-02,"Guardian Documentaries on the Oscars red carpet: 'It's strange, but brilliant'",membership
531,2019-02-28,Contribute to a podcast on how we can make fashion more sustainable,membership
532,2019-02-20,Katharine Viner: 'Journalists and readers share a vital stake in our future',membership
533,2019-02-16,Australia's shame: how we mapped a decade of Indigenous deaths in custody,membership
534,2019-02-09,The potato solution: how the Guardian switched to biodegradable packaging,membership
535,2019-02-02,Reporting on Trump as a Muslim American woman: 'The facts are our most important tools',membership
536,2019-01-26,Racism in Britain: how we revealed the shocking impact of unconscious bias,membership
537,2019-01-19,Readers' hopes for 2019: what would you like us to cover this year?,membership
538,2019-01-12,Grace Dent on being a restaurant critic: 'It's the greatest job in the world but friends never invite me for dinner',membership
539,2019-01-11,What do you think about the future of education?,membership
540,2021-01-02,Guardian readers on their hopes and fears for 2021,membership
541,2020-12-21,Covid through a lens: how Guardian video continued amid the pandemic,membership
542,2020-12-14,'I speak Italian with a Croydon accent': reporters on their language skills,membership
543,2020-12-07,Reporting from Greece: 'This country has become a poster child for resilience',membership
544,2020-11-29,Reporting on wealth: ‘The virus isn't a leveller. It has made the rich richer’,membership
545,2020-11-23,Today in Focus: 'Listeners feel they have a personal relationship with us',membership
546,2020-11-15,"Tracking the US election results: 'We needed to be clear, fast, and accurate'",membership
547,2020-11-09,"The consumer champions: 'Firms hope we'll just go away, but we don’t'",membership
548,2020-11-02,Reporting the US election: 'No one quite knows when it will end. Or how',membership
549,2020-10-25,On the US campaign trail: 'We are watching democracy unfold',membership
550,2020-10-18,Scotland: 'Accurate and accessible reporting never more important',membership
551,2020-09-27,Reporting on Brexit: 'I think we'll soon have some closure',membership
552,2020-09-21,Covering the race for a Covid vaccine: 'The speed of progress is astonishing',membership
553,2020-09-13,Reporting from India: 'Pandemics have a painful legacy here',membership
554,2020-08-23,Reporting from Latin America: 'Coronavirus has proved an intensely political story',membership
555,2020-08-16,Reporting from Beirut: 'How could this have been allowed to happen?',membership
556,2020-08-09,"Reporting on Covid-19 in Spain: 'peaks, troughs and sacrifices",membership
557,2020-08-02,Covid-19 in the Middle East: 'Normal life is back – including the tensions',membership
558,2020-07-26,Covid-19 and technology: ‘This time has shown me that analogue life has its advantages’,membership
559,2020-07-19,"We've reached our goal of 150,000 Guardian Australia supporters. Thank you | Lucy Clark",membership
560,2020-07-18,Making the timelines: 'There's much more to black history than slavery',membership
561,2020-07-12,Covering Russia and the west: 'Putin's goal is to make the truth unknowable',membership
