,Date,Content,Section
0,2014-11-27,Behind the Headlines: Isis - who said what,membership
1,2014-11-21,An evening with Ken Clarke: 10 things we learned,membership
2,2014-11-14,William Gibson's digital thumbprint from Neuromancer to Interstellar,membership
3,2014-11-13,Split decisions,membership
4,2014-11-11,Farage and the UK Independence Party: the death of Ukip has been greatly exaggerated,membership
5,2014-11-11,The rise of Ukip: what we learnt,membership
6,2014-11-10,A big beast in suede shoes: Ken Clarke – an ‘authentic political personality’,membership
7,2014-09-29,Guardian Live: Hatreds Old and New – as it happened,membership
8,2014-09-24,Guardian Live: Scotland Decides – as it happened,membership
9,2014-09-22,Guardian Membership: your thoughts so far,membership
10,2014-09-19,Guardian Live with Russell Brand: broadcasting live around the UK,membership
11,2014-09-17,Shami Chakrabarti on Liberty's greatest achievement,membership
12,2014-09-10,Space Oddities: the best tweets from the cosmos,membership
13,2014-09-10,Alan Rusbridger: welcome to Guardian Membership,membership
14,2014-09-10,"The Midland Goods Shed: welcome to the Guardian's new space for debate, culture and curiosity",membership
15,2014-09-10,The best of infographics: designers pick their favourites,membership
16,2014-09-10,Guardian Live: Ian McEwan – as it happened,membership
17,2014-09-10,Guardian Live: David Mitchell – as it happened,membership
18,2014-09-10,Where are the best places for cycling in the UK?,membership
19,2014-09-10,Guardian Live: Brunch with Yotam Ottolenghi - video,membership
20,2014-09-10,Guardian reader event: David Mitchell discusses The Bone Clocks - video,membership
21,2014-09-05,Guardian reader event: Ian McEwan talks about The Children Act - video,membership
22,2015-12-18,Guardian Members' assignment: how to be happy,membership
23,2015-12-15,Guardian Live: what next for feminism?,membership
24,2015-12-11,"Nigella Lawson: ""Obesity is a poverty issue""",membership
25,2015-12-11,"Punks, raves and rappers: making it in the music industry, Dizzee style",membership
26,2015-12-07,Guardian Live: has gambling got out of control?,membership
27,2015-12-04,We stand together: behind the scenes of our annual charity appeal,membership
28,2015-12-04,What does 2016 hold? Our thoughts on the next 12 months,membership
29,2015-12-04,What does 2016 hold? Your thoughts on the next 12 months,membership
30,2015-12-04,Ian Black on reporting from the Middle East,membership
31,2015-12-03,Reach into history with the Guardian and Observer archives,membership
32,2015-12-01,#GivingTuesday: an appeal to help alleviate the global refugee crisis,membership
33,2015-11-26,Event preview: the future of football,membership
34,2015-11-17,Guardian Live: is education failing our economy?,membership
35,2015-11-12,Paddy Ashdown on surveillance: don't make us a country of suspects,membership
36,2015-11-09,"Michael Palin: 'Saying ‘yeah, alright’ could be the story of my life'",membership
37,2015-11-07,Inside the Guardian: from first word to final edition,membership
38,2015-11-04,Guardian Members' assignment - what will 2016 hold?,membership
39,2015-10-19,"The Hunting Ground: 'Like climate change deniers, there is an industry of rape deniers'",membership
40,2015-10-03,Stuart Langley on the challenge of starting a pop-up restaurant,membership
41,2015-10-03,"Sarah Lee: ""A decent lens matters more than a decent camera""",membership
42,2015-10-02,Live stream: Imogen Heap releases Tiny Human using blockchain technology,membership
43,2015-10-02,Guardian Live: will the market save us?,membership
44,2015-10-02,Inside the Guardian: Jason Phipps on the power of the podcast,membership
45,2015-09-30,"Jeanie Finlay: ""I can't watch X Factor""",membership
46,2015-09-29,Caroline Flint: Labour was in denial about the unpopularity of Miliband,membership
47,2015-09-19,"After Corbynmania, have we entered the age of political easy answers?",membership
48,2015-09-14,What's your favourite ghost story?,membership
49,2015-09-09,Share your experiences of pop-up restaurants,membership
50,2015-09-06,Guardian Live: our autumn literary programme,membership
51,2015-09-05,Raw food revolution,membership
52,2015-09-05,Meet Manchester futurist - Mike Ryan,membership
53,2015-08-26,Guardian Live - Labour leadership hustings live stream,membership
54,2015-08-06,Put your questions to the Labour leadership contenders,membership
55,2015-07-31,Share your experiences of raw food,membership
56,2015-07-27,Guardian Live: Why do young women want to join Islamic State?,membership
57,2015-07-23,Guardian Live: Is capitalism dead?,membership
58,2015-07-17,Guardian Live: Is devolution a good deal for Manchester's NHS?,membership
59,2015-07-10,Guardian Live: inequality set to rise with fresh attack on working-age welfare,membership
60,2015-07-10,EXPIRED Win a pair of tickets to see Vivien: Letter to Larry at London's Jermyn Street Theatre,membership
61,2015-07-10,EXPIRED Win a pair of tickets to see Vivien: Letter to Larry at London’s Jermyn Street Theatre,membership
62,2015-07-04,Simon Hattenstone: the unpredictable and the  unpublishable,membership
63,2015-07-03,The Real Junk Food Project's Corin Bell on fighting food waste in Manchester,membership
64,2015-07-03,Guardian Members - introduce yourselves,membership
65,2015-07-01,Has capitalism had its day?,membership
66,2015-06-26,Guardian Live: Can Greece be saved?,membership
67,2015-06-26,What's the future for the Liberal Democrats?,membership
68,2015-06-23,Guardian Live: do we still need the BBC?,membership
69,2015-06-22,Share your views on the Human Rights Act,membership
70,2015-06-19,These are nation-changing times  join the Guardian and help us hold power to account,membership
71,2015-06-19,Guardian Live: Brexit - what would happen if the UK left the EU?,membership
72,2015-06-18,Guardian Live: what's the future of Fifa?,membership
73,2015-06-18,Guardian Live: should you let your baby use a tablet?,membership
74,2015-06-17,Guardian Live: what can we do about the migration crisis?,membership
75,2015-06-13,Ethical eats – zero waste cafes and community projects,membership
76,2015-06-12,Guardian Live and Manchester's Discuss: is big business good for communities?,membership
77,2015-06-11,Raising the bar: an audience with Jeremy Hutchinson QC and Alan Rusbridger – review,membership
78,2015-06-10,Do we still need a BBC? Share your views,membership
79,2015-06-05,Jay Rayner: 'Me playing is akin to watching the dog walk on his back legs',membership
80,2015-06-05,Inside the Guardian: News by numbers,membership
81,2015-05-26,Guardian Live: Gilbert & George in conversation,membership
82,2015-05-20,Guardian Live: at what price happiness?,membership
83,2015-05-19,Guardian Live: We Are Many preview,membership
84,2015-05-15,Become a Guardian Member and support our investigative journalism,membership
85,2015-05-15,Guardian Live and Manchester's Discuss: should the rich pay more tax?,membership
86,2015-05-13,We Are Many: how Amir Amirani got global anti-war protests to the big screen,membership
87,2015-04-30,Guardian Live: Sketching the coalition with Steve Bell and John Crace - review,membership
88,2015-04-28,Guardian Live: The Guardian Film Show,membership
89,2015-04-23,Is happiness worth measuring?,membership
90,2015-04-21,Guardian Live: What shall we do about politics with Zoe Williams,membership
91,2015-04-17,Guardian Live: Diversity in the arts,membership
92,2015-04-14,How to fight trans invisibility in film,membership
93,2015-04-13,'Making our conversation richer is at the heart of Guardian Membership',membership
94,2015-04-07,'Songs for Alexis achieves something close to perfect simplicity',membership
95,2015-03-26,Guardian Live: is big money ruining English football?,membership
96,2015-03-25,Guardian Live: Nick Broomfield on Tales of the Grim Sleeper,membership
97,2015-03-24,Guardian Live: Doc Day Sunday - Dreamcatcher,membership
98,2015-03-23,Inside the Guardian – how we started the debate about climate change,membership
99,2015-03-20,Guardian Live featuring John Gray and Will Self: Is free will an illusion?,membership
100,2015-03-19,Our campaign puts climate change where it should be – on the front page,membership
101,2015-03-17,Join Guardian Membership … because it will be great for me too,membership
102,2015-03-17,"Guardian Live: exceptional women, incredible stories",membership
103,2015-03-13,Guardian Live: Syria four years on,membership
104,2015-03-13,Extraordinary things happen at Guardian events – come and join us,membership
105,2015-03-11,The making of a murder documentary,membership
106,2015-03-03,"Guardian Live: Midlake film and Q&A with Jason Lee, Eric Noren and Eric Pulido",membership
107,2015-03-02,The Edward Snowden story - video,membership
108,2015-02-26,"Join us to discuss, debate, argue and co-create some great journalism",membership
109,2015-02-18,"Jonathan Freedland: 'If you believe in what the Guardian is doing, come and join us'",membership
110,2015-02-18,Guardian Live: What is TTIP and how does it affect us?,membership
111,2015-02-11,Guardian Live: To frack or not to frack?,membership
112,2015-02-09,Rebooting Raymond Chandler: five things we learned from John Banville,membership
113,2015-02-06,Bryan Stevenson: 'I don’t do what I do because I have to. I do what I do because I’m broken too',membership
114,2015-02-06,"'If you read the Guardian, join the Guardian'",membership
115,2015-02-04,Guardian Live: Is David Cameron our most radical prime minister?,membership
116,2015-01-21,Is there a future for the NHS – Guardian Live event roundup,membership
117,2015-01-09,The UK and the EU – should we stay or should we go?,membership
118,2015-01-08,We are Charlie: an event in support of Charlie Hebdo – video,membership
119,2016-12-24,"Weekend reading: Conspiracies, podcasts and how to win a row",membership
120,2016-12-22,Members' views on Alan Bennett: 'Like opening your Christmas present and getting exactly what you wanted',membership
121,2016-12-21,Do you care about the truth? Help the Guardian sort fake news from reality,membership
122,2016-12-21,Fight for a free and independent press – it's crucial to a democratic society,membership
123,2016-12-17,"Weekend reading: Marine Le Pen, Wonder Woman and hangover cures",membership
124,2016-12-16,How to capture an extraordinary year in just 70 articles?,membership
125,2016-12-10,"Weekend reading: Boris bother, godless cities and 2016 charity appeal",membership
126,2016-12-09,Inside the Guardian: Brexit watch helps readers draw their own conclusions,membership
127,2016-12-09,Bridges not walls: how the Guardian is expanding its Brexit coverage,membership
128,2016-12-03,"Weekend reading: Leaked papers, landlords' secrets and booze science",membership
129,2016-12-02,Members' views: 'Trevor Noah's take was really thought-provoking',membership
130,2016-11-26,"Weekend reading: Autumn statement, Black Friday lies, Hygge conspiracy",membership
131,2016-11-25,A Member's view:  ‘I can’t see edible insects catching on …’,membership
132,2016-11-25,"At the Guardian's morning conference in London and New York, Trump’s victory dominates",membership
133,2016-11-19,"Weekend reading: Trump's sidekicks, pop box sets and Christmas pudding",membership
134,2016-11-18,"Members' views: 'When Marr started playing, everyone's jaw dropped'",membership
135,2016-11-18,'The Guardian doesn't reinforce my prejudices – it challenges them',membership
136,2016-11-16,The view from Middletown: final thoughts on Trump's victory,membership
137,2016-11-16,How Trump took middle America | Gary Younge,membership
138,2016-11-12,"Weekend reading: Trolls, Trump, Asperger's comics",membership
139,2016-11-11,A member's view: 'You need to plan a long time before you're ill',membership
140,2016-11-09,"In this new world, now is the time to support fearless, independent journalism",membership
141,2016-11-08,"The view from Middletown: 'More than any other election, people want it to be over'",membership
142,2016-11-07,This election has been so important. Support our efforts to cover it | Richard Wolffe,membership
143,2016-11-05,"Weekend reading: Election prediction, Brexit busting and a bonfire feast",membership
144,2016-11-03,The view from Middletown: 'This election has revealed a divided America',membership
145,2016-11-03,'Whoever wins the US election needs to address the rage out there': the view from Middletown,membership
146,2016-11-01,The view from Middletown: 'The perfect female presidential candidate doesn't exist',membership
147,2016-11-01,The view from Middletown: 'The perfect female presidential candidate doesn't exist',membership
148,2016-10-29,"Weekend reading: Heathrow aggro, tabloids' revenge and good scares",membership
149,2016-10-28,Michael White reflects on 45 years as a Guardian journalist,membership
150,2016-10-28,Guardian Members' views:  an evening with Bryan Cranston,membership
151,2016-10-27,The view from Middletown: 'Trump speaks to us in a way other people don’t',membership
152,2016-10-27,The view from Middletown: 'Trump speaks to us in a way other people don’t',membership
153,2016-10-25,The view from Middletown: Muncie's forgotten factories,membership
154,2016-10-25,The view from Middletown: Muncie's forgotten factories - a photo essay by David Levene,membership
155,2016-10-24,A member's view: 'It's just how I remember the restaurants in Jerusalem',membership
156,2016-10-24,The Scott Trust: why the Guardian is unique,membership
157,2016-10-22,"Weekend reading: Mosul examined, satire in trouble and the end of cash",membership
158,2016-10-20,"The view from Middletown: For Bernie Sanders supporters, a vote for Clinton does not come easy",membership
159,2016-10-20,"The view from Middletown: For the Bernie believers, a vote for Clinton does not come easy",membership
160,2016-10-19,Why Donald Trump's accusers chose to speak to the Guardian,membership
161,2016-10-19,Help the Guardian keep reporting on gun violence in America,membership
162,2016-10-18,The view from Middletown: a typical US city that never did exist,membership
163,2016-10-18,The view from Middletown: a typical US city that never did exist,membership
164,2016-10-18,How has Muncie changed over time? Share your photos and memories,membership
165,2016-10-15,"Weekend reading: Price hikes, attack ads and film locations",membership
166,2016-10-13,The view from Middletown: voters seem embarrassed – not angry,membership
167,2016-10-13,The view from Middletown: voters seem embarrassed – not angry,membership
168,2016-10-11,Sign up for Gary Younge's news from Middletown,membership
169,2016-10-11,Muncie voters: tell us which issues will decide the US election,membership
170,2016-10-11,The view from Middletown: Why are we covering this story?,membership
171,2016-10-11,The view from Middletown: join Gary Younge for a unique look at the US election,membership
172,2016-10-08,"Weekend reading: May's Britain, scary clowns and cheese scones",membership
173,2016-10-07,Member's view:  'I wanted to ask what we can do about gun crime',membership
174,2016-10-07,Virtual reality:  the Guardian's 6x9 is shown at the White House,membership
175,2016-10-01,"Weekend reading: Turner 2016, Ashley Madison and Amazon review secrets",membership
176,2016-09-30,A Member's view: Graphene is a solution for problems yet to come,membership
177,2016-09-27,"Weekend reading: Labour pains, secret cash and top album sleeves",membership
178,2016-09-26,EndFGM: Guardian live event held in London,membership
179,2016-09-23,The week at Guardian conference: from immigration to Brangelina,membership
180,2016-09-23,"A member's view: ""What happens to the talent of people who don't make it?""",membership
181,2016-09-19,Labour & Liverpool: support this new approach to our journalism,membership
182,2016-09-17,"Weekend reading: Grammar schools, gun control and Red Dwarf's return",membership
183,2016-09-16,Gun Nation: inside the US's deadly obsession,membership
184,2016-09-16,Guardian members' views: 'All parties on the left need to work together',membership
185,2016-09-13,Louise Ellman MP: 'A small number are intent on creating dissent',membership
186,2016-09-10,"Weekend reading: Paralympics, secret wars and political lingo",membership
187,2016-09-09,A member's view: 'These days football is all about demand for the finished article',membership
188,2016-09-03,"Weekend reading: Apple tax, Ed 'Disco' Balls and 40 films for autumn",membership
189,2016-08-31,Members' view: a night with Ian McEwan,membership
190,2016-08-30,Labour & Liverpool: young people and the party,membership
191,2016-08-26,"Weekend reading: Burkinis, divorce and a culture slamdown",membership
192,2016-08-26,A journey to Soweto reveals South Africa's past and present,membership
193,2016-08-22,"A members view: 'People care,  the energy and passion came through'",membership
194,2016-08-16,Labour & Liverpool: comradely debate at our live public meeting,membership
195,2016-08-12,"If you value the Guardian’s work to count police killings, please support our efforts",membership
196,2016-08-12,A member's view: 'I hope people will always want newspapers',membership
197,2016-08-11,"If you value Guardian Australia’s coverage of immigration and detention, please help fund it | Kath Viner",membership
198,2016-08-09,A Member's view: 'Turns out Not Vital is his name',membership
199,2016-08-05,Edinburgh fringe is where I stock my theatrical larder for the year ahead,membership
200,2016-08-05,Peter Kilfoyle: 'Something is going wrong in Liverpool',membership
201,2016-07-29,A member's view: 'There was one archive item I really wanted to see',membership
202,2016-07-29,Reporting on atrocities: it is vital that we measure every word with care,membership
203,2016-07-28,Labour & Liverpool: join us for a meeting on Merseyside,membership
204,2016-07-22,A member's view: 'What would a poet be doing in a steel mill?',membership
205,2016-07-20,Labour & Liverpool: how to make party meetings more welcoming,membership
206,2016-07-15,A Guardian member's view: 'You have to believe in a story to work on it for so long',membership
207,2016-07-15,In at the death: the art of the celebrity obituary,membership
208,2016-07-12,A member's view: 'It would be good to hear them say sorry for Iraq',membership
209,2016-07-11,Labour leadership: readers put case for and against Corbyn,membership
210,2016-07-08,Member's view: 'Stanley Spencer's works offer utopian vision of Britain',membership
211,2016-07-04,Tim Anderson's strawberry daifuku - recipe,membership
212,2016-07-02,A member's view: our emotions rule if we're swamped by information,membership
213,2016-07-02,Angela Eagle: anger stirs in her Wallasey constituency,membership
214,2016-06-28,Guardian Brexit debate livestream: what happens next?,membership
215,2016-06-27,"Undercover at Sports Direct: rewarding, exhilarating and sometimes petrifying",membership
216,2016-06-24,A member's view: The Terror Dream changed my thinking on America,membership
217,2016-06-23,Labour & Liverpool: 'the project is off to a good start',membership
218,2016-06-23,Labour & Liverpool,membership
219,2016-06-17,A member's view: modern art 'makes us think outside the box',membership
220,2016-06-16,Labour & Liverpool with Ewen MacAskill,membership
221,2016-06-10,A member's view: 'Look after your brain as well as your body',membership
222,2016-06-03,A member's view: 'Self-portraits​ are intriguing in the age of the selfie',membership
223,2016-05-27,A member's view: 'Free speech is about defending those we loathe as well',membership
224,2016-05-20,The shock of the new: how classical music turned atonal,membership
225,2016-05-06,Jeremy Hutchinson's Case Histories reveals road to modern Britain,membership
226,2016-04-30,A member's view: Andy Warhol will always represent 60s and 70s New York,membership
227,2016-04-29,A member's view: ​class matters because it affects people’s life chances,membership
228,2016-04-29,Gary Younge on David Beresford:  'the most generous and gentle mentor',membership
229,2016-04-11,Inside The Counted: how Guardian US has tracked police killings nationwide,membership
230,2016-03-21,Marina Litvinenko talks to Guardian Members – review,membership
231,2016-02-25,On the road with the Guardian fashion team,membership
232,2016-02-23,EU referendum: what questions would you like to ask our panel?,membership
233,2016-02-05,Inside the Guardian: David Smith's letter from America,membership
234,2016-02-04,Inside the Guardian: how the live blog has changed the face of news reporting,membership
235,2016-01-22,Brett Anderson: 'Reforming has given us an opportunity to correct the mistakes of youth',membership
236,2016-01-21,Inside the Guardian: planning the NHS project,membership
237,2018-01-06,"Weekend reading: Pizza, burgers and booze",membership
238,2017-12-31,"Dan Sabbagh: 'Editing news is intense, thrilling and ultimately exhausting'",membership
239,2017-12-30,Weekend reading: All kneel for 2017,membership
240,2017-12-25,How reader funding is helping save independent media across the world,membership
241,2017-12-23,"Weekend reading: Looking back at 2017 – and forward to, er, blue passports",membership
242,2017-12-16,Reporting on 2017: 'The editor had never seen a news cycle like this',membership
243,2017-12-16,Weekend reading: Grenfell’s memorial – and a near miss in Alabama,membership
244,2017-12-09,Peter Bradshaw Q&A: 'Now critics get reviewed – it's a sobering experience',membership
245,2017-12-09,Weekend reading: Uproar in Jerusalem and a deal in Brussels,membership
246,2017-12-03,How Scotland reduced knife deaths among young people,membership
247,2017-12-02,Weekend reading: Backchat on royal union and rip in 'special relationship',membership
248,2017-11-29,Beyond the Blade: our search for data exposed the poverty of the knife crime debate,membership
249,2017-11-28,Beyond the Blade: we finally know how many youths are killed by knives,membership
250,2017-11-28,Child knife deaths in England and Wales set for nine-year peak,membership
251,2017-11-25,The article that changed my view … of humanity's impact on the planet,membership
252,2017-11-25,"Weekend reading: Mnangagwa, Mladić and Mosul",membership
253,2017-11-18,Weekend reading: Wedded bliss – and the twilight of an autocrat,membership
254,2017-11-16,Working to discourage young people from carrying knives,membership
255,2017-11-14,'A knife isn't necessarily there to damage – young people say it's for protection',membership
256,2017-11-11,"Weekend reading: Paradise Papers, sacked MPs and stopgap pasta",membership
257,2017-11-08,'Covering Trump's White House is like being tossed inside a washing machine',membership
258,2017-11-07,Weekend reading: The best films by women – and our biggest regrets,membership
259,2017-10-28,The article that changed my view ... of who deserved my vote,membership
260,2017-10-28,Weekend reading: Above Jerusalem – and how to be bolder,membership
261,2017-10-26,"Together, we are safeguarding the Guardian's independent journalism",membership
262,2017-10-21,The article that changed my view … of becoming a single parent,membership
263,2017-10-21,Weekend reading: A dictator's dream city – and how to cook rice,membership
264,2017-10-18,"UK needs coordinated strategy to tackle knife crime, says MP",membership
265,2017-10-14,Contribute to a podcast on finding common ground in a polarised world,membership
266,2017-10-14,Weekend reading: Hollywood's dark side – and Australia's cruelty,membership
267,2017-10-14,"'Thanks to Guardian readers, many children are now sleeping safely in warm beds'",membership
268,2017-10-07,Should we be having fewer children for the sake of the planet?,membership
269,2017-10-07,Weekend reading: The cough heard around the world,membership
270,2017-09-30,Event review: 'It's staggering how little is known about North Korea',membership
271,2017-09-30,Weekend reading: Fowl play – and how to break bad habits,membership
272,2017-09-23,Knowledge and nonsense – in the studio with Guardian Football Weekly,membership
273,2017-09-23,The article that changed my view … of my ideal career,membership
274,2017-09-23,Weekend reading: Mother! of all disasters – and Labour's success,membership
275,2017-09-19,Beyond the Blade: How does a teenager come to kill?,membership
276,2017-09-19,The boy who killed – and the mother who tried to stop him,membership
277,2017-09-16,"Weekend reading: Autumn's food, fashion shows and must-see films",membership
278,2017-09-09,Modern mix tapes: the Guardian's new monthly playlist,membership
279,2017-09-09,Guardian members: join our podcast on climate change and population,membership
280,2017-09-09,Weekend reading: Plastic planet – and a pink lady,membership
281,2017-09-02,Celebrating wildlife in pictures,membership
282,2017-09-02,"Weekend reading: Swinging London, a sea story, and a deadly storm",membership
283,2017-08-26,The article that changed my view … of how research affects medical training,membership
284,2017-08-26,'This sums up my childhood': readers share their fondest memories,membership
285,2017-08-26,Weekend reading: US gazes at eclipse while UK looks to Norway,membership
286,2017-08-19,Dear Guardian: how to improve the chances of your letter appearing in print,membership
287,2017-08-19,The article that changed my view … of caring for my mother,membership
288,2017-08-19,"Weekend reading: Statues, centaurs and a silent Big Ben",membership
289,2017-08-12,Clearing the hurdles: why we're keeping the spotlight on women's sport,membership
