,Date,Content,Section
0,2013-11-20,Your voice: what does social enterprise mean to you? Share your pictures,social-enterprise-network
1,2014-04-30,What inspired you to start a social enterprise?,social-enterprise-network
2,2014-04-16,The best social enterprise Easter eggs - taste test,social-enterprise-network
3,2014-04-11,2014 Skoll World Forum: as it happens,social-enterprise-network
4,2014-02-21,"Simple ideas, big impact – in pictures",social-enterprise-network
5,2014-01-29,The history of the British co-operative movement - timeline,social-enterprise-network
