,Date,Content,Section
0,2010-12-30,Reward and recognition,society-professionals
1,2010-12-29,A serious lack of detail,society-professionals
2,2010-12-21,Bold leadership key to success in 2011,society-professionals
3,2010-12-13,Managing performance - time for a change in the NHS,society-professionals
4,2010-12-10,How can you cut fleet costs in public sector organisations?,society-professionals
5,2010-12-09,A fair day's pay cap?,society-professionals
6,2010-12-07,Preparing for the worst: crisis management training,society-professionals
7,2010-12-06,London boroughs fall out over chief executive merger,society-professionals
8,2010-11-23,When keeping 'calm and carrying on' is not enough,society-professionals
9,2010-11-18,Managing through a strike,society-professionals
10,2010-11-16,Dealing with stress-related absence,society-professionals
11,2010-11-15,Middle managers' chance to shine,society-professionals
12,2010-11-09,Show us what you can do ...,society-professionals
13,2010-11-05,A result for consultants - but at what cost?,society-professionals
14,2010-11-03,Relief for council workers,society-professionals
15,2010-11-01,Positive psychology at work,society-professionals
16,2010-10-28,If you want my advice ...,society-professionals
17,2010-10-25,Let's get together,society-professionals
18,2010-10-21,Going forward in reverse,society-professionals
19,2010-10-19,NHS listening skills,society-professionals
20,2010-10-18,Cutting through the red tape,society-professionals
21,2010-10-06,Lessons learned: the hard way,society-professionals
22,2010-10-04,Walk the line,society-professionals
23,2010-09-20,Job cuts and the long-term implications,society-professionals
24,2010-09-20,Minority report,society-professionals
25,2010-09-17,'No way to run a life let alone a country',society-professionals
26,2010-09-16,Brennan joins the female elite,society-professionals
27,2010-08-19,A good leader is much more than 'just a manager',society-professionals
28,2010-08-18,100 days: how the coalition is shaping up,society-professionals
29,2010-07-28,No more 'unknown unknowns',society-professionals
30,2010-07-19,Sharing the workflow,society-professionals
31,2010-07-19,Checkmate: how bad decisions can cost an organisation,society-professionals
32,2010-07-16,Managing expectations,society-professionals
33,2010-07-09,Online help to develop people skills,society-professionals
34,2010-07-08,"Big society, needs big ideas and the right people at the helm",society-professionals
35,2010-06-30,Getting on with the job,society-professionals
36,2010-06-29,Middle managers have crucial role to play,society-professionals
37,2010-06-24,Beat surrender: minister calls for fresh thinking on police,society-professionals
38,2010-06-23,The alternative to traditional care,society-professionals
39,2010-06-20,Demand for MBAs holds despite the downturn,society-professionals
40,2010-06-18,Masters of all trades?,society-professionals
41,2010-06-17,NHS managers must not gamble with patient care,society-professionals
42,2010-06-14,Going on voluntary terms,society-professionals
43,2010-05-27,NHS: something's gotta give - either targets or services,society-professionals
44,2010-05-26,No stone unturned: how Natural England conducted a root and branch review,society-professionals
45,2010-05-18,"Chemistry, communication and coalition",society-professionals
46,2010-05-10,Don't blame me,society-professionals
47,2010-04-29,Kent county council: Not so rosy in the garden of England,society-professionals
48,2010-04-21,Careers Talk: Job security in the public sector,society-professionals
49,2010-04-20,Doncaster's failing: how did it get so bad?,society-professionals
50,2010-04-19,Developing future leaders,society-professionals
51,2010-04-15,How to be indispensable in today's job market,society-professionals
52,2010-04-08,Tax can be taxing,society-professionals
53,2010-03-31,Local hero: Dr Patrick Geoghegan,society-professionals
54,2010-03-29,A past master at change management,society-professionals
55,2010-03-24,Total Place: give it more time says Bichard,society-professionals
56,2010-03-22,Rewarding good performance in the public sector,society-professionals
57,2010-03-03,How personal coaching helps keep managers focussed,society-professionals
58,2010-03-01,"How to fund, govern and run a hybrid organisation",society-professionals
59,2010-02-25,Bullying in the workplace: is it out of control?,society-professionals
60,2010-02-18,Under pressure: local councils and their ageing population,society-professionals
61,2010-02-17,Is there a manager in the house?,society-professionals
62,2010-02-10,Public Services Summit 2010: Anticipating the challenges ahead,society-professionals
63,2010-02-09,Managing the 'translation gap',society-professionals
64,2010-02-03,Live blog: Guardian Public Services Summit 2010,society-professionals
65,2010-02-03,Public sector managers need to do better,society-professionals
66,2010-02-02,External managers are not the ideal role models,society-professionals
67,2010-01-19,A strong Cabinet Office is good for government,society-professionals
68,2010-01-13,Procurement: the stakes just got higher,society-professionals
69,2010-01-06,Backs to the grindstone,society-professionals
70,2010-01-05,'Whitehall of the north',society-professionals
71,2010-01-05,Pay: not all wishful thinking,society-professionals
72,2010-01-05,'Making assets work harder is good for the public purse',society-professionals
73,2010-01-04,2010: a budgetary odyssey,society-professionals
74,2011-06-13,Coordinating social care procurement,society-professionals
75,2011-06-07,New report finds public sector in danger of losing talented staff,society-professionals
76,2011-06-03,Modernising the coastguard,society-professionals
77,2011-06-03,NHS staff should be taking responsibility for their actions,society-professionals
78,2011-06-02,Keeping the brightest and best onside,society-professionals
79,2011-06-01,Report calls for shake-up of the Met,society-professionals
80,2011-05-31,Gagging the coastguard,society-professionals
81,2011-05-31,Senior management changes need to be handled with care,society-professionals
82,2011-05-26,What makes a good public servant?,society-professionals
83,2011-02-24,A dramatic public sector management cull,society-professionals
84,2011-02-21,A united front on procurement in the north-west,society-professionals
85,2011-02-18,Leadership from within,society-professionals
86,2011-02-16,'Democracy proofing' local authorities,society-professionals
87,2011-02-15,Toolkit for self-regulation,society-professionals
88,2011-02-10,'Significant variation' in NHS sickness absences,society-professionals
89,2011-02-10,What we might expect from this year's summit,society-professionals
90,2011-01-26,Braving the new world,society-professionals
91,2011-01-25,Heroes and egos,society-professionals
92,2011-01-25,A view from the north,society-professionals
93,2011-01-24,Transformers in disguise,society-professionals
94,2011-01-20,Order over chaos,society-professionals
95,2011-01-19,Watchdog alarm over NHS trust failure,society-professionals
96,2011-01-13,Back to the drawing board,society-professionals
97,2011-01-12,Map and data: few patterns in GP commissioning pathfinders,society-professionals
98,2011-01-12,The curious case of Ms M,society-professionals
99,2011-01-11,Would I lie to you?,society-professionals
100,2011-01-11,A guide to change,society-professionals
101,2011-01-10,Closing in on the circle,society-professionals
102,2011-01-04,It's a question of the right answer,society-professionals
103,2011-01-04,Getting less for more,society-professionals
104,2013-06-04,Australian summit will tackle 'vexed' global public service reform problems,society-professionals
105,2014-12-18,Working in public services this Christmas? Share your pictures,society-professionals
106,2014-12-10,Domestic abuse: 'You're most at risk of being killed when you try to leave',society-professionals
107,2014-12-01,Olivia Colman: Tyrannosaur made me face the true brutality of domestic violence,society-professionals
108,2014-11-28,Domestic violence legislation in England and Wales: timeline,society-professionals
109,2014-10-24,Does working in public services run in the genes?,society-professionals
110,2014-10-20,Why working in public services is still a desirable career choice,society-professionals
111,2014-08-21,The community is key in tackling loneliness,society-professionals
112,2014-08-08,The three housing problems that most affect your health,society-professionals
113,2014-08-04,Tackling squalor in Britain’s homes: five to follow on Twitter,society-professionals
114,2014-07-30,Five ways to tackle inequality at a grassroots level,society-professionals
115,2014-07-29,Fighting for equality: the five to follow on Twitter,society-professionals
116,2014-07-24,Taking on chronic illness: five top people to follow on Twitter,society-professionals
117,2014-07-18,Gentrification: what happens to those left behind?,society-professionals
118,2014-07-17,A neat way to help neets: how Oldham council is combating unemployment,society-professionals
119,2014-07-16,Avoid loneliness in retirement with proper workplace support,society-professionals
120,2014-07-15,Isolation and underemployment: five to follow on Twitter,society-professionals
121,2014-07-14,How can public services professionals tackle loneliness? – live discussion,society-professionals
122,2014-07-10,Public sector strike: why are workers protesting? Open thread,society-professionals
123,2014-07-09,Tackling digital exclusion: five to follow on Twitter,society-professionals
124,2014-07-07,Introducing Society Professionals: a bigger picture for public services,society-professionals
125,2014-07-07,The Beveridge report revisited: where now for the welfare state?,society-professionals
126,2014-03-11,How councils can help domestic violence victims,society-professionals
127,2015-12-04,'Positive not pleading': making the case for public services,society-professionals
128,2015-11-27,Making the case for public services – livechat,society-professionals
129,2015-11-20,Measuring impact: a guide to resources and tools,society-professionals
130,2015-11-09,What do you value about public services?,society-professionals
131,2015-11-04,Proving your impact: what funders want from charities,society-professionals
132,2015-11-02,How do you measure friendship? Why public services need to show their worth,society-professionals
133,2015-07-02,"Healthy eating tips for busy, tired public service workers",society-professionals
134,2015-06-28,Psychosis isn't catching but burnout is a risk for many caring professionals,society-professionals
135,2015-06-26,How to become a director of finance,society-professionals
136,2015-06-25,'I ran myself into the ground': life at the bottom end of the public sector pay scale,society-professionals
137,2015-06-22,11 low-cost ways to combat stress,society-professionals
138,2015-06-10,"Social housing staff endure long hours and high stress levels, survey finds",society-professionals
139,2015-06-10,"Government staff suffer longer hours, fewer breaks and increased stress",society-professionals
140,2015-06-10,"Heavy workloads, too few staff: social care workers say stress is inevitable",society-professionals
141,2015-06-10,"Almost all charity staff work beyond their contracted hours, survey finds",society-professionals
142,2015-06-10,#ClockOff: examining the work-life balance of Society Professionals,society-professionals
143,2015-06-09,Stress in public services: how do you unwind? Share your photos and stories,society-professionals
144,2015-05-06,Staff wellbeing in the voluntary and public sectors - take our survey,society-professionals
145,2015-02-07,How to become a … head librarian,society-professionals
146,2015-02-03,How to become a … British ambassador,society-professionals
147,2016-11-30,Guardian Public Service Awards 2016 overall winner: Sevenoaks district council,society-professionals
148,2016-11-30,Guardian Public Service Awards 2016 transformation winner: Poplar Harca,society-professionals
149,2016-11-30,Guardian Public Service Awards 2016 recruitment winner: Transport for London,society-professionals
150,2016-11-30,Guardian Public Service Awards 2016 sustainability winner: Warm Homes Oldham,society-professionals
151,2016-11-30,Guardian Public Service Awards 2016 learning and development winner: Independent Lives,society-professionals
152,2016-11-30,Guardian Public Service Awards 2016: winners and runners-up,society-professionals
153,2016-11-30,Guardian Public Service Awards 2016 Public Servant of the Year winner: Helen Backus,society-professionals
154,2016-11-30,Guardian Public Service Awards 2016 housing winner: Money House,society-professionals
155,2016-11-30,Guardian Public Service Awards 2016 digital winner: Baby Buddy,society-professionals
156,2016-11-30,Guardian Public Service Awards 2016 care winner: Pause Southwark,society-professionals
157,2016-11-30,Guardian Public Service Awards 2016 health and wellbeing winner: Derventio Housing Trust,society-professionals
158,2016-11-30,Guardian Public Service Awards 2016: runners-up,society-professionals
159,2016-09-14,Guardian Public Service Awards 2016: the category shortlist,society-professionals
160,2016-09-14,Guardian Public Service Awards 2016 Public Servant Year shortlist: vote now,society-professionals
161,2016-06-07,Public Service Awards 2016 - entries now closed,society-professionals
162,2016-06-01,Guardian Public Service Awards 2016: launch event,society-professionals
163,2016-05-18,Why we need the Guardian Public Service Awards,society-professionals
164,2016-05-18,Guardian Public Service Awards 2016: sponsors,society-professionals
165,2016-05-18,Guardian Public Service Awards 2016: meet the judges,society-professionals
166,2016-05-18,Guardian Public Service Awards 2016: terms & conditions,society-professionals
167,2016-05-18,Guardian Public Service Awards 2016: categories and criteria,society-professionals
168,2016-05-18,Guardian Public Service Awards 2016: key dates & FAQ,society-professionals
169,2016-05-18,How to enter the Guardian Public Service Awards 2016,society-professionals
170,2017-04-24,Public service workers: tell us what you want from the next government,society-professionals
