,Date,Content,Section
2004,2015-08-12,"Remember, your A-levels don't define you: how to beat results day nerves",teacher-network
2005,2015-08-11,University clearing: a teachers' guide for results day,teacher-network
2006,2015-08-10,A guide for parents and tutors: how to get children reading this summer,teacher-network
2007,2015-08-09,A-level results day: what teachers can do to help anxious or upset students,teacher-network
2008,2015-08-08,Secret Teacher: I know my students won't get the results they deserve,teacher-network
2009,2015-08-07,Teachers' messages to students on results day,teacher-network
2010,2015-08-06,How to brush up on your subject knowledge (and beyond) this summer,teacher-network
2011,2015-08-05,Alternative classrooms: why teachers are taking students to the pub,teacher-network
2012,2015-08-04,"When academies are failing, don’t pass the parcel – bring back local authorities",teacher-network
2013,2015-08-03,The art of relaxation: ideas to get students to unwind and recharge,teacher-network
2014,2015-08-02,Science of stress: how neuroscience can help teachers switch off this summer,teacher-network
2015,2015-08-01,Secret Teacher: private school students are great – it's their parents I worry about,teacher-network
2016,2015-07-29,Smells like teen spirit: schools where students give back to their communities,teacher-network
2017,2015-07-28,Wearable technology in the classroom: what's available and what does it do?,teacher-network
2018,2015-07-27,Four creative ways to keep children learning over the summer holidays,teacher-network
2019,2015-07-26,"Homework might be routine, but tech can make it meaningful",teacher-network
2020,2015-07-25,Secret Teacher: the working culture in teaching is impossible for mums,teacher-network
2021,2015-07-24,Secondary school student numbers set to rise – weekly news review,teacher-network
2022,2015-07-23,Beyond the Women's World Cup: 8 ways to get female students into football,teacher-network
2023,2015-07-22,"Teachers' end-of-term gifts: the good, the bad and the ugly",teacher-network
2024,2015-07-21,"A teacher's view on school reports: they're bland, robotic and misleading",teacher-network
2025,2015-07-20,How to teach ... To Kill a Mockingbird,teacher-network
2026,2015-07-19,Out with the old: teachers reveal the topics they'd rather not teach,teacher-network
2027,2015-07-18,Secret Teacher: Elizabeth is 12 and homework is stealing her childhood,teacher-network
2028,2015-07-17,Share your experiences of writing end-of-year reports,teacher-network
2029,2015-07-17,Caroline Lucas MP calls for compulsory PSHE lessons – weekly news review,teacher-network
2030,2015-07-16,What do you enjoy most about the end of term in school?,teacher-network
2031,2015-07-15,How do top private schools spend their money?,teacher-network
2032,2015-07-14,Should schools be doing more to track vulnerable students?,teacher-network
2033,2015-07-14,A parent's view of homework: I waver between tolerance and outright hatred,teacher-network
2034,2015-07-13,How to teach ... making friends,teacher-network
2035,2015-07-12,Can neuroscience solve the mystery of how students learn?,teacher-network
2036,2015-07-11,Secret Teacher: I am too overworked to give trainees the support they need,teacher-network
2037,2015-07-10,Teachers' pay rises restricted to 1% for four years – weekly news review,teacher-network
2038,2015-07-09,How schools support children with life-limiting illnesses,teacher-network
2039,2015-07-09,"Schools of the future: don't forget, the most powerful computer is the brain",teacher-network
2040,2015-07-07,Teach black students they can change communities - they don't have to escape,teacher-network
2041,2015-07-06,How to teach ... creative writing,teacher-network
2042,2015-07-05,How to thank teachers in tough schools? Government answer: punish them,teacher-network
2043,2015-07-04,Secret Teacher: I wish I could stop taking out my work stress on my class,teacher-network
2044,2015-07-03,Schools leave poor white families 'abandoned' – weekly news review,teacher-network
2045,2015-07-02,Teachers share their top 10 summer reads,teacher-network
2046,2015-07-01,Five useful ways teachers can help pupils transition to secondary school,teacher-network
2047,2015-06-29,How to teach ... population,teacher-network
2048,2015-06-29,Green-fingered teachers: how to grow fruit and vegetables in school,teacher-network
2049,2015-06-28,Top tips for teachers on engaging parents in learning,teacher-network
2050,2015-06-27,"Secret Teacher: we help students to cheat, but how long before it's exposed?",teacher-network
2051,2015-06-26,Could Interstellar add a new dimension to physics class? – weekly news review,teacher-network
2052,2015-06-24,Michael Morpurgo answers your students' questions – live chat,teacher-network
2053,2015-06-24,Schools must consider double shifting to accommodate growing pupil numbers,teacher-network
2054,2015-06-23,Three recipes to help you spruce up summer packed lunches,teacher-network
2055,2015-06-22,How to teach ... the suffragettes,teacher-network
2056,2015-06-21,How taking to the streets of Brixton turned my school around,teacher-network
2057,2015-06-20,Secret Teacher: we are too quick to label children who aren't perfect,teacher-network
2058,2015-06-19,Headteachers will reject plans to teach Ebacc to all – weekly news review,teacher-network
2059,2015-06-16,Diversity among private school students is rising but heads aren't following suit,teacher-network
2060,2015-06-15,How to teach … habitats,teacher-network
2061,2015-06-14,"When I started my career I was told 'you're a teacher, not a social worker'",teacher-network
2062,2015-06-13,Secret Teacher: marking exam papers exposes the flaws in teaching,teacher-network
2063,2015-06-12,Schools minister calls for focus on academic GCSEs – weekly news review,teacher-network
2064,2015-06-11,How can we encourage boys to read for pleasure? Teachers give their views,teacher-network
2065,2015-06-10,Five ways teachers can fit exercise around work,teacher-network
2066,2015-06-09,Schools opt to replace 'test too far' for reception children,teacher-network
2067,2015-06-09,Would you leave the UK to teach abroad? Answer our poll,teacher-network
2068,2015-06-09,Tips for aspiring school leaders: how to apply for your first headship,teacher-network
2069,2015-06-09,The academies agenda is just a case of the Emperor's New Clothes,teacher-network
2070,2015-06-08,How to teach ... sports day,teacher-network
2071,2015-06-07,The New York iSchool: reinventing the high school experience,teacher-network
2072,2015-06-06,Secret Teacher: I'm fleeing abroad to get my life back,teacher-network
2073,2015-06-05,More failing schools to become academies – weekly news review,teacher-network
2074,2015-06-04,Job hunting tips for teachers: how to ace the presentation,teacher-network
2075,2015-06-03,A quick guide to the 2015 headteacher standards,teacher-network
2076,2015-06-02,From Blake to Jessie: a 7-year-old's transgender story,teacher-network
2077,2015-06-02,Sport relief: beating exam stress with bowls and boxing,teacher-network
2078,2015-06-01,Intergalactic lessons: five creative ways to teach about space,teacher-network
2079,2015-05-31,"If you want teachers to innovate, don't train them using a sage on a stage",teacher-network
2080,2015-05-30,Secret Teacher: I'm astonished by what some parents complain about,teacher-network
2081,2015-05-29,Queen's speech includes plans to tackle 'coasting' schools – weekly news review,teacher-network
2082,2015-05-27,Stress-busting snacks: easy recipes for exam season,teacher-network
2083,2015-05-26,"Teachers, send us pictures of your best holiday bakes",teacher-network
2084,2015-05-25,How to teach ... about refugees,teacher-network
2085,2015-05-24,How to make PE more inclusive: top tips for teachers,teacher-network
2086,2015-05-24,It's an open secret that women work harder to reach the top in prep schools,teacher-network
2087,2015-05-23,"Secret teacher: I am all for inclusion in principle, but it doesn't always work",teacher-network
2088,2015-05-22,Exam boards to re-write GCSE maths papers – weekly news review,teacher-network
2089,2015-05-21,GCSE maths papers to be changed amid concerns over difficulty,teacher-network
2090,2015-05-20,Let the kids use their phones in class,teacher-network
2091,2015-05-20,Three creative ways teachers can explore oceans in the classroom,teacher-network
2092,2015-05-19,How to spot if a school is right for you when job hunting,teacher-network
2093,2015-05-18,How to teach … fossils,teacher-network
2094,2015-05-17,Punk rock is part of what makes me a good teacher,teacher-network
2095,2015-05-16,Secret Teacher: Sats stress is crushing children's love of learning,teacher-network
2096,2015-05-15,Rise in number of students reporting exam stress – weekly news review,teacher-network
2097,2015-05-14,Exam stress: how has it affected you?,teacher-network
2098,2015-05-13,What does the new Tory government mean for teachers?,teacher-network
2099,2015-05-13,Lost for words? How reading can teach children empathy,teacher-network
2100,2015-05-11,How to ace lesson observations: 10 tips for PGCE students,teacher-network
2101,2015-05-11,How to teach … sound,teacher-network
2102,2015-05-10,How I've made my school a safe space for students to share problems,teacher-network
2103,2015-05-10,Teachers share the best exam advice they received as a student,teacher-network
2104,2015-05-09,Secret Teacher: I'm not giving up on education despite the election result,teacher-network
2105,2015-05-08,Schools struggle to recruit senior leaders – weekly news review,teacher-network
2106,2015-05-07,Brain science: the answer to helping primary pupils cope with exam stress,teacher-network
2107,2015-05-06,Why my students told David Cameron they don't deserve to vote,teacher-network
2108,2015-05-06,Fit for purpose: the top five apps for PE teachers,teacher-network
2109,2015-05-06,Computer games vs PE: teachers use tech to get students moving,teacher-network
2110,2015-05-05,How to teach … summer fairs,teacher-network
2111,2015-05-03,"Mini Oscars, snack-time shows and Skittles – inspiring children through film",teacher-network
2112,2015-05-02,Secret Teacher: I stay calm in the face of trauma so I can do my job,teacher-network
2113,2015-05-01,Google should be allowed in exams – weekly news review,teacher-network
2114,2015-04-30,Join us for the launch of the schools of the future exhibition – event,teacher-network
2115,2015-04-30,School attacks around the world in data,teacher-network
2116,2015-04-29,"If schools are teaching about porn, should they show it too?",teacher-network
2117,2015-04-28,Five of the best apps that help teachers communicate with parents,teacher-network
2118,2015-04-27,How to teach ... Magna Carta,teacher-network
2119,2015-04-26,"Diversity in school leadership: the higher up you go, the harder you have to fight",teacher-network
2120,2015-04-25,Secret Teacher: make me education secretary and I'll sort out this mess,teacher-network
2121,2015-04-24,"Parental engagement: tips, tricks and how to make it work – live chat",teacher-network
2122,2015-04-24,Labour could scrap GCSEs within a decade – weekly news review,teacher-network
2123,2015-04-23,Teens and tech: what happens when students give up smartphones?,teacher-network
2124,2015-04-21,"The forest school revolution: leaves, logs and life skills",teacher-network
2125,2015-04-20,How to teach … running,teacher-network
2126,2015-04-19,'History is too often a sanitised version of patriotic victories in textbooks',teacher-network
2127,2015-04-18,Secret Teacher: why do some parents expect us to toilet train their children?,teacher-network
2128,2015-04-17,How can we make school sport and PE more inclusive? – live chat,teacher-network
2129,2015-04-17,Primary school places squeezed due to baby boom – weekly news review,teacher-network
2130,2015-04-15,Wellbeing in boarding schools: six ways to boost student welfare,teacher-network
2131,2015-04-14,Inside a Syrian refugee camp: 'Education is the only hope for children',teacher-network
2132,2015-04-14,What's next on the menu for school dinners?,teacher-network
2133,2015-04-13,How to teach … revision,teacher-network
2134,2015-04-12,"It’s not easy to turn a school around, but the principles are simple",teacher-network
2135,2015-04-11,Secret Teacher: I am the new generation and I’m here to stay,teacher-network
2136,2015-04-10,Low pay forces young teachers to share bedrooms – weekly news review,teacher-network
2137,2015-04-09,"All jokes aside, comedy really can help in the classroom",teacher-network
2138,2015-04-07,Three ways to use Minecraft imaginatively in the classroom,teacher-network
2139,2015-04-06,How to teach ... yoga,teacher-network
2140,2015-04-05,"Very few teachers in Germany quit. If they do, it could be due to workload",teacher-network
2141,2015-04-04,"Secret Teacher: we have one of the best jobs in the world, so stop moaning",teacher-network
2142,2015-04-03,Rising number of teachers receive online abuse – weekly news review,teacher-network
2143,2015-04-02,The science of spring: how a change of seasons can boost classroom learning,teacher-network
2144,2015-04-01,How teaching assistants can make a real difference in the classroom,teacher-network
2145,2015-03-31,How to set up a mock general election in your school,teacher-network
2146,2015-03-30,How to teach... Anne Frank,teacher-network
2147,2015-03-29,The idea you can put a number against a child's ability is flawed and dangerous,teacher-network
2148,2015-03-28,Secret Teacher: when does a relaxing glass of wine become a problem?,teacher-network
2149,2015-03-27,Schools face significant funding cuts – weekly news review,teacher-network
2150,2015-03-26,What role should teachers play in career guidance?,teacher-network
2151,2015-03-25,How to balance work with family life: a teacher's survival guide,teacher-network
2152,2015-03-24,Easter craft ideas: a last-minute guide for teachers,teacher-network
2153,2015-03-23,How to teach ... Italian,teacher-network
2154,2015-03-23,"Easter lessons: share your ideas, photos and classroom displays",teacher-network
2155,2015-03-22,Mexican teachers are not respected – but we can create a better future,teacher-network
2156,2015-03-21,Secret Teacher: cut stressed-out NQTs some slack – you were once in their shoes,teacher-network
2157,2015-03-20,Debate rages over role of porn in schools – weekly news review,teacher-network
2158,2015-03-19,Eight top tips for making extracurricular work in school,teacher-network
2159,2015-03-18,My best PE lesson: I turned students into their teachers' personal trainers,teacher-network
2160,2015-03-17,Shakespeare Week: teachers share their favourite quotes,teacher-network
2161,2015-03-17,How to design a primary school where learning has no limits,teacher-network
2162,2015-03-16,How to teach ... political campaigning,teacher-network
2163,2015-03-16,Gordon Brown: No terrorist should stop a child's right to education,teacher-network
2164,2015-03-15,Self-esteem is key to improving diversity among UK headteachers,teacher-network
2165,2015-03-14,Secret Teacher: demotion is the only way to save my work-life balance,teacher-network
2166,2015-03-13,Sexual consent lessons for 11-year-olds – weekly news review,teacher-network
2167,2015-03-12,"Teachers are overworked but still dedicated, new survey suggests",teacher-network
2168,2015-03-11,Where are all the young school governors?,teacher-network
2169,2015-03-09,The look of love: a profile of teenage relationships for teachers,teacher-network
2170,2015-03-09,How to teach… the brain,teacher-network
2171,2015-03-08,UK education mimics the worst aspects of a McDonald's production line,teacher-network
2172,2015-03-07,Secret Teacher: don't let spineless school managers drag you down,teacher-network
2173,2015-03-06,Boys outperform girls in maths – weekly news review,teacher-network
2174,2015-03-06,"Extracurricular activities: tips, tricks and how to make it work – live chat",teacher-network
2175,2015-03-05,World Book Day 2015: teachers share their favourite books,teacher-network
2176,2015-03-04,"Three years after Trayvon Martin, my students fight injustice with protest art",teacher-network
2177,2015-03-03,10 interview questions for teachers applying to private schools,teacher-network
2178,2015-03-02,New counter-terrorism duties: what schools need to know,teacher-network
2179,2015-03-02,How to teach ... Red Nose Day 2015,teacher-network
2180,2015-03-01,'Anyone can play havoc with a weak teacher – behaviour is never a given',teacher-network
2181,2015-02-28,Secret Teacher: am I paranoid or is my colleague after my job?,teacher-network
2182,2015-02-27,Exam culture hinders pupils' character development – weekly news review,teacher-network
2183,2015-02-25,Top tips: how can PE and school sport help students stay healthy?,teacher-network
2184,2015-02-24,Could computers ever replace teachers?,teacher-network
2185,2015-02-24,How to teach … tax,teacher-network
2186,2015-02-23,The science of homework: tips to engage students' brains,teacher-network
2187,2015-02-22,Teaching after the Taliban – I've risked my life for education,teacher-network
2188,2015-02-21,Secret Teacher: the end-of-holiday blues,teacher-network
2189,2015-02-20,Scientists explore teachers' brains – weekly news review for teachers,teacher-network
2190,2015-02-19,Career tips for teachers: moving between private and state schools,teacher-network
2191,2015-02-18,Are permanent exclusions for disruptive students the best we can do?,teacher-network
2192,2015-02-17,Dickens with a twist: how to teach Hard Times,teacher-network
2193,2015-02-16,How to teach … German,teacher-network
2194,2015-02-16,Teachers' pets: share pictures of your furry friends this half term,teacher-network
2195,2015-02-15,Building one community in a school where 38 languages are spoken,teacher-network
2196,2015-02-14,Secret Teacher: I didn’t enter teaching to improve students’ lives,teacher-network
2197,2015-02-13,"Tristram Hunt offends nuns, Labour to protect schools funding and a pork ban",teacher-network
2198,2015-02-13,Fancy learning a thing or two about love? 19 reasons to date a teacher,teacher-network
2199,2015-02-12,What does data tell us about how to tackle heavy teacher workloads?,teacher-network
2200,2015-02-11,Inside the schools that dare to break with traditional teaching,teacher-network
2201,2015-02-10,"‘You’re gay, this is gay’: how can we tackle homophobia in PE?",teacher-network
2202,2015-02-10,Why are we blindly following the Chinese approach to teaching maths?,teacher-network
2203,2015-02-09,How to teach … relationships and consent,teacher-network
2204,2015-02-08,"The future of teaching is about the relevance of issues, not just facts",teacher-network
2205,2015-02-07,Secret Teacher: exams have left my students incapable of thinking,teacher-network
2206,2015-02-06,DfE waters down plans to tackle teacher workload,teacher-network
2207,2015-02-06,How can PE and sport improve student health and wellbeing? – live chat,teacher-network
2208,2015-02-06,"Labour tackles homophobia, Ofqual's defiance and a College of Teaching plan",teacher-network
2209,2015-02-05,Does boarding school really help disadvantaged students?,teacher-network
2210,2015-02-05,10 tips for passing practical assessments when applying for a senior teaching job,teacher-network
2211,2015-02-04,A radical experiment to end science practicals? That’s just not true,teacher-network
2212,2015-02-03,What private schools think about teaching British values,teacher-network
2213,2015-02-02,How to teach … ancient Egypt,teacher-network
2214,2015-02-02,"If we can code a human genome, we can find a way to assess science practicals",teacher-network
2215,2015-02-01,I converted my private school into an academy to rediscover its original ethos,teacher-network
2216,2015-01-31,"Secret Teacher: I want to be like Yoda, but I feel more like a stormtrooper",teacher-network
2217,2015-01-30,"League table woes, no proof academies raise standards and Ofsted on religion",teacher-network
2218,2015-01-29,Does competitive sport in school do more harm than good?,teacher-network
2219,2015-01-28,"How I teach students about equality: only Smarties have the answer
",teacher-network
2220,2015-01-27,How to spot if you or colleagues are stressed: tell-tale signs for teachers,teacher-network
2221,2015-01-27,"Workload forcing new teachers out of the profession, survey suggests",teacher-network
2222,2015-01-27,Five top reasons people become teachers – and why they quit,teacher-network
2223,2015-01-26,"How to teach … volcanoes
",teacher-network
2224,2015-01-25,"Even with classes of 70 to 100, behaviour is better in Uganda than the UK",teacher-network
2225,2015-01-24,"Secret Teacher: Dear Ofsted, please can you send me a copy of the real rules?",teacher-network
2226,2015-01-23,"Digital textbooks, tech giants back primary schools and DfE's poor finances",teacher-network
2227,2015-01-21,What challenges do teachers face  in schools where ethos is everything?,teacher-network
2228,2015-01-20,How to survive interview lessons – teachers' tips and experiences,teacher-network
2229,2015-01-20,What questions are teachers asked at interview? – readers' tips,teacher-network
2230,2015-01-19,School Direct v PGCE: the pros and cons for potential new teachers,teacher-network
2231,2015-01-19,"How to teach ... the EU
",teacher-network
2232,2015-01-18,Learning shouldn’t be a competitive sport that only a few can succeed at,teacher-network
2233,2015-01-17,Secret Teacher: it’s time to go old school on targets,teacher-network
2234,2015-01-16,"School places crisis deepens, unreliable Ofsted and using Lego to teach maths",teacher-network
2235,2015-01-14,The future of PE: 'I worry it is getting less physical',teacher-network
2236,2015-01-13,Five ways teachers use Lego creatively in class,teacher-network
2237,2015-01-12,How to teach ... drawing and illustration,teacher-network
2238,2015-01-11,"Michael Wilshaw is a great guy, but Ofsted is devastating education",teacher-network
2239,2015-01-10,Secret Teacher: I feel like more of a social worker than a teacher,teacher-network
2240,2015-01-09,How to move between private and state education –  live chat,teacher-network
2241,2015-01-09,"New York lifts cellphone ban, exclusion angst and character education award",teacher-network
2242,2015-01-08,School libraries shelve tradition to create new learning spaces,teacher-network
2243,2015-01-07,Is a lower threshold for exclusion a good idea? Headteacher views,teacher-network
2244,2015-01-07,By targeting schools the Taliban acknowledge the power of education,teacher-network
2245,2015-01-05,How to teach ... about birds,teacher-network
2246,2017-01-04,"Sport, skills and storytelling: how charity begins at school",teacher-network
2247,2016-12-30,Education quiz: how much do you remember about 2016?,teacher-network
2248,2016-12-24,Our top 10 Secret Teachers of 2016,teacher-network
2249,2016-12-21,Teachers and tech: 'they're worlds apart - we can bring them together',teacher-network
2250,2016-12-18,Lock up your laptops: how teachers can unwind over Christmas,teacher-network
2251,2016-12-17,Secret Teacher: Bah humbug! My bosses are worse than Scrooge,teacher-network
2252,2016-12-12,How schools are helping refugee children to succeed,teacher-network
2253,2016-12-11,Christmas craft: how to make a paper robin bauble,teacher-network
2254,2016-12-10,"Secret Teacher: I feel too old for this job, but I'm trapped",teacher-network
2255,2016-12-09,How to be happy: a guide for teachers (and everyone else),teacher-network
2256,2016-12-03,Secret Teacher: I'm tired of my colleagues' ignorance about race,teacher-network
2257,2016-12-01,What can state schools learn from Eton?,teacher-network
2258,2016-11-30,Should universities take control of schools? The government thinks so,teacher-network
2259,2016-11-29,It's official: your school's marking policy is probably wrong,teacher-network
2260,2016-11-26,Secret Teacher: I moved to Africa – and realised how flawed British education is,teacher-network
2261,2016-11-23,"'It's not all anal sex': the German schools exploring love, equality and LGBT issues",teacher-network
2262,2016-11-22,Five ways to help migrant children settle in your class,teacher-network
2263,2016-11-21,Alternative careers for teachers: what to do if you need a change,teacher-network
2264,2016-11-19,Secret Teacher: An invasive alien species is taking over education,teacher-network
2265,2016-11-16,Want your students to love learning? Get them to the library,teacher-network
2266,2016-11-14,My pupils are young UK Muslims – and they're scared about Trump,teacher-network
2267,2016-11-12,Secret Teaching Assistant: We end up hindering the pupils we're meant to help,teacher-network
2268,2016-11-10,Seven ways to give better feedback to your students,teacher-network
2269,2016-11-08,'We're preparing for the worst': urban heads await funding changes,teacher-network
2270,2016-11-05,Secret Teacher: Online dating is like taking an exam,teacher-network
2271,2016-11-03,Are England's teachers being paid enough?,teacher-network
2272,2016-11-02,Looking for a teaching job? Here's how to avoid a dysfunctional school,teacher-network
2273,2016-11-01,Another education U-turn? This is dangerous driving from Theresa May,teacher-network
2274,2016-10-31,Is competition between schools restricting collaboration?,teacher-network
2275,2016-10-29,Secret Teacher: I'm my school's go-to gay guy,teacher-network
2276,2016-10-27,Why are so many SEN pupils excluded from school? Because we are failing them,teacher-network
