,Date,Content,Section
611,2012-03-12,Managing teacher stress,teacher-network
612,2012-03-11,Teacher Network newsletter: the Syrian crisis explained plus No Smoking Day,teacher-network
613,2012-03-10,What would you do if...,teacher-network
614,2012-03-09,How robotics inspires my pupils - and my teaching,teacher-network
615,2012-03-08,Teachers must forge their own charter for education,teacher-network
616,2012-03-07,Bad attitudes to maths makes children switch off,teacher-network
617,2012-03-06,How to get the most out of homework,teacher-network
618,2012-03-05,Are your pupils getting enough sleep?,teacher-network
619,2012-03-04,Teacher Network newsletter: cute kittens to count,teacher-network
620,2012-03-03,Calling future leaders!,teacher-network
621,2012-03-02,Hack to the future now!,teacher-network
622,2012-02-29,"Hey teacher, leave those books alone!",teacher-network
623,2012-02-28,Teaching in Chembakolli,teacher-network
624,2012-02-27,How to teach … Fair Trade Fortnight,teacher-network
625,2012-02-27,Stop ignoring good behaviour!,teacher-network
626,2012-02-27,Teacher Network newsletter: The Oscars and leadership interviews,teacher-network
627,2012-02-25,Would you miss your school staff room?,teacher-network
628,2012-02-24,Could teaching ever be a team sport?,teacher-network
629,2012-02-22,Less than £1 per pupil spent on RE resources,teacher-network
630,2012-02-21,How do senior leaders get their jobs?,teacher-network
631,2012-02-20,How to teach … Sport Relief,teacher-network
632,2012-02-20,ICT spending: proceed with caution,teacher-network
633,2012-02-19,Teacher Network newsletter: the impact of global learning and Sport Relief,teacher-network
634,2012-02-18,Just how much will digital text books shake up education?,teacher-network
635,2012-02-17,"Children need to see adults ""caught reading""",teacher-network
636,2012-02-16,Learning through role play,teacher-network
637,2012-02-15,Islington's education turnaround,teacher-network
638,2012-02-14,How to make your visual arts department digital,teacher-network
639,2012-02-14,Win a subscription to the Guardian and Observer,teacher-network
640,2012-02-13,How to teach … responsible dog ownership,teacher-network
641,2012-02-13,"Children are at school to learn, not to behave",teacher-network
642,2012-02-12,Teacher Network newsletter: our first anniversary,teacher-network
643,2012-02-11,PE teachers made me bunk off PE!,teacher-network
644,2012-02-09,What's the point of education?,teacher-network
645,2012-02-08,Teaching schools revolution,teacher-network
646,2012-02-07,Teaching Dickens is all a question of timing,teacher-network
647,2012-02-06,How to teach … Charles Dickens,teacher-network
648,2012-02-06,Safer Internet Day,teacher-network
649,2012-02-05,Teacher Network newsletter: Charles Dickens and the Boy in Striped Pyjamas,teacher-network
650,2012-02-04,Good teachers learn from their mistakes,teacher-network
651,2012-02-03,"From Warhorse to the Wizard of Oz, it's time to give film credit in the classroom",teacher-network
652,2012-02-02,What really improves children's learning?,teacher-network
653,2012-02-01,How to help children discover they LOVE reading,teacher-network
654,2012-01-31,Building the future of computing in schools,teacher-network
655,2012-01-30,The Leveson inquiry on the Guardian Teacher Network,teacher-network
656,2012-01-30,"""Coming out"" at school",teacher-network
657,2012-01-29,Teacher Network newsletter: schools jobs special,teacher-network
658,2012-01-27,"Introducing the amazing ""Grizzlegrog""",teacher-network
659,2012-01-27,Win an iPad 2!,teacher-network
660,2012-01-26,How to get that senior leadership job in teaching,teacher-network
661,2012-01-25,Why I did VSO in Africa,teacher-network
662,2012-01-24,Top ten computer science teaching resources,teacher-network
663,2012-01-23,How to teach … Holocaust Memorial Day,teacher-network
664,2012-01-23,Punishment is not the answer,teacher-network
665,2012-01-22,Teacher Network newsletter: Holocaust Memorial Day and blogs worth talking about,teacher-network
666,2012-01-20,Should school summer holidays be cut short?,teacher-network
667,2012-01-19,Girls can love computing; someone just needs to show them how,teacher-network
668,2012-01-18,Transforming holocaust education,teacher-network
669,2012-01-17,Michael Gove is right: poor teachers should be sacked,teacher-network
670,2012-01-16,Oxfam's Food for Thought on the Guardian Teacher Network,teacher-network
671,2012-01-16,Pupils need free home access to ICT tools,teacher-network
672,2012-01-15,Teacher Network newsletter: building a wiki curriculum and a fair trade challenge,teacher-network
673,2012-01-13,Is Gove washing his hands of ICT?,teacher-network
674,2012-01-12,The power of endings,teacher-network
675,2012-01-11,Computer science reboot,teacher-network
676,2012-01-10,How to teach code,teacher-network
677,2012-01-09,Human rights begin at home,teacher-network
678,2012-01-08,"Teacher Network newsletter: digital literacy, tests and magical maths",teacher-network
679,2012-01-06,Your right to tweet,teacher-network
680,2012-01-05,New term resolutions,teacher-network
681,2012-01-04,What's your philosophy of education?,teacher-network
682,2012-01-03,How to inject creativity into your maths lessons,teacher-network
683,2014-01-03,"The reading list: misspent pupil premium, the critical thinking debate and reasons to be cheerful",teacher-network
684,2013-12-31,Secret Teacher in 2013: our top 10 posts,teacher-network
685,2013-12-31,How to teach: the best bits of 2013,teacher-network
686,2013-12-30,Teacher blogs: who should I be reading?,teacher-network
687,2013-12-28,Secret Teacher: stress is reaching a crisis point in schools,teacher-network
688,2013-12-22,The Three Wise Men of Education – cartoon,teacher-network
689,2013-12-22,Why I'm taking learning through play back to my home in Uganda,teacher-network
690,2013-12-21,Secret Teacher: is it time the school league tables got a festive makeover?,teacher-network
691,2013-12-20,"Research round up: Racism against teachers and impact of £9,000 university fees",teacher-network
692,2013-12-19,"Telly on, email off: take a real break from school this Christmas",teacher-network
693,2013-12-18,Bah Humbug: Mikey Gove's Christmas Carol – cartoon,teacher-network
694,2013-12-18,Why the staff Christmas drinks are no place for a headteacher,teacher-network
695,2013-12-17,"Christmas classroom crafts: reduce, rejoice, recycle",teacher-network
696,2013-12-16,How to teach… reading for pleasure,teacher-network
697,2013-12-15,Jumping through hoops: Mikey Gove's education circus – cartoon,teacher-network
698,2013-12-15,Talking heads: 'Black people shouldn't think being a headteacher is out of reach',teacher-network
699,2013-12-15,Antarctica – news and teaching resources round up,teacher-network
700,2013-12-14,Secret Teacher: an early Christmas present from Ofsted,teacher-network
701,2013-12-13,The future of school governance – live chat,teacher-network
702,2013-12-13,How genetics impact exam results and why boys need an ego boost,teacher-network
703,2013-12-12,Selective schooling: a friend or foe for education?,teacher-network
704,2013-12-11,10 things teachers need to know about Ofsted's annual report,teacher-network
705,2013-12-11,Tower Hamlets is proof that poverty is no excuse for a substandard education,teacher-network
706,2013-12-11,How Tower Hamlets transformed its failing schools,teacher-network
707,2013-12-10,If UK children start school too early it could damage their learning for life,teacher-network
708,2013-12-10,Women's rights in Afghanistan: a headteacher's story – video,teacher-network
709,2013-12-10,Get with the program: engaging students in computing,teacher-network
710,2013-12-09,How to teach… punctuation,teacher-network
711,2013-12-09,Seven steps to Ofsted success for Sencos,teacher-network
712,2013-12-08,Sexual orientation – news and teaching resources round up,teacher-network
713,2013-12-08,Nelson Mandela – news and teaching resources round up,teacher-network
714,2013-12-08,From High Tech High to project-based learning in the UK: my teaching story,teacher-network
715,2013-12-07,Secret Teacher: do they know it's Christmas?,teacher-network
716,2013-12-06,"Sexism in schools, breaking admissions rules and supporting students with tourettes",teacher-network
717,2013-12-04,Project-based learning: the top teachers to follow on Twitter,teacher-network
718,2013-12-04,Education in Finland: Pisa isn't the full story,teacher-network
719,2013-12-03,10 things teachers need to know about the Pisa results,teacher-network
720,2013-12-03,"Forget Pisa results, let's concentrate on what really matters to schools",teacher-network
721,2013-12-03,Teaching in Thailand: my working life in an international school,teacher-network
722,2013-12-02,10 ways to tackle cyberbullying in schools,teacher-network
723,2013-12-02,How to teach… the countdown to Christmas,teacher-network
724,2013-12-01,SLT job tips: share your top career tips with aspiring school leaders – competition,teacher-network
725,2013-12-01,Modern-day slavery – news and teaching resources round up,teacher-network
726,2013-12-01,Co-headship: why we think two heads are better than one,teacher-network
727,2013-11-30,Secret Teacher: low morale and high pressure leaves no time for inspiration,teacher-network
728,2013-11-30,Project-based learning: how can you make it work in your school? - live chat,teacher-network
729,2013-11-29,"Research in brief: curriculum confidence, gang violence and the $4,000 project",teacher-network
730,2013-11-28,An apprehensive teacher's guide to… ClassDojo,teacher-network
731,2013-11-28,Teaching slavery: tips for tackling the issues in the classroom,teacher-network
732,2013-11-27,Heading up the famous Hampstead School: my leadership formula,teacher-network
733,2013-11-27,Five ways to use 1 Second Everyday in the classroom,teacher-network
734,2013-11-26,Six creative ideas for practical maths lessons,teacher-network
735,2013-11-25,How to teach… engineering,teacher-network
736,2013-11-25,What kind of global citizens are teachers creating?,teacher-network
737,2013-11-24,Cycle safety – news and teaching resources round up,teacher-network
738,2013-11-24,Becoming a primary teacher: my 18-month job search finally paid off,teacher-network
739,2013-11-23,How to introduce enterprise into your school's curriculum,teacher-network
740,2013-11-23,Secret Teacher: it seems feminism is still a dirty word in the classroom,teacher-network
741,2013-11-22,"Boys reluctant writers, UK shortage of language skills and sleepy students",teacher-network
742,2013-11-21,My best English lesson: using rugby to engage boys in descriptive writing,teacher-network
743,2013-11-21,Teachers taking control: a new vision for professional development,teacher-network
744,2013-11-21,"Science education still not making the grade, say Ofsted",teacher-network
745,2013-11-20,How do other countries tackle bullying?,teacher-network
746,2013-11-19,Behaviour management: how strict is too strict?,teacher-network
747,2013-11-19,"The behaviour management balance: authority, systems and support",teacher-network
748,2013-11-19,Film can have a leading role in education,teacher-network
749,2013-11-18,How to teach… music,teacher-network
750,2013-11-18,10 tips for engaging pupils and parents in e-safety and digital citizenship,teacher-network
751,2013-11-17,Typhoon Haiyan and disaster recovery – news and teaching resources round up,teacher-network
752,2013-11-17,Talking heads: why we decided to become a co-operative school,teacher-network
753,2013-11-16,Secret Teacher: bullies lurk in the staffroom too,teacher-network
754,2013-11-15,How can schools beat cyberbullying? – live chat,teacher-network
755,2013-11-15,Vocational subjects raise academy exam results and rise in NQT employment,teacher-network
756,2013-11-14,A Royal College of Teaching would improve educational standards,teacher-network
757,2013-11-14,Big shoes to fill: how I followed a 20-year headship,teacher-network
758,2013-11-13,Are schools squandering their teachers' talent?,teacher-network
759,2013-11-12,Shakespeare in a hurry: teaching and learning ideas from Shakespeare's Globe,teacher-network
760,2013-11-11,How to teach … Anti-Bullying week 2013,teacher-network
761,2013-11-11,Teaching in a US charter school: land of the free or home of the brave?,teacher-network
762,2013-11-10,Russell Brand's revolution: news and teaching resources round up,teacher-network
763,2013-11-10,Why I became a design and technology teacher: I'm devoted to design,teacher-network
764,2013-11-09,Secret Teacher: it's tough for us but our students are the real victims of Gove's reforms,teacher-network
765,2013-11-08,"Music lessons boost the brain, teens' views on school and obesity concern",teacher-network
766,2013-11-07,Wilshaw's way: Ofsted chief's vision for future school leaders,teacher-network
767,2013-11-07,10 tips on getting your first headship,teacher-network
768,2013-11-06,Sensory stories: reading with five senses,teacher-network
769,2013-11-06,10 ideas to help teachers beat stress,teacher-network
770,2013-11-05,Should children start school as young as two? – the Twitter debate,teacher-network
771,2013-11-05,Inside performance related pay: how will the new system work?,teacher-network
772,2013-11-04,How to teach … photography,teacher-network
773,2013-11-04,Are gimmicks and trends getting in the way of teaching?,teacher-network
774,2013-11-03,St Jude's storm: news and teaching resources round up,teacher-network
775,2013-11-03,Talking heads: all teachers can be good if they get the support they need,teacher-network
776,2013-11-02,Secret Teacher: bribing students to learn is bad education,teacher-network
777,2013-11-01,Teaching digital citizenship and keeping students safe online – live chat,teacher-network
778,2013-11-01,Education research in brief: rise in extra exam marks and the positive impact of chatrooms,teacher-network
779,2013-10-31,Playing truant at Passmores: how we tackle student absenteeism,teacher-network
780,2013-10-30,Lessons on pornography: sex education in the digital world,teacher-network
781,2013-10-29,My best science lesson: dissecting cow brains to explore intelligence,teacher-network
782,2013-10-29,"Skipping lunch, DfE emails and online shopping: a day in the life of a primary head",teacher-network
783,2013-10-28,How to teach… fractions,teacher-network
784,2013-10-28,Do teachers need to be qualified? Don't ask such silly questions,teacher-network
785,2013-10-28,Beyond superheads: what does it take to turn around failing schools?,teacher-network
786,2013-10-28,Is the pupil premium a silver bullet for social mobility?,teacher-network
787,2013-10-27,Food waste: news and teaching resources round up,teacher-network
788,2013-10-27,Why I became a philosophy teacher: to get children thinking about the big ideas in life,teacher-network
789,2013-10-25,Nick Clegg's headteacher champions league: Twitter round up,teacher-network
790,2013-10-25,Secret Teacher: was this the worst NQT year ever?,teacher-network
791,2013-10-25,Research round-up: over-optimistic A-level predictions and is RE being sidelined?,teacher-network
792,2013-10-24,Changing the subject: going beyond your teaching specialism,teacher-network
793,2013-10-24,6 creative ways to use questions in the classroom,teacher-network
794,2013-10-23,The irony of religious education? It needs to include atheists and humanists,teacher-network
795,2013-10-22,10 professional development ideas for teachers,teacher-network
796,2013-10-22,The Ofsted Stockholm syndrome,teacher-network
797,2013-10-22,Creating the Amazon in the classroom,teacher-network
798,2013-10-22,Lesson ideas to bring the rainforest to life,teacher-network
799,2013-10-22,The Amazon: a resource under threat,teacher-network
800,2013-10-21,How to teach … autumn crafts and festivals,teacher-network
801,2013-10-21,My best citizenship lesson: faking news and sparking riots for digital natives,teacher-network
802,2013-10-20,The mystery behind the yeti: news and teaching resources round up,teacher-network
803,2013-10-20,Talking heads: how I learnt golden rules about school improvement,teacher-network
804,2013-10-19,Stepping up into headship: how to get the top job,teacher-network
805,2013-10-19,Secret Teacher: why I'm worried about my grandson starting school,teacher-network
806,2013-10-18,Do schools always have to sing from the same song sheet?,teacher-network
807,2013-10-18,"Sexting, kids' perceptions of autism and premature babies' low results",teacher-network
808,2013-10-17,"Pay, pensions and longer working days are forcing us to strike, say teachers",teacher-network
809,2013-10-17,It's time to drop the confusing 'academy' brand,teacher-network
810,2013-10-16,Teachers' strike: why I will be striking,teacher-network
811,2013-10-16,Work-life balance in teaching – cartoon,teacher-network
812,2013-10-16,Support for Sencos: what needs to change?,teacher-network
813,2013-10-15,GCSE league table shakeup: what schools need to know,teacher-network
814,2013-10-15,Play is the cornerstone of creative learning,teacher-network
815,2013-10-15,How to teach … dyslexia awareness,teacher-network
816,2013-10-15,How I got my headship: school leaders share their stories,teacher-network
817,2013-10-14,Why I finally decided to prioritise my personal life over my teaching career,teacher-network
818,2013-10-14,Teaching human rights can be lonely with little student and staff support,teacher-network
819,2013-10-13,The rich list and wealth distribution: news and teaching resources round up,teacher-network
820,2013-10-13,Why I became a primary teacher: to get children hooked on languages,teacher-network
821,2013-10-12,Top 10 resources to help teachers manage their time,teacher-network
822,2013-10-12,Secret Teacher: 'There's an insidious prejudice against older teachers',teacher-network
823,2013-10-11,Lesson observations: why we love our 'Big Brother' classroom,teacher-network
824,2013-10-11,My best science lesson: how I sent year 5 into space,teacher-network
825,2013-10-11,How schools can help teachers beat stress – live chat,teacher-network
826,2013-10-11,"Education research in brief: adult literacy and numeracy, language learning and body image",teacher-network
827,2013-10-11,"Social media: like the staffroom, but without all the negativity",teacher-network
828,2013-10-10,Lessons for educators: which countries are miles ahead in professional development?,teacher-network
829,2013-10-10,Five ways to teach girls' rights,teacher-network
830,2013-10-10,A teacher's guide to girls' rights and street children – gallery,teacher-network
831,2013-10-09,How to apply for your first headship – and get the job,teacher-network
832,2013-10-09,"School Direct could revolutionise CPD, not just teacher training",teacher-network
833,2013-10-08,Professional development: what can Brits learn from schools abroad?,teacher-network
834,2013-10-07,How to teach … Black History Month 2013,teacher-network
835,2013-10-07,CPD diaries: teacher insights into engaging professional development,teacher-network
836,2013-10-07,"Professional development in teaching: the challenges, solutions and status quo",teacher-network
837,2013-10-06,Teaching the US shutdown:  news and resources round up,teacher-network
838,2013-10-06,Talking heads: CPD is essential to stop teachers feeling jaded and demoralised,teacher-network
839,2013-10-05,Secret Teacher: schools need more meaningful reports from Ofsted,teacher-network
840,2013-10-04,How can we ensure professional development is engaging? – live chat,teacher-network
841,2013-10-04,Eight priorities to improve primary education,teacher-network
842,2013-10-04,"Research round up: students' bad breakfasts, phonics results rise and teacher pay",teacher-network
843,2013-10-03,Why do some countries respect their teachers more than others?,teacher-network
844,2013-10-03,How teachers are rated in 21 countries around the world,teacher-network
845,2013-10-03,The rise of spoken word educators in UK schools,teacher-network
846,2013-10-02,How can the status of teaching be improved? – live chat,teacher-network
847,2013-10-02,Michael Wilshaw's speech to HMC conference,teacher-network
848,2013-10-02,Teaching assistants are the unsung heroes of education,teacher-network
849,2013-10-01,Do examinations get in the way of learning?,teacher-network
850,2013-09-30,How to teach … The School We'd Like competition,teacher-network
851,2013-09-30,How to learn from your exam results,teacher-network
852,2013-09-29,Poems and National Poetry Day: news and teaching resources round up,teacher-network
853,2013-09-29,Why I became a music teacher and my mission to reshape music in UK schools,teacher-network
854,2013-09-28,Secret Teacher: nearly 50 and going back to school – is it the right choice?,teacher-network
855,2013-09-27,Napping boosts brain power and confidence is key to achievement,teacher-network
856,2013-09-26,Creative writing in the classroom: five top tips for teachers,teacher-network
857,2013-09-26,Teaching creative writing: lead your class by example,teacher-network
858,2013-09-26,Romantic rhymes to Michael Gove – share your sentiments,teacher-network
859,2013-09-26,"Languages, camera, action: using film to inspire your students",teacher-network
860,2013-09-25,A fully inclusive society starts in school,teacher-network
861,2013-09-24,How to teach… ancient Greece,teacher-network
862,2013-09-24,The eight qualities of successful school leaders,teacher-network
863,2013-09-23,The first R: why we need to teach philosophy in the classroom,teacher-network
864,2013-09-22,Voyager 1: news and teaching resources round up,teacher-network
865,2013-09-22,Talking heads: how I got through my first year of headship,teacher-network
866,2013-09-21,The Secret Teacher: Don't be fooled by the honeymoon period,teacher-network
867,2013-09-20,How to ensure your school can spot the signs of child abuse,teacher-network
868,2013-09-20,Cover lessons hamper students' progress and Northern Ireland teachers lack faith in tests,teacher-network
869,2013-09-19,Coding for technophobes: how to teach the new computing curriculum,teacher-network
870,2013-09-19,Back at the board: why teachers keep working after retirement,teacher-network
871,2013-09-18,Balancing teaching with family life – your tips and insights,teacher-network
872,2013-09-18,Free school meals: not the only way to get kids eating healthily,teacher-network
873,2013-09-18,How social media helps bridge the gap between home and school,teacher-network
874,2013-09-17,Using games to build citizenship and positive relationships,teacher-network
875,2013-09-17,How to teach … rhinos and conservation,teacher-network
876,2013-09-17,Teaching in favelas: a new approach to schooling children from slums,teacher-network
877,2013-09-16,Why I believe we should test pupils at age four,teacher-network
878,2013-09-16,Lest we forget: making history lessons memorable for students,teacher-network
879,2013-09-15,Van Gogh: news and teaching resources round up,teacher-network
880,2013-09-15,Why I became a teaching assistant: working as a TA fits into my family life,teacher-network
881,2013-09-14,Secret Teacher: it's only a matter of time before ninjas take over our schools,teacher-network
882,2013-09-13,"Early schooling ""damages"" children and how reading boosts maths skills",teacher-network
883,2013-09-12,Don't get ticked off: a beginner's guide to marking,teacher-network
884,2013-09-12,Schools leading the way in citizenship education,teacher-network
885,2013-09-11,How can heads support stressed teachers?,teacher-network
886,2013-09-11,Translating history for EAL students,teacher-network
887,2013-09-10,An ode to retiring from teaching: all of the things I won't miss,teacher-network
888,2013-09-10,Juggling home and school life on the first day of term,teacher-network
889,2013-09-09,How to teach … the UN,teacher-network
890,2013-09-09,"Supporting students with dyslexia: tips, tricks and tech for teachers",teacher-network
891,2013-09-08,Talking heads: why I'm part of the studio school revolution in education,teacher-network
892,2013-09-08,Gaming – news and teaching resources round up,teacher-network
893,2013-09-07,Life as an NQT: 10 survival tips from those who've lived to tell the tale,teacher-network
894,2013-09-07,Secret Teacher: we need to practice what we teach,teacher-network
895,2013-09-06,Young people say cyberbullying getting worse and parents back state schools,teacher-network
896,2013-09-05,My best lesson: using social media to connect pupils and politicians,teacher-network
897,2013-09-05,How can the teacher experience be improved in schools? – open thread,teacher-network
898,2013-09-04,What does the future hold for primary languages?,teacher-network
899,2013-09-03,The 10 commandments for new teachers,teacher-network
900,2013-09-03,How to work with your teaching assistant: it's a double act,teacher-network
901,2013-09-02,How to teach … Chinese,teacher-network
902,2013-09-02,English and maths GCSE hurdle: the teachers' verdict,teacher-network
903,2013-09-02,The butterfly effect in schools: sharing simple ideas can have a big impact,teacher-network
904,2013-09-01,Back to school: the prep task teachers shouldn't forget,teacher-network
905,2013-09-01,Why I became a science teacher: to share lessons from industry,teacher-network
906,2013-09-01,Asylum seekers: news and teaching resources round up,teacher-network
907,2013-08-31,Caught on camera: could CCTV transform your lesson observations?,teacher-network
908,2013-08-31,Back to school preparation: top 10 resources for teachers,teacher-network
