,Date,Content,Section
1185,2013-04-09,Gove's Daily Mail column confirms he doesn't understand how learning works,teacher-network
1186,2013-04-09,How a Dragons' Den-style careers class developed my students' speaking skills,teacher-network
1187,2013-04-08,How to teach … political campaigning,teacher-network
1188,2013-04-08,Teachers' workload: tips on how to manage it and get a work-life balance,teacher-network
1189,2013-04-08,Trial lesson ideas for primary school job interviews,teacher-network
1190,2013-04-07,North Korea: news and resources round up,teacher-network
1191,2013-04-07,Why I became a teacher: I wanted to work with families and break down barriers to learning,teacher-network
1192,2013-04-06,Secret Teacher: where do teachers draw the line in helping students achieve?,teacher-network
1193,2013-04-05,Five ways to turn your students into citizen scientists,teacher-network
1194,2013-04-04,Teaching conference season: unproductive union bashing abounds,teacher-network
1195,2013-04-04,A geocaching treasure hunt helped my students learn about the landscape,teacher-network
1196,2013-04-03,Top 10 behaviour resources,teacher-network
1197,2013-04-03,The new curriculum will not work without backing from teachers,teacher-network
1198,2013-04-02,Learning and behaviour management: two sides of the same coin?,teacher-network
1199,2013-04-02,Teaching resources for World Autism Day,teacher-network
1200,2013-04-02,Schools need a new approach to behaviour management,teacher-network
1201,2013-04-01,Climate change and the curriculum: teachers share their views,teacher-network
1202,2013-04-01,How to teach … phonics,teacher-network
1203,2013-04-01,How to throw the ultimate revision party for students,teacher-network
1204,2013-03-31,Failing schools and shifting education policy: lessons from my headship,teacher-network
1205,2013-03-31,Dangerous dogs: news and resources round up,teacher-network
1206,2013-03-30,Secret Teacher: schools are flunking when it comes to student reports,teacher-network
1207,2013-03-28,A good degree isn't the only sign of a good teacher,teacher-network
1208,2013-03-28,Is character caught or taught?,teacher-network
1209,2013-03-27,"Preparing for the new grammar, punctuation and spelling test",teacher-network
1210,2013-03-27,Forensic science: how to turn your classroom into a CSI lab,teacher-network
1211,2013-03-26,How can schools tackle disruptive behaviour? - open thread,teacher-network
1212,2013-03-26,Evidence-based education: is it really that straightforward?,teacher-network
1213,2013-03-26,Building on the legacy of well-designed schools,teacher-network
1214,2013-03-25,How to teach … superheroes,teacher-network
1215,2013-03-25,"Teaching molecules using games, Gangnam Style and retro 3D posters",teacher-network
1216,2013-03-25,How can school and colleges better support social mobility?,teacher-network
1217,2013-03-24,Budget 2013: news and resources round up,teacher-network
1218,2013-03-24,Why I swapped professional football for teaching PE,teacher-network
1219,2013-03-23,Secret Teacher: schools should not be slaves to a destructive C-grade culture,teacher-network
1220,2013-03-22,School design: how important are buildings to learning? - live chat,teacher-network
1221,2013-03-22,Putting the planet in pupils' own hands: ideas on student-led green lessons,teacher-network
1222,2013-03-21,We need to talk about the ownership and control of schools,teacher-network
1223,2013-03-21,Lost in translation: why modern foreign languages in schools needs an overhaul,teacher-network
1224,2013-03-20,Pay is not the only way to raise the standard of school governance,teacher-network
1225,2013-03-20,What aspects of personal and public finance should be taught in schools?,teacher-network
1226,2013-03-20,The headteacher-chair of governors relationship: lessons from private sector boards,teacher-network
1227,2013-03-19,Count down to Earth Hour with lessons on climate change,teacher-network
1228,2013-03-19,'Headships at failing schools are career suicide': what do you think?,teacher-network
1229,2013-03-18,How to teach ... light,teacher-network
1230,2013-03-18,My Spanish students write their own plays to improve their English vocab,teacher-network
1231,2013-03-18,"Surviving lesson observations: if it could go wrong, it almost certainly will",teacher-network
1232,2013-03-17,Our ageing population: news and resources round up,teacher-network
1233,2013-03-17,Pupil insights: making politics and economics engaging in the classroom,teacher-network
1234,2013-03-17,Learning about economic policy: what students want for the budget 2013,teacher-network
1235,2013-03-17,I needed to get out of the lonely lab and into the classroom,teacher-network
1236,2013-03-16,Secret Teacher: leaders can't afford to forget behaviour management basics,teacher-network
1237,2013-03-14,Doing your research: how to prepare for a new teaching job,teacher-network
1238,2013-03-13,Putting parents into the equation: maths homework ideas for teens,teacher-network
1239,2013-03-12,What's happening to the school recruitment churn?,teacher-network
1240,2013-03-12,The self-improvement school system: the pros and cons of co-operation,teacher-network
1241,2013-03-11,How to teach ... Easter,teacher-network
1242,2013-03-11,My best lesson: I get my psychology students to assess my mental health,teacher-network
1243,2013-03-11,Is technology and the internet reducing pupils' attention spans?,teacher-network
1244,2013-03-10,School careers clinic: help and advice on finding your dream teaching job,teacher-network
1245,2013-03-10,It's essential that schools work hard to reduce inequality,teacher-network
1246,2013-03-10,HIV and Aids: news and resources round up,teacher-network
1247,2013-03-09,Secret Teacher: a letter of application for the minister of education,teacher-network
1248,2013-03-08,Going green reduced our energy bills and sparked an eco revolution,teacher-network
1249,2013-03-07,Behind the job title: my role as an English mentor,teacher-network
1250,2013-03-07,World Book Day 2013: teachers get into character to inspire their pupils – in pictures,teacher-network
1251,2013-03-07,How can senior school leaders bring more strategic and reflective thinking into their already busy schedules?,teacher-network
1252,2013-03-06,iPads in the classroom: embedding technology in the primary curriculum,teacher-network
1253,2013-03-06,A mighty times table problem solved,teacher-network
1254,2013-03-05,Ten tips to help NQTs survive their first year in the classroom,teacher-network
1255,2013-03-05,Could area-wide school boards solve the governance crisis?,teacher-network
1256,2013-03-04,My best lesson: turning maths pupils into second world war codebreakers,teacher-network
1257,2013-03-04,What next for careers education in schools?,teacher-network
1258,2013-03-03,The Oscars: news and resources round up,teacher-network
1259,2013-03-03,Teaching chemistry is my career and my hobby,teacher-network
1260,2013-03-03,Open thread: how should careers advice be taught in schools?,teacher-network
1261,2013-03-02,Secret Teacher: beware of the professional standards paradox,teacher-network
1262,2013-03-01,Solar power: lighting up schools and lessons,teacher-network
1263,2013-02-28,How to use the enduring power of Greek myths in your classroom,teacher-network
1264,2013-02-28,A maths curriculum rooted in problem solving: reflections on the US core standards system,teacher-network
1265,2013-02-27,Play in education: the role and importance of creative learning,teacher-network
1266,2013-02-27,The PGCE diaries: I'm finally starting to feel like a real teacher,teacher-network
1267,2013-02-26,Job interviews are like stories - you have to get the beginning and ending right,teacher-network
1268,2013-02-26,Learning by doing: why we've embraced a practical primary curriculum,teacher-network
1269,2013-02-25,How to teach ... Red Nose Day,teacher-network
1270,2013-02-25,My best lesson: using psychic powers and deduction to analyse poetry,teacher-network
1271,2013-02-24,Obesity crisis: news and resources round-up,teacher-network
1272,2013-02-24,How I turned my hate of school into a love for teaching,teacher-network
1273,2013-02-23,Secret Teacher: is it possible to balance leadership with time in the classroom?,teacher-network
1274,2013-02-22,Are teaching research projects the ultimate form of professional development?,teacher-network
1275,2013-02-21,"Technology in schools: saving money with cloud, open source and consortia",teacher-network
1276,2013-02-20,High culture versus pop culture: which is best for engaging students?,teacher-network
1277,2013-02-20,No comprende: are the benefits of languages getting lost in translation?,teacher-network
1278,2013-02-19,Could this be the end of A-level psychology?,teacher-network
1279,2013-02-19,Let's put a stop to illegal exclusions for students with special educational needs,teacher-network
1280,2013-02-18,How to teach ... the Mali conflict,teacher-network
1281,2013-02-18,My best lesson: Getting jiggy with English turned B grades into As,teacher-network
1282,2013-02-18,What should be included in the new history curriculum?,teacher-network
1283,2013-02-17,How I built a career in LGBT education,teacher-network
1284,2013-02-17,How do you engage students in green issues?,teacher-network
1285,2013-02-17,Pope Benedict XVI: news and resources round up,teacher-network
1286,2013-02-16,Secret Teacher: there is no autonomy in teaching today,teacher-network
1287,2013-02-15,"Learning through play: pedagogy, challenges and ideas - live chat",teacher-network
1288,2013-02-15,Changes to education funding will put rural schools at risk,teacher-network
1289,2013-02-14,10 creative ways to teach English that deliver outstanding results,teacher-network
1290,2013-02-13,There is room for both computing and ICT in schools,teacher-network
1291,2013-02-13,Computing in schools: teaching the next generation of computer scientists,teacher-network
1292,2013-02-13,GCSEs U-turn is a lost opportunity for improving our exam system,teacher-network
1293,2013-02-12,"Stability will raise standards in schools, not constant reform",teacher-network
1294,2013-02-12,Endangered species: how can schools help save the hedgehog?,teacher-network
1295,2013-02-11,How to teach … Fairtrade Fortnight,teacher-network
1296,2013-02-11,Draft national curriculum: change for the better or a step back in time?,teacher-network
1297,2013-02-11,NQT job tips: how to get that first teaching post,teacher-network
1298,2013-02-10,Richard III discovery: news and resources round up,teacher-network
1299,2013-02-10,Is the curriculum putting students off learning?,teacher-network
1300,2013-02-10,Cooperative learning reinvigorated my teaching,teacher-network
1301,2013-02-09,Gifted and talented education: using technology to engage students,teacher-network
1302,2013-02-09,Secret Teacher: My NQT year was made unbearable by bullying,teacher-network
1303,2013-02-08,GCSE reforms: when is a U-turn not a U-turn?,teacher-network
1304,2013-02-08,Teaching psychology in schools would encourage more girls into science,teacher-network
1305,2013-02-07,Gove GCSE U-turn: teachers' reaction on Twitter,teacher-network
1306,2013-02-07,Online communities are transforming professional development for teachers,teacher-network
1307,2013-02-07,The language of Twitter: the rise of MFL teachers online,teacher-network
1308,2013-02-06,Scrapping AS-levels will give students time to explore their subjects,teacher-network
1309,2013-02-06,Secondary schools should look to primaries for innovative ideas,teacher-network
1310,2013-02-05,Children are never too young to know homophobic bullying is wrong,teacher-network
1311,2013-02-05,Children learn best when they use their imagination,teacher-network
1312,2013-02-04,How to teach … LGBT history month,teacher-network
1313,2013-02-03,Why I became a teacher: as a route to change the world,teacher-network
1314,2013-02-03,Wind power and renewable energy: news and resources round up,teacher-network
1315,2013-02-02,Closing the inequality gap in education - live chat,teacher-network
1316,2013-02-02,Secret Teacher: I'm sick of playing the observation game,teacher-network
1317,2013-02-01,Creative writing tips for teachers: ideas and activities to inspire your class,teacher-network
1318,2013-02-01,A masterclass in teaching evolution,teacher-network
1319,2013-01-31,Modern free schools have a lot to learn from anarchist education,teacher-network
1320,2013-01-31,Headteachers on performance related pay: how will it work in practice?,teacher-network
1321,2013-01-30,Computer science added to English Baccalaureate: ICT teachers react,teacher-network
1322,2013-01-30,"Love English, hate maths? Numbers should be cool not scary",teacher-network
1323,2013-01-30,Debating in class: how to encourage your students on to the soap box,teacher-network
1324,2013-01-30,A masterclass in teaching algebra,teacher-network
1325,2013-01-29,Professional development for teachers: how can we take it to the next level?,teacher-network
1326,2013-01-29,"Outdoor lessons in winter: how to get outside and learn, whatever the weather",teacher-network
1327,2013-01-29,It's time to give teachers the skills and respect they deserve,teacher-network
1328,2013-01-28,The Olympic legacy: schools sports needs funding not rhetoric,teacher-network
1329,2013-01-28,How to teach … maths creatively,teacher-network
1330,2013-01-28,"Musical maths: teaching mode, median and mean in the style of Daft Punk",teacher-network
1331,2013-01-27,Could your students do a better job than George Osborne?,teacher-network
1332,2013-01-27,Immigration in the UK: news and resources round up,teacher-network
1333,2013-01-27,"Teaching the budget: lesson ideas, resources and tips",teacher-network
1334,2013-01-27,"Why I became a teacher: I love to learn, so this is the perfect career",teacher-network
1335,2013-01-26,"Secret Teacher: A levels do need fixing, but not in the way Michael Gove suggests",teacher-network
1336,2013-01-24,Should I stay or should I go: it's tough to quit a headship after 17 years,teacher-network
1337,2013-01-24,Academy schools: a flawed system that cannot be sustained,teacher-network
1338,2013-01-23,"Teachers' experiences of the job market: new opportunities, ageism and competition",teacher-network
1339,2013-01-23,Spotlight on storytelling: how I use film to engage pupils with literature,teacher-network
1340,2013-01-22,What will the new Google search mean for teachers?,teacher-network
1341,2013-01-21,How to teach ... birdwatching,teacher-network
1342,2013-01-21,"Inside out: trends, quirks and ideas from the School We'd Like competition",teacher-network
1343,2013-01-20,I left the corporate world to teach and pursue my love of maths,teacher-network
1344,2013-01-20,What's in our food? News and resources round up,teacher-network
1345,2013-01-19,Secret Teacher: even outstanding schools can be unsupportive,teacher-network
1346,2013-01-17,Working class boys: why we must raise their attainment,teacher-network
1347,2013-01-16,The role of technology in gifted and talented education - live chat,teacher-network
1348,2013-01-16,How to combine maths and poetry in your class,teacher-network
1349,2013-01-15,Snow days shouldn't leave teachers cold,teacher-network
1350,2013-01-15,Green schools: shining a light on solar power and renewable energy in your classroom,teacher-network
1351,2013-01-14,How to teach … astronomy,teacher-network
1352,2013-01-14,Headteachers have a responsibility to stand up and defend education,teacher-network
1353,2013-01-13,Wildfires and heatwaves: news and resources round up,teacher-network
1354,2013-01-13,I wanted a route into psychology but found a school I just couldn't leave,teacher-network
1355,2013-01-12,Secret Teacher: we can stop education becoming a production line,teacher-network
1356,2013-01-11,"School careers clinic: tips on job applications, interviews, trial lessons and beyond",teacher-network
1357,2013-01-11,Pupils are disadvantaged if they don't have internet access at home,teacher-network
1358,2013-01-10,To bin or not to bin: how headteachers sift job applications,teacher-network
1359,2013-01-10,Mary Seacole and the primary curriculum debate: a teacher's perspective,teacher-network
1360,2013-01-09,New Year's resolutions for teachers: my classroom rules for 2013,teacher-network
1361,2013-01-09,Job tips for teachers: how to write a winning application,teacher-network
1362,2013-01-08,Top 10 back to school resources: hidden gems and team favourites from 2012,teacher-network
1363,2013-01-08,A guide to vertical teaching,teacher-network
1364,2013-01-07,Vertical teaching returns: could it work for your school?,teacher-network
1365,2013-01-07,How to teach... New Year's resolutions,teacher-network
1366,2013-01-07,"Drama is a subject, despite what the government thinks",teacher-network
1367,2013-01-06,GM farming and crops: news and resources round up,teacher-network
1368,2013-01-06,Why I became a teacher: music lured me into the profession,teacher-network
1369,2013-01-05,"Secret Teacher: our school is closing, so what's next for my career?",teacher-network
1370,2013-01-04,Top 10 don'ts for wannabe teacher bloggers,teacher-network
1371,2013-01-04,What can schools do about declining staff morale?,teacher-network
1372,2013-01-03,The Sandy Hook tragedy highlights a polarised society as well as gun crime,teacher-network
1373,2013-01-03,Give teachers some credit - the profession is stronger than ever,teacher-network
1374,2015-01-04,'I used to teach English GCSE with a baby on my hip',teacher-network
1375,2015-01-03,How to use brain science to engage students after the holidays,teacher-network
1376,2015-01-03,Secret Teacher: I miss the torture of inset training,teacher-network
1377,2014-12-31,What's in store for education in 2015?,teacher-network
1378,2014-12-30,Top 10 blogs from the Guardian Teacher Network in 2014,teacher-network
1379,2014-12-29,Secret Teacher: the best blogs of 2014,teacher-network
1380,2014-12-28,Strictly biology: how I use dance routines to inspire young scientists,teacher-network
1381,2014-12-27,Secret Teacher: sending my boys to school taught me a lesson or two,teacher-network
1382,2014-12-23,Best education quotes of 2014 – quiz,teacher-network
1383,2014-12-22,Christmas Day in school: lunch with colleagues followed by a game of cricket,teacher-network
1384,2014-12-21,I never doubted my decision to send home 200 pupils for uniform breaches,teacher-network
1385,2014-12-20,Secret Teacher: what if Ofsted and the DfE got their hands on Christmas?,teacher-network
1386,2014-12-19,"Free school meals take off, boys text talk and support for Roma students",teacher-network
1387,2014-12-18,Three ways teachers can wind down effectively after a long term,teacher-network
1388,2014-12-17,Christmas wind down: 12 handy lesson resources to get you to the end of term,teacher-network
1389,2014-12-16,A winter’s tale: don't overlook the value of drama in school,teacher-network
1390,2014-12-15,How can schools support students who aren't facing a merry Christmas?,teacher-network
1391,2014-12-15,How to teach … Christmas carols and festive songs,teacher-network
1392,2014-12-14,Christmas gift ideas: the best presents for teachers,teacher-network
1393,2014-12-14,I want a behaviour problem – I want my students to talk too much and be excited,teacher-network
1394,2014-12-13,How to make perfect festive treats for your staffroom,teacher-network
1395,2014-12-13,Secret Teacher: my Christmas party mischief got me on the naughty list,teacher-network
1396,2014-12-12,"Disadvantaged pupils' results, top class teachers and secondary schools slip",teacher-network
1397,2014-12-10,Ofsted’s annual report 2013-14: what teachers need to know,teacher-network
1398,2014-12-10,Top 10 tips on how teachers can improve their work-life balance,teacher-network
1399,2014-12-09,Is the College of Teaching a good move for the profession?,teacher-network
1400,2014-12-09,Teaching British values proves that schools are about more than exams,teacher-network
1401,2014-12-08,How to teach ... winter and keeping warm,teacher-network
1402,2014-12-08,Live Q&A: Google's Eileen Naughton answers your students' questions,teacher-network
1403,2014-12-07,"My state school will offer a £30,000-a-year standard of education",teacher-network
1404,2014-12-06,Secret Teacher: why can’t I tell pupils about my eating disorder?,teacher-network
1405,2014-12-05,"Tablets in school, alternative nativity plays and criticism for A-level reforms",teacher-network
1406,2014-12-04,Let's stop the divisive rhetoric damaging private and state school relations,teacher-network
1407,2014-12-03,Why should teachers talk about mental health with students and colleagues?,teacher-network
1408,2014-12-03,DIY nativity costumes: five crafty tricks for making last-minute ensembles,teacher-network
1409,2014-12-02,Five ways to tackle the mental health taboo in your classroom,teacher-network
1410,2014-12-02,Why do so few women apply for top jobs in international schools?,teacher-network
1411,2014-12-01,How to teach ... human rights,teacher-network
1412,2014-12-01,12 days of Christmas giveaway for teachers - entry form,teacher-network
1413,2014-12-01,12 days of Christmas giveaway for teachers – interactive,teacher-network
1414,2014-11-30,In my expeditionary learning school we build fires to teach metaphors,teacher-network
1415,2014-11-29,"Secret Teacher: the cold, hard truth is that many of us cheat to meet targets",teacher-network
1416,2014-11-28,How to combat mental health stigma in schools – live chat,teacher-network
1417,2014-11-28,"Teachers with top degrees, private schools' tax breaks and weak academies",teacher-network
1418,2014-11-26,Tristram Hunt's taken the wrong approach to making private schools pull their weight,teacher-network
1419,2014-11-26,Four common myths about young people and mental health debunked,teacher-network
1420,2014-11-25,How pupil power makes schools more open about mental health issues,teacher-network
1421,2014-11-24,How to teach … immigration,teacher-network
1422,2014-11-23,Could you teach with a child telling you to f-off every five minutes?,teacher-network
1423,2014-11-22,Secret Teacher: the culture of fear in my school stops us taking sick leave,teacher-network
1424,2014-11-21,"Brian Cox on Rosetta, tackling mental health and worksheets v textbooks",teacher-network
1425,2014-11-20,Daily tips to help teachers stay happy and healthy during the week,teacher-network
1426,2014-11-20,Pushy parents in private schools: public enemy number one for teachers?,teacher-network
1427,2014-11-19,How have teacher workloads changed over the past 25 years?,teacher-network
1428,2014-11-18,Do teachers in private schools really work fewer hours for more money?,teacher-network
1429,2014-11-17,How to teach … anti-bullying,teacher-network
1430,2014-11-17,Live Q&A: professor Brian Cox answers your students' questions,teacher-network
1431,2014-11-16,Teaching children with mental health issues can be the best and worst job,teacher-network
1432,2014-11-15,"Secret Teacher: parents, please remember we’re people too",teacher-network
1433,2014-11-14,Rosetta mission: resources to help you teach children about space and comets,teacher-network
1434,2014-11-14,"Boris backs grammar schools, academy trusts finances and wellbeing",teacher-network
1435,2014-11-13,Shopping lists and water skis: teachers and their unusual hobbies,teacher-network
1436,2014-11-12,"Teachers, are you happy in your job? Tell us by filling in our survey",teacher-network
1437,2014-11-12,What are the best time-saving apps for teachers?,teacher-network
1438,2014-11-11,Teacher's guide to sleep – and why it matters,teacher-network
1439,2014-11-10,How to teach … careers advice,teacher-network
1440,2014-11-10,Food for the soul: recipes to give teachers' energy levels a boost,teacher-network
1441,2014-11-09,I improved my school by recruiting unemployed graduates,teacher-network
1442,2014-11-08,"Secret governor: have we let the Trojan horse into our school?
",teacher-network
1443,2014-11-07,How can teachers get a better work-life balance? – live chat,teacher-network
1444,2014-11-07,"Swimming lessons, uniform breaches and university support for AS-levels",teacher-network
1445,2014-11-05,Playlist for teachers: 10 great songs to help you de-stress,teacher-network
1446,2014-11-05,Techniques for technophobes: how to digitally remix classic lesson activities,teacher-network
1447,2014-11-05,History teachers on Twitter: who to follow,teacher-network
1448,2014-11-04,Ready for a close up? 12 tips on how to use film creatively in class,teacher-network
1449,2014-11-03,How to teach ... war memorials and war poetry,teacher-network
1450,2014-11-02,People are frightened to return to a time when they trusted teachers,teacher-network
1451,2014-11-01,"Secret Teacher: without antidepressants, I stop being the person I should be",teacher-network
1452,2014-10-31,How can we improve the way we assess teachers?,teacher-network
1453,2014-10-31,Effective teaching: 10 tips on what works and what doesn’t,teacher-network
1454,2014-10-31,"A recipe for great teachers, absence guidance and hidden costs of education",teacher-network
1455,2014-10-31,What makes great teaching? – expert views,teacher-network
1456,2014-10-29,How teachers can support transgender students,teacher-network
1457,2014-10-28,How to find a teaching job you love,teacher-network
1458,2014-10-28,Joe Bispham: 'You need a safe place to be able to say that was a shit lesson',teacher-network
1459,2014-10-27,How to teach … press freedom,teacher-network
1460,2014-10-26,My alternative school – proof you don’t need grades and the curriculum,teacher-network
