,Date,Content,Section
0,2012-01-02,How to teach … New Year planners,teacher-network
1,2012-01-02,"""It's just my opinion"" isn't good enough",teacher-network
2,2012-01-01,Teacher Network newsletter: Happy New Year to you all,teacher-network
3,2011-12-30,What makes a brilliant teacher?,teacher-network
4,2011-12-29,Mentors not Latin tutors,teacher-network
5,2011-12-28,Breathe life into your lessons with oral history,teacher-network
6,2011-12-25,Teacher Network newsletter: Merry Christmas everyone!,teacher-network
7,2011-12-23,My PGCE journey: I've made it to the end of my first term,teacher-network
8,2011-12-21,Green dream school,teacher-network
9,2011-12-19,How to teach … the winter solstice,teacher-network
10,2011-12-19,Great headteachers inspire more than they direct,teacher-network
11,2011-12-18,Teacher Network newsletter: Christmas confessions and a free wallplanner,teacher-network
12,2011-12-16,Boy-friendly practice is just good teaching,teacher-network
13,2011-12-15,Quest for a switched on school,teacher-network
14,2011-12-14,Resources for the Christmas week,teacher-network
15,2011-12-13,Why children shouldn't be excluded,teacher-network
16,2011-12-12,How to teach … Christmas,teacher-network
17,2011-12-12,The Christmas I sold kisses,teacher-network
18,2011-12-11,"Teacher Network newsletter: The Olympics, Ted Hughes and a little something called School Portrait",teacher-network
19,2011-12-09,The North of England Education Conference is as relevant as ever,teacher-network
20,2011-12-08,Trade places with the Fulbright programme,teacher-network
21,2011-12-07,Can teachers ever have a work-life balance?,teacher-network
22,2011-12-06,Democracy starts at school,teacher-network
23,2011-12-05,How to teach … the attack on Pearl Harbor,teacher-network
24,2011-12-05,How to engage the disengaged,teacher-network
25,2011-12-04,"Teacher Network newsletter: A time-saving toolkit, Pearl Harbour and festive goodies galore",teacher-network
26,2011-12-02,Top tips on supporting EAL pupils,teacher-network
27,2011-12-01,World Aids Day,teacher-network
28,2011-12-01,Win a gorgeous Christmas hamper!,teacher-network
29,2011-11-30,The power of knitting,teacher-network
30,2011-11-29,Why teaching is the best job in the world - despite strikes and shrinking pensions,teacher-network
31,2011-11-28,How to teach … National Tree Week,teacher-network
32,2011-11-28,The magic of Whole School reading,teacher-network
33,2011-11-27,"Teacher Network newsletter: English Language Teaching, co-author a story and the X Factor",teacher-network
34,2011-11-25,How fiction can engage history students in the past,teacher-network
35,2011-11-24,How to get your perfect teaching job,teacher-network
36,2011-11-23,Targets are meaningless if children are anxious,teacher-network
37,2011-11-22,Should we be teaching knowledge or skills?,teacher-network
38,2011-11-21,How to teach … Road Safety Week,teacher-network
39,2011-11-21,"Leave history alone but teach it for longer, says historian",teacher-network
40,2011-11-21,Speak Free: human rights campaigning in school,teacher-network
41,2011-11-20,"Teacher Network newsletter: Breathing life into languages, sexual selection and Little Red Riding Hood",teacher-network
42,2011-11-18,Educating Essex told it like it is,teacher-network
43,2011-11-17,How to move your lessons from good to outstanding,teacher-network
44,2011-11-16,Bringing languages to life in the classroom,teacher-network
45,2011-11-15,The transition from PGCE to NQT year,teacher-network
46,2011-11-14,How to teach … Anti-Bullying Week,teacher-network
47,2011-11-14,Ten top tips for NQTs,teacher-network
48,2011-11-13,"Teacher Network newsletter: lessons in loaf, anti-bullying and brilliant blogs",teacher-network
49,2011-11-11,Moving videos of war veterans capture history,teacher-network
50,2011-11-10,Teaching meditation at school,teacher-network
51,2011-11-09,"It's too simplistic to condemn ""poor"" teachers",teacher-network
52,2011-11-08,How should schools value professional experience gained outside of the education sector?,teacher-network
53,2011-11-07,How to teach … Armistice Day,teacher-network
54,2011-11-07,How to succeed with EAL students in the classroom,teacher-network
55,2011-11-06,"Teacher Network newsletter: war, peace and art of handwriting",teacher-network
56,2011-11-04,The importance of storytelling,teacher-network
57,2011-11-03,Bad behaviour in the classroom is not the problem,teacher-network
58,2011-11-02,What's the point of handwriting?,teacher-network
59,2011-11-01,In UK Parliament Week: the case for citizenship education,teacher-network
60,2011-10-31,How to teach … UK Parliament Week,teacher-network
61,2011-10-31,Good to great classrooms do...,teacher-network
62,2011-10-30,"Teacher Network newsletter: spring cleaning, plenaries on a plate and mobiles in schools",teacher-network
63,2011-10-28,Halloween humbug,teacher-network
64,2011-10-27,Coping with redundancy,teacher-network
65,2011-10-26,How to use mobile devices in the classroom,teacher-network
66,2011-10-25,How to get home cooking skills and gardening tips into the classroom,teacher-network
67,2011-10-24,How to teach … children to cook,teacher-network
68,2011-10-24,Tackling homophobia in schools,teacher-network
69,2011-10-23,"Teacher Network newsletter: Jamie Oliver, spooky masks and a special invite",teacher-network
70,2011-10-21,To PGCE or not to PGCE?,teacher-network
71,2011-10-20,How to bring debating activities into the classroom,teacher-network
72,2011-10-19,The importance of inclusion: Why I learned British Sign Language,teacher-network
73,2011-10-18,Ideas from teachers could change the lives of disadvantaged children,teacher-network
74,2011-10-17,How to teach … saving energy,teacher-network
75,2011-10-17,Our expert's guide to the perfect starter,teacher-network
76,2011-10-16,Teacher Network newsletter: teaching tips for quick learning,teacher-network
77,2011-10-14,Occupy Wall Street protests are too big to ignore in the classroom,teacher-network
78,2011-10-13,No Pens Day Wednesday,teacher-network
79,2011-10-12,Why I swapped life as a city banker for the classroom,teacher-network
80,2011-10-11,Amnesty International Young Human Rights Reporter of the Year competition,teacher-network
81,2011-10-10,How to teach … human rights reporting,teacher-network
82,2011-10-10,National Schools Film Week,teacher-network
83,2011-10-09,Teacher Network newsletter: the Teacher Network survey and how your students can put the world to rights,teacher-network
84,2011-10-08,The Girl Effect: education is the key,teacher-network
85,2011-10-07,How a drama CPD project inspired my teaching practice,teacher-network
86,2011-10-06,It's National Poetry Day,teacher-network
87,2011-10-05,Why I left teaching,teacher-network
88,2011-10-04,Guardian Teacher Network survey: the official response,teacher-network
89,2011-10-03,I love teaching,teacher-network
90,2011-10-03,Career development,teacher-network
91,2011-10-03,Bureaucracy,teacher-network
92,2011-10-03,Curriculum,teacher-network
93,2011-10-03,Exams and assessment,teacher-network
94,2011-10-03,Bullying,teacher-network
95,2011-10-03,Government interference,teacher-network
96,2011-10-03,"Pay, pensions and retirement",teacher-network
97,2011-10-03,Parenting,teacher-network
98,2011-10-03,General comments,teacher-network
99,2011-10-03,Ofsted,teacher-network
100,2011-10-03,Behaviour,teacher-network
101,2011-10-03,I love teaching but…,teacher-network
102,2011-10-03,Teachers speak out - the full results of the Guardian Teacher Network survey,teacher-network
103,2011-10-03,Targets and league tables,teacher-network
104,2011-10-03,Respect,teacher-network
105,2011-10-03,Management/leadership,teacher-network
106,2011-10-03,Teacher training,teacher-network
107,2011-10-03,Work-life balance,teacher-network
108,2011-10-03,Academies and free schools,teacher-network
109,2011-10-03,How to teach ... global education,teacher-network
110,2011-10-03,My PGCE journey: I'm excited to be teaching for the first time,teacher-network
111,2011-10-02,Teacher Network newsletter: I love teaching but...,teacher-network
112,2011-10-01,Autumn Days: how to celebrate harvest in school,teacher-network
113,2011-09-30,Myth Master Rick Riordan on the books he wishes he still had,teacher-network
114,2011-09-29,Top tips for NQTs,teacher-network
115,2011-09-28,No Pens Wednesday,teacher-network
116,2011-09-27,Top tips for teaching Black History Month,teacher-network
117,2011-09-26,How to teach Black History Month,teacher-network
118,2011-09-26,European Day of Languages: our best teaching resources,teacher-network
119,2011-09-25,"Teacher Network newsletter: thinking skills, reading for pleasure and a Dickens Wallchart",teacher-network
120,2011-09-24,How to teach about harvest – without using corn dollies!,teacher-network
121,2011-09-23,Waiting for the call – the challenges of supply teaching,teacher-network
122,2011-09-22,Peer tutoring and reading in the primary classroom,teacher-network
123,2011-09-21,Peace One Day,teacher-network
124,2011-09-20,Why not to teach,teacher-network
125,2011-09-19,How to teach Peace Day,teacher-network
126,2011-09-19,The case for teaching texting,teacher-network
127,2011-09-17,This week's newsletter,teacher-network
128,2011-09-16,Increasing engagement in homework,teacher-network
129,2011-09-15,A world divided – teaching about North and South Korea,teacher-network
130,2011-09-14,Surviving your PGCE,teacher-network
131,2011-09-13,Roald Dahl Day,teacher-network
132,2011-09-12,How to teach ... Roald Dahl,teacher-network
133,2011-09-12,The week's newsletter,teacher-network
134,2011-09-12,Children don't need to know all their number facts to succeed at maths,teacher-network
135,2011-09-09,9/11 assembly plan,teacher-network
136,2011-09-08,Reading for pleasure,teacher-network
137,2011-09-07,My PGCE My PGCE journey: why I'm embarking on a new career: embarking on a new career,teacher-network
138,2011-09-05,How to teach … the riots,teacher-network
139,2011-09-05,Positive behaviour teaching resources,teacher-network
140,2011-09-02,Making sense of the riots in the classroom,teacher-network
141,2011-09-02,Welcome to our teaching blog,teacher-network
142,2011-09-01,Guardian Teacher Network Seminars: venue details,teacher-network
143,2011-05-31,How to teach ... migration,teacher-network
144,2011-04-11,How to teach ... space travel,teacher-network
145,2013-01-02,How to set up a student newspaper,teacher-network
146,2012-12-31,Teacher predictions: what will 2013 bring for education?,teacher-network
147,2012-12-30,Smoking and tobacco: news and resources round up,teacher-network
148,2012-12-30,Why I became a teacher: to help children feel good about themselves,teacher-network
149,2012-12-29,Secret Teacher: why do we feel so guilty for taking a day off sick?,teacher-network
150,2012-12-28,Teacher Network review of 2012: our 10 best blogs of the year,teacher-network
151,2012-12-27,Secret Teacher in 2012: the 10 best blogs of the year,teacher-network
152,2012-12-23,Colds and viruses: news and resources round up,teacher-network
153,2012-12-23,Why I became a teacher: I drifted into it but soon found my passion,teacher-network
154,2012-12-22,Secret Teacher: our schools need more teaching and less management,teacher-network
155,2012-12-20,A Christmas number one for Michael Gove,teacher-network
156,2012-12-20,A day in the life of... a teacher of autistic pupils,teacher-network
157,2012-12-19,Dear Mr Gove: let me educate you about the world of teaching,teacher-network
158,2012-12-18,Teaching at Christmas - in pictures,teacher-network
159,2012-12-17,"End of term resources: quizzes, crafts and cookies for your last lessons",teacher-network
160,2012-12-17,How to teach ... homelessness,teacher-network
161,2012-12-17,Guests make a mark on students' written work,teacher-network
162,2012-12-16,Why I became a teacher: I'm on a mission to transform education in Brazil,teacher-network
163,2012-12-16,Teaching the census: news and resources round up,teacher-network
164,2012-12-15,Secret Teacher: leadership is like the Wizard of Oz – a facade that lacks magic,teacher-network
165,2012-12-13,A few parting words: perfecting the end-of-term speech,teacher-network
166,2012-12-12,How do you boost literacy in your school?,teacher-network
167,2012-12-12,Let's all hope a GCSE judicial review brings justice for our students and staff,teacher-network
168,2012-12-12,Christmas presents from your class - what's acceptable and what's not?,teacher-network
169,2012-12-11,Teachers must stand up against performance pay,teacher-network
170,2012-12-11,10 great works of literature to use in your classroom,teacher-network
171,2012-12-11,Classic works of literature still have a place in today's classrooms,teacher-network
172,2012-12-10,Whistleblowing in schools: advice for teachers reporting malpractice,teacher-network
173,2012-12-10,How to teach... snow,teacher-network
174,2012-12-10,Performance-related pay will mean yet more emphasis on results,teacher-network
175,2012-12-10,Education reforms: where is the evidence and consensus?,teacher-network
176,2012-12-09,Why I became a teacher: travelling changed my mind about the profession,teacher-network
177,2012-12-09,Learning about Leveson: news and resources round up,teacher-network
178,2012-12-08,Secret Teacher: when a pupil rules your classroom,teacher-network
179,2012-12-07,Talking about books brings reading to life for primary school students,teacher-network
180,2012-12-06,Innovation in Education conference live blog: 6 December 2012,teacher-network
181,2012-12-05,"Teaching in private and state schools: the differences, priorities and styles",teacher-network
182,2012-12-04,How are public spending cuts affecting your school?,teacher-network
183,2012-12-04,"Last chance to enter our competition and win £5,000 for your school",teacher-network
184,2012-12-04,Come on teachers - it's time to shout about what we are doing right,teacher-network
185,2012-12-03,How to teach... Christmas arts and crafts,teacher-network
186,2012-12-03,An alternative vision for primary maths,teacher-network
187,2012-12-03,Five ways to reduce the stress of marking and save time,teacher-network
188,2012-12-02,Teaching the Hobbit and Tolkien: news and resources round up,teacher-network
189,2012-12-02,Why I'm becoming a teacher: because I don't want to be bored in my career,teacher-network
190,2012-12-01,"Secret Teacher: we can't be outstanding every day, so why judge us on that?",teacher-network
191,2012-11-30,An experiment in making bread at school the sustainable way,teacher-network
192,2012-11-29,It's time to rethink the way Christianity is taught in schools,teacher-network
193,2012-11-29,Music lessons should not become the preserve of the privileged,teacher-network
194,2012-11-29,"Dealing with grief: how schools can offer sanctuary, normality and valued support",teacher-network
195,2012-11-28,"After 30 years of new schools policy, why haven't we closed the quality gap?",teacher-network
196,2012-11-28,How to bring economics and politics to life in the classroom,teacher-network
197,2012-11-28,I've joined the EBC opposition movement - will you?,teacher-network
198,2012-11-27,Take one sheet of paper and really get to know your pupils,teacher-network
199,2012-11-27,How online challenges are helping to stretch student chemists,teacher-network
200,2012-11-26,How to teach... the economy,teacher-network
201,2012-11-26,Helping students see their place in the bigger picture,teacher-network
202,2012-11-26,How Carshalton Boys Sports College turned its grades around,teacher-network
203,2012-11-25,Chance to be Chancellor: helping students have a say in the Youth Budget,teacher-network
204,2012-11-25,Why I became a teacher: to engage students in the news and economy,teacher-network
205,2012-11-25,Learning about apes and monkeys: news and resources round up,teacher-network
206,2012-11-24,Secret Teacher: it's time to get shot of incompetent heads,teacher-network
207,2012-11-23,Is there a fear of failure in education?,teacher-network
208,2012-11-23,Experiments and ideas for teaching philosophically,teacher-network
209,2012-11-22,An unexpected Olympic legacy: how to make marginal gains with your students,teacher-network
210,2012-11-21,Using films to empower pupils to challenge bullying,teacher-network
211,2012-11-21,Why memorising facts can be a keystone to learning,teacher-network
212,2012-11-19,How to teach... the Jimmy Savile scandal,teacher-network
213,2012-11-19,Notes on the new Ofsted framework: how to be outstanding,teacher-network
214,2012-11-19,Anti-Bullying Week: poll shows students hiding talent,teacher-network
215,2012-11-19,Under pressure? School teachers struggling with jobs advice,teacher-network
216,2012-11-19,Has blocking mobiles in schools had its day?,teacher-network
217,2012-11-18,Israel and Gaza news and resources round up,teacher-network
218,2012-11-18,Why I became a teacher: to help children discover their inner talents,teacher-network
219,2012-11-17,Secret Teacher: industrial action makes teachers look like whingers,teacher-network
220,2012-11-16,Science PGCE: asking the right questions,teacher-network
221,2012-11-16,It's time to tackle mental health stigma in our classrooms,teacher-network
222,2012-11-16,Is celebrity culture really that bad for our students?,teacher-network
223,2012-11-15,Digital literacy must become an essential part of the ICT curriculum,teacher-network
224,2012-11-15,My experience as a stammering teacher,teacher-network
225,2012-11-15,Bringing maths to life with cross-curricular appeal,teacher-network
226,2012-11-14,High court to decide on establishment of two faith schools,teacher-network
227,2012-11-14,"Teachers, what would be in your primary curriculum?",teacher-network
228,2012-11-14,Homophobic bullying: the 'toughest nut to crack',teacher-network
229,2012-11-13,"Vic Goddard: bullying, restorative justice and teenage girls",teacher-network
230,2012-11-13,Top tips on how to teach empathy and curb bullying,teacher-network
231,2012-11-13,School autonomy and accountability 40 years on: help or hindrance?,teacher-network
232,2012-11-12,Do you need to have been a teacher to be a head?,teacher-network
233,2012-11-12,How to teach ... Anti-Bullying Week 2012,teacher-network
234,2012-11-12,Why children find it easier to spell 'pterodactyl' and 'Hermione',teacher-network
235,2012-11-12,Being an outstanding teacher relies on more than passing harder QTS test,teacher-network
236,2012-11-12,Is Langley Academy the ultimate green school?,teacher-network
237,2012-11-11,Staff development and school improvement through global learning,teacher-network
238,2012-11-11,How can schools take global learning to the next level?,teacher-network
239,2012-11-11,Teaching the ash dieback: news and resources round up,teacher-network
240,2012-11-11,Why I became a teacher: to show students how the world really works,teacher-network
241,2012-11-10,How our school developed an international approach to learning,teacher-network
242,2012-11-10,"Secret Teacher: 'Dear Ofsted inspector, I am giving you notice to improve'",teacher-network
243,2012-11-09,Tackling bullying in schools: live chat,teacher-network
244,2012-11-09,Learning from teachers overseas: shared experiences across the continent,teacher-network
245,2012-11-09,10 tips to promote global citizenship in the classroom,teacher-network
246,2012-11-09,From peace to poverty: lesson ideas to help students grasp global issues,teacher-network
247,2012-11-09,We need more diversity in school leadership,teacher-network
248,2012-11-08,Snapshots of hurricane Sandy: a New York teacher's view,teacher-network
249,2012-11-08,Five ideas for getting students involved in global learning,teacher-network
250,2012-11-08,Getting students globe trotting isn't the only way to bridge the global skills gap,teacher-network
251,2012-11-07,"Teaching in multicultural classrooms: tips, challenges and opportunities",teacher-network
252,2012-11-07,Sex education: giving straight answers without blushes,teacher-network
253,2012-11-07,Connecting and collaborating with schools across Europe,teacher-network
254,2012-11-07,"Bringing languages to life: teaching tips, tech and ideas",teacher-network
255,2012-11-06,Headteachers must think about school reputation in the digital age,teacher-network
256,2012-11-06,The role of technology in global learning,teacher-network
257,2012-11-05,How to teach... road safety,teacher-network
258,2012-11-05,Exploring other countries and cultures: my school exchange story,teacher-network
259,2012-11-05,Why global awareness matters to schools,teacher-network
260,2012-11-04,Gove's call for openness is all one way - government isn't open to teachers' ideas,teacher-network
261,2012-11-04,Learning about hurricane Sandy: news and resources round up,teacher-network
262,2012-11-04,Why I became a teacher: to help kids ask critical questions about the world,teacher-network
263,2012-11-03,"Global awareness in schools: opportunities, challenges and ideas - live chat",teacher-network
264,2012-11-03,"Secret Teacher: It's time to prioritise subject knowledge, teaching ideas and marking again",teacher-network
265,2012-11-02,What skills do academy governors need to manage million-pound budgets?,teacher-network
266,2012-11-01,"Inspiration for a school hack day: what, where, why and how",teacher-network
267,2012-10-31,Get that teaching job: how to write a winning application,teacher-network
268,2012-10-31,GCSE scandal has damaged my students' views of education,teacher-network
269,2012-10-30,In defence of school drama: don't let arts fall off the curriculum,teacher-network
270,2012-10-30,The confusing life and times of a trainee teacher: getting the balance right,teacher-network
271,2012-10-29,Don't be taken in by the fantasy world of schools policy making,teacher-network
272,2012-10-29,"Teaching climate change, recycling and natural resources: ideas and activities",teacher-network
273,2012-10-28,The US elections: a guide for teachers and students,teacher-network
274,2012-10-28,Why I became a teacher: I wanted to leave advertising to do something worthwhile and memorable,teacher-network
275,2012-10-27,Secret Teacher: we're all under pressure but don't take it out on the pupils,teacher-network
276,2012-10-26,There's no getting away from anatomy in art class,teacher-network
277,2012-10-26,Moving between state and independent schools: a teacher's guide,teacher-network
278,2012-10-25,"BSF transformed our school, but what about those who missed out?",teacher-network
279,2012-10-24,"Overcoming negative attitudes to reading using football, speedway and journalism",teacher-network
280,2012-10-24,Spotting specific language impairment: signs for teachers to look out for,teacher-network
281,2012-10-23,Fundraising in school - it's not all about shaking the charity can,teacher-network
282,2012-10-22,How to teach ... gravity,teacher-network
283,2012-10-22,2015 and beyond: what's next for school reform?,teacher-network
284,2012-10-22,"Remember the fifth of November - gunpowder, tweeting and blogs",teacher-network
285,2012-10-21,Why I became a teacher: there is no job that's more exciting,teacher-network
286,2012-10-21,Teacher's guide to EMA and social mobility: news and resources round up,teacher-network
287,2012-10-20,Exploring student collaboration in schools - live chat,teacher-network
288,2012-10-20,Balancing the budget: five key issues that could put your school in the red,teacher-network
289,2012-10-20,"The Secret Teacher: micro management is so bad at our school, teachers don't have time to think",teacher-network
290,2012-10-19,Teachers react to Gove's computer science plans,teacher-network
291,2012-10-19,Going green for Halloween: rifle through the recycling box for scary classroom decorations,teacher-network
292,2012-10-19,Are the composers and pop stars of tomorrow lurking in your class?,teacher-network
293,2012-10-18,Is teaching in a remote rural school an educational utopia?,teacher-network
294,2012-10-17,New exam proposal is full of holes,teacher-network
295,2012-10-17,Free education from political meddling and hand control to teachers,teacher-network
296,2012-10-16,Live chat: is this the golden age for curriculum innovation?,teacher-network
297,2012-10-16,I'm doing a PGCE at 40: savvy career move or expensive mistake?,teacher-network
298,2012-10-16,School libraries: using data to boost student literacy,teacher-network
299,2012-10-15,Teaching the Holocaust: the power of personal stories,teacher-network
300,2012-10-14,Why I became a teacher: because I know education changes people's lives,teacher-network
301,2012-10-14,Teaching the Nobel prize: news and resources round up,teacher-network
302,2012-10-13,The Secret Teacher: 'action short of strike' lets down students – we have to find a better way,teacher-network
303,2012-10-12,The pupil 'power rangers' driving energy efficiency in schools,teacher-network
304,2012-10-12,Can we afford David Cameron's idea of a 'great education'?,teacher-network
305,2012-10-12,Teaching Tennessee Williams: Cat on a Hot Tin Roof has an emotional pull students can't resist,teacher-network
306,2012-10-11,Where is Gove's real speech on the future of education?,teacher-network
307,2012-10-11,Using real data to bring science lessons to life,teacher-network
308,2012-10-10,"Educating Essex: Vic Goddard on leadership, Ofsted and school life",teacher-network
309,2012-10-10,"Ringleaders, rebels and rascals: how Bill Rogers saved my PGCE",teacher-network
310,2012-10-09,When boxing meets education: teaching experiences in alternative provision,teacher-network
