,Date,Content,Section
294,2013-08-24,"Cory Booker: hope, hype – and heir to Barack Obama? | The observer profile",theobserver
295,2013-08-17,Paul O'Grady: a class act in more ways than one | Observer profile,theobserver
296,2013-08-11,Alexei Navalny: firebrand bidding for Russia's soul | Observer profile,theobserver
297,2013-08-10,"David Peace: 'Bill Shankly was a good man, as close to a saint as you could get'",theobserver
298,2013-08-03,Gareth Bale: from prize loser to the Real deal | Observer profile,theobserver
299,2013-07-27,Caroline Lucas: 'Politics is about everything we do' | Q&A,theobserver
300,2013-07-21,Christopher Guest: 'Spinal Tap are talking about something for next year',theobserver
301,2013-07-20,Lynton Crosby: David Cameron's Lizard of Oz | Observer profile,theobserver
302,2013-07-13,Felix Barrett: the visionary who reinvented theatre | Observer profile,theobserver
303,2013-06-22,Charles Saatchi: art supremo with an image problem | The Observer profile,theobserver
304,2013-06-15,Dawn French: 'I decided I'd pretend to be someone very confident',theobserver
305,2013-06-15,Russell Brand: messiah or very naughty boy? | Observer profile,theobserver
306,2013-06-08,Sean Parker: tech guru and the bad boy of Silicon Valley | Observer profile,theobserver
307,2013-06-08,Rachel Kushner: 'I know what it feels like to crash a motorcycle at 140mph',theobserver
308,2013-05-25,Jenna Lyons: fashion queen of America | profile,theobserver
309,2013-05-18,José Mourinho: second coming of the Special One? | profile,theobserver
310,2013-05-11,Melanie Phillips: Melanie Phillips: she's putting the world to rights | profile,theobserver
311,2013-04-27,Sheikh Mohammed: the ruler with real horsepower | Observer profile,theobserver
312,2013-04-20,Lionel Shriver: time to talk about  her big brother | Observer profile,theobserver
313,2013-04-20,Is it wrong for a person to change their accent?,theobserver
314,2013-03-31,Tim Minchin: the man who waltzed Matilda | Observer profile,theobserver
315,2013-03-24,Gillian Flynn: chronicler of the midwest's dark side | profile,theobserver
316,2013-03-24,Sara Kestelman: 'I didn't enjoy my immersion in Shakespeare. I was frightened of it',theobserver
317,2013-03-17,"Ali Hewson: 'In the next 20 years, Africa is going to blow our minds'",theobserver
318,2013-03-17,Ricken Patel: the global leader of online protest | Observer profile,theobserver
319,2013-03-10,Wayne Rooney: football's gilded youth falls to earth | Observer profile,theobserver
320,2013-03-03,Sonia Friedman: an unfailing eye for theatreland gold,theobserver
321,2013-02-24,Sheryl Sandberg: the Facebook boss on a self-help mission | Profile,theobserver
322,2013-02-24,"Tamsin Greig: 'I'd love to play Cleopatra, Lady Macbeth, Paulina… just ask me'",theobserver
323,2013-02-23,Maggie O'Farrell: 'My writing is tougher and much better since I had children',theobserver
324,2013-02-17,Adam Ondra: a rock star at the height of his powers | Observer profile,theobserver
325,2013-02-10,Tom Ford: fashion's slickest control freak | Observer profile,theobserver
326,2013-02-03,Eve Ensler: dancing for a free world for women,theobserver
327,2013-01-27,Justin Welby: from mammon to man of God | Observer profile,theobserver
328,2013-01-06,Anna Maxwell Martin: 'Loads of women's drama is really dumbed down',theobserver
329,2013-01-05,Binyamin Netanyahu: strong man with a fearful heart | Observer profile,theobserver
330,2015-01-04,Adam Curtis: cult film-maker with an eye for the unsettling | Observer profile,theobserver
331,2015-01-04,Alcohol abuse: it’s not a doctor’s job to decide who ‘deserves’ treatment | the big issue,theobserver
332,2014-12-28,Jessica Raine: ‘If I’d been born in Tudor times I’d have married a blacksmith’,theobserver
333,2014-12-28,The readers’ editor on… unfinished business | Stephen Pritchard,theobserver
334,2014-12-28,Elizabeth Warren: can this scourge of Wall Street make it to the White House?,theobserver
335,2014-12-28,The Lib Dems: Nick Clegg’s party has no excuses for its collusion  | the Big Issue,theobserver
336,2014-12-21,Travis Kalanick: Uber-capitalist who wants to have the world in the back of his cabs | Observer profile,theobserver
337,2014-12-21,Stephen Cleobury: ‘The next auditions are on 24 January so get in touch’,theobserver
338,2014-12-21,Poverty: Labour’s priority should be to ensure the poor have a voice | The big issue,theobserver
339,2014-12-14,Taxation: VAT is a poll tax on living. To increase it is to hit the poorest | the big issue,theobserver
340,2014-12-07,Qassem Suleimani: can this man bring about the downfall of Isis? | Observer profile,theobserver
341,2014-12-07,The secrecy over the Greek civil war is due to a British cover-up | letters,theobserver
342,2014-12-07,Dementia care: the way sufferers are looked after needs to be transformed | the big issue,theobserver
343,2014-12-02,Evicted - a sleepless night for London's latest victim of rent hike city,theobserver
344,2014-11-30,Jim O’Neill: ‘My task is to build a global consensus on antibiotics by 2016’,theobserver
345,2014-11-30,Harriet Green: Thomas Cook’s high flyer packs her bags | Observer profile,theobserver
346,2014-11-30,The readers’ editor on… online moderation,theobserver
347,2014-11-30,We must learn to limit our excessive consumption | Big issue,theobserver
348,2014-11-30,Council leaders of all parties plead for no more cuts | Letters,theobserver
349,2014-11-23,Diane von Fürstenberg: ‘Don’t waste your time! Be hard on yourself’,theobserver
350,2014-11-23,Bill Cosby: a dark cloud now hangs over ‘America’s Dad’ | Observer profile,theobserver
351,2014-11-23,Only new legislation will bring Britain’s bankers to heel | the big issue,theobserver
352,2014-11-23,Trade unions today need to work with the community | letters,theobserver
353,2014-11-16,Kate Reardon: ‘We can’t get sucked into some parallel universe where we think everyone has an Hermès handbag’,theobserver
354,2014-11-16,Maurice Saatchi: the greatest campaign for the love of his life | Observer profile,theobserver
355,2014-11-16,Labour leadership: political success can only come from having credible policies | the big issue,theobserver
356,2014-11-16,We need better transport systems right across the UK | letters,theobserver
357,2014-11-15,Should Band Aid be resurrected?,theobserver
358,2014-11-09,"Fabiola Gianotti:
woman with the key to the secrets of the universe | Observer profile",theobserver
359,2014-11-09,The living wage: getting all employers to pay a fair wage requires legislation | the big issue,theobserver
360,2014-11-09,"The prime minister, tax and morality| letters",theobserver
361,2014-11-07,When a woman reaches 50 does sex become less important?,theobserver
362,2014-11-02,We need a new treaty to restore voters’ faith in Europe | letters,theobserver
363,2014-11-02,We’re still in the dark ages when it comes to time zones | the big issue,theobserver
364,2014-11-02,"Tim Cook: out, proud, Apple’s new leader steps into the limelight | Observer profile",theobserver
365,2014-10-25,The green belt: outmoded ideals about urban sprawl do no one any good | the big issue,theobserver
366,2014-10-25,CJ Sansom: a bestselling mix of Tudor history and mystery | Stephanie Merritt,theobserver
367,2014-10-25,The battle against obesity is about to get more complicated | letters,theobserver
368,2014-10-25,The readers’ editor on … regional coverage | Stephen Pritchard,theobserver
369,2014-10-18,Amy Poehler: sweet queen of comedy with a wicked streak | Observer profile,theobserver
370,2014-10-18,King’s Cross owes a great deal to far-sighted past planners | letters,theobserver
371,2014-10-18,Politics needs people with a broader experience of life | the big issue,theobserver
372,2014-10-11,The NHS: Tory fag-packet health policy ignores the emotional challenges facing medical workers,theobserver
373,2014-10-11,"What did public relations ever do for us? Quite a lot, actually",theobserver
374,2014-10-11,Malala made history but there is resentment not pride in Pakistan,theobserver
375,2014-10-05,Jenny Smith: ‘These schools aren’t full of gangs or badly behaved kids’,theobserver
376,2014-10-05,Physicist Brian Cox: ‘The side of me that people don’t tend to see is the side that argues’,theobserver
377,2014-10-04,People and politics: ordinary workers stand no chance of becoming an MP | the big issue,theobserver
378,2014-10-04,The deplorable censorship of the installation Exhibit B at the Barbican | letters,theobserver
379,2014-09-30,There's nothing irregular about flexi-schooling,theobserver
380,2014-09-29,Labour homes in on the student vote,theobserver
381,2014-09-27,Thomas Quasthoff: ‘Schubert’s songs fly through the sky like angels’,theobserver
382,2014-09-27,"Devolution for all? Yes please, and why not begin in London? | The big issue",theobserver
383,2014-09-27,The readers’ editor on… the naming of Isis | Stephen Pritchard,theobserver
384,2014-09-27,Keeping vulnerable children out of care costs money | Observer letters,theobserver
385,2014-09-13,Kate Tempest: a winning wielder of words | Observer profile,theobserver
386,2014-09-07,2014 New Radicals: the story behind this year's winners,theobserver
387,2014-09-07,Stay Up Late: 'It's important to be able to have an active social life',theobserver
388,2014-09-07,Mazí Mas: 'We're changing women's lives – with their own food',theobserver
389,2014-09-07,"Cocktails in Care Homes: 'It's an occasion, people wonder what to wear'",theobserver
390,2014-09-07,Bristol Together: 'You have to invest in people for the long term',theobserver
391,2014-09-07,Nightriders: 'Our support is designed around empathy and openness',theobserver
392,2014-09-07,More of the best new radicals,theobserver
393,2014-09-07,"Buffalo Grid: 'If you need a doctor, or you've been robbed, you need a phone'",theobserver
394,2014-09-06,Biba founder Barbara Hulanicki: 'I have a lovely life. I intend to outlive you all',theobserver
395,2014-08-30,Clare Smyth: queen of cuisine steps out of the shadows | profile,theobserver
396,2014-08-23,Marina Abramović: 'This piece is deeper and more profound than anything I've ever done before',theobserver
397,2014-08-18,A woman in tech is as rare as a girl on a skateboard,theobserver
398,2014-08-16,Amazon's Russell Grandinetti: Kindle champ takes on the books trade | Observer profile,theobserver
399,2014-08-16,"'I'm not bossy, I'm just the Boss' says Edinburgh festival actor and director",theobserver
400,2014-08-13,Lauren Bacall - far more than just a beautiful face,theobserver
401,2014-08-12,Want to read something compelling? Try someone else's diary,theobserver
402,2014-08-09,Amy Bloom: 'We did not have people who identified as transgender lauded in the mainstream press',theobserver
403,2014-08-09,Thokozile Masipa: the world awaits her verdict | Observer profile,theobserver
404,2014-08-09,Who says we're not Europeans? It's August and the country has closed,theobserver
405,2014-08-08,Boris has betrayed young people in London,theobserver
406,2014-08-07,What if 'Harry Potter meets Sally' finally rekindles our passion for the rom-com?,theobserver
407,2014-08-06,In response... Phoebe Ash says 'of course I'm naive',theobserver
408,2014-08-04,My first foray into the world of dating after decades with my husband,theobserver
409,2014-08-02,Jimmy Wales: digital champion of free speech | Juliette Garside,theobserver
410,2014-08-02,Is the decline in topless sunbathing a backward step for feminism?,theobserver
411,2014-08-02,Why should trailblazing women have to project a perfect image?,theobserver
412,2014-08-01,Mexico's machismo culture has forced me to change the way I dress,theobserver
413,2014-07-26,Gillian Anderson: actor with a very distinctive X factor | Observer profile,theobserver
414,2014-07-26,Michael Johnson interview: 'Many commentators are annoying. So I model myself on not being like them',theobserver
415,2014-07-26,Why are so many people obsessed with Muslim women's wardrobes?,theobserver
416,2014-07-19,David Mitchell: a storyteller of infinite richness | Observer profile,theobserver
417,2014-07-19,Eve Branson: ‘I was not saved by Kate Winslet!’,theobserver
418,2014-07-19,"Barbie, you've had your day",theobserver
419,2014-07-17,Size triple zero: why won't our obsession with super skinny disappear?,theobserver
420,2014-07-11,I'm 28 and broke - so don't talk to me about payday treats!,theobserver
421,2014-07-05,The elderflower season is nearly over - get foraging while you can,theobserver
422,2014-07-03,Does it matter if big brands use message of female empowerment to sell their products?,theobserver
423,2014-06-28,Harry Shearer interview: 'I told them I don't dance – now I prove it nightly',theobserver
424,2014-06-28,Ramadan starts today - a spiritual time but hard work for women,theobserver
425,2014-06-27,"High heels are glamorous and sexy, but they are not empowering",theobserver
426,2014-06-26,Iraq's women: 'It's only us who understand each other's reality',theobserver
427,2014-06-23,A sad month for Blackadder fans as we mourn the death of Patsy Byrne AKA 'Nursie',theobserver
428,2014-06-21,Philippe Petit interview: 'There is a child inside me that wants to come out',theobserver
429,2014-06-21,Amazon's Jeff Bezos: the man who wants you to buy everything from his company | Observer profile,theobserver
430,2014-06-18,Am I one of Danny Cohen's box set snobs?,theobserver
431,2014-06-14,Is the latest Oxfam advertisement too political?,theobserver
432,2014-06-13,Tens of thousands of tents are discarded at festivals - and I know why,theobserver
433,2014-06-11,Cartoon therapy for sexual abuse  - for people who don't want to read about it,theobserver
434,2014-06-07,Dawn French: first lady of laughter gets back on the road | Observer profile,theobserver
435,2014-06-07,Katy Brand interview: 'Standup is like wearing an uncomfortable coat all day',theobserver
436,2014-06-07,New Radicals 2014: contestants are flooding  in,theobserver
437,2014-06-06,China's Chubby Women: Big bums and bold ideas,theobserver
438,2014-06-06,"Shoplifting is on the rise, but is the way stores deal with it fair?",theobserver
439,2014-06-05,World Cup 2014: Why Brazil is no country for female football players,theobserver
440,2014-06-04,Warring parents need to grow up and act like adults,theobserver
441,2014-05-31,Was YouTube right to take down Elliot Rodger's video?,theobserver
442,2014-05-31,My beautiful motherland is sinking under a growing tide of blood and broken bodies,theobserver
443,2014-05-29,My mixed-race daughter has been called the P-word for the first time,theobserver
444,2014-05-27,"Quietly, a gripping play showing how the Troubles will affect lives for generations",theobserver
445,2014-05-24,Elon Musk: the new It Boy of Silicon Valley | The Observer profile,theobserver
446,2014-05-17,Kerpow! How women used the boy's own world of comic books to further the cause,theobserver
447,2014-05-16,Why do women bear the brunt of infertility treatment ?,theobserver
448,2014-05-16,It's time to stop this competitive sleep deprivation,theobserver
449,2014-05-10,Britain's new radicals 2014: how you can make a positive impact,theobserver
450,2014-05-10,Britain's new radicals show that the best ideas can't be stifled,theobserver
451,2014-05-10,Search is on for Britain's New Radicals,theobserver
452,2014-05-10,Labour's election videos don't work,theobserver
453,2014-05-08,Gender equality starts  in childhood... with the chores,theobserver
454,2014-05-07,"Katie Price, the latest woman to be tied to the internet's whipping post",theobserver
455,2014-05-05,Cabaret - a fun night out with added subversive glamour,theobserver
456,2014-05-05,A week of racist words from Jeremy Clarkson and UKIP - just another day for many British Muslim women,theobserver
457,2014-05-03,Feminism for pre-teens - delivered along with pink nail stickers,theobserver
458,2014-05-03,Jeremy Clarkson: middle England's serial offender strikes again,theobserver
459,2014-05-02,The missing Chibok schoolgirls in Nigeria deserve better,theobserver
460,2014-04-30,Mending a broken heart in Morocco - with overpriced crab,theobserver
461,2014-04-30,'In Pakistan we shoot journalists' - and torture and kidnap them too,theobserver
462,2014-04-27,The kindness of the Muslim men who helped me leave behind my miserable marriage,theobserver
463,2014-04-26,My Dad's ever shrinking veg patch,theobserver
464,2014-04-24,Helen Mirren is wrong - my children love Shakespeare,theobserver
465,2014-04-23,And now - the case against tights that match your skin tone,theobserver
466,2014-04-21,Here comes summer - and I'm shunning the fake tan for fuddy-duddy nude tights,theobserver
467,2014-04-20,Does it matter if two feminists pose with their hand on their hip?,theobserver
468,2014-04-20,Banksy: the artist who's driven to the wall | Observer profile,theobserver
469,2014-04-19,Who made your clothes? It’s time we knew – and cared,theobserver
470,2014-04-19,Don't assume the bar sex pest is drunk - it's more likely he hopes you are,theobserver
471,2014-04-17,Unisex changing rooms are depriving me of getting naked with my fellow women,theobserver
472,2014-04-15,Nigel Evans MP has been cleared of assault but the aftermath of the case is unsettling,theobserver
473,2014-04-14,From Tommy Smith to Brendan Rodgers - a mother's obsession with Liverpool FC,theobserver
474,2014-04-14,The hidden costs of a state education,theobserver
475,2014-04-13,This Christian preacher should not have been allowed to bring her 'witch hunt' into this country,theobserver
476,2014-04-13,The Government has a women problem - and its down to the feminist men to fix it,theobserver
477,2014-04-12,Lawrence Osborne: 'Acclaim. I don't notice it much',theobserver
478,2014-04-12,Prince William continues royal tradition with baby Prince George - working the 'this is women's work' look,theobserver
479,2014-04-09,Knitting and needlework: relaxing hobbies or seditious activities?,theobserver
480,2014-04-08,People who just want to help are the biggest hindrance of all in my kitchen,theobserver
481,2014-04-06,Priced out of the capital city: London is losing its lustre for younger people,theobserver
482,2014-04-06,Foraging for food - 'tis the season of wild garlic,theobserver
483,2014-04-05,Annie Leibovitz: can her magic now bring lustre back to M&S? | Observer profile,theobserver
484,2014-04-05,Cameron's gushing over Waitrose just poked the class-war embers,theobserver
485,2014-04-04,Death of Anja Niedringhaus in Afghanistan - a 'staggeringly shit' day,theobserver
486,2014-04-04,My husband's finally helping with the childcare - but it won't save our marriage,theobserver
487,2014-04-03,The New Strict in our schools is far from family friendly,theobserver
488,2014-04-02,The pill liberating? For me it's stuck in the 60s,theobserver
489,2014-04-01,Laugh? Not at my hijab please,theobserver
490,2014-03-30,Women rowers catch up with men at the Boat Race,theobserver
491,2014-03-30,Want to have a say on Scots' independence? Don't pick the Partick Thistle fan,theobserver
492,2014-03-30,"Ian Hislop: 'I am very, very interested in Britain'",theobserver
493,2014-03-29,Is Hamlet staged too often?,theobserver
494,2014-03-29,"Being an agony aunt is just common sense, says Katharine Whitehorn",theobserver
495,2014-03-28,Why bother with Mother's Day when we're so half-hearted about it?,theobserver
496,2014-03-28,"Hollywood's portrayal of family life is too airbrushed, the reality is far more gritty",theobserver
497,2014-03-28,"Colin Dexter says no one else can ever play Morse, so why do some fictional characters live on?",theobserver
498,2014-03-27,Why should female characters have to “behave”? (semi-spoiler alert),theobserver
499,2014-03-26,Conscious uncoupling? My marital breakdown feels quite the opposite,theobserver
500,2014-03-26,Don't spoil the party - my illness is my business,theobserver
501,2014-03-25,"""Sri Lanka is stuck in the middle of an unfinished war""",theobserver
502,2014-03-25,Binge-drinking women are Britain's litmus test,theobserver
503,2014-03-25,The power of a well-packed lunchbox,theobserver
504,2014-03-24,Got the Monday blues? Try a moti-quote...,theobserver
505,2014-03-24,Caroline Criado-Perez: Women must shout louder,theobserver
506,2014-03-23,Is Kim Kardashian the new 'undeserving celebrity'?,theobserver
507,2014-03-23,Introducing She Said,theobserver
508,2014-03-23,Why jockey Ruby Walsh missed the racing point,theobserver
509,2014-03-23,'I'd have made a lousy mother of a girl',theobserver
510,2014-03-23,"It's a budget for makers, doers and savers – male ones",theobserver
511,2014-03-23,The ghost of Peter Rachman still stalks the halls of Britain's rented properties,theobserver
512,2014-03-23,Welcome to She Said. 'We need you because it's still a man's world',theobserver
513,2014-03-23,Louis Theroux: 'You get to inhabit quite an intimate space',theobserver
514,2014-03-16,George Michael: the superstar who doesn't take life too seriously | Observer profile,theobserver
515,2014-03-11,Rich pickings health pack,theobserver
516,2014-03-09,Simon Rich pickings bathroom sign,theobserver
517,2014-03-09,"John le Carré: Behind the Smiley face, a man of mystery | Observer profile",theobserver
518,2014-03-09,Elizabeth Kolbert: 'The whole world is becoming a kind of zoo',theobserver
519,2014-03-02,Simon Rich pickings Guinness Records,theobserver
520,2014-03-01,Karl Ove Knausgaard: Norway's Proust and a life laid painfully bare | profile,theobserver
521,2014-03-01,The rules | Rafael Behr | Comment is free,theobserver
522,2014-02-21,Andrew Sachs interview: 'John Cleese once hit me so hard I couldn't get up',theobserver
523,2014-02-16,Simon Rich mouthwash,theobserver
524,2014-02-16,Susie Lau interview: 'I still see myself as an interloper',theobserver
525,2014-02-09,Simon Rich Nostradamus,theobserver
526,2014-02-08,Wendi Deng: dizzying rise of the Shanghai star | Observer profile,theobserver
527,2014-02-02,Sara Maitland: 'My subconscious was cleverer than my conscious in choosing to live alone',theobserver
528,2014-02-01,Henning Mankell: chronicler of his own decline | the Observer profile,theobserver
529,2014-01-26,rich pickings magic show,theobserver
530,2014-01-26,Angela Lansbury: return of a star who shines ever brighter | Observer profile,theobserver
531,2014-01-19,Rich Pickings non alcoholic beer,theobserver
532,2014-01-12,Rich Pickings space,theobserver
533,2014-01-12,Linder Sterling: 'Lady Gaga didn't acknowledge I wore a meat dress first',theobserver
534,2014-01-11,Dieudonné: was François Hollande right to support a ban on the comedian?,theobserver
535,2014-01-05,Rich Pickings Oscar Wilde,theobserver
536,2014-01-04,Armistead Maupin: San Francisco's chronicler calls time on his saga | profile,theobserver
537,2015-10-17,The Conservative conference: the Tories’ second term sees society slip further into abyss | the big issue,theobserver
538,2015-10-10,Is Britain simply too ashamed to fund a memorial to slavery? | The big issue,theobserver
539,2015-10-03,Air quality: governments woo the motor industry with dire results | the big issue,theobserver
540,2015-09-26,Let charities take a leading role in discovering antibiotics | the big issue,theobserver
541,2015-09-20,Katherine Parkinson: ‘Comedy is instinctive – you don’t have to do any homework’,theobserver
542,2015-09-19,The new Labour leader: Give Jeremy Corbyn a chance. He’s the best hope we’ve got | the big issue,theobserver
543,2015-09-12,"Despite the bill’s fate, assisted dying is the compassionate way | the big issue",theobserver
544,2015-09-05,The government’s whole attitude towards teaching has to change | the big issue,theobserver
545,2015-09-05,Assisted dying: leaders of faith communities speak out against new bill | the big issue,theobserver
546,2015-08-29,Labour leadership: better back to the 1970s with Jeremy Corbyn than 1870s with Tories | the big issue,theobserver
547,2015-08-22,End-of-life care needs to be better understood and managed| the big issue,theobserver
548,2015-08-08,Neil Kinnock and the Labour party’s vision – or lack of it | the big issue,theobserver
549,2015-08-01,"Museum fees: charging for entry is a pointless, retrograde step | the big issue",theobserver
550,2015-07-25,Labour leadership: a clear and clearly stated vision is what voters need | the big issue,theobserver
551,2015-07-18,We must rethink society to be fair to all age groups | the big issue,theobserver
552,2015-07-11,The Tories’ living wage presents a huge opportunity for Labour | big issue,theobserver
553,2015-07-04,Social segregation is endemic… in both private and state schools | The big issue,theobserver
554,2015-06-20,"Women in science: call Tim Hunt a silly duffer, but don’t destroy his career | the big issue",theobserver
555,2015-06-15,The mystery of the missing remains of the Tuam babies,theobserver
556,2015-06-13,Britain’s potential exit from the EU raises many problems | the big issue,theobserver
557,2015-06-13,What Muslim extremists and rightwing racists have in common,theobserver
558,2015-05-30,James Watt changed history – and the future of our planet | Big issue,theobserver
559,2015-05-23,The depth of anti-EU feeling should not be forgotten,theobserver
560,2015-05-16,General election result: One nation? That’s not what it looks like from where I live,theobserver
561,2015-05-09,Climate change: we must look to international agencies to save the world | the big issue,theobserver
562,2015-05-02,The economy: the government can’t run out of money. That’s simply false,theobserver
