,Date,Content,Section
563,2015-04-25,Zero-hours contracts are a tyranny that must end now | the big issue,theobserver
564,2015-04-18,Electricity pylons: our need for energy must not overwhelm the landscape | the big issue,theobserver
565,2015-04-11,Endless goverment meddling blights teachers and pupils | the big issue,theobserver
566,2015-03-29,"Election 2015: we need progressive politics, not mean, arid accountancy | the big issue",theobserver
567,2015-03-22,When we build new homes we must also build communities | the big issue,theobserver
568,2015-03-15,Selling off our national assets is a wilfully destructive policy | the big issue,theobserver
569,2015-03-14,I have a confession: I want to be an MP,theobserver
570,2015-03-08,Tuition fees: cutting the cost of university will not gain student votes | the big issue,theobserver
571,2015-03-01,Lyse Doucet: ‘Our job is to make sure people don’t turn away’,theobserver
572,2015-03-01,The readers’ editor on … self-censorship and self-regulation,theobserver
573,2015-03-01,Jailing more and more people fails offenders and society | the big issue,theobserver
574,2015-02-15,Teachers are undermined by government interference | the big issue,theobserver
575,2015-02-08,Harper Lee: a late twist in the tale of an adored writer | profile,theobserver
576,2015-02-08,"The NHS needs change, yes. But reform must be intelligent | the big issue",theobserver
577,2015-02-01,Sharon Horgan: comedian with a keen eye and a sharp tongue | Elizabeth Day,theobserver
578,2015-02-01,The economy: we are stymied by greed and fear of change at the top | the big issue,theobserver
579,2015-01-25,"SJ Watson: ‘The internet has this illusion of anonymity, but we give ourselves away’",theobserver
580,2015-01-25,The readers’ editor on… verification | Stephen Pritchard,theobserver
581,2015-01-25,Fracking: we should not believe anything ‘officialdom’ tells us | the big issue,theobserver
582,2015-01-18,Universities must place more emphasis on teaching quality | the big issue,theobserver
583,2017-01-01,Rising stars of 2017: chef Lopè Ariyo,theobserver
584,2016-12-06,‘The Observer frees its writers – you only write well when you are not intimidated’,theobserver
585,2016-12-04,"The Observer: 225 years of ideas, innovations and campaigns",theobserver
586,2016-12-04,‘There are many mysteries surrounding Kim Philby’s appointment at the Observer’,theobserver
587,2016-12-04,"Caitlin Moran: ‘I brought the Observer staff a suitcase of vomit, and they gave me a job’",theobserver
588,2016-12-04,Observer 225 timeline: a liberal voice in a changing world,theobserver
589,2016-12-04,‘Fleet Street legend’ hardly seems to do Vincent Dowling justice,theobserver
590,2016-12-04,‘You feel the history at the Observer as soon as you start to write or edit’,theobserver
591,2016-12-04,‘It has been an immense privilege to carry the Observer pencil’,theobserver
592,2016-12-04,The lion tamer from Lilliput and the birth of Observer photography,theobserver
593,2016-12-04,Patience Akumu: ‘I can express myself in ways I never could in Uganda’,theobserver
594,2016-12-04,‘Kenneth Tynan brilliantly achieved an intellectual slum-clearance of the stage’,theobserver
595,2016-12-04,"The Observer is part of a noble tradition, treating a complex world with compassion",theobserver
596,2016-12-04,‘My revelation of a cloned adult mammal led to predictions that medical science would be transformed’,theobserver
597,2016-12-04,Neal Ascherson: ‘I was right in the middle of the 1960s convulsions throughout Europe’,theobserver
598,2016-12-03,Read all about it: the history that made the Observer’s front page,theobserver
599,2016-09-17,Robbie Coltrane: the jovial giant with an enduring hint of menace,theobserver
600,2016-08-14,"With nightclubs in decline, what does modern Britain get up to after dark?",theobserver
601,2016-08-14,From midnight road movies to small-hours rave: the best culture for night-owls,theobserver
602,2016-07-10,New Note Orchestra: ‘Every single musician has maintained their recovery’,theobserver
603,2016-07-10,Madlug: ‘I don’t want to be a campaigner or a big stick’,theobserver
604,2016-07-10,Abianda: ‘You’re the expert on your life’,theobserver
605,2016-07-10,"Crack + Cider: ‘You can’t say don’t give money, but then not provide a solution’",theobserver
606,2016-07-10,Nail Transphobia: ‘I’m just trying to be everyone’s trans friend’,theobserver
607,2016-07-10,Beatfreeks: ‘So many brands are saying: ‘Our institution is dying”’,theobserver
608,2016-07-10,Euan’s Guide: ‘It’s often the small things that really make a difference’,theobserver
609,2016-07-10,End Youth Homelessness Cymru: ‘Some people's experiences were horrific’,theobserver
610,2016-07-10,The House of St Barnabas: ‘To be invited in is empowering’,theobserver
611,2016-07-10,2016 New Radicals: the story behind this year’s winners,theobserver
612,2016-06-12,"Scenes from the Somme: surreal, sickening spectacle",theobserver
613,2016-02-24,Why does the Queen get her name on everything?,theobserver
614,2016-02-14,New Radicals 2016: how to make a positive impact,theobserver
615,2019-01-06,May I have a word about… flexitarian diets | Jonathan Bouquet,theobserver
616,2019-01-05,"Observer picture archive: Lost and found, part 2",theobserver
617,2018-12-30,The big picture: dreamweaver Christian Dior at work,theobserver
618,2018-12-30,May I have a word about… how the world’s gone boutique | Jonathan Bouquet,theobserver
619,2018-12-29,"Observer picture archive: a dustman in Brixton, 4 January 1953",theobserver
620,2018-12-23,May I have a word about… ugly ad slogans and a beautiful word | Jonathan Bouquet,theobserver
621,2018-12-22,"Observer picture archive: Judy Garland, 28 December 1968",theobserver
622,2018-12-16,May I have a word about… Steve Bannon and his bedroom badinage | Jonathan Bouquet,theobserver
623,2018-12-15,"Observer picture archive: The Daleks, 18 December 1966",theobserver
624,2018-12-09,May I have a word about… Christmassy cascades on the railways | Jonathan Bouquet,theobserver
625,2018-12-08,"Observer picture archive: Batley back streets, 14 December 1974",theobserver
626,2018-12-02,The big picture: if looks could kill... on the streets of Edinburgh,theobserver
627,2018-12-02,May I have a word about… policy speak and Baroness Trumpington | Jonathan Bouquet,theobserver
628,2018-12-01,"Observer picture archive: Coronation Street, 2 December 1962",theobserver
629,2018-11-25,The big picture: an afternoon out at a ‘mine’ in Durham,theobserver
630,2018-11-25,May I have a word about… the Brexit word | Jonathan Bouquet,theobserver
631,2018-11-24,"Observer picture archive: The life of Lee Harvey Oswald, 30 November 1963",theobserver
632,2018-11-18,"May I have a word about… football, data analysis and donkeys | Jonathan Bouquet",theobserver
633,2018-11-17,"Observer picture archive: Jean Cocteau, November 1950",theobserver
634,2018-11-11,Observer picture archive: Lost and found,theobserver
635,2018-11-11,"May I have a word about … testing times for Facebook, Google and co | Jonathan Bouquet",theobserver
636,2018-11-04,The big picture: prêt-à-porter on the gritty streets of Paris,theobserver
637,2018-11-04,"May I have a word about… tropes, chops and malaprops | Jonathan Bouquet",theobserver
638,2018-11-03,"Observer picture archive: Simone Signoret, 6 November 1966",theobserver
639,2018-10-29,"The big picture: discarded shoes in Tijuana, Mexico",theobserver
640,2018-10-28,May I have a word…about sports-washing and cover-ups | Jonathan Bouquet,theobserver
641,2018-10-27,"Observer picture archive: Alf Ramsey, 28 October 1962",theobserver
642,2018-10-21,May I have a word about… doom loops | Jonathan Bouquet,theobserver
643,2018-10-20,"Observer picture archive: Dennis Hopper, 24 October 1982",theobserver
644,2018-10-14,"May I have a word… about toolkits, real and metaphorical | Jonathan Bouquet",theobserver
645,2018-10-13,"Observer picture archive: Gypsies in Hampshire, 14 October 1956",theobserver
646,2018-10-07,"May I have a word… about rotters, twerps and scumbags | Jonathan Bouquet",theobserver
647,2018-10-06,"Observer picture archive: Adam Ant, 9 October 1984",theobserver
648,2018-09-30,May I have a word… about using nouns as verbs | Jonathan Bouquet,theobserver
649,2018-09-29,"Observer picture archive: The postman's picnic, 2 October 1966",theobserver
650,2018-09-23,May I have a word… about Mauricio Pochettino and Eric Cantona | Jonathan Bouquet,theobserver
651,2018-09-22,"Observer picture archive: Anti-Nazis in Nuremberg, 24 September 1969",theobserver
652,2018-09-16,Dogs on the Streets: helping homeless pets and their owners,theobserver
653,2018-09-16,Prison Voicemail: ‘Prisoners’ families are victims of crime as well’,theobserver
654,2018-09-16,Atlantic Pacific: ‘We’re providing lifeboats where there are none’,theobserver
655,2018-09-16,Disrupt Disability: designing wheelchairs with a difference,theobserver
656,2018-09-16,New Radicals 2018: more of Britain’s best social enterprises,theobserver
657,2018-09-16,Impact Hub: ‘You were raised to be embarrassed to be from Birmingham’,theobserver
658,2018-09-16,Mytime: ‘40% of carers have not had a break in over a year’,theobserver
659,2018-09-16,Bureau Local: ‘We want to find and tell the stories that matter in local communities’,theobserver
660,2018-09-16,2018 New Radicals: Michael Sheen introduces this year’s winners,theobserver
661,2018-09-16,The late Swedish photographer Lars Tunbjörk had an unerring eye for contemporary suburban life,theobserver
662,2018-09-16,May I have a word… about Elon Musk and his multiple meltdowns | Jonathan Bouquet,theobserver
663,2018-09-15,"Observer picture archive: Rock Around the Clock, 16 September 1956",theobserver
664,2018-09-09,May I have a word… about mobile phone numpties | Jonathan Bouquet,theobserver
665,2018-09-08,"Observer picture archive: Ibiza, 9 September 1984",theobserver
666,2018-09-02,May I have a word… about super recognisers and other sleuths | Jonathan Bouquet,theobserver
667,2018-09-01,"Observer picture archive: Mick Jagger, 4 September 1964",theobserver
668,2018-08-25,Observer picture archive: The standalone photograph,theobserver
669,2018-08-19,May I have a word… about gobbledegook in the Lake District | Jonathan Bouquet,theobserver
670,2018-08-12,May I have a word… about the mystifying parlance of the City | Jonathan Bouquet,theobserver
671,2018-08-11,"Observer picture archive: Twiggy, 12 August 1966",theobserver
672,2018-08-05,May I have a word… about Hitler’s British traitors | Jonathan Bouquet,theobserver
673,2018-08-04,"Observer picture archive: Glyndebourne, 9 August 1957",theobserver
674,2018-07-29,"Observer picture archive: Cross-channel swimmers, 3 August 1963",theobserver
675,2018-07-29,May I have a word… about potting trees and dotting i’s | Jonathan Bouquet,theobserver
676,2018-07-22,"Observer picture archive: The Prague Spring, 27 July 1968",theobserver
677,2018-07-22,May I have a word… about marketing speak | Jonathan Bouquet,theobserver
678,2018-07-15,"Observer picture archive: In Franco's Spain, 15 July 1959",theobserver
679,2018-07-15,May I have a word about… family-friendly pubs | Jonathan Bouquet,theobserver
680,2018-07-08,The big picture: romance in rave-era Wirral,theobserver
681,2018-07-08,Master a roadman’s vocabulary and your teenager might be easier to understand… | Vanessa Thorpe,theobserver
682,2018-07-01,"Observer picture archive: The Rolling Stones in Hyde Park, 5 July 1969",theobserver
683,2018-07-01,May I have a word about… economics? | Jonathan Bouquet,theobserver
684,2018-06-24,May I have a word about… Geraldine McCaughrean and ‘difficult’ children’s words | Jonathan Bouquet,theobserver
685,2018-06-17,"Observer picture archive: Teddy boys and teddy girls, 19 June 1955",theobserver
686,2018-06-17,May I have a word about… the lexicon of the World Cup | Jonathan Bouquet,theobserver
687,2018-06-10,May I have a word about… words that make us squirm? | Jonathan Bouquet,theobserver
688,2018-06-03,"May I have a word about... national treasures, real and fake | Jonathan Bouquet",theobserver
689,2018-06-02,The big picture: America says goodbye to Robert F Kennedy,theobserver
690,2018-05-27,"Observer picture archive: Cross-border ravers, 29 May 1993",theobserver
691,2018-05-27,May I have a word about… the Chelsea flower show having a moment? | Jonathan Bouquet,theobserver
692,2018-05-20,"Observer picture archive: Rollermania, 23 May 1975",theobserver
693,2018-05-20,May I have a word about… Goldilocks? | Jonathan Bouquet,theobserver
694,2018-05-13,"Observer picture archive: The Gorbals, 18 May 1968",theobserver
695,2018-05-13,May I have a word about… impenetrable sentences? | Jonathan Bouquet,theobserver
696,2018-05-06,"Observer picture archive: Road wrecks, 6 May 1966",theobserver
697,2018-05-06,May I have a word about… issues? | Jonathan Bouquet,theobserver
698,2018-04-29,"Observer picture archive: The Carnation Revolution, 5 May 1974",theobserver
699,2018-04-29,May I have a word about… the excessive use of ‘eye-watering’ | Jonathan Bouquet,theobserver
700,2018-04-22,"Observer picture archive: Patricia Highsmith, 27 April 1980",theobserver
701,2018-04-22,May I have a word about… bullets? | Jonathan Bouquet,theobserver
702,2018-04-15,"Observer picture archive: Cardboard city, 23 April 1989",theobserver
703,2018-04-15,May I have a word about… the business of buying a coffee? | Jonathan Bouquet,theobserver
704,2018-04-08,"Observer picture archive: Mods at the Greyhound,  11 April 1980",theobserver
705,2018-03-31,"Observer picture archive: Eurovision Song Contest, 6 April 1968",theobserver
706,2018-03-24,"Observer picture archive: Torrey Canyon disaster, 26 March 1967",theobserver
707,2018-03-18,50 New Radicals for 2018: how you can make a difference,theobserver
708,2018-03-18,Top social justice award for Cracked It smartphone project,theobserver
709,2018-03-17,"Observer picture archive: Quentin Crisp, 16 March 1978",theobserver
710,2018-03-04,"Observer picture archive: Muhammad Ali in Miami, 7 March 1971",theobserver
711,2018-02-25,"Observer picture archive: Voting in Rhodesia, 2 March 1980",theobserver
712,2018-02-04,"Observer picture archive: Barbara Windsor in The Threepenny Opera, 2 February 1972",theobserver
713,2018-01-28,"The big picture: Giorgi’s Cafe, Bethnal Green Road, London, 1971",theobserver
714,2018-01-28,"Observer picture archive: Robert Kennedy at the Oxford Union, 28 January 1967",theobserver
715,2018-01-21,"Observer picture archive: Hymns in the chapel, 24 January 1965",theobserver
716,2019-12-29,May I have a word about… why ‘wardrobing’ should be outlawed | Jonathan Bouquet,theobserver
717,2019-12-15,May I have a word about… lasers and their more unusual uses | Jonathan Bouquet,theobserver
718,2019-12-01,The big picture: the fading of hope in post-apartheid South Africa,theobserver
719,2019-12-01,May I have a word about… how to order a drink properly | Jonathan Bouquet,theobserver
720,2019-11-24,The big picture: a handbag's grown-up secrets,theobserver
721,2019-11-17,May I have a word about... the revival of gongoozling | Jonathan Bouquet,theobserver
722,2019-11-03,May I have a word about… the translator’s unhappy lot | Jonathan Bouquet,theobserver
723,2019-10-20,May I have a word about… frozen robot syndrome | Jonathan Bouquet,theobserver
724,2019-10-06,May I have a word about… the ‘bastard corner’ | Jonathan Bouquet,theobserver
725,2019-09-22,May I have a word about… Facebook claiming the word ‘book’ | Jonathan Bouquet,theobserver
726,2019-09-15,May I have a word about… perking up your pet the hi-tech way | Jonathan Bouquet,theobserver
727,2019-09-08,The big picture: Honduran migrants on their way to the US border,theobserver
728,2019-09-08,May I have a word about… premiumisation and resurrecting the post of hospitaller | Jonathan Bouquet,theobserver
729,2019-09-02,From the Blitz to Brexit: how society changed after the second world war,theobserver
730,2019-09-02,Lost empire: it’s a myth that Britain stood alone against Hitler,theobserver
731,2019-09-02,"Culture and conflict: how the second world war transformed  fashion, food, arts and tech",theobserver
732,2019-09-01,Brave new world: the search for peace after the second world war,theobserver
733,2019-09-01,Into the storm: the horror of the second world war,theobserver
734,2019-09-01,May I have a word about … comparisons that are a load of bananas | Jonathan Bouquet,theobserver
735,2019-08-25,"The big picture: a day of sand, sea and cycles",theobserver
736,2019-08-25,May I have a word about… Boris Johnson’s linguistic prowess | Jonathan Bouquet,theobserver
737,2019-08-18,May I have a word about… commuter woes | Jonathan Bouquet,theobserver
738,2019-08-11,May I have a word about… our love affair with the French language | Jonathan Bouquet,theobserver
739,2019-08-04,May I have a word about… the consistency of gruel | Jonathan Bouquet,theobserver
740,2019-07-28,May I have a word about… everyone going on a journey | Jonathan Bouquet,theobserver
741,2019-07-21,May I have a word about… the BBC’s ‘support visits’ to people over 75 | Jonathan Bouquet,theobserver
742,2019-07-14,May I have a word about… delightful phrases on the at-risk list | Vanessa Thorpe,theobserver
743,2019-07-07,May I have a word about… the bliss of noctilucent clouds | Jonathan Bouquet,theobserver
744,2019-06-30,May I have a word about... Mercedes-Benz and its failure to own up,theobserver
745,2019-06-23,May I have a word about… Boris Johnson and the Tory leadership race | Jonathan Bouquet,theobserver
746,2019-06-16,The big picture: funny faces and quick canapes on a couple’s big day,theobserver
747,2019-06-16,May I have a word about… the intriguing profession of cryptozoology | Jonathan Bouquet,theobserver
748,2019-06-09,May I have a word about… the brave new world of banking and fintech | Jonathan Bouquet,theobserver
749,2019-06-02,May I have a word about… Kate Moss and Emma Thompson | Jonathan Bouquet,theobserver
750,2019-06-01,"Observer picture archive: Cassius Clay in London, 30 May 1963",theobserver
751,2019-05-26,May I have a word about… forest bathing with the Duchess of Cambridge | Jonathan Bouquet,theobserver
752,2019-05-25,"Observer picture archive: on a kibbutz, 26 May 1958",theobserver
753,2019-05-19,May I have a word about… Pegasus spyware | Jonathan Bouquet,theobserver
754,2019-05-18,"Observer picture archive: Bridget Riley, 25 May 1969",theobserver
755,2019-05-12,May I have a word... about Groucho Marx and the pleasures of a paraprosdokian | Jonathan Bouquet,theobserver
756,2019-05-11,"Observer picture archive: students demonstrate in Paris, 10 May 1968",theobserver
757,2019-05-05,May I have a word about… English football’s debt to Argentina | Jonathan Bouquet,theobserver
758,2019-05-04,"Observer picture archive: Old Bill the beggar, 11 May 1969",theobserver
759,2019-04-28,May I have a word about… headless body in topless bar | Jonathan Bouquet,theobserver
760,2019-04-27,"Observer picture archive: nurses pay protest, 28 April 1962",theobserver
761,2019-04-21,May I have a word about… Joey Barton and South Yorkshire police | Jonathan Bouquet,theobserver
762,2019-04-20,"Observer picture archive: Women of Whitby, 27 April 1969",theobserver
763,2019-04-14,May I have a word about ... the confusion caused by City terminology,theobserver
764,2019-04-13,"Observer picture archive: Shirley Bassey, 16 April 1970",theobserver
765,2019-04-07,"May I have a word about… hubs, upticks and spikes | Jonathan Bouquet",theobserver
766,2019-04-06,"Observer picture archive: Jayne Mansfield, 7 April 1967",theobserver
767,2019-03-31,May I have a word about… Mike Lynch and tech’s ‘trial of the century’ | Jonathan Bouquet,theobserver
768,2019-03-30,"Observer picture archive: Harold Wilson, 5 April 1969",theobserver
769,2019-03-24,May I have a word about... the many multiple sins against English | Jonathan Bouquet,theobserver
770,2019-03-23,"Observer picture archive: Billie Whitelaw, 28 March 1969",theobserver
771,2019-03-17,"Observer picture archive: My clothes and I, by Simone de Beauvoir, 20 March 1960",theobserver
772,2019-03-17,May I have a word about… the ludicrous language of Boris Johnson | Jonathan Bouquet,theobserver
773,2019-03-10,May I have a word about… Iain Duncan Smith and his ‘London tsar’ | Jonathan Bouquet,theobserver
774,2019-03-09,"Observer picture archive: butcher's window, 11 March 1951",theobserver
775,2019-03-03,May I have a word about… the Kalashnikov kamikaze drone | Jonathan Bouquet,theobserver
776,2019-03-02,"Observer picture archive: Fleet Street at closing time, 6 March 1988",theobserver
777,2019-02-24,"May I have a word about… actors, hackers and shape-shifting balls | Jonathan Bouquet",theobserver
778,2019-02-23,"Observer picture archive: bidders at Sotheby's, 25 February 1954",theobserver
779,2019-02-17,May I have a word about… the not-so insightful language of academe | Jonathan Bouquet,theobserver
780,2019-02-16,"Observer picture archive: Anjelica Huston, 22 February 1969",theobserver
781,2019-02-10,May I have a word about… Richard Sorge and Courtney Lawes | Jonathan Bouquet,theobserver
782,2019-02-09,"Observer picture archive: Count Basie, 15 February 1959",theobserver
783,2019-02-03,May I have a word about… vortexes | Jonathan Bouquet,theobserver
784,2019-02-02,"Observer picture archive: char ladies of the Foreign Office, 4 February 1968",theobserver
785,2019-01-27,May I have a word about… the finer points of fashion | Jonathan Bouquet,theobserver
786,2019-01-26,"Observer picture archive: Lost and found, part 3",theobserver
787,2019-01-20,May I have a word about… Marcelo Bielsa | Jonathan Bouquet,theobserver
788,2019-01-19,"Observer picture archive: a bummaree, 22 January 1956",theobserver
789,2019-01-13,May I have a word about… the Consumer Electronics Show | Jonathan Bouquet,theobserver
790,2019-01-12,"Observer picture archive: the Algerian war, 13 January 1962",theobserver
791,2021-01-03,"The big picture: the right kind of snow, London 2009",theobserver
792,2020-12-27,"The big picture: the women of Water Valley, Mississippi",theobserver
793,2020-12-27,May I have a word about… the need for the government to speak with one voice | Jonathan Bouquet,theobserver
794,2020-12-20,"The big picture: Santa takes a coffee break, New York, 1962",theobserver
795,2020-12-13,"May I have a word about… Boris Johnson, in granular detail | Jonathan Bouquet",theobserver
796,2020-11-15,May I have a word about… the language of epidemiologists | Jonathan Bouquet,theobserver
797,2020-11-01,May I have a word about… the seven political tribes | Jonathan Bouquet,theobserver
798,2020-10-18,May I have a word about… when John Terry got too big for his boots | Jonathan Bouquet,theobserver
799,2020-10-04,May I have a word about… young people’s bafflement at being betrothed | Jonathan Bouquet,theobserver
800,2020-09-27,The big picture: cafe culture on the road,theobserver
801,2020-09-20,May I have a word about… the rebranding of Thomas Cook | Jonathan Bouquet,theobserver
802,2020-09-06,May I have a word about… Boris Johnson being all at sea | Jonathan Bouquet,theobserver
803,2020-08-23,May I have a word about… the magnificently raffish Simon Raven | Jonathan Bouquet,theobserver
804,2020-08-09,May I have a word about… the Chichester cathedral experience | Jonathan Bouquet,theobserver
805,2020-07-26,May I have a word about… why there’s no room for doubt in politics today | Jonathan Bouquet,theobserver
806,2020-07-12,May I have a word about… why it’s a bloodbath on the streets | Jonathan Bouquet,theobserver
807,2020-07-05,The big picture: summer camp goodbyes,theobserver
808,2020-06-28,"The big picture: girl in the dust, Somerset",theobserver
809,2020-06-28,May I have a word about the sudden arrival of legions of cohorts? | Jonathan Bouquet,theobserver
810,2020-06-21,"The big picture: voyage of discovery, Sydney, 2018",theobserver
811,2020-06-14,"May I have a word about… carnage, carnage everywhere | Jonathan Bouquet",theobserver
812,2020-06-07,"The big picture: dancing in Dublin, 1980",theobserver
813,2020-05-31,The demystification of Kim Jong-un | Jonathan Bouquet,theobserver
814,2020-05-17,The big picture: a pause during celebrations in 90s Bulgaria,theobserver
815,2020-05-10,The big picture: America's wild young women,theobserver
816,2020-05-03,May I have a word about… smelling a good book | Jonathan Bouquet,theobserver
817,2020-04-26,The big picture: Paul Almasy and the 'grey sisters' of Paris,theobserver
818,2020-04-19,May I have a word about… ‘Chopper’ Harris and other top nicknames | Jonathan Bouquet,theobserver
819,2020-04-12,"The big picture: look, no hands! Easter in Cardiff, 1937",theobserver
820,2020-04-05,May I have a word about… bidding farewell to the furlough | Jonathan Bouquet,theobserver
821,2020-03-22,"May I have a word about… contangos, craters and North Korea | Jonathan Bouquet",theobserver
822,2020-03-08,May I have a word about… Cobra and coronavirus | Jonathan Bouquet,theobserver
823,2020-02-23,May I have a word about… utility firms digging a hole for themselves | Jonathan Bouquet,theobserver
824,2020-02-23,The big picture: at home with Mr and Mrs Picasso,theobserver
825,2020-02-09,May I have a word about… being left all at sea by civilianisation | Jonathan Bouquet,theobserver
