,Date,Content,Section
284,2014-10-15,"By offering to freeze their employees’ eggs, Apple and Facebook make it clear they don’t know what women want",women-in-leadership
285,2014-10-15,"The company that plays together, stays together: why a bit of playtime works",women-in-leadership
286,2014-10-14,Beating the buoys: the all-female team taking on the Volvo Ocean Race,women-in-leadership
287,2014-10-13,How I managed a career and caring for my disabled son,women-in-leadership
288,2014-10-08,"If we want more women in tech, we need to sweat the small stuff",women-in-leadership
289,2014-10-07,Advice for my younger self: Find your stretch zone,women-in-leadership
290,2014-10-06,The unwritten rules of work and why you should break them,women-in-leadership
291,2014-10-03,"10 mins with: Heather Jackson, founder of An Inspirational Journey",women-in-leadership
292,2014-10-01,Flexible working: why do we treat it as a women-only issue?,women-in-leadership
293,2014-09-30,"To my younger self: stop, collaborate and listen",women-in-leadership
294,2014-09-29,Diversity is a bombastic buzzword and I'm over it,women-in-leadership
295,2014-09-26,"Nancy Honey: I wanted to discover these amazing, strong women that no-one had ever heard of",women-in-leadership
296,2014-09-25,Family values: would you start a business with your sister?,women-in-leadership
297,2014-09-24,Hackers are trying to silence Emma Watson by leaking nude photos - but they only made her voice louder,women-in-leadership
298,2014-09-24,"Money talks: why women need to invest cash, not just time, in other women",women-in-leadership
299,2014-09-23,"Advice to my younger self: “Shyness is part of who you are, so embrace it”",women-in-leadership
300,2014-09-22,Rajita Chaudhuri: the author and entrepreneur on business and luck,women-in-leadership
301,2014-09-19,The real Riot Club: does workplace inequality start at university?,women-in-leadership
302,2014-09-18,"Watch out boys, women are getting smarter, faster",women-in-leadership
303,2014-09-17,Defining yourself as a mumpreneur is a powerful statement,women-in-leadership
304,2014-09-16,Superman style leaders are alienating women: why can't we solve this?,women-in-leadership
305,2014-09-15,Women who don't help other women: myth or reality?,women-in-leadership
306,2014-09-12,five tips for men who want to support gender equality at work,women-in-leadership
307,2014-09-11,How to build a business from a blog: our top tips,women-in-leadership
308,2014-09-10,‘Clothing doesn’t protect women from disrespect’,women-in-leadership
309,2014-09-09,To my younger self: here are a few things I wish you'd known,women-in-leadership
310,2014-09-08,How to get a job without any relevant experience,women-in-leadership
311,2014-09-07,"Five links for inspiration including Gisele, Joan Rivers and job spec fear",women-in-leadership
312,2014-09-05,Five Joan Rivers quotes working women should live by,women-in-leadership
313,2014-09-05,Female coders modelling underwear while they work: sexist or empowering?,women-in-leadership
314,2014-09-03,Head to head: How much experience do you need to start your own business?,women-in-leadership
315,2014-09-02,Ability not fertility: why do we define professional women by their family?,women-in-leadership
316,2014-09-01,Enough is enough: why we all need to stand up to the gender pay gap,women-in-leadership
317,2014-08-29,"From Bake Off to the office, why team players are overrated",women-in-leadership
318,2014-08-28,Video: How empathy in the workplace can revolutionise business,women-in-leadership
319,2014-08-26,Female experts: why do we ignore them?,women-in-leadership
320,2014-08-25,Take a break: how I learned to relax and reboot,women-in-leadership
321,2014-08-22,A female comedian at the Edinburgh Festival must be resilient. Or stupid,women-in-leadership
322,2014-08-21,Hitting targets: how Linklaters plan to increase their number of female partners,women-in-leadership
323,2014-08-20,"Women working in low paid, insecure or temporary roles on the rise",women-in-leadership
324,2014-08-19,Five ways to end the gender pay gap,women-in-leadership
325,2014-08-18,John Simpson’s comments should only cheer the ‘tough women’ at the BBC,women-in-leadership
326,2014-08-15,'I was young enough to start again if it didn't work out',women-in-leadership
327,2014-08-14,My former boss taught me that not all men are sexist. Some are just shy,women-in-leadership
328,2014-08-12,Sarah Wood: I left academia for tech,women-in-leadership
329,2014-08-11,We won our company because values are more important than profit,women-in-leadership
330,2014-08-08,"After ten years out of the workplace, I now have the job of my dreams. This is how I did it",women-in-leadership
331,2014-08-07,Women on boards: is a lack of supply really the issue?,women-in-leadership
332,2014-08-06,Six degrees of separation: why you need to network,women-in-leadership
333,2014-08-06,The truth hurts: why we shouldn't care that women are more likely to be lied to,women-in-leadership
334,2014-08-05,Women and humour: just what are we so scared of?,women-in-leadership
335,2014-08-04,"I had to start my own business, work was just 'school for grown-ups'",women-in-leadership
336,2014-08-01,You swine! How to manage a chauvinist pig at work,women-in-leadership
337,2014-07-31,Ten minutes with: the publishing director of Elle UK,women-in-leadership
338,2014-07-29,Wondering where the women are in TV's Silicon Valley? There aren't any,women-in-leadership
339,2014-07-25,Put your money where your mouth is: why the pay gap is widening,women-in-leadership
340,2014-07-25,"10 mins with: Katie Derham, presenter of the BBC's Proms 2014 coverage",women-in-leadership
341,2014-07-24,Returning from maternity leave: our top tips,women-in-leadership
342,2014-07-23,Why Bob the Builder is keeping women out of construction,women-in-leadership
343,2014-07-22,I thought I could balance work and motherhood. My company didn't agree,women-in-leadership
344,2014-07-17,Timeline: women in the UK cabinet,women-in-leadership
345,2014-07-14,Universities need to help women beat the gender pay gap,women-in-leadership
346,2014-07-11,How to make sure your Kickstarter campaign succeeds,women-in-leadership
347,2014-07-10,How mentoring 'like a girl' can help create a more diverse working world,women-in-leadership
348,2014-07-09,New report reveals lack of women at top level of sports industry,women-in-leadership
349,2014-07-08,Women of colour in tech: challenging the status quo,women-in-leadership
350,2014-07-07,Entrepreneur Barbie: stop telling girls that business values appearance,women-in-leadership
351,2014-07-02,The tech industry gender gap: what we can learn from Europe,women-in-leadership
352,2014-06-30,London revealed to have lowest percentage of female directors,women-in-leadership
353,2014-06-27,Five lessons in leadership from the UK's smartest women,women-in-leadership
354,2014-06-25,"10 minutes with ... Caroline Rush, chief executive of the British Fashion Council",women-in-leadership
355,2014-06-23,I went from ballet dancer to CEO and this is what it taught me,women-in-leadership
356,2014-06-23,National Women in Engineering Day: six Twitter accounts to follow,women-in-leadership
357,2014-06-20,How millennial women are redefining leadership at work,women-in-leadership
358,2014-06-19,How to pitch to venture capitalists,women-in-leadership
359,2014-06-18,Can empathy really work in a business world dominated by testosterone?,women-in-leadership
360,2014-06-18,How to manage workplace stress in five simple steps,women-in-leadership
361,2014-06-16,National women in engineering day: the battle to be taken seriously,women-in-leadership
362,2014-06-16,I like being 'one of the boys',women-in-leadership
363,2014-06-10,Live Q&A: How to manage stress levels at work,women-in-leadership
364,2014-06-10,"Arianna Huffington discusses meditation, balance and the importance of sleep - video",women-in-leadership
365,2014-06-09,How meditation brought me back from burnout,women-in-leadership
366,2014-06-03,Small charities need your support – says the founder of Localgiving.com,women-in-leadership
367,2014-06-02,"Kirstie Allsopp is right about one thing: work and education are for life, not just your 20s",women-in-leadership
368,2014-06-02,Head to head: does the confidence gap exist?,women-in-leadership
369,2014-05-30,10 minutes with: the founder of mybeautycompare.com,women-in-leadership
370,2014-05-29,Working mother guilt: flexibility and trust are the only solutions,women-in-leadership
371,2014-05-28,Want to get more women in tech? Ditch the beanbags,women-in-leadership
372,2014-05-27,"Harriet Green: ""I don't give a damn whether people like me""",women-in-leadership
373,2014-05-23,Failing to tackle Richard Scudamore over sexism is a red card for the FA,women-in-leadership
374,2014-05-22,Accountancy is top sector for supporting and retaining female talent,women-in-leadership
375,2014-05-21,Rise of the 'weekend creative',women-in-leadership
376,2014-05-20,How female PhD students are driving business growth in the Middle East,women-in-leadership
377,2014-05-19,Jill Abramson and the confidence gap,women-in-leadership
378,2014-05-16,How the New York Times could end rumours about Jill Abramson's salary,women-in-leadership
379,2014-05-15,Sally Field: why I'd choose politics over Hollywood,women-in-leadership
380,2014-05-14,How to create a more inclusive workplace culture,women-in-leadership
381,2014-05-14,Helena Costa: A new era for the beautiful game?,women-in-leadership
382,2014-05-13,Women in business and the perils of 'cotton wool culture',women-in-leadership
383,2014-05-12,"Lights, camera, inaction: women directors cut out of British TV",women-in-leadership
384,2014-05-12,Why does no one ask what I did before having children?,women-in-leadership
385,2014-05-09,"Single, female and under 30? You're the top choice for a job abroad",women-in-leadership
386,2014-05-07,The Ahrendts effect: what Apple should look out for,women-in-leadership
387,2014-05-06,Women hold the key to economic growth in Iraq,women-in-leadership
388,2014-05-02,A well-designed environment motivates staff and can help your business thrive,women-in-leadership
389,2014-05-01,Women CEOs are a risky business? What nonsense,women-in-leadership
390,2014-05-01,How unconscious bias holds us back,women-in-leadership
391,2014-04-30,Live Q&A: how to improve your negotiation skills,women-in-leadership
392,2014-04-30,Five ways to be a negotiation superhero,women-in-leadership
393,2014-04-29,Female CEOs are more likely to be sacked than their male colleagues,women-in-leadership
394,2014-04-29,Negotiation: is it a man's game?,women-in-leadership
395,2014-04-28,10 minutes with: Tash Whitmey of Havas EHS,women-in-leadership
396,2014-04-28,Deal or no deal? Five common mistakes people make when negotiating deals,women-in-leadership
397,2014-04-24,How flexible working is good for you - and for your career,women-in-leadership
398,2014-04-23,How to create more young female entrepreneurs,women-in-leadership
399,2014-04-22,5 tips for improving your personal brand online,women-in-leadership
400,2014-04-17,Sexism in the UK is rife – we need to challenge the status quo,women-in-leadership
401,2014-04-17,"For women in business, there's no such thing as 'harmless banter'",women-in-leadership
402,2014-04-17,Live Q&A: how to tackle bullying and harassment at work,women-in-leadership
403,2014-04-16,Facebook's Sheryl Sandberg: 'I don't plan on running for political office'  - video,women-in-leadership
404,2014-04-16,Returnships: A bridge back to work for women leaders,women-in-leadership
405,2014-04-15,Why the creative industries still offer the most inspiring environment for women leaders,women-in-leadership
406,2014-04-14,The Mad Men legacy: why are women still under-represented in advertising?,women-in-leadership
407,2014-04-11,Think authenticity is about being honest and open? Think again,women-in-leadership
408,2014-04-11,10 minutes with: Dame Barbara Stocking,women-in-leadership
409,2014-04-10,Embarrassing and awkward: the new ministers for women and equality,women-in-leadership
410,2014-04-08,"Lindsay Pattison: ""My next role? My boss's job""",women-in-leadership
411,2014-04-07,Why a chocolate bar is keeping women out of construction,women-in-leadership
412,2014-04-04,Four groups bringing together women in tech,women-in-leadership
413,2014-04-03,If we want more African women as business leaders we need to embrace quotas,women-in-leadership
414,2014-04-02,52% of women have been bullied or harassed at work in the past three years,women-in-leadership
415,2014-04-02,How to be a braver entrepreneur,women-in-leadership
416,2014-04-01,10 women to watch at Advertising Week Europe 2014,women-in-leadership
417,2014-03-31,How this seven word advert for female engineers in Jordan attracted 700 responses,women-in-leadership
418,2014-03-28,Dealing with divorce at work: what we can all learn from Gwyneth Paltrow,women-in-leadership
419,2014-03-27,Ten minutes with: Mary Whenman of Weber Shandwick,women-in-leadership
420,2014-03-26,"In honour of Diana Ross, can we reclaim the word ""diva""?",women-in-leadership
421,2014-03-26,Women represent over 20% of FTSE 100 board members for first time,women-in-leadership
422,2014-03-25,70% of women fear taking a career break,women-in-leadership
423,2014-03-24,One in five men believes his employer is actively opposed to fathers sharing parental leave,women-in-leadership
424,2014-03-24,Why women are fighting an uphill battle on military language,women-in-leadership
425,2014-03-21,Meet the scientists behind Cancer Research UK's Women of Influence,women-in-leadership
426,2014-03-20,Celebrate Women's History Month by mobilising your resources,women-in-leadership
427,2014-03-19,"Open thread: If we're banning bossy, which other words need a rebrand?",women-in-leadership
428,2014-03-19,10 minutes with: News editor Cristina Nicolotti Squires,women-in-leadership
429,2014-03-18,Female lawyers over 30 earning 25% less than the men,women-in-leadership
430,2014-03-17,Event: the Guardian introduces Sheryl Sandberg,women-in-leadership
431,2014-03-17,"Sheryl Sandberg's ""ban bossy"" campaign shows we still don't think of women as leaders",women-in-leadership
432,2014-03-14,Fiona Reynolds: I'm on my third glass ceiling,women-in-leadership
433,2014-03-13,The trouble with money,women-in-leadership
434,2014-03-12,"Tips for a safe, successful business trip",women-in-leadership
435,2014-03-11,Building bridges for women in the construction industry,women-in-leadership
436,2014-03-10,The corporate conundrum: are women on board or jumping ship?,women-in-leadership
437,2014-03-09,10 women who are changing the face of the City,women-in-leadership
438,2014-03-08,Anne-Marie Slaughter: we could see a female president in 2016,women-in-leadership
439,2014-03-08,This International Women's Day stop and check your bias,women-in-leadership
440,2014-03-07,Live gallery: see the best from our International Women's Day campaign,women-in-leadership
441,2014-03-07,Five pieces of advice for International Women's Day 2014,women-in-leadership
442,2014-03-06,"Live blog: 6th annual WEPs event, gender equality and the global jobs challenge",women-in-leadership
443,2014-03-06,Three pieces of advice entrepreneurs should ignore,women-in-leadership
444,2014-03-05,Why Wales' traditional gender roles hold women back,women-in-leadership
445,2014-03-05,"I was a woman laughing alone with salad, it's really not that funny",women-in-leadership
446,2014-03-04,New report calls for greater transparency from headhunters,women-in-leadership
447,2014-03-03,Open thread: how do we make International Women's Day 2014 count?,women-in-leadership
448,2014-02-28,"Vanesa Tate, sound designer",women-in-leadership
449,2014-02-28,"Tina Jones, set decorator",women-in-leadership
450,2014-02-28,"Sharon Smith, supervising art director, creature design",women-in-leadership
451,2014-02-28,"Rose Wicksteed, casting director",women-in-leadership
452,2014-02-28,"Rachel Portman, composer",women-in-leadership
453,2014-02-28,"Nadia Stacey, makeup artist",women-in-leadership
454,2014-02-28,"Laura Lovejoy, dialogue editor",women-in-leadership
455,2014-02-28,"Kristina Hetherington, film editor",women-in-leadership
456,2014-02-28,"Keziah Bailey, digital artist",women-in-leadership
457,2014-02-28,"Kate Reid, cinematographer",women-in-leadership
458,2014-02-28,"Kate Molins, focus puller",women-in-leadership
459,2014-02-28,"Julie Baines, executive producer",women-in-leadership
460,2014-02-28,"Jacqueline Abrahams, production designer",women-in-leadership
461,2014-02-28,"Jackie Thorogood, production manager",women-in-leadership
462,2014-02-28,"Hayley Gibbs, prop maker",women-in-leadership
463,2014-02-28,"Eri Adachi, compositor",women-in-leadership
464,2014-02-28,"Emma Friend, clapper loader",women-in-leadership
465,2014-02-28,"Emily Greenwood, online editor",women-in-leadership
466,2014-02-28,"Deloris Collins, digital imaging technician",women-in-leadership
467,2014-02-28,"Carolina Schmidtholstein, gaffer",women-in-leadership
468,2014-02-28,"Amma Asante, director",women-in-leadership
469,2014-02-28,"Amanda Foster, stunt producer and performer",women-in-leadership
470,2014-02-28,"Abigail Payne, lawyer",women-in-leadership
471,2014-02-27,"10 female directors you, and the Academy, should keep an eye on",women-in-leadership
472,2014-02-26,10 minutes with: Hollywood scriptwriter Anna Waterhouse,women-in-leadership
473,2014-02-25,"Film directing may be a man's world, but not for long",women-in-leadership
474,2014-02-24,Gabrielle Tana: producing Philomena was a huge responsibility,women-in-leadership
475,2014-02-21,Forget arbitrary targets and quotas. The correct figure for women in leadership is 50%,women-in-leadership
476,2014-02-20,For International Women's Day join our campaign to #BeYourselfAtWork,women-in-leadership
477,2014-02-19,Do you know what your best work will look like?,women-in-leadership
478,2014-02-19,Are women having to achieve more in the classroom to get the top jobs?,women-in-leadership
479,2014-02-18,We need to make ageism in the workplace old news,women-in-leadership
480,2014-02-17,Six things I know: tech entrepreneur Ping Fu on why life is a mountain range,women-in-leadership
481,2014-02-14,Two heads are better than one: the power of shared leadership,women-in-leadership
482,2014-02-13,"Like Lottie Dexter, I'm a technology imposter. And I'm fine with it",women-in-leadership
483,2014-02-12,"10 minutes with: Joanna Prior, managing director of Penguin General",women-in-leadership
484,2014-02-11,Leaders need to speak from the heart on gender diversity,women-in-leadership
485,2014-02-10,Don't want to lose your kids in the divorce? Don't be the breadwinner,women-in-leadership
486,2014-02-07,Rising from the ashes: Christine Hodgson on fighting fires and winning,women-in-leadership
487,2014-02-06,10 minutes with: a female pilot,women-in-leadership
488,2014-02-05,The plan behind Lloyds' goal of gender equality by 2020,women-in-leadership
489,2014-02-04,"'Match your car to your nail varnish?' Stop patronising us, Citroen",women-in-leadership
490,2014-02-03,Vince Cable: companies still not doing enough to get women on boards,women-in-leadership
491,2014-01-31,The challenge of achieving a gender-balanced boardroom,women-in-leadership
492,2014-01-31,"It's not just Cameron who has a woman problem, it's the whole political system",women-in-leadership
493,2014-01-30,Addressing the under-representation of women in Parliament,women-in-leadership
494,2014-01-30,Addressing the under-representation of women in Parliament,women-in-leadership
495,2014-01-29,Stop being in awe of star performers,women-in-leadership
496,2014-01-28,Is 'sharism' the future for building business value?,women-in-leadership
497,2014-01-27,Sexual harassment: a simple apology isn't enough,women-in-leadership
498,2014-01-24,Decoding the fallout from Birmingham city council's equal pay cases,women-in-leadership
499,2014-01-24,"Carrie Hindmarsh: motherhood, cancer and the importance of optimism",women-in-leadership
500,2014-01-23,"Mothers are 'worth less', Nigel Farage? Don't make me yawn",women-in-leadership
501,2014-01-23,More women at Davos? Not at this rate,women-in-leadership
502,2014-01-21,Facing up to gender inequality in the public sector,women-in-leadership
503,2014-01-20,Three simple steps to becoming a better manager,women-in-leadership
504,2014-01-17,"10 minutes with: Anna Bance, co-founder of Girl Meets Dress | Harriet Minter",women-in-leadership
505,2014-01-16,The Paula Principle: why part-time work holds women back,women-in-leadership
506,2014-01-15,Maternity leave: managing the guilt of returning to work,women-in-leadership
507,2014-01-14,10 women in architecture to watch in 2014,women-in-leadership
508,2014-01-13,Sexism in architecture: on the rise,women-in-leadership
509,2014-01-10,Ten minutes to a better work/life balance,women-in-leadership
510,2014-01-09,How (not)... to make a fool of yourself at your first board meeting,women-in-leadership
511,2014-01-08,Live chat: is 2014 the year we stop trying to have it all?,women-in-leadership
512,2014-01-08,How to be a role model,women-in-leadership
513,2014-01-07,How to work hard and stay healthy,women-in-leadership
514,2014-01-06,How to have it all in 2014,women-in-leadership
515,2016-01-05,Diversity at work: hiring 'the best person for the job' isn't enough,women-in-leadership
516,2016-01-04,Could working out solve your workplace woes?,women-in-leadership
517,2015-12-29,"If we really want more women in tech, we need to bring them back",women-in-leadership
518,2015-12-23,Top stories on Women in Leadership in 2015,women-in-leadership
519,2015-12-22,'My ambition is to be a voice for those who don’t or can’t speak their mind',women-in-leadership
520,2015-12-21,The money vs happiness debate: how much are you worth?,women-in-leadership
521,2015-12-17,Nine essential tips for the (successfully) self-employed,women-in-leadership
522,2015-12-16,WIN: a very merry Christmas stocking from Women in Leadership,women-in-leadership
523,2015-12-16,End of year anxiety? Here are five steps to getting what you want in 2016,women-in-leadership
524,2015-12-15,The joy of Christmas time off,women-in-leadership
525,2015-12-14,How to recognise and overcome your unconscious bias,women-in-leadership
526,2015-12-11,"'Considering a career in rail? Explore all options, not just 'female’ roles'",women-in-leadership
527,2015-12-10,"Body language at work: how to connect, inspire and project confidence",women-in-leadership
528,2015-12-09,How to speak the language of finance,women-in-leadership
529,2015-12-07,'I secured an investment deal for my business while nine months pregnant',women-in-leadership
530,2015-12-04,"'I am part of an eight-member assembly, running a small country'",women-in-leadership
531,2015-12-03,The 'angry black woman' cliche is still at work,women-in-leadership
532,2015-12-02,Why female experts are outnumbered 3:1 on the small screen,women-in-leadership
533,2015-11-30,Thinking of quitting your job? Do these five things first,women-in-leadership
534,2015-11-27,'I am the first women's-only tailor in the history of Savile Row',women-in-leadership
535,2015-11-26,Is there ever a right time to sell your business?,women-in-leadership
536,2015-11-25,Meet the woman who wants to disrupt the porn industry,women-in-leadership
537,2015-11-23,Salesforce and equal pay: the tech giant is putting its money where its mouth is,women-in-leadership
538,2015-11-23,Why we need quotas for women on boards,women-in-leadership
539,2015-11-20,How our theatre workshops are empowering migrant women in China,women-in-leadership
540,2015-11-19,The benefits of learning to say 'no',women-in-leadership
541,2015-11-17,Nice girls don't finish last: why empathy isn't a business liability,women-in-leadership
542,2015-11-13,‘A typical day? Crawling out of a tent to find a fur seal staring at you’,women-in-leadership
543,2015-11-12,Sisterhood 2.0: why traditional networking isn't working for women,women-in-leadership
544,2015-11-11,Why I’m proud to be a ‘Token Man’,women-in-leadership
545,2015-11-10,Parental leave: what to expect on the return to work,women-in-leadership
546,2015-11-09,This equal pay day say no to working for free,women-in-leadership
547,2015-11-09,Equal pay day: a woman's guide to getting a pay rise,women-in-leadership
548,2015-11-06,'I realised that something was missing in the British confectionery market',women-in-leadership
549,2015-11-05,"Travel, talk and Tinder: how I learned to carve an identity outside work",women-in-leadership
550,2015-11-04,"As a man, I'd much rather work for a woman",women-in-leadership
551,2015-11-02,"Girls can have it all, we need to stop telling them otherwise",women-in-leadership
552,2015-11-02,Are women more afraid of success than failure?,women-in-leadership
553,2015-10-30,'I hope we can open more doors for women in Formula One',women-in-leadership
554,2015-10-29,Women on boards: what happens now?,women-in-leadership
555,2015-10-29,All work and no play? Why I gave up my freelance life for the nine-to-five,women-in-leadership
556,2015-10-28,What does success look like for women today?,women-in-leadership
557,2015-10-27,My career has taught me women’s networks are crucial,women-in-leadership
558,2015-10-23,'I was one of the first women to qualify as a UK beer sommelier',women-in-leadership
559,2015-10-21,The Women's Equality Party launch is not a moment too soon,women-in-leadership
560,2015-10-21,Rediscovering the lost art of switching off,women-in-leadership
