,Date,Content,Section
0,2014-01-03,How (not)... to be a domestic goddess,women-in-leadership
1,2014-01-02,The art of reflection,women-in-leadership
2,2013-12-31,Making new year's resolutions? Set yourself up for success with our top tips,women-in-leadership
3,2013-12-30,How to make job sharing work,women-in-leadership
4,2013-12-23,Women on boards: it's not a problem of supply but rather of demand,women-in-leadership
5,2013-12-20,From imposter syndrome to feminism: our top ten stories of 2013,women-in-leadership
6,2013-12-19,Five inspiring talks from six inspiring women,women-in-leadership
7,2013-12-18,Why the world's most valuable brands embrace women on boards,women-in-leadership
8,2013-12-17,All I want for Christmas: equal pay and more women in management,women-in-leadership
9,2013-12-16,What I learned from the woman who took my job,women-in-leadership
10,2013-12-13,Women: Project 28-40 needs you!,women-in-leadership
11,2013-12-13,"Three women changing the face, and style, of app development",women-in-leadership
12,2013-12-12,Monica Galetti: 'When I first met Michel Roux I just thought he was mean',women-in-leadership
13,2013-12-11,Open thread: what do the leaders of the future look like?,women-in-leadership
14,2013-12-10,More women on boards saves companies money on acquisitions,women-in-leadership
15,2013-12-09,How to beat the female leadership stereotypes,women-in-leadership
16,2013-12-06,Why Rebecca Okwaci should be the role model for girls around the world,women-in-leadership
17,2013-12-05,The psychology of entrepreneurship: have you got what it takes?,women-in-leadership
18,2013-12-04,The Oprah Winfrey effect: what it means for British broadcasters,women-in-leadership
19,2013-12-03,Gender stereotypes: do men make better surgeons than women?,women-in-leadership
20,2013-12-02,I'd rather have women only awards than quotas,women-in-leadership
21,2013-11-29,"Ten minutes with: Nicola Rabson, employment partner at Linklaters",women-in-leadership
22,2013-11-28,Five tips for gender diversity your company can implement now,women-in-leadership
23,2013-11-27,"Advertising has plenty of women at the top, but is there more to do?",women-in-leadership
24,2013-11-26,Women on boards: companies need to be looking internally,women-in-leadership
25,2013-11-25,Tamara Mellon: 'Am I a feminist? Absolutely',women-in-leadership
26,2013-11-22,"Ten mins with: entrepreneur and Dragon's Den dragon, Kelly Hoppen",women-in-leadership
27,2013-11-21,Over a quarter of young people think looking good will help their career,women-in-leadership
28,2013-11-20,Employers must get better at talking about maternity leave,women-in-leadership
29,2013-11-20,"50,000 women lose jobs over maternity discrimination, study shows",women-in-leadership
30,2013-11-19,I left my job at five months pregnant: Mumsnet founder talks,women-in-leadership
31,2013-11-19,"'The workplace was designed by men, for men – we need to modernise'",women-in-leadership
32,2013-11-18,Live chat: is gender diversity at work the responsibility of women or employers?,women-in-leadership
33,2013-11-18,Women in democracy? We still have a long way to go,women-in-leadership
34,2013-11-15,Women's magazines ignore technology and demean women,women-in-leadership
35,2013-11-14,"Engineering has moved on, it's time women took advantage",women-in-leadership
36,2013-11-13,"We don't need a hero, we just need more women at the top",women-in-leadership
37,2013-11-12,"'If she can't see it, she can't be it': why media representation matters",women-in-leadership
38,2013-11-11,"Patronising, sexist and wrong. Law firm issues note on how to dress",women-in-leadership
39,2013-11-08,10 minutes with: vice-president of HR at BP,women-in-leadership
40,2013-11-08,Manage your talent or watch future leaders walk out of the door,women-in-leadership
41,2013-11-07,Cranfield report: 25% target for women on boards is in sight,women-in-leadership
42,2013-11-07,Equal pay day: a plea for transparency,women-in-leadership
43,2013-11-06,How to ... create a workplace that works for women,women-in-leadership
44,2013-11-05,Why is being openly feminist in the boardroom seen as 'damaging'?,women-in-leadership
45,2013-11-04,Out of the shadows: the women who sparked the Labour movement,women-in-leadership
46,2013-11-01,"Bad teaching causes girls to fail at school, not male classmates",women-in-leadership
47,2013-11-01,10 minutes with: CEO of an energy company,women-in-leadership
48,2013-10-31,How to ... plan your path to career success,women-in-leadership
49,2013-10-30,Co-educational schools are bad for girls,women-in-leadership
50,2013-10-29,Helen Clark: We must invest in women and girls - video,women-in-leadership
51,2013-10-29,Mirroring male colleagues is a big mistake,women-in-leadership
52,2013-10-28,Under the spotlight: mastering media appearances,women-in-leadership
53,2013-10-26,Redefining leadership will solve society's big problems,women-in-leadership
54,2013-10-25,Comment: I support quotas. So what?,women-in-leadership
55,2013-10-25,10 minutes with: founder of Libertine Debbi Evans,women-in-leadership
56,2013-10-24,How to manage ... a new team,women-in-leadership
57,2013-10-23,Are women in the West being left behind on leadership?,women-in-leadership
58,2013-10-22,Managing negativity in the face of internet abuse: take the high road,women-in-leadership
59,2013-10-18,It's no secret: we need more women in security,women-in-leadership
60,2013-10-18,What will Burberry CEO Angela Ahrendts bring to Apple?,women-in-leadership
61,2013-10-17,How to manage aggressive behaviour at work: five top tips,women-in-leadership
62,2013-10-17,How to ... handle a difficult colleague,women-in-leadership
63,2013-10-16,Ruth Owen: 'there's no point being a woman and trying to be a man',women-in-leadership
64,2013-10-15,"Being a tech geek is cool, I should know, I am one",women-in-leadership
65,2013-10-15,Ten women in tech you need to meet,women-in-leadership
66,2013-10-15,Putting the HER in Hero: why we need more tech superwomen,women-in-leadership
67,2013-10-14,How blind auditions help orchestras to eliminate gender bias,women-in-leadership
68,2013-10-14,Why being a woman makes me a better police detective,women-in-leadership
69,2013-10-11,Happiness at work: what we can learn from the Swiss,women-in-leadership
70,2013-10-10,What working parents really look like,women-in-leadership
71,2013-10-09,Five tips for developing your all-important personal brand,women-in-leadership
72,2013-10-08,Comment: another disappointing reshuffle for women,women-in-leadership
73,2013-10-07,The secret to getting the top job? Learning how to influence,women-in-leadership
74,2013-10-04,Is the women's vote a false concept?,women-in-leadership
75,2013-10-04,10 minutes with: Karen Campbell,women-in-leadership
76,2013-10-03,"Young women will find engineering inspiring, not intimidating",women-in-leadership
77,2013-10-02,Is being a woman a barrier to international business?,women-in-leadership
78,2013-10-01,Sarah Wollaston: I would consider all-women shortlists in 2015,women-in-leadership
79,2013-10-01,Live Q&A with Jo Swinson MP,women-in-leadership
80,2013-10-01,A stay-at-home CEO writes: recruiting my maternity cover,women-in-leadership
81,2013-09-30,Compliments: sexist and inappropriate or actually quite nice?,women-in-leadership
82,2013-09-27,10 minutes with: Marin Alsop,women-in-leadership
83,2013-09-26,They are constantly evolving – but are computer games art?,women-in-leadership
84,2013-09-25,China: setting the new standard for women in top jobs?,women-in-leadership
85,2013-09-24,We must not alienate mums who juggle work with raising a disabled child,women-in-leadership
86,2013-09-23,What women want from adverts: reality,women-in-leadership
87,2013-09-23,Stella Creasy told: tackling women's issues will be 'career suicide',women-in-leadership
88,2013-09-23,Working parents: show us what 'working parenthood' means to you,women-in-leadership
89,2013-09-23,Formal complaints over sexism should be last resort for women,women-in-leadership
90,2013-09-20,The confidence trap: how to avoid back to work blues,women-in-leadership
91,2013-09-19,"We've tried persuasion, now it's time for quotas",women-in-leadership
92,2013-09-18,Why Nationwide stopped advertising on Facebook,women-in-leadership
93,2013-09-16,Women's football: best man for the job?,women-in-leadership
94,2013-09-13,Setting up a business: insider tips to get you started,women-in-leadership
95,2013-09-12,"Face facts, women have different development needs at work",women-in-leadership
96,2013-09-11,Inspiring women in engineering: planning your career,women-in-leadership
97,2013-09-11,'What about the business'? Why maternity leave scares employers,women-in-leadership
98,2013-09-10,Advertising to women: why HTC has a dude problem,women-in-leadership
99,2013-09-09,The lessons I've learned from my nine-year mentoring relationship,women-in-leadership
100,2013-09-06,STEM subjects versus the arts: why languages are just as important,women-in-leadership
101,2013-09-05,Insider tips from a recruiter: how to avoid unconscious bias,women-in-leadership
102,2013-09-04,"Why banks must break down the barriers for women, fast",women-in-leadership
103,2013-09-03,How many successful black businesswomen can you name?,women-in-leadership
104,2013-09-02,'Take advice from the knowledgeable women around you',women-in-leadership
105,2013-08-30,10 minutes with: a social selling company boss,women-in-leadership
106,2013-08-29,Winning big in TV: four women return to work,women-in-leadership
107,2013-08-28,Are you overconfident? It could be holding you back,women-in-leadership
108,2013-08-27,"Profile: Harriet Green, chief executive of Thomas Cook and a fearless leader",women-in-leadership
109,2013-08-23,I wasted four years of my life – don't make the same mistake,women-in-leadership
110,2013-08-21,Live discussion: why isn't pay fair?,women-in-leadership
111,2013-08-21,How to get a boardroom position: practical tips for success,women-in-leadership
112,2013-08-20,Mind the gender pay (and bonus) gap,women-in-leadership
113,2013-08-20,"Women are still trailing men on salaries and bonuses, research finds",women-in-leadership
114,2013-08-19,EU may force UK companies to reveal gender diversity targets,women-in-leadership
115,2013-08-16,"Fiona Lambert: Being a leader is scary, but you have to believe in yourself",women-in-leadership
116,2013-08-15,Are you guilty of unconscious bias about job roles?,women-in-leadership
117,2013-08-14,The 'third dimension' explained: redefining success,women-in-leadership
118,2013-08-13,Pregnant presenteeism: why women won't take time off,women-in-leadership
119,2013-08-12,Women's cycling: we're creating our own history,women-in-leadership
120,2013-08-09,Helen Grant: I haven't cried on David Cameron's shoulder,women-in-leadership
121,2013-08-08,Are older women being shut out of business funding?,women-in-leadership
122,2013-08-07,Why are so many women leaving architecture?,women-in-leadership
123,2013-08-06,Benevolent sexism: the real barrier holding women back,women-in-leadership
124,2013-08-05,Empathy: the last big business taboo?,women-in-leadership
125,2013-08-02,Expert advice: how to secure senior support for a women's network,women-in-leadership
126,2013-08-01,"Behind the scenes, parents still face a tough time working in TV",women-in-leadership
127,2013-07-31,Live discussion: helping female colleagues progress,women-in-leadership
128,2013-07-31,A manifesto for modern leadership,women-in-leadership
129,2013-07-30,Changing the face of part-time working: the power listers,women-in-leadership
130,2013-07-29,'Talent is everywhere but opportunity is not',women-in-leadership
131,2013-07-26,Stability and loyalty: why family businesses benefit women,women-in-leadership
132,2013-07-25,Secrets of the global talent race,women-in-leadership
133,2013-07-24,Media training: five tips for a great interview,women-in-leadership
134,2013-07-23,Why the next Mark Zuckerberg currently won't be female,women-in-leadership
135,2013-07-22,10 minutes with: Elena Baturina,women-in-leadership
136,2013-07-19,How flexible working can save the economy,women-in-leadership
137,2013-07-19,"Diversity progress is being made, but it won't happen overnight",women-in-leadership
138,2013-07-18,Talkpoint: why are we ashamed of flexible working?,women-in-leadership
139,2013-07-17,"'I couldn't have won The Apprentice, I didn't believe in myself enough'",women-in-leadership
140,2013-07-16,Generation Y men lead charge for change on fatherhood,women-in-leadership
141,2013-07-15,How Diageo supports women,women-in-leadership
142,2013-07-12,"Sue Biggs, RHS: 'It's a confidence issue, about daring to dream'",women-in-leadership
143,2013-07-11,Women should risk it in start-ups instead of sticking to corporates,women-in-leadership
144,2013-07-10,Katie Hopkins: champion of personal branding or bad news for women?,women-in-leadership
145,2013-07-09,Are not-for-profits getting away lightly on female leadership?,women-in-leadership
146,2013-07-08,"Sponsorship: it's not who you know, but who knows you",women-in-leadership
147,2013-07-05,"When pitching goes wrong, and how to put it right",women-in-leadership
148,2013-07-03,Live discussion: how can women's networks collaborate better?,women-in-leadership
149,2013-07-03,Why I won't speak at women-only events,women-in-leadership
150,2013-07-02,What does the future look like for women?,women-in-leadership
151,2013-07-01,Is the gender magnet pulling you backwards?,women-in-leadership
152,2013-06-28,10 minutes with: director of communications at LinkedIn,women-in-leadership
153,2013-06-27,Telefónica COO: focus on education to improve gender equality,women-in-leadership
154,2013-06-26,Three steps to creating your personal brand – and why it matters,women-in-leadership
155,2013-06-25,Why a women's enterprise minister would boost the Scottish economy,women-in-leadership
156,2013-06-24,The false theory of meritocracy: why women lose out,women-in-leadership
157,2013-06-21,10 minutes with: a space scientist,women-in-leadership
158,2013-06-20,BIS: 'Government must match rhetoric with action on equal pay',women-in-leadership
159,2013-06-19,New report calls for coalition to bring forward tax-free childcare policy,women-in-leadership
160,2013-06-19,Live discussion: mentoring and sponsorship,women-in-leadership
161,2013-06-19,'Geeky and not for girls': Technology's big image problem,women-in-leadership
162,2013-06-18,Part-time partners: why the legal profession is changing,women-in-leadership
163,2013-06-17,"You plan your holiday, so why not your career?",women-in-leadership
164,2013-06-14,Positive action: more than a politically correct buzzword,women-in-leadership
165,2013-06-13,Foreign Office broadens its appeal to women,women-in-leadership
166,2013-06-12,Smart tech: how IBM made itself more attractive to women,women-in-leadership
167,2013-06-11,Generation flex? Why it's time to rethink our attitude to work,women-in-leadership
168,2013-06-10,Tatty Devine co-founders awarded MBEs,women-in-leadership
169,2013-06-10,The government is failing young women on career advice,women-in-leadership
170,2013-06-07,Extreme pay in the UK: the truth behind CEO paychecks,women-in-leadership
171,2013-06-05,Talkpoint: what does being successful mean to you?,women-in-leadership
172,2013-06-05,10 minutes with: a professor of organisational behaviour,women-in-leadership
173,2013-06-04,"US is best for female entrepreneurs, with UK ranked in sixth place",women-in-leadership
174,2013-06-04,"Why Sheryl Sandberg's call to 'lean in' is about working smarter, not harder",women-in-leadership
175,2013-06-03,How speech and language determine success in the workplace,women-in-leadership
176,2013-05-31,"Jo Swinson: 'despite progress, women still face challenges'",women-in-leadership
177,2013-05-30,The unwritten rules that could hold you back at work if you don't learn them,women-in-leadership
178,2013-05-29,Chairmen: look to the public sector for talented female non-executive directors,women-in-leadership
179,2013-05-28,Women in STEM: it's time to take ownership of being female,women-in-leadership
180,2013-05-24,'The culture around childcare will never change if we're not brave',women-in-leadership
181,2013-05-24,The leadership toolkit: get more done and leave on time,women-in-leadership
182,2013-05-22,Live discussion: how to network,women-in-leadership
183,2013-05-22,Will shared parental leave turn negative stereotypes around?,women-in-leadership
184,2013-05-21,Board diversity: can voluntary change succeed?,women-in-leadership
185,2013-05-20,Marketing to women: why painting it pink doesn't work (and never did),women-in-leadership
186,2013-05-17,Young women must be taught not to fear failure,women-in-leadership
187,2013-05-16,Do you need a mentor or a sponsor? (Answer: you need both),women-in-leadership
188,2013-05-15,Budding entrepreneurs put off by 'intimidating businesswomen',women-in-leadership
189,2013-05-14,"Women are more engaged at work, so are they happier?",women-in-leadership
190,2013-05-14,Will we ever have more women at the top? - Video,women-in-leadership
191,2013-05-13,Why 'real models' not role models will help women get to the top,women-in-leadership
192,2013-05-10,Why moving 'sideways' and keeping options broad can be good for career,women-in-leadership
193,2013-05-09,Are all-male panels at tech conferences a thing of the past?,women-in-leadership
194,2013-05-08,Collaboration and cultural awareness essential in next generation of leaders,women-in-leadership
195,2013-05-07,Win an iPad mini,women-in-leadership
196,2013-05-07,The UK lags behind when it comes to female leaders in public office – why?,women-in-leadership
197,2013-05-03,Whose responsibility is it to get more women to the top?,women-in-leadership
198,2013-05-03,Will we ever have more women at the top?,women-in-leadership
199,2013-05-02,The power of the media: putting women in the frame,women-in-leadership
200,2013-05-01,Julie Bentley: 'I am grateful that my mentors saw my potential',women-in-leadership
201,2013-05-01,Pot half full? How women lose out when it comes to pensions,women-in-leadership
202,2013-04-30,Nemat Shafik: Picking a good boss is important,women-in-leadership
203,2013-04-29,Gender parity on company boards – a 212-year wait,women-in-leadership
204,2013-04-26,Chris Sullivan: 'Gender diversity won't be a problem in 15 years' time',women-in-leadership
205,2013-04-26,Women in retail: Maria Thompson,women-in-leadership
206,2013-04-26,Women in tech: Saba Shaukat,women-in-leadership
207,2013-04-26,Women in engineering: Juliet Davenport,women-in-leadership
208,2013-04-25,Working mothers: the two year crunch point,women-in-leadership
209,2013-04-25,Why stereotypes still loom large for female mayors,women-in-leadership
210,2013-04-24,Why the Natwest everywoman awards still matter,women-in-leadership
211,2013-04-23,Dame Nancy Rothwell: 'Break the rules and see what happens',women-in-leadership
212,2013-04-22,A cup of tea with: Tatty Devine,women-in-leadership
213,2013-04-22,Infographic: How are big companies doing on boards?,women-in-leadership
214,2013-04-22,Women entrepreneurs: Harriet Vine MBE,women-in-leadership
215,2013-04-22,Women in Finance: Lesley Batchelor,women-in-leadership
216,2013-04-22,Women in Tech: Nikki Flanders,women-in-leadership
217,2013-04-22,The cultural shift to get more women into boardrooms must begin at start-up level,women-in-leadership
218,2013-04-19,Practical experience or managerial skill? Why both matter,women-in-leadership
219,2013-04-18,Women in retail: Celia Pronto,women-in-leadership
220,2013-04-18,Women in leadership: Emma Howard Boyd,women-in-leadership
221,2013-04-18,Women in government: Margaret Hodge,women-in-leadership
222,2013-04-18,Helena Morrissey: 'The big challenge is below the boardroom',women-in-leadership
223,2013-04-18,"Boardroom culture is putting women off, it must change",women-in-leadership
224,2013-04-17,Tessa Jowell: Thatcher's legacy for women was nonexistent,women-in-leadership
225,2013-04-17,Vince Cable: There is a chronic shortage of women in top jobs,women-in-leadership
226,2013-04-17,Glass ceilings and the law: unconscious bias must be acknowledged,women-in-leadership
227,2013-04-17,"Will we ever have more women at the top? 1st May, 5.30pm",women-in-leadership
228,2013-04-17,About us,women-in-leadership
229,2013-04-17,Guardian launches Women in Leadership,women-in-leadership
230,2013-04-17,Why quotas are out and openness is in at PepsiCo,women-in-leadership
231,2013-04-17,Creating an inclusive workplace – starting with white men,women-in-leadership
232,2015-01-02,10 minutes with... inventor Annie Brooking,women-in-leadership
233,2014-12-30,Where are all the female computing students?,women-in-leadership
234,2014-12-29,New year’s resolutions: essential or outdated?,women-in-leadership
235,2014-12-23,2014: our top stories,women-in-leadership
236,2014-12-22,"Uschi Schreiber: women can have it all, they just need to think big",women-in-leadership
237,2014-12-19,"10 minutes with... Tabitha Goldstaub, co-founder of Rightster",women-in-leadership
238,2014-12-18,"Why equal parental leave is the mother of good ideas for modern families (and employers)

",women-in-leadership
239,2014-12-17,Quiz: ridiculous quotes of 2014,women-in-leadership
240,2014-12-16,Equal pay: Sarah Champion's bill was a start but women need to vote with their feet,women-in-leadership
241,2014-12-16,"Advice to my younger self: the road to success is a long one, don’t give up",women-in-leadership
242,2014-12-15,"Carla Buzasi on leaving the Huffington Post, building brands and shouting louder",women-in-leadership
243,2014-12-12,Entrepreneurs are expected to be white and male. We need to change this,women-in-leadership
244,2014-12-10,Stop vilifying Zoella. She’s just enjoying the spoils of her success,women-in-leadership
245,2014-12-09,"Advice for my younger self: it’s OK to clock off
",women-in-leadership
246,2014-12-08,Women in film and TV: advice from the award-winning women behind the scenes,women-in-leadership
247,2014-12-05,I breastfed while working. All news mums should have the option,women-in-leadership
248,2014-12-04,"How to be a more inclusive leader
",women-in-leadership
249,2014-12-03,"Jacqueline Gold: ""I do feel like Boudicca sometimes""",women-in-leadership
250,2014-12-02,"Rachel Yankey: 'the boys' football team thought I was a young lad called Ray""",women-in-leadership
251,2014-12-01,Harriet Green quit your job,women-in-leadership
252,2014-11-28,"10 minutes with… Melissa Di Donato, VP EMEA and APAC at Salesforce",women-in-leadership
253,2014-11-27,Can good karma have a positive impact on your business?,women-in-leadership
254,2014-11-26,How to create a better future for women in science,women-in-leadership
255,2014-11-25,Advice for my younger self: Go at your own pace,women-in-leadership
256,2014-11-20,Event: bridging the confidence gap,women-in-leadership
257,2014-11-20,Why it’s important to prove that ‘small’ can be flexible,women-in-leadership
258,2014-11-19,Advice for my younger self: face your fear of taking to the stage,women-in-leadership
259,2014-11-18,Women on boards: open your eyes to the opportunities offered by SMEs,women-in-leadership
260,2014-11-17,Six things no one tells you about starting your own business,women-in-leadership
261,2014-11-13,Five difficult colleagues – and how to handle them,women-in-leadership
262,2014-11-13,Why are women opting out of STEM industries?,women-in-leadership
263,2014-11-12,Five career lessons to live by,women-in-leadership
264,2014-11-12,"UK, European or US business women: Who has the best work-life balance?",women-in-leadership
265,2014-11-11,"Almost 50 years after the Dagenham strikes, how life has changed at Ford",women-in-leadership
266,2014-11-10,"Can advertising and feminism learn to get along?
",women-in-leadership
267,2014-11-07,Money talks: six women tell us their experiences of earning,women-in-leadership
268,2014-11-06,Why karma won’t get you a pay rise,women-in-leadership
269,2014-11-05,Does the women's movement serve all equally? Take our survey,women-in-leadership
270,2014-11-04,Equal Pay Day: Would you agree to work for free for the rest of the year?,women-in-leadership
271,2014-11-04,"How to be a great public speaker
",women-in-leadership
272,2014-11-03,Why entrepreneurs are flocking to collaborative business,women-in-leadership
273,2014-10-29,"Entrepreneurship: five macho myths debunked
",women-in-leadership
274,2014-10-28,Advice for my younger self: success is about both style and substance,women-in-leadership
275,2014-10-27,Lessons from Silicon Valley: What I and other female tech entrepreneurs can learn from the US,women-in-leadership
276,2014-10-24,"KPMG sets diversity targets across gender, race, disability and sexual orientation",women-in-leadership
277,2014-10-24,"10 minutes with ... Anne-Marie Huby, co-founder of JustGiving",women-in-leadership
278,2014-10-23,Getting women to board level requires a ‘dogged determination’,women-in-leadership
279,2014-10-22,‘Young women need female role models to inspire success’,women-in-leadership
280,2014-10-21,Advice for my younger self: learn how to fail,women-in-leadership
281,2014-10-20,Why women are under-represented in science and engineering,women-in-leadership
282,2014-10-17,"10 minutes with ... Debbie Sterling, founder of GoldieBlox",women-in-leadership
283,2014-10-16,Japan must embrace ‘womenomics’ to modernise economy,women-in-leadership
