,Date,Content,Section
561,2015-10-19,What standup comedy taught me about success at work,women-in-leadership
562,2015-10-16,‘There is something magical about watching a newly born calf take its first steps',women-in-leadership
563,2015-10-15,Negotiating a pay rise: what I wish Jennifer Lawrence had known,women-in-leadership
564,2015-10-15,"I'm with Jennifer Lawrence, F-that to  being 'adorable' at work",women-in-leadership
565,2015-10-14,Baby loss awareness week: we need to talk about miscarriage,women-in-leadership
566,2015-10-13,Five steps to balancing work and family,women-in-leadership
567,2015-10-09,Want a plan for how to get more women into engineering? It's easy,women-in-leadership
568,2015-10-07,"Successful women like Annabel Karmel, shouldn't tell others they 'can't'",women-in-leadership
569,2015-10-07,"'Time, not money is the 21st century’s most precious commodity'",women-in-leadership
570,2015-10-06,Why an open culture could be the key to business success,women-in-leadership
571,2015-10-05,Why we must stop framing inclusivity as a women’s issue,women-in-leadership
572,2015-10-02,Coping with grief at work: why moving on is the hardest job ever,women-in-leadership
573,2015-09-30,Live Q&A: how to hack working parenthood,women-in-leadership
574,2015-09-30,'Business is not rocket science. I’m not saving lives or doing open-heart surgery',women-in-leadership
575,2015-09-29,'We struggle to find women to build our bicycles',women-in-leadership
576,2015-09-28,How to make a difference and make money,women-in-leadership
577,2015-09-24,67% of Europeans don't believe women have the skills to be scientists,women-in-leadership
578,2015-09-23,"Goodbye nine to five, hello work-life balance",women-in-leadership
579,2015-09-22,"Peer influence: in business, who can you really trust?",women-in-leadership
580,2015-09-18,How to avoid that 'back to work' feeling,women-in-leadership
581,2015-09-16,"The three things, beyond childcare, that can help new mothers return to work",women-in-leadership
582,2015-09-15,"Forget about 'mumpreneurs', here are the dads who mix work and family",women-in-leadership
583,2015-09-11,"10 minutes with: Karen Mattison MBE, joint chief executive of Timewise",women-in-leadership
584,2015-09-10,"Publish and be damned, Charlotte Proudman. You did the right thing",women-in-leadership
585,2015-09-10,Use a recent graduate as a career mentor and tap the millennial mindset,women-in-leadership
586,2015-09-09,"The mentor: “I thought I would change her life. In fact, she changed mine”",women-in-leadership
587,2015-09-08,Nearly half of working mothers feel discriminated against,women-in-leadership
588,2015-09-08,Meet the next generation of Stem entrepreneurs,women-in-leadership
589,2015-09-07,"The female firefighter: 'when I joined, I was one of only 30 women in a workforce of 6,000'",women-in-leadership
590,2015-09-04,Twins and two weeks' maternity leave. Good luck Marissa Mayer,women-in-leadership
591,2015-09-03,"A new kind of academia: free courses, no exams and real life lessons",women-in-leadership
592,2015-09-02,From yoga girl to business woman,women-in-leadership
593,2015-09-01,The three things holding women back at work,women-in-leadership
594,2015-08-27,Flying in Mary Poppins won’t fix work for parents,women-in-leadership
595,2015-08-24,Show me the money: why women need to stop working for free,women-in-leadership
596,2015-08-20,How to stand out from the crowd and be an authentic leader,women-in-leadership
597,2015-08-17,"Being a charismatic leader isn't enough, as Camila Batmanghelidjh can tell you",women-in-leadership
598,2015-08-13,How to design your life for happiness,women-in-leadership
599,2015-08-12,"Bic advertising: look like a girl, market your company like a 1970s misogynist",women-in-leadership
600,2015-08-11,I've just quit my dream job and I'm so excited about it,women-in-leadership
601,2015-08-07,'I have the best job in the world'. Meet the alcohol alchemist,women-in-leadership
602,2015-08-06,Female solicitors in Scotland earn 42% less than their male colleagues,women-in-leadership
603,2015-08-04,It shouldn't be difficult for men to speak out about gender equality,women-in-leadership
604,2015-08-03,Support for women returners is key to closing the gender gap,women-in-leadership
605,2015-07-30,Flexible senior roles are the key to unlocking our workforce's hidden talent,women-in-leadership
606,2015-07-29,The women reframing the fitness industry,women-in-leadership
607,2015-07-27,Maternity leave discrimination: five women tell their stories,women-in-leadership
608,2015-07-24,'You only live once: I really believe we can all do some good',women-in-leadership
609,2015-07-23,"Why academia needs emotional, passionate women",women-in-leadership
610,2015-07-22,If women want to get ahead at work they're going to need some help from the men,women-in-leadership
611,2015-07-21,Challenging cultural norms is the first step towards gender parity in India,women-in-leadership
612,2015-07-20,Why women-only initiatives are vital for the arts,women-in-leadership
613,2015-07-17,"10 minutes with: Pauline Black, lead singer and manager of The Selecter",women-in-leadership
614,2015-07-15,"'Think manager, think man' stops us seeing woman as leaders",women-in-leadership
615,2015-07-14,"Thanks Cameron, but pay transparency won't solve the gender gap",women-in-leadership
616,2015-07-14,How to manage your contacts in just 30 minutes a day,women-in-leadership
617,2015-07-13,Investing in education and inspiration will level the field for the next generation,women-in-leadership
618,2015-07-09,"The boss is away? Don’t panic, this is your time to shine",women-in-leadership
619,2015-07-08,America is the best place in the world to be a female entrepreneur,women-in-leadership
620,2015-07-07,Are we ever really 'out of the office'?,women-in-leadership
621,2015-07-06,Presenteeism over productivity: why flexible working needs a rebrand,women-in-leadership
622,2015-07-02,Want to know the secret of success? Help your competitors,women-in-leadership
623,2015-07-01,"It's not just sports, all women's initiatives lack corporate sponsorship",women-in-leadership
624,2015-06-30,Could a gadget help you to switch off?,women-in-leadership
625,2015-06-29,Walking away from my business taught me the true meaning of success,women-in-leadership
626,2015-06-25,What competitive sport taught me about business success,women-in-leadership
627,2015-06-24,The accidental mentor: why we should all help other women climb the ladder,women-in-leadership
628,2015-06-23,Hide your family and live in the office: how women in engineering get ahead,women-in-leadership
629,2015-06-21,International Yoga Day: being bad at yoga made me better at life,women-in-leadership
630,2015-06-19,10 minutes with the artist behind the 'grown up colouring book',women-in-leadership
631,2015-06-17,Top tips for pitching your business to investors,women-in-leadership
632,2015-06-16,What Ireland's Yes campaign can teach us about inclusion in business,women-in-leadership
633,2015-06-15,The sound of silence: is cutting out noise the answer to a stress-free life?,women-in-leadership
634,2015-06-11,'When I started working in technology I could count the number of women on one hand',women-in-leadership
635,2015-06-10,Feminism is more than a middle-class view of 'what women want',women-in-leadership
636,2015-06-09,"Farewell to the queen bee, she's been buzzing around for far too long",women-in-leadership
637,2015-06-08,"Stop freaking out, it's just a tampon",women-in-leadership
638,2015-06-08,How to manage cultural change without causing a mutiny,women-in-leadership
639,2015-06-05,Think the logistics industry is all about trucks and warehouses? Think again,women-in-leadership
640,2015-06-03,A third of working women say they're discriminated against,women-in-leadership
641,2015-06-02,Fertility on the curriculum? The last thing we need is more scaremongering,women-in-leadership
642,2015-06-02,Having women in the cabinet is just the first step,women-in-leadership
643,2015-06-01,HeForShe: do men in Iceland lead the way?,women-in-leadership
644,2015-05-28,The digital industry isn't a boys' club: it's all about meritocracy,women-in-leadership
645,2015-05-27,Five TED Talks that will change the way you work,women-in-leadership
646,2015-05-26,"Forget the glass ceiling, we need to fix the broken windows first",women-in-leadership
647,2015-05-21,"'Extreme blood, sweat and tears': behind the glamour of the ad industry",women-in-leadership
648,2015-05-20,Less is more: the science of an effective night's sleep,women-in-leadership
649,2015-05-19,"When you are self-employed, there's no such thing as 'free time'",women-in-leadership
650,2015-05-18,"Michelle Obama highlighted the issues women of colour face, we must fix them",women-in-leadership
651,2015-05-15,'Being a woman isn’t a barrier to working in the rail industry',women-in-leadership
652,2015-05-14,"From 'mumpreneur' to 'lipstick entrepreneur', why do we feminise work?",women-in-leadership
653,2015-05-13,Then and now: how attitudes to working women have shifted in one generation,women-in-leadership
654,2015-05-12,Know who you want to be kidnapped with and four more lessons for leaders,women-in-leadership
655,2015-05-12,Pregnant but screwed: the truth about workplace discrimination,women-in-leadership
656,2015-05-08,The power of visibility: why we must ask 'where are all the women?',women-in-leadership
657,2015-05-07,Mud and mavericks: what it's like to run your own festival,women-in-leadership
658,2015-05-06,Election 2015: 'a critical juncture at which women’s lives are pushed to the brink’,women-in-leadership
659,2015-05-05,Shared parental leave: the beginning of societal change or just another policy?,women-in-leadership
660,2015-04-30,Seven top tips for mastering the art of public speaking,women-in-leadership
661,2015-04-30,"'I used to be self-conscious about saying I was a blogger, but now I’ll shout it from the rooftops'",women-in-leadership
662,2015-04-29,Want to write a business book? Put your pen down and start talking,women-in-leadership
663,2015-04-24,"10 minutes with: MasterChef finalist, Emma Spitzer",women-in-leadership
664,2015-04-23,Who are you calling a dizzy blonde? PRs hold a firm's reputation in their hands,women-in-leadership
665,2015-04-22,Become a yes-woman and break from the thinking patterns that hold you back,women-in-leadership
666,2015-04-21,"Female leadership, entrepreneurship and self-belief can close the gender gap",women-in-leadership
667,2015-04-20,Hillary Clinton's campaign encourages women to stand in the spotlight,women-in-leadership
668,2015-04-17,10 minutes with… health and wellness entrepreneur Kate Percival,women-in-leadership
669,2015-04-16,From drug dealer to sausage celebrity: how one woman turned her life around,women-in-leadership
670,2015-04-15,How to navigate a mid-life career change,women-in-leadership
671,2015-04-14,"Don't demonise immigrants: a diverse, multilingual workforce is essential for modern business",women-in-leadership
672,2015-04-13,Where are all the female innovators?,women-in-leadership
673,2015-04-10,"10 minutes with: Lynne Sanders, co-founder and CEO of A La Carte London",women-in-leadership
674,2015-04-09,Is Reddit's feminist 'hero' feeding stereotypes that hold women back?,women-in-leadership
675,2015-04-08,Dance away your workplace stress with boardroom ballet,women-in-leadership
676,2015-04-07,The fall of Jeremy Clarkson: being a top performer is no excuse for bullying,women-in-leadership
677,2015-04-02,The rise of the conscious consumer: why businesses need to open up,women-in-leadership
678,2015-04-01,Why failure isn't a dirty word,women-in-leadership
679,2015-03-31,'I decided time with my family was a once in a lifetime opportunity that I couldn’t afford to miss',women-in-leadership
680,2015-03-27,"10 minutes with: Adepeju Jaiyeoba, maternity campaigner",women-in-leadership
681,2015-03-25,Forget flexibility. What working women really want is power,women-in-leadership
682,2015-03-23,The five things I want to tell employers about women returning to work,women-in-leadership
683,2015-03-19,Geena Davis: ‘I assumed sexism wasn't present in what we show to kids’,women-in-leadership
684,2015-03-17,"'If we don’t actively and intentionally include women, the system will exclude them'",women-in-leadership
685,2015-03-16,Career envy: the green-eyed monster under the desk,women-in-leadership
686,2015-03-13,The importance of targets: why I pledged to help 1bn women by 2020,women-in-leadership
687,2015-03-12,What Silicon Valley can learn from a hipster haven in Colorado,women-in-leadership
688,2015-03-11,Live blog: Women's Empowerment Principles annual conference 2015,women-in-leadership
689,2015-03-10,The 'Lean In' generation have become addicted to work. It has to stop,women-in-leadership
690,2015-03-09,Mary Nightingale: 'There's still no role for white-haired women on TV',women-in-leadership
691,2015-03-08,How I made it happen: leading businesswomen share secrets of success,women-in-leadership
692,2015-03-08,No need for International Women's Day? What world do you live in?,women-in-leadership
693,2015-03-07,"If we want women to support women's charities, make it personal",women-in-leadership
694,2015-03-06,The rise of the female millionaire,women-in-leadership
695,2015-03-04,Events to mark International Women’s Day 2015,women-in-leadership
696,2015-03-03,Role models and culture: why the UK leads Europe for women in tech,women-in-leadership
697,2015-03-02,"How to manage people older than you
",women-in-leadership
698,2015-02-25,"Live Q&A: how to prepare for, and make the most of, maternity leave",women-in-leadership
699,2015-02-25,Want a creative career? Do the maths and put the tech industry top,women-in-leadership
700,2015-02-24,"'I suspect honorary chairman is a Japanese term for fat, old lady'",women-in-leadership
701,2015-02-23,"Play dumb, don’t wear velcro and other questionable career advice",women-in-leadership
702,2015-02-18,What we can learn from TV's leading anti-heroines,women-in-leadership
703,2015-02-16,Cindy Crawford's leaked pictures hit back at the tyranny of Photoshop,women-in-leadership
704,2015-02-11,Where are all the female headteachers?,women-in-leadership
705,2015-02-10,‘We used our kitchens to kickstart a whole new industry’,women-in-leadership
706,2015-02-09,Can a healthy body make you better at your job?,women-in-leadership
707,2015-02-06,10 minutes with: restaurant owner Valeria Zilkha,women-in-leadership
708,2015-02-05,The kids are to blame: and other myths about women and work,women-in-leadership
709,2015-02-04,What is ‘the British dream’ for women?,women-in-leadership
710,2015-02-03,Can the perfect workspace make you more productive?,women-in-leadership
711,2015-02-02,How I finally learned to love working from home,women-in-leadership
712,2015-01-30,"I was diagnosed with dyslexia and it's a gift, not a curse",women-in-leadership
713,2015-01-29,Global Links mentoring scheme will help female entrepreneurs in India,women-in-leadership
714,2015-01-28,How to cure your technology addiction yet  hold onto your phone,women-in-leadership
715,2015-01-27,20% of women believe they'll never make it to the boardroom,women-in-leadership
716,2015-01-26,How to create a diverse event: tips for the World Economic Forum organisers,women-in-leadership
717,2015-01-26,What it feels like to be a woman at Davos in 2015,women-in-leadership
718,2015-01-21,"Starting my own business was about small gains, not big risks",women-in-leadership
719,2015-01-20,Putting the brakes on gender stereotyped advertising,women-in-leadership
720,2015-01-16,Five life lessons from Clare Balding,women-in-leadership
721,2015-01-15,Find recruiting female staff hard? These students are smarter than you,women-in-leadership
722,2015-01-14,Has the alpha female grown a heart? I hope so,women-in-leadership
723,2015-01-13,Why there's no such thing as a fixed career path,women-in-leadership
724,2015-01-09,10 minutes with: two women awarded New Year honours for their work on gender equality,women-in-leadership
725,2015-01-07,'There's nothing wrong with being ambitious' and four other times Angela Merkel was absolutely right,women-in-leadership
726,2015-01-07,Five simple steps to a better work-life balance in the new year,women-in-leadership
727,2015-01-06,Corporate burnout: how to avoid it in 2015,women-in-leadership
728,2015-01-05,"Early nights, technology bans and meditation: in search of Arianna Huffington’s ‘third metric’ of success",women-in-leadership
729,2016-07-01,A day in the life of an executive coach,women-in-leadership
730,2016-06-30,Obama on feminism and other lessons from the first United State of Women summit,women-in-leadership
731,2016-06-29,Women's talk: why language matters to female entrepreneurs,women-in-leadership
732,2016-06-27,Three simple steps to better employee engagement,women-in-leadership
733,2016-06-16,"'If diversity means giving white men more work writing about black women, we've failed'",women-in-leadership
734,2016-06-13,The 'greatest dead company in Silicon Valley' has lessons for all of us,women-in-leadership
735,2016-05-24,If you want flexible working you have to be upfront and unashamed about it,women-in-leadership
736,2016-05-24,When I asked for flexible working recruiters said it didn't exist,women-in-leadership
737,2016-05-19,If you choose your job over your mental health something's wrong,women-in-leadership
738,2016-05-12,Enforcing high heels in the office is the height of workplace sexism,women-in-leadership
739,2016-05-11,Five things companies can do to boost employee happiness,women-in-leadership
740,2016-05-09,How to handle everyday sexism without HR or a boss to back you up,women-in-leadership
741,2016-05-06,'We need a public education project about what it means to be European',women-in-leadership
742,2016-05-05,Lessons from a life coach: three steps to conquering your fears,women-in-leadership
743,2016-05-03,My baby left me with no career path. It was the best thing to happen,women-in-leadership
744,2016-04-29,Thrilling and daunting: my work has an impact on the New York skyline,women-in-leadership
745,2016-04-28,Flexible working: the secret to professional women's success,women-in-leadership
746,2016-04-26,When women dominate the room why do we thank men for letting us be there?,women-in-leadership
747,2016-04-22,A day in the life of a female glass blower,women-in-leadership
748,2016-04-21,Ten tips for future creative leaders,women-in-leadership
749,2016-04-20,Five things to promote gender equality at work,women-in-leadership
750,2016-04-14,A fortnight’s holiday is hardly relaxing - let’s all take a sabbatical,women-in-leadership
751,2016-04-08,Meet the woman racing to save the planet,women-in-leadership
752,2016-04-07,Tina Brown: 'Our speakers have taken on bigger misogynists than Trump',women-in-leadership
753,2016-04-04,There are so many opportunities for women in tech - so why aren't there more of us?,women-in-leadership
754,2016-04-01,Cheers to the women brewing (and drinking) beer,women-in-leadership
755,2016-03-31,Network and hustle: the key skills for women in technology,women-in-leadership
756,2016-03-30,Three ways to inspire hunger and commitment in your team,women-in-leadership
757,2016-03-29,The detective inspector leading the charge against cybercrime,women-in-leadership
758,2016-03-24,Four ways emerging tech is empowering women,women-in-leadership
759,2016-03-22,Mind the gap: when will women finally be able to celebrate equal pay?,women-in-leadership
760,2016-03-17,Don't play by the rules: how to reignite women's fire in the workplace,women-in-leadership
761,2016-03-16,Live blog: Women's Empowerment Principles annual conference 2016,women-in-leadership
762,2016-03-16,Live Q&A: where are the women in tech?,women-in-leadership
763,2016-03-15,Mums are formidable in the workplace – we need to hire more,women-in-leadership
764,2016-03-14,Family or career ... what if neither parent wants to stay at home?,women-in-leadership
765,2016-03-10,Brands are finally using images to reflect women as they truly are,women-in-leadership
766,2016-03-09,Three reasons why hiring mothers is good for business,women-in-leadership
767,2016-03-09,Is it time to stop giving so much of a damn at work?,women-in-leadership
768,2016-03-08,International Women's Day's #pledgeforparity is holding women back,women-in-leadership
769,2016-03-07,All young women need strong male role models,women-in-leadership
770,2016-03-04,"'Every day involves thinking, dreaming, playing and singing'",women-in-leadership
771,2016-03-03,"Lessons from a life coach: how to get what you want, now",women-in-leadership
772,2016-02-29,Carla Marie Williams: For black women in music it's hard to defy the stereotype,women-in-leadership
773,2016-02-26,The future is in code and I want women to write it,women-in-leadership
774,2016-02-25,The oil crisis makes a compelling case for women's equality in Saudi Arabia,women-in-leadership
775,2016-02-24,#FreeKesha but don't forget the other women silenced by fear,women-in-leadership
776,2016-02-23,How one woman's app is changing politics in the digital age,women-in-leadership
777,2016-02-22,Is it so bad for me to have a career and be a mum? Other women seem to think so,women-in-leadership
778,2016-02-19,"I launched a social enterprise after becoming a mother, widow and HIV positive",women-in-leadership
779,2016-02-17,"I hate to shatter feminist illusions, but Danish women are still battling like us",women-in-leadership
780,2016-02-12,Life in the Royal Navy: forget 'pink and fluffy' I'm a military-minded lieutenant,women-in-leadership
781,2016-02-11,Boost your brainpower and do something different this February,women-in-leadership
782,2016-02-10,The wings of high-flying women are still being clipped by sexist stereotypes,women-in-leadership
783,2016-02-05,'Weighing the giraffes can be challenging: all nine giraffes want to get on the scales at once',women-in-leadership
784,2016-02-04,How your physical health controls your mental success,women-in-leadership
785,2016-02-03,Five facts that show how the advertising industry fails women,women-in-leadership
786,2016-02-02,I started a business to avoid maternity leave,women-in-leadership
787,2016-02-01,I chose not to go to university – it was the best career decision I ever made,women-in-leadership
788,2016-01-29,"'One of my ambitions is to produce a documentary - radio of course. It’s the best, most intimate medium""",women-in-leadership
789,2016-01-28,Davos 2016: it's time to talk about gender inequality,women-in-leadership
790,2016-01-27,"Budding entrepreneurs must learn from the failure of others, not just the success",women-in-leadership
791,2016-01-25,"How to lead like a woman, in a man’s world",women-in-leadership
792,2016-01-22,A day in the life of a nuclear materials engineer,women-in-leadership
793,2016-01-21,Stressed and exhausted: spot the signs of burnout before it hits you,women-in-leadership
794,2016-01-20,Mind-blowing: how your thoughts control your work-life satisfaction,women-in-leadership
795,2016-01-19,Mental health affects all of us and we need to talk about it,women-in-leadership
796,2016-01-18,Businesses are missing a trick by writing off older women,women-in-leadership
797,2016-01-15,"Success stories, tears and sexism: a day in the life of a charity CEO",women-in-leadership
798,2016-01-14,The Just Not Sorry app is keeping women trapped in a man's world,women-in-leadership
799,2016-01-13,Why the new women and work all-party parliamentary group matters,women-in-leadership
800,2016-01-12,The perfect role model doesn't exist – we need visibility and cultural change,women-in-leadership
801,2016-01-08,"'Handouts can be essential, but enabling people to empower themselves is inspiring'",women-in-leadership
802,2016-01-07,My 2016 resolution? Let ambition take a back seat,women-in-leadership
803,2016-01-06,How to handle the office diet bore,women-in-leadership
